2026-05-26 18:46:39,844 - INFO - ----- Fine Tuning -----
2026-05-26 18:46:39,844 - INFO - A new study created in memory with name: no-name-0a186542-2cd2-404a-b829-0f0c225a0678
2026-05-26 19:10:18,459 - INFO - Trial 7 finished with value: 0.8844354223330555 and parameters: {'n_estimators': 272, 'max_depth': 8, 'min_samples_leaf': 39, 'max_features': 0.10419283558400827, 'criterion': 'gini'}. Best is trial 7 with value: 0.8844354223330555.
2026-05-26 19:11:12,599 - INFO - Trial 10 finished with value: 0.9050075323547888 and parameters: {'n_estimators': 232, 'max_depth': 11, 'min_samples_leaf': 74, 'max_features': 0.10400522764049591, 'criterion': 'entropy'}. Best is trial 10 with value: 0.9050075323547888.
2026-05-26 19:11:13,643 - INFO - Trial 1 finished with value: 0.9010875742310545 and parameters: {'n_estimators': 114, 'max_depth': 6, 'min_samples_leaf': 53, 'max_features': 0.3903679599495561, 'criterion': 'gini'}. Best is trial 10 with value: 0.9050075323547888.
2026-05-26 19:15:09,622 - INFO - Trial 4 finished with value: 0.903952218883299 and parameters: {'n_estimators': 217, 'max_depth': 9, 'min_samples_leaf': 59, 'max_features': 0.1505947128653233, 'criterion': 'entropy'}. Best is trial 10 with value: 0.9050075323547888.
2026-05-26 19:15:22,178 - INFO - Trial 3 finished with value: 0.9170579511830473 and parameters: {'n_estimators': 120, 'max_depth': 9, 'min_samples_leaf': 136, 'max_features': 0.3112456988284489, 'criterion': 'gini'}. Best is trial 3 with value: 0.9170579511830473.
2026-05-26 19:16:04,809 - INFO - Trial 9 finished with value: 0.9215250182284438 and parameters: {'n_estimators': 183, 'max_depth': 14, 'min_samples_leaf': 123, 'max_features': 0.14889953869123912, 'criterion': 'gini'}. Best is trial 9 with value: 0.9215250182284438.
2026-05-26 19:17:25,858 - INFO - Trial 2 pruned. 
2026-05-26 19:17:40,158 - INFO - Trial 11 pruned. 
2026-05-26 19:19:14,585 - INFO - Trial 5 pruned. 
2026-05-26 19:32:37,514 - INFO - Trial 19 pruned. 
2026-05-26 19:33:12,112 - INFO - Trial 14 finished with value: 0.9196126897813274 and parameters: {'n_estimators': 131, 'max_depth': 12, 'min_samples_leaf': 90, 'max_features': 0.16338377075030508, 'criterion': 'gini'}. Best is trial 9 with value: 0.9215250182284438.
2026-05-26 19:38:17,356 - INFO - Trial 8 finished with value: 0.9129692150492972 and parameters: {'n_estimators': 411, 'max_depth': 13, 'min_samples_leaf': 133, 'max_features': 0.11847354968591076, 'criterion': 'gini'}. Best is trial 9 with value: 0.9215250182284438.
2026-05-26 19:44:19,481 - INFO - Trial 18 finished with value: 0.9201112212194469 and parameters: {'n_estimators': 165, 'max_depth': 12, 'min_samples_leaf': 88, 'max_features': 0.16269903692123916, 'criterion': 'entropy'}. Best is trial 9 with value: 0.9215250182284438.
2026-05-26 20:00:56,713 - INFO - Trial 6 finished with value: 0.9136820977222374 and parameters: {'n_estimators': 313, 'max_depth': 8, 'min_samples_leaf': 78, 'max_features': 0.3431079887832641, 'criterion': 'entropy'}. Best is trial 9 with value: 0.9215250182284438.
2026-05-26 20:07:08,920 - INFO - Trial 20 finished with value: 0.931576302459038 and parameters: {'n_estimators': 170, 'max_depth': 15, 'min_samples_leaf': 125, 'max_features': 0.29926148749513637, 'criterion': 'entropy'}. Best is trial 20 with value: 0.931576302459038.
2026-05-26 20:10:08,996 - INFO - Trial 22 finished with value: 0.9257774470989129 and parameters: {'n_estimators': 191, 'max_depth': 14, 'min_samples_leaf': 111, 'max_features': 0.1987940449684959, 'criterion': 'gini'}. Best is trial 20 with value: 0.931576302459038.
2026-05-26 20:13:56,869 - INFO - Trial 13 finished with value: 0.9167377423828462 and parameters: {'n_estimators': 232, 'max_depth': 8, 'min_samples_leaf': 20, 'max_features': 0.3959573821066248, 'criterion': 'entropy'}. Best is trial 20 with value: 0.931576302459038.
2026-05-26 20:14:49,454 - INFO - Trial 23 finished with value: 0.9271750575649224 and parameters: {'n_estimators': 187, 'max_depth': 15, 'min_samples_leaf': 108, 'max_features': 0.1986850573812382, 'criterion': 'gini'}. Best is trial 20 with value: 0.931576302459038.
2026-05-26 20:21:49,546 - INFO - Trial 24 finished with value: 0.9278934778104988 and parameters: {'n_estimators': 183, 'max_depth': 15, 'min_samples_leaf': 105, 'max_features': 0.21050755185023856, 'criterion': 'gini'}. Best is trial 20 with value: 0.931576302459038.
2026-05-26 20:33:01,205 - INFO - Trial 15 finished with value: 0.9255145087502686 and parameters: {'n_estimators': 348, 'max_depth': 11, 'min_samples_leaf': 35, 'max_features': 0.2581303861124037, 'criterion': 'gini'}. Best is trial 20 with value: 0.931576302459038.
2026-05-26 20:35:50,045 - INFO - Trial 16 finished with value: 0.9254783381061241 and parameters: {'n_estimators': 282, 'max_depth': 10, 'min_samples_leaf': 47, 'max_features': 0.36925584130012357, 'criterion': 'gini'}. Best is trial 20 with value: 0.931576302459038.
2026-05-26 20:36:22,875 - INFO - Trial 25 finished with value: 0.9277632349772924 and parameters: {'n_estimators': 187, 'max_depth': 15, 'min_samples_leaf': 107, 'max_features': 0.20615494721853073, 'criterion': 'gini'}. Best is trial 20 with value: 0.931576302459038.
2026-05-26 20:41:09,708 - INFO - Trial 21 finished with value: 0.9276392964152347 and parameters: {'n_estimators': 358, 'max_depth': 15, 'min_samples_leaf': 110, 'max_features': 0.21296079125976874, 'criterion': 'gini'}. Best is trial 20 with value: 0.931576302459038.
2026-05-26 20:42:30,518 - INFO - Trial 17 finished with value: 0.9249876458400529 and parameters: {'n_estimators': 430, 'max_depth': 12, 'min_samples_leaf': 103, 'max_features': 0.23209500362961427, 'criterion': 'gini'}. Best is trial 20 with value: 0.931576302459038.
2026-05-26 20:45:41,121 - INFO - Trial 26 finished with value: 0.9295184219215699 and parameters: {'n_estimators': 195, 'max_depth': 15, 'min_samples_leaf': 117, 'max_features': 0.24537855700980182, 'criterion': 'gini'}. Best is trial 20 with value: 0.931576302459038.
2026-05-26 20:53:13,459 - INFO - Trial 12 finished with value: 0.9320330533740868 and parameters: {'n_estimators': 394, 'max_depth': 12, 'min_samples_leaf': 51, 'max_features': 0.35935767823356546, 'criterion': 'entropy'}. Best is trial 12 with value: 0.9320330533740868.
2026-05-26 20:55:20,335 - INFO - Trial 27 finished with value: 0.9291231032347096 and parameters: {'n_estimators': 290, 'max_depth': 15, 'min_samples_leaf': 109, 'max_features': 0.23228089359342055, 'criterion': 'gini'}. Best is trial 12 with value: 0.9320330533740868.
2026-05-26 20:57:33,821 - INFO - Trial 0 finished with value: 0.9347461794952053 and parameters: {'n_estimators': 454, 'max_depth': 14, 'min_samples_leaf': 80, 'max_features': 0.3856130181224291, 'criterion': 'entropy'}. Best is trial 0 with value: 0.9347461794952053.
2026-05-26 20:57:42,850 - INFO - Trial 28 finished with value: 0.9300641664695448 and parameters: {'n_estimators': 289, 'max_depth': 15, 'min_samples_leaf': 108, 'max_features': 0.24771664549584022, 'criterion': 'gini'}. Best is trial 0 with value: 0.9347461794952053.
2026-05-26 20:59:26,327 - INFO - Trial 29 finished with value: 0.9308151946133627 and parameters: {'n_estimators': 285, 'max_depth': 15, 'min_samples_leaf': 112, 'max_features': 0.27796974666397267, 'criterion': 'gini'}. Best is trial 0 with value: 0.9347461794952053.
2026-05-26 20:59:26,329 - INFO - Best AUC: 0.9347461794952053 | Best params: {'n_estimators': 454, 'max_depth': 14, 'min_samples_leaf': 80, 'max_features': 0.3856130181224291, 'criterion': 'entropy'}
2026-05-26 20:59:26,329 - INFO - ----- Saving Pipeline -----
