2026-05-21 20:22:37,813 - INFO - Trial 0 finished with value: 0.8790843441871263 and parameters: {'loss': 'modified_huber', 'penalty': 'elasticnet', 'alpha': 0.013936896193853408, 'learning_rate': 'optimal', 'eta0': 0.0022863288397869993, 'l1_ratio': 0.49005991581489994, 'tol': 0.005997790545703715, 'average': False}. Best is trial 0 with value: 0.8790843441871263.
2026-05-21 20:22:42,296 - INFO - Trial 1 finished with value: 0.8883723073986147 and parameters: {'loss': 'modified_huber', 'penalty': 'l2', 'alpha': 0.00418430245998486, 'learning_rate': 'optimal', 'eta0': 0.010002310828202245, 'l1_ratio': 0.1171640409589162, 'tol': 0.005433634840699919, 'average': False}. Best is trial 1 with value: 0.8883723073986147.
2026-05-21 20:22:51,260 - INFO - Trial 7 finished with value: 0.8652647522065522 and parameters: {'loss': 'modified_huber', 'penalty': 'l2', 'alpha': 0.09743776982049956, 'learning_rate': 'optimal', 'eta0': 0.01384225107810767, 'l1_ratio': 0.763658448143036, 'tol': 6.263697058639023e-05, 'average': True}. Best is trial 1 with value: 0.8883723073986147.
2026-05-21 20:23:01,972 - INFO - Trial 3 finished with value: 0.586869771521117 and parameters: {'loss': 'modified_huber', 'penalty': 'elasticnet', 'alpha': 0.00042765939413857474, 'learning_rate': 'optimal', 'eta0': 0.011015113230221453, 'l1_ratio': 0.6832505384258609, 'tol': 0.003402132483674499, 'average': True}. Best is trial 1 with value: 0.8883723073986147.
2026-05-21 20:23:03,774 - INFO - Trial 11 finished with value: 0.7486957662666135 and parameters: {'loss': 'modified_huber', 'penalty': 'l1', 'alpha': 1.562209677859605e-05, 'learning_rate': 'optimal', 'eta0': 0.011911558723147446, 'l1_ratio': 0.08634420694541256, 'tol': 0.00038265954830928636, 'average': False}. Best is trial 1 with value: 0.8883723073986147.
2026-05-21 20:23:08,806 - INFO - Trial 2 pruned. 
2026-05-21 20:23:09,700 - INFO - Trial 4 pruned. 
2026-05-21 20:23:10,594 - INFO - Trial 5 pruned. 
2026-05-21 20:23:14,991 - INFO - Trial 10 finished with value: 0.8907376276561576 and parameters: {'loss': 'log_loss', 'penalty': 'l1', 'alpha': 0.00021004605535389248, 'learning_rate': 'optimal', 'eta0': 0.002295476261086772, 'l1_ratio': 0.6737723712901356, 'tol': 0.0003219774549869588, 'average': False}. Best is trial 10 with value: 0.8907376276561576.
2026-05-21 20:23:17,116 - INFO - Trial 9 pruned. 
2026-05-21 20:23:19,157 - INFO - Trial 13 pruned. 
2026-05-21 20:23:20,384 - INFO - Trial 6 pruned. 
2026-05-21 20:23:20,398 - INFO - Trial 14 pruned. 
2026-05-21 20:23:28,992 - INFO - Trial 12 pruned. 
2026-05-21 20:23:39,303 - INFO - Trial 18 pruned. 
2026-05-21 20:23:40,264 - INFO - Trial 20 pruned. 
2026-05-21 20:23:41,866 - INFO - Trial 8 finished with value: 0.887416881307708 and parameters: {'loss': 'modified_huber', 'penalty': 'l2', 'alpha': 7.7943683919109e-07, 'learning_rate': 'adaptive', 'eta0': 0.04415095180611397, 'l1_ratio': 0.5801422682837696, 'tol': 0.0006555378461079159, 'average': False}. Best is trial 10 with value: 0.8907376276561576.
2026-05-21 20:23:49,176 - INFO - Trial 19 pruned. 
2026-05-21 20:23:53,754 - INFO - Trial 22 pruned. 
2026-05-21 20:23:55,261 - INFO - Trial 21 pruned. 
2026-05-21 20:24:01,202 - INFO - Trial 16 pruned. 
2026-05-21 20:24:01,215 - INFO - Trial 23 pruned. 
2026-05-21 20:24:05,419 - INFO - Trial 25 pruned. 
2026-05-21 20:24:10,020 - INFO - Trial 26 pruned. 
2026-05-21 20:24:15,133 - INFO - Trial 17 pruned. 
2026-05-21 20:24:15,134 - INFO - Trial 24 finished with value: 0.8341646191099958 and parameters: {'loss': 'log_loss', 'penalty': 'l1', 'alpha': 1.1340783845387363e-06, 'learning_rate': 'optimal', 'eta0': 0.07258802927559226, 'l1_ratio': 0.9307827641260649, 'tol': 2.6026800041672848e-05, 'average': False}. Best is trial 10 with value: 0.8907376276561576.
2026-05-21 20:24:21,149 - INFO - Trial 27 finished with value: 0.8829276540600212 and parameters: {'loss': 'log_loss', 'penalty': 'l1', 'alpha': 0.001894473920816714, 'learning_rate': 'optimal', 'eta0': 0.05701145744716382, 'l1_ratio': 0.952827246231081, 'tol': 0.00016878083176121393, 'average': False}. Best is trial 10 with value: 0.8907376276561576.
2026-05-21 20:24:24,695 - INFO - Trial 28 finished with value: 0.8852233952111398 and parameters: {'loss': 'log_loss', 'penalty': 'l1', 'alpha': 0.0014402467509490552, 'learning_rate': 'optimal', 'eta0': 0.08599646085985178, 'l1_ratio': 0.9511096965198163, 'tol': 1.2359269723504214e-05, 'average': False}. Best is trial 10 with value: 0.8907376276561576.
2026-05-21 20:24:27,330 - INFO - Trial 29 finished with value: 0.8810832503009614 and parameters: {'loss': 'log_loss', 'penalty': 'l1', 'alpha': 0.00249411296613364, 'learning_rate': 'optimal', 'eta0': 0.043992500006374204, 'l1_ratio': 0.9798196987076575, 'tol': 1.48774381398881e-05, 'average': False}. Best is trial 10 with value: 0.8907376276561576.
2026-05-21 20:24:37,685 - INFO - Trial 15 finished with value: 0.8919499448533651 and parameters: {'loss': 'modified_huber', 'penalty': 'elasticnet', 'alpha': 1.5522236764405038e-06, 'learning_rate': 'adaptive', 'eta0': 0.007808056597325227, 'l1_ratio': 0.31802365720481196, 'tol': 1.6372126883524787e-05, 'average': False}. Best is trial 15 with value: 0.8919499448533651.
2026-05-21 20:24:37,687 - INFO - Best AUC: 0.8919499448533651 | Best params: {'loss': 'modified_huber', 'penalty': 'elasticnet', 'alpha': 1.5522236764405038e-06, 'learning_rate': 'adaptive', 'eta0': 0.007808056597325227, 'l1_ratio': 0.31802365720481196, 'tol': 1.6372126883524787e-05, 'average': False}
2026-05-21 20:24:37,687 - INFO - ----- Saving Pipeline -----
2026-05-21 20:25:08,302 - INFO - ----- Fine Tuning -----
2026-05-21 20:25:08,302 - INFO - A new study created in memory with name: no-name-004df182-311e-40ac-a254-2d8db3a29188
