2026-05-15 21:07:00,629 - INFO - ----- Fine Tuning -----
2026-05-15 21:08:37,991 - INFO - ----- Fine Tuning -----
2026-05-15 22:05:14,899 - INFO - Best AUC: 0.8934924863693583 | Best params: {'C': 7.298885645430723}
2026-05-15 22:05:14,899 - INFO - ----- Saving Pipeline -----
2026-05-21 20:18:33,811 - INFO - ----- Fine Tuning -----
2026-05-21 20:18:33,811 - INFO - A new study created in memory with name: no-name-2af9e9ec-4143-4f57-a687-dc775194d4c3
2026-05-21 20:18:34,352 - WARNING - Trial 0 failed with parameters: {'loss': 'log_loss', 'penalty': 'l1', 'alpha': 0.0015012617706758344, 'learning_rate': 'optimal', 'eta0': 0.0032588088280838595, 'l1_ratio': 0.5513095851757914, 'tol_sgd': 0.00015275174240082505, 'average': True} because of the following error: TypeError("SGDClassifier.__init__() got an unexpected keyword argument 'tol_sgd'").
Traceback (most recent call last):
  File "/home/junior/Documentos/GitHub/prediction-f1-pit-stops-kaggle-competition/.venv/lib/python3.13/site-packages/optuna/study/_optimize.py", line 206, in _run_trial
    value_or_values = func(trial)
  File "/home/junior/Documentos/GitHub/prediction-f1-pit-stops-kaggle-competition/src/sgdclassifier_tuning.py", line 122, in <lambda>
    study.optimize(lambda trial: objective(trial, X_train, y_train), n_trials=30, n_jobs=-1, show_progress_bar=True)
                                 ~~~~~~~~~^^^^^^^^^^^^^^^^^^^^^^^^^
  File "/home/junior/Documentos/GitHub/prediction-f1-pit-stops-kaggle-competition/src/sgdclassifier_tuning.py", line 93, in objective
    SGDClassifier(
    ~~~~~~~~~~~~~^
        loss=trial.suggest_categorical("loss", ["log_loss", "modified_huber", "hinge", "squared_hinge"]),
        ^^^^^^^^^^^^^^^^^^^^^^^^^^^^^^^^^^^^^^^^^^^^^^^^^^^^^^^^^^^^^^^^^^^^^^^^^^^^^^^^^^^^^^^^^^^^^^^^^
    ...<10 lines>...
        n_jobs=1
        ^^^^^^^^
    )
    ^
TypeError: SGDClassifier.__init__() got an unexpected keyword argument 'tol_sgd'
2026-05-21 20:18:34,370 - WARNING - Trial 0 failed with value None.
2026-05-21 20:18:34,595 - WARNING - Trial 2 failed with parameters: {'loss': 'modified_huber', 'penalty': 'l2', 'alpha': 0.024637467243986664, 'learning_rate': 'adaptive', 'eta0': 0.00010961244938627807, 'l1_ratio': 0.6637566512732967, 'tol_sgd': 4.2076844431217044e-05, 'average': False} because of the following error: TypeError("SGDClassifier.__init__() got an unexpected keyword argument 'tol_sgd'").
Traceback (most recent call last):
  File "/home/junior/Documentos/GitHub/prediction-f1-pit-stops-kaggle-competition/.venv/lib/python3.13/site-packages/optuna/study/_optimize.py", line 206, in _run_trial
    value_or_values = func(trial)
  File "/home/junior/Documentos/GitHub/prediction-f1-pit-stops-kaggle-competition/src/sgdclassifier_tuning.py", line 122, in <lambda>
    study.optimize(lambda trial: objective(trial, X_train, y_train), n_trials=30, n_jobs=-1, show_progress_bar=True)
                                 ~~~~~~~~~^^^^^^^^^^^^^^^^^^^^^^^^^
  File "/home/junior/Documentos/GitHub/prediction-f1-pit-stops-kaggle-competition/src/sgdclassifier_tuning.py", line 93, in objective
    SGDClassifier(
    ~~~~~~~~~~~~~^
        loss=trial.suggest_categorical("loss", ["log_loss", "modified_huber", "hinge", "squared_hinge"]),
        ^^^^^^^^^^^^^^^^^^^^^^^^^^^^^^^^^^^^^^^^^^^^^^^^^^^^^^^^^^^^^^^^^^^^^^^^^^^^^^^^^^^^^^^^^^^^^^^^^
    ...<10 lines>...
        n_jobs=1
        ^^^^^^^^
    )
    ^
TypeError: SGDClassifier.__init__() got an unexpected keyword argument 'tol_sgd'
2026-05-21 20:18:34,603 - WARNING - Trial 2 failed with value None.
2026-05-21 20:18:34,608 - WARNING - Trial 1 failed with parameters: {'loss': 'log_loss', 'penalty': 'elasticnet', 'alpha': 0.000128398754286767, 'learning_rate': 'optimal', 'eta0': 0.003628513883018822, 'l1_ratio': 0.7211754291334092, 'tol_sgd': 0.0005716693732063673, 'average': False} because of the following error: TypeError("SGDClassifier.__init__() got an unexpected keyword argument 'tol_sgd'").
Traceback (most recent call last):
  File "/home/junior/Documentos/GitHub/prediction-f1-pit-stops-kaggle-competition/.venv/lib/python3.13/site-packages/optuna/study/_optimize.py", line 206, in _run_trial
    value_or_values = func(trial)
  File "/home/junior/Documentos/GitHub/prediction-f1-pit-stops-kaggle-competition/src/sgdclassifier_tuning.py", line 122, in <lambda>
    study.optimize(lambda trial: objective(trial, X_train, y_train), n_trials=30, n_jobs=-1, show_progress_bar=True)
                                 ~~~~~~~~~^^^^^^^^^^^^^^^^^^^^^^^^^
  File "/home/junior/Documentos/GitHub/prediction-f1-pit-stops-kaggle-competition/src/sgdclassifier_tuning.py", line 93, in objective
    SGDClassifier(
    ~~~~~~~~~~~~~^
        loss=trial.suggest_categorical("loss", ["log_loss", "modified_huber", "hinge", "squared_hinge"]),
        ^^^^^^^^^^^^^^^^^^^^^^^^^^^^^^^^^^^^^^^^^^^^^^^^^^^^^^^^^^^^^^^^^^^^^^^^^^^^^^^^^^^^^^^^^^^^^^^^^
    ...<10 lines>...
        n_jobs=1
        ^^^^^^^^
    )
    ^
TypeError: SGDClassifier.__init__() got an unexpected keyword argument 'tol_sgd'
2026-05-21 20:18:34,612 - WARNING - Trial 1 failed with value None.
2026-05-21 20:18:34,620 - WARNING - Trial 10 failed with parameters: {'loss': 'log_loss', 'penalty': 'elasticnet', 'alpha': 0.020174820551077055, 'learning_rate': 'optimal', 'eta0': 0.0004161338106128429, 'l1_ratio': 0.5869194497878271, 'tol_sgd': 0.005201457453873784, 'average': False} because of the following error: TypeError("SGDClassifier.__init__() got an unexpected keyword argument 'tol_sgd'").
Traceback (most recent call last):
  File "/home/junior/Documentos/GitHub/prediction-f1-pit-stops-kaggle-competition/.venv/lib/python3.13/site-packages/optuna/study/_optimize.py", line 206, in _run_trial
    value_or_values = func(trial)
  File "/home/junior/Documentos/GitHub/prediction-f1-pit-stops-kaggle-competition/src/sgdclassifier_tuning.py", line 122, in <lambda>
    study.optimize(lambda trial: objective(trial, X_train, y_train), n_trials=30, n_jobs=-1, show_progress_bar=True)
                                 ~~~~~~~~~^^^^^^^^^^^^^^^^^^^^^^^^^
  File "/home/junior/Documentos/GitHub/prediction-f1-pit-stops-kaggle-competition/src/sgdclassifier_tuning.py", line 93, in objective
    SGDClassifier(
    ~~~~~~~~~~~~~^
        loss=trial.suggest_categorical("loss", ["log_loss", "modified_huber", "hinge", "squared_hinge"]),
        ^^^^^^^^^^^^^^^^^^^^^^^^^^^^^^^^^^^^^^^^^^^^^^^^^^^^^^^^^^^^^^^^^^^^^^^^^^^^^^^^^^^^^^^^^^^^^^^^^
    ...<10 lines>...
        n_jobs=1
        ^^^^^^^^
    )
    ^
TypeError: SGDClassifier.__init__() got an unexpected keyword argument 'tol_sgd'
2026-05-21 20:18:34,621 - WARNING - Trial 8 failed with parameters: {'loss': 'squared_hinge', 'penalty': 'l1', 'alpha': 1.1189855015279848e-07, 'learning_rate': 'adaptive', 'eta0': 0.0448498993002766, 'l1_ratio': 0.25708781062738506, 'tol_sgd': 0.009405747782492355, 'average': False} because of the following error: TypeError("SGDClassifier.__init__() got an unexpected keyword argument 'tol_sgd'").
Traceback (most recent call last):
  File "/home/junior/Documentos/GitHub/prediction-f1-pit-stops-kaggle-competition/.venv/lib/python3.13/site-packages/optuna/study/_optimize.py", line 206, in _run_trial
    value_or_values = func(trial)
  File "/home/junior/Documentos/GitHub/prediction-f1-pit-stops-kaggle-competition/src/sgdclassifier_tuning.py", line 122, in <lambda>
    study.optimize(lambda trial: objective(trial, X_train, y_train), n_trials=30, n_jobs=-1, show_progress_bar=True)
                                 ~~~~~~~~~^^^^^^^^^^^^^^^^^^^^^^^^^
  File "/home/junior/Documentos/GitHub/prediction-f1-pit-stops-kaggle-competition/src/sgdclassifier_tuning.py", line 93, in objective
    SGDClassifier(
    ~~~~~~~~~~~~~^
        loss=trial.suggest_categorical("loss", ["log_loss", "modified_huber", "hinge", "squared_hinge"]),
        ^^^^^^^^^^^^^^^^^^^^^^^^^^^^^^^^^^^^^^^^^^^^^^^^^^^^^^^^^^^^^^^^^^^^^^^^^^^^^^^^^^^^^^^^^^^^^^^^^
    ...<10 lines>...
        n_jobs=1
        ^^^^^^^^
    )
    ^
TypeError: SGDClassifier.__init__() got an unexpected keyword argument 'tol_sgd'
2026-05-21 20:18:34,622 - WARNING - Trial 4 failed with parameters: {'loss': 'log_loss', 'penalty': 'elasticnet', 'alpha': 7.0950280513035716e-06, 'learning_rate': 'adaptive', 'eta0': 0.00045736890584164273, 'l1_ratio': 0.4375527138833737, 'tol_sgd': 3.8994378161160426e-05, 'average': True} because of the following error: TypeError("SGDClassifier.__init__() got an unexpected keyword argument 'tol_sgd'").
Traceback (most recent call last):
  File "/home/junior/Documentos/GitHub/prediction-f1-pit-stops-kaggle-competition/.venv/lib/python3.13/site-packages/optuna/study/_optimize.py", line 206, in _run_trial
    value_or_values = func(trial)
  File "/home/junior/Documentos/GitHub/prediction-f1-pit-stops-kaggle-competition/src/sgdclassifier_tuning.py", line 122, in <lambda>
    study.optimize(lambda trial: objective(trial, X_train, y_train), n_trials=30, n_jobs=-1, show_progress_bar=True)
                                 ~~~~~~~~~^^^^^^^^^^^^^^^^^^^^^^^^^
  File "/home/junior/Documentos/GitHub/prediction-f1-pit-stops-kaggle-competition/src/sgdclassifier_tuning.py", line 93, in objective
    SGDClassifier(
    ~~~~~~~~~~~~~^
        loss=trial.suggest_categorical("loss", ["log_loss", "modified_huber", "hinge", "squared_hinge"]),
        ^^^^^^^^^^^^^^^^^^^^^^^^^^^^^^^^^^^^^^^^^^^^^^^^^^^^^^^^^^^^^^^^^^^^^^^^^^^^^^^^^^^^^^^^^^^^^^^^^
    ...<10 lines>...
        n_jobs=1
        ^^^^^^^^
    )
    ^
TypeError: SGDClassifier.__init__() got an unexpected keyword argument 'tol_sgd'
2026-05-21 20:18:34,624 - WARNING - Trial 10 failed with value None.
2026-05-21 20:18:34,625 - WARNING - Trial 8 failed with value None.
2026-05-21 20:18:34,627 - WARNING - Trial 9 failed with parameters: {'loss': 'log_loss', 'penalty': 'l1', 'alpha': 0.0010623204782785056, 'learning_rate': 'adaptive', 'eta0': 0.023330343379564678, 'l1_ratio': 0.5751543959649748, 'tol_sgd': 2.7956521849290768e-05, 'average': True} because of the following error: TypeError("SGDClassifier.__init__() got an unexpected keyword argument 'tol_sgd'").
Traceback (most recent call last):
  File "/home/junior/Documentos/GitHub/prediction-f1-pit-stops-kaggle-competition/.venv/lib/python3.13/site-packages/optuna/study/_optimize.py", line 206, in _run_trial
    value_or_values = func(trial)
  File "/home/junior/Documentos/GitHub/prediction-f1-pit-stops-kaggle-competition/src/sgdclassifier_tuning.py", line 122, in <lambda>
    study.optimize(lambda trial: objective(trial, X_train, y_train), n_trials=30, n_jobs=-1, show_progress_bar=True)
                                 ~~~~~~~~~^^^^^^^^^^^^^^^^^^^^^^^^^
  File "/home/junior/Documentos/GitHub/prediction-f1-pit-stops-kaggle-competition/src/sgdclassifier_tuning.py", line 93, in objective
    SGDClassifier(
    ~~~~~~~~~~~~~^
        loss=trial.suggest_categorical("loss", ["log_loss", "modified_huber", "hinge", "squared_hinge"]),
        ^^^^^^^^^^^^^^^^^^^^^^^^^^^^^^^^^^^^^^^^^^^^^^^^^^^^^^^^^^^^^^^^^^^^^^^^^^^^^^^^^^^^^^^^^^^^^^^^^
    ...<10 lines>...
        n_jobs=1
        ^^^^^^^^
    )
    ^
TypeError: SGDClassifier.__init__() got an unexpected keyword argument 'tol_sgd'
2026-05-21 20:18:34,627 - WARNING - Trial 4 failed with value None.
2026-05-21 20:18:34,628 - WARNING - Trial 3 failed with parameters: {'loss': 'modified_huber', 'penalty': 'l2', 'alpha': 3.900787118546197e-07, 'learning_rate': 'optimal', 'eta0': 0.03697738900610329, 'l1_ratio': 0.4819171850034266, 'tol_sgd': 0.00023927805405094603, 'average': False} because of the following error: TypeError("SGDClassifier.__init__() got an unexpected keyword argument 'tol_sgd'").
Traceback (most recent call last):
  File "/home/junior/Documentos/GitHub/prediction-f1-pit-stops-kaggle-competition/.venv/lib/python3.13/site-packages/optuna/study/_optimize.py", line 206, in _run_trial
    value_or_values = func(trial)
  File "/home/junior/Documentos/GitHub/prediction-f1-pit-stops-kaggle-competition/src/sgdclassifier_tuning.py", line 122, in <lambda>
    study.optimize(lambda trial: objective(trial, X_train, y_train), n_trials=30, n_jobs=-1, show_progress_bar=True)
                                 ~~~~~~~~~^^^^^^^^^^^^^^^^^^^^^^^^^
  File "/home/junior/Documentos/GitHub/prediction-f1-pit-stops-kaggle-competition/src/sgdclassifier_tuning.py", line 93, in objective
    SGDClassifier(
    ~~~~~~~~~~~~~^
        loss=trial.suggest_categorical("loss", ["log_loss", "modified_huber", "hinge", "squared_hinge"]),
        ^^^^^^^^^^^^^^^^^^^^^^^^^^^^^^^^^^^^^^^^^^^^^^^^^^^^^^^^^^^^^^^^^^^^^^^^^^^^^^^^^^^^^^^^^^^^^^^^^
    ...<10 lines>...
        n_jobs=1
        ^^^^^^^^
    )
    ^
TypeError: SGDClassifier.__init__() got an unexpected keyword argument 'tol_sgd'
2026-05-21 20:18:34,629 - WARNING - Trial 5 failed with parameters: {'loss': 'squared_hinge', 'penalty': 'l1', 'alpha': 3.1850193609792694e-07, 'learning_rate': 'adaptive', 'eta0': 0.008513979913464045, 'l1_ratio': 0.9833415684602624, 'tol_sgd': 0.0004775285588830452, 'average': False} because of the following error: TypeError("SGDClassifier.__init__() got an unexpected keyword argument 'tol_sgd'").
Traceback (most recent call last):
  File "/home/junior/Documentos/GitHub/prediction-f1-pit-stops-kaggle-competition/.venv/lib/python3.13/site-packages/optuna/study/_optimize.py", line 206, in _run_trial
    value_or_values = func(trial)
  File "/home/junior/Documentos/GitHub/prediction-f1-pit-stops-kaggle-competition/src/sgdclassifier_tuning.py", line 122, in <lambda>
    study.optimize(lambda trial: objective(trial, X_train, y_train), n_trials=30, n_jobs=-1, show_progress_bar=True)
                                 ~~~~~~~~~^^^^^^^^^^^^^^^^^^^^^^^^^
  File "/home/junior/Documentos/GitHub/prediction-f1-pit-stops-kaggle-competition/src/sgdclassifier_tuning.py", line 93, in objective
    SGDClassifier(
    ~~~~~~~~~~~~~^
        loss=trial.suggest_categorical("loss", ["log_loss", "modified_huber", "hinge", "squared_hinge"]),
        ^^^^^^^^^^^^^^^^^^^^^^^^^^^^^^^^^^^^^^^^^^^^^^^^^^^^^^^^^^^^^^^^^^^^^^^^^^^^^^^^^^^^^^^^^^^^^^^^^
    ...<10 lines>...
        n_jobs=1
        ^^^^^^^^
    )
    ^
TypeError: SGDClassifier.__init__() got an unexpected keyword argument 'tol_sgd'
2026-05-21 20:18:34,629 - WARNING - Trial 11 failed with parameters: {'loss': 'modified_huber', 'penalty': 'elasticnet', 'alpha': 2.054713274843515e-06, 'learning_rate': 'adaptive', 'eta0': 0.002890729689618278, 'l1_ratio': 0.4951925711909717, 'tol_sgd': 3.735050647458867e-05, 'average': False} because of the following error: TypeError("SGDClassifier.__init__() got an unexpected keyword argument 'tol_sgd'").
Traceback (most recent call last):
  File "/home/junior/Documentos/GitHub/prediction-f1-pit-stops-kaggle-competition/.venv/lib/python3.13/site-packages/optuna/study/_optimize.py", line 206, in _run_trial
    value_or_values = func(trial)
  File "/home/junior/Documentos/GitHub/prediction-f1-pit-stops-kaggle-competition/src/sgdclassifier_tuning.py", line 122, in <lambda>
    study.optimize(lambda trial: objective(trial, X_train, y_train), n_trials=30, n_jobs=-1, show_progress_bar=True)
                                 ~~~~~~~~~^^^^^^^^^^^^^^^^^^^^^^^^^
  File "/home/junior/Documentos/GitHub/prediction-f1-pit-stops-kaggle-competition/src/sgdclassifier_tuning.py", line 93, in objective
    SGDClassifier(
    ~~~~~~~~~~~~~^
        loss=trial.suggest_categorical("loss", ["log_loss", "modified_huber", "hinge", "squared_hinge"]),
        ^^^^^^^^^^^^^^^^^^^^^^^^^^^^^^^^^^^^^^^^^^^^^^^^^^^^^^^^^^^^^^^^^^^^^^^^^^^^^^^^^^^^^^^^^^^^^^^^^
    ...<10 lines>...
        n_jobs=1
        ^^^^^^^^
    )
    ^
TypeError: SGDClassifier.__init__() got an unexpected keyword argument 'tol_sgd'
2026-05-21 20:18:34,630 - WARNING - Trial 7 failed with parameters: {'loss': 'log_loss', 'penalty': 'elasticnet', 'alpha': 1.0471320795364866e-05, 'learning_rate': 'adaptive', 'eta0': 0.0006883730407454291, 'l1_ratio': 0.46470112754353166, 'tol_sgd': 0.0014930022264936008, 'average': False} because of the following error: TypeError("SGDClassifier.__init__() got an unexpected keyword argument 'tol_sgd'").
Traceback (most recent call last):
  File "/home/junior/Documentos/GitHub/prediction-f1-pit-stops-kaggle-competition/.venv/lib/python3.13/site-packages/optuna/study/_optimize.py", line 206, in _run_trial
    value_or_values = func(trial)
  File "/home/junior/Documentos/GitHub/prediction-f1-pit-stops-kaggle-competition/src/sgdclassifier_tuning.py", line 122, in <lambda>
    study.optimize(lambda trial: objective(trial, X_train, y_train), n_trials=30, n_jobs=-1, show_progress_bar=True)
                                 ~~~~~~~~~^^^^^^^^^^^^^^^^^^^^^^^^^
  File "/home/junior/Documentos/GitHub/prediction-f1-pit-stops-kaggle-competition/src/sgdclassifier_tuning.py", line 93, in objective
    SGDClassifier(
    ~~~~~~~~~~~~~^
        loss=trial.suggest_categorical("loss", ["log_loss", "modified_huber", "hinge", "squared_hinge"]),
        ^^^^^^^^^^^^^^^^^^^^^^^^^^^^^^^^^^^^^^^^^^^^^^^^^^^^^^^^^^^^^^^^^^^^^^^^^^^^^^^^^^^^^^^^^^^^^^^^^
    ...<10 lines>...
        n_jobs=1
        ^^^^^^^^
    )
    ^
TypeError: SGDClassifier.__init__() got an unexpected keyword argument 'tol_sgd'
2026-05-21 20:18:34,631 - WARNING - Trial 9 failed with value None.
2026-05-21 20:18:34,632 - WARNING - Trial 6 failed with parameters: {'loss': 'squared_hinge', 'penalty': 'elasticnet', 'alpha': 0.0041769819634126515, 'learning_rate': 'optimal', 'eta0': 0.001825891046742564, 'l1_ratio': 0.024815184864179995, 'tol_sgd': 0.0002843729097248406, 'average': False} because of the following error: TypeError("SGDClassifier.__init__() got an unexpected keyword argument 'tol_sgd'").
Traceback (most recent call last):
  File "/home/junior/Documentos/GitHub/prediction-f1-pit-stops-kaggle-competition/.venv/lib/python3.13/site-packages/optuna/study/_optimize.py", line 206, in _run_trial
    value_or_values = func(trial)
  File "/home/junior/Documentos/GitHub/prediction-f1-pit-stops-kaggle-competition/src/sgdclassifier_tuning.py", line 122, in <lambda>
    study.optimize(lambda trial: objective(trial, X_train, y_train), n_trials=30, n_jobs=-1, show_progress_bar=True)
                                 ~~~~~~~~~^^^^^^^^^^^^^^^^^^^^^^^^^
  File "/home/junior/Documentos/GitHub/prediction-f1-pit-stops-kaggle-competition/src/sgdclassifier_tuning.py", line 93, in objective
    SGDClassifier(
    ~~~~~~~~~~~~~^
        loss=trial.suggest_categorical("loss", ["log_loss", "modified_huber", "hinge", "squared_hinge"]),
        ^^^^^^^^^^^^^^^^^^^^^^^^^^^^^^^^^^^^^^^^^^^^^^^^^^^^^^^^^^^^^^^^^^^^^^^^^^^^^^^^^^^^^^^^^^^^^^^^^
    ...<10 lines>...
        n_jobs=1
        ^^^^^^^^
    )
    ^
TypeError: SGDClassifier.__init__() got an unexpected keyword argument 'tol_sgd'
2026-05-21 20:18:34,633 - WARNING - Trial 3 failed with value None.
2026-05-21 20:18:34,634 - WARNING - Trial 5 failed with value None.
2026-05-21 20:18:34,635 - WARNING - Trial 11 failed with value None.
2026-05-21 20:18:34,635 - WARNING - Trial 7 failed with value None.
2026-05-21 20:18:34,636 - WARNING - Trial 6 failed with value None.
2026-05-21 20:19:28,047 - INFO - ----- Fine Tuning -----
2026-05-21 20:19:28,047 - INFO - A new study created in memory with name: no-name-05d520c1-f9c1-4e3a-ac6f-d15109975853
2026-05-21 20:19:36,959 - WARNING - Trial 8 failed with parameters: {'loss': 'hinge', 'penalty': 'l2', 'alpha': 0.04161818422453125, 'learning_rate': 'optimal', 'eta0': 0.006505952725965256, 'l1_ratio': 0.5023551252551857, 'tol': 2.3931799431858404e-05, 'average': False} because of the following error: AttributeError("This 'Pipeline' has no attribute 'predict_proba'").
Traceback (most recent call last):
  File "/home/junior/Documentos/GitHub/prediction-f1-pit-stops-kaggle-competition/.venv/lib/python3.13/site-packages/sklearn/utils/_available_if.py", line 32, in _check
    check_result = self.check(obj)
  File "/home/junior/Documentos/GitHub/prediction-f1-pit-stops-kaggle-competition/.venv/lib/python3.13/site-packages/sklearn/linear_model/_stochastic_gradient.py", line 1310, in _check_proba
    raise AttributeError(
        "probability estimates are not available for loss=%r" % self.loss
    )
AttributeError: probability estimates are not available for loss='hinge'

The above exception was the direct cause of the following exception:

Traceback (most recent call last):
  File "/home/junior/Documentos/GitHub/prediction-f1-pit-stops-kaggle-competition/.venv/lib/python3.13/site-packages/sklearn/utils/_available_if.py", line 32, in _check
    check_result = self.check(obj)
  File "/home/junior/Documentos/GitHub/prediction-f1-pit-stops-kaggle-competition/.venv/lib/python3.13/site-packages/sklearn/pipeline.py", line 45, in check
    getattr(self._final_estimator, attr)
    ~~~~~~~^^^^^^^^^^^^^^^^^^^^^^^^^^^^^
  File "/home/junior/Documentos/GitHub/prediction-f1-pit-stops-kaggle-competition/.venv/lib/python3.13/site-packages/sklearn/utils/_available_if.py", line 43, in __get__
    self._check(obj, owner=owner)
    ~~~~~~~~~~~^^^^^^^^^^^^^^^^^^
  File "/home/junior/Documentos/GitHub/prediction-f1-pit-stops-kaggle-competition/.venv/lib/python3.13/site-packages/sklearn/utils/_available_if.py", line 34, in _check
    raise AttributeError(attr_err_msg) from e
AttributeError: This 'SGDClassifier' has no attribute 'predict_proba'

The above exception was the direct cause of the following exception:

Traceback (most recent call last):
  File "/home/junior/Documentos/GitHub/prediction-f1-pit-stops-kaggle-competition/.venv/lib/python3.13/site-packages/optuna/study/_optimize.py", line 206, in _run_trial
    value_or_values = func(trial)
  File "/home/junior/Documentos/GitHub/prediction-f1-pit-stops-kaggle-competition/src/sgdclassifier_tuning.py", line 122, in <lambda>
    study.optimize(lambda trial: objective(trial, X_train, y_train), n_trials=30, n_jobs=-1, show_progress_bar=True)
                     