2026-05-21 01:24:25,516 - INFO - Trial 40 finished with value: 0.7705053839635893 and parameters: {'n_components': 0.9890932779435972, 'svd_solver': 'full', 'whiten': False, 'C': 0.007681419176218294, 'loss': 'squared_hinge', 'tol': 2.285697171538424e-06}. Best is trial 40 with value: 0.7705053839635893.
2026-05-21 01:24:25,526 - INFO - Trial 45 finished with value: 0.7708783342438873 and parameters: {'n_components': 0.9898844633798193, 'svd_solver': 'full', 'whiten': False, 'C': 0.00022633095609925444, 'loss': 'squared_hinge', 'tol': 2.203406431035072e-06}. Best is trial 45 with value: 0.7708783342438873.
2026-05-21 01:24:25,534 - INFO - Trial 41 finished with value: 0.7705053509416003 and parameters: {'n_components': 0.9889935543226674, 'svd_solver': 'full', 'whiten': False, 'C': 0.007049929122330277, 'loss': 'squared_hinge', 'tol': 2.133877416211478e-06}. Best is trial 45 with value: 0.7708783342438873.
2026-05-21 01:24:25,543 - INFO - Trial 36 finished with value: 0.7704121669452377 and parameters: {'n_components': 0.9880651767603694, 'svd_solver': 'full', 'whiten': False, 'C': 0.007568028370352718, 'loss': 'squared_hinge', 'tol': 2.1991188427416665e-06}. Best is trial 45 with value: 0.7708783342438873.
2026-05-21 01:24:41,580 - INFO - Trial 46 finished with value: 0.7690743330820226 and parameters: {'n_components': 0.9849504236491762, 'svd_solver': 'full', 'whiten': True, 'C': 0.00023824982723496236, 'loss': 'squared_hinge', 'tol': 7.89993696700365e-05}. Best is trial 45 with value: 0.7708783342438873.
2026-05-21 01:24:42,120 - INFO - Trial 49 finished with value: 0.7705076401753466 and parameters: {'n_components': 0.9893198985591993, 'svd_solver': 'full', 'whiten': True, 'C': 0.00018218843794386562, 'loss': 'squared_hinge', 'tol': 9.859658644165118e-05}. Best is trial 45 with value: 0.7708783342438873.
2026-05-21 01:24:42,297 - INFO - Trial 48 finished with value: 0.7704146751498977 and parameters: {'n_components': 0.9884112218731015, 'svd_solver': 'full', 'whiten': True, 'C': 0.00023100474793369437, 'loss': 'squared_hinge', 'tol': 2.3872453244976186e-06}. Best is trial 45 with value: 0.7708783342438873.
2026-05-21 01:24:42,299 - INFO - Best AUC: 0.7708783342438873 | Best params: {'n_components': 0.9898844633798193, 'svd_solver': 'full', 'whiten': False, 'C': 0.00022633095609925444, 'loss': 'squared_hinge', 'tol': 2.203406431035072e-06}
2026-05-21 01:24:42,299 - INFO - ----- Saving Pipeline -----
2026-05-21 01:25:17,340 - INFO - ----- Model Tuning -----
2026-05-21 01:25:17,340 - INFO - A new study created in memory with name: no-name-d0887a70-95b0-4268-9049-0ec800db2953
2026-05-21 01:27:46,331 - INFO - Trial 0 finished with value: 0.530358331355866 and parameters: {'n_components': 0.8490729830100597, 'svd_solver': 'full', 'whiten': True, 'C': 4.021003149180271, 'loss': 'squared_hinge', 'tol': 8.741152445453208e-06}. Best is trial 0 with value: 0.530358331355866.
2026-05-21 01:27:46,420 - INFO - Trial 7 finished with value: 0.5444299993104693 and parameters: {'n_components': 0.8857194441034205, 'svd_solver': 'full', 'whiten': True, 'C': 46.76709690084262, 'loss': 'squared_hinge', 'tol': 0.0002877489173310943}. Best is trial 7 with value: 0.5444299993104693.
2026-05-21 01:27:46,454 - INFO - Trial 1 finished with value: 0.5444299083780649 and parameters: {'n_components': 0.8861103814694017, 'svd_solver': 'full', 'whiten': False, 'C': 16.009619571712154, 'loss': 'squared_hinge', 'tol': 2.493527197494332e-06}. Best is trial 7 with value: 0.5444299993104693.
2026-05-21 01:27:46,469 - INFO - Trial 3 finished with value: 0.576260983391746 and parameters: {'n_components': 0.9201662487404688, 'svd_solver': 'full', 'whiten': False, 'C': 30.810254979599513, 'loss': 'squared_hinge', 'tol': 0.002535476048526685}. Best is trial 3 with value: 0.576260983391746.
2026-05-21 01:27:46,498 - INFO - Trial 5 finished with value: 0.5303612164450181 and parameters: {'n_components': 0.8202124032040659, 'svd_solver': 'full', 'whiten': True, 'C': 0.3879943205787135, 'loss': 'squared_hinge', 'tol': 0.006749586227161375}. Best is trial 3 with value: 0.576260983391746.
2026-05-21 01:27:46,547 - INFO - Trial 11 finished with value: 0.5767618663182594 and parameters: {'n_components': 0.9165935856241226, 'svd_solver': 'full', 'whiten': False, 'C': 4.292629789207671e-05, 'loss': 'squared_hinge', 'tol': 1.103408391651744e-05}. Best is trial 11 with value: 0.5767618663182594.
2026-05-21 01:27:46,614 - INFO - Trial 10 finished with value: 0.7131292411451096 and parameters: {'n_components': 0.9554804701677944, 'svd_solver': 'full', 'whiten': True, 'C': 32.078273716210965, 'loss': 'squared_hinge', 'tol': 7.288253416362015e-05}. Best is trial 10 with value: 0.7131292411451096.
2026-05-21 01:27:46,638 - INFO - Trial 4 finished with value: 0.544430143924124 and parameters: {'n_components': 0.8953674585477575, 'svd_solver': 'full', 'whiten': True, 'C': 0.12101983221288533, 'loss': 'squared_hinge', 'tol': 3.31560799108046e-05}. Best is trial 10 with value: 0.7131292411451096.
2026-05-21 01:27:46,788 - INFO - Trial 9 finished with value: 0.7448140762538367 and parameters: {'n_components': 0.9785929597429968, 'svd_solver': 'full', 'whiten': True, 'C': 0.0002703864419642645, 'loss': 'squared_hinge', 'tol': 1.1381526262311225e-05}. Best is trial 9 with value: 0.7448140762538367.
2026-05-21 01:27:46,876 - INFO - Trial 8 finished with value: 0.7157808832691366 and parameters: {'n_components': 0.968107725369604, 'svd_solver': 'full', 'whiten': True, 'C': 0.017871012350278007, 'loss': 'squared_hinge', 'tol': 0.0009458033127575515}. Best is trial 9 with value: 0.7448140762538367.
2026-05-21 01:27:46,944 - INFO - Trial 6 finished with value: 0.7146986949776567 and parameters: {'n_components': 0.9643413651387345, 'svd_solver': 'full', 'whiten': True, 'C': 0.915858032407645, 'loss': 'squared_hinge', 'tol': 7.441278065331798e-06}. Best is trial 9 with value: 0.7448140762538367.
2026-05-21 01:27:46,971 - INFO - Trial 2 finished with value: 0.7192270277472783 and parameters: {'n_components': 0.9715166507418052, 'svd_solver': 'full', 'whiten': True, 'C': 0.1632518115776584, 'loss': 'squared_hinge', 'tol': 1.1932536605270938e-05}. Best is trial 9 with value: 0.7448140762538367.
2026-05-21 01:29:58,293 - INFO - Trial 12 finished with value: 0.6095353327411728 and parameters: {'n_components': 0.9271175727451384, 'svd_solver': 'full', 'whiten': True, 'C': 2.5228040573691537, 'loss': 'squared_hinge', 'tol': 1.6724743804557383e-05}. Best is trial 9 with value: 0.7448140762538367.
2026-05-21 01:29:58,635 - INFO - Trial 21 finished with value: 0.7124569479426835 and parameters: {'n_components': 0.9410373248422967, 'svd_solver': 'full', 'whiten': True, 'C': 0.0019119895317133296, 'loss': 'squared_hinge', 'tol': 1.8062826089580982e-06}. Best is trial 9 with value: 0.7448140762538367.
2026-05-21 01:30:16,840 - INFO - Trial 18 finished with value: 0.7687443758655321 and parameters: {'n_components': 0.9839405357255192, 'svd_solver': 'full', 'whiten': True, 'C': 0.0026506634844974787, 'loss': 'squared_hinge', 'tol': 1.1423063214564828e-06}. Best is trial 18 with value: 0.7687443758655321.
2026-05-21 01:30:21,890 - INFO - Trial 17 finished with value: 0.7694111515091658 and parameters: {'n_components': 0.9861449319400742, 'svd_solver': 'full', 'whiten': True, 'C': 0.0027580746247982905, 'loss': 'squared_hinge', 'tol': 1.2160432780657187e-06}. Best is trial 17 with value: 0.7694111515091658.
2026-05-21 01:30:22,003 - INFO - Trial 15 finished with value: 0.7691008374685373 and parameters: {'n_components': 0.9855702599934698, 'svd_solver': 'full', 'whiten': True, 'C': 0.002894090402101606, 'loss': 'squared_hinge', 'tol': 1.1343422985341915e-06}. Best is trial 17 with value: 0.7694111515091658.
2026-05-21 01:30:22,332 - INFO - Trial 22 finished with value: 0.7690776322137068 and parameters: {'n_components': 0.9849352548013977, 'svd_solver': 'full', 'whiten': True, 'C': 0.0025715811719501124, 'loss': 'squared_hinge', 'tol': 1.1336647084194475e-06}. Best is trial 17 with value: 0.7694111515091658.
2026-05-21 01:30:22,747 - INFO - Trial 13 finished with value: 0.7691328465049264 and parameters: {'n_components': 0.9859408749778846, 'svd_solver': 'full', 'whiten': True, 'C': 0.0025996320863640524, 'loss': 'squared_hinge', 'tol': 1.044984788106435e-06}. Best is trial 17 with value: 0.7694111515091658.
2026-05-21 01:30:22,789 - INFO - Trial 20 finished with value: 0.769411009659241 and parameters: {'n_components': 0.9868140741588515, 'svd_solver': 'full', 'whiten': True, 'C': 0.002092813032595811, 'loss': 'squared_hinge', 'tol': 1.0094833490225657e-06}. Best is trial 17 with value: 0.7694111515091658.
2026-05-21 01:30:22,800 - INFO - Trial 14 finished with value: 0.7705095615291355 and parameters: {'n_components': 0.9890461395461976, 'svd_solver': 'full', 'whiten': True, 'C': 0.0026417517128731866, 'loss': 'squared_hinge', 'tol': 3.428918026793246e-05}. Best is trial 14 with value: 0.7705095615291355.
2026-05-21 01:30:27,556 - INFO - Trial 16 finished with value: 0.7701325648658514 and parameters: {'n_components': 0.9875990891388499, 'svd_solver': 'full', 'whiten': True, 'C': 0.0030939014357595695, 'loss': 'squared_hinge', 'tol': 1.4323368674655285e-06}. Best is trial 14 with value: 0.7705095615291355.
2026-05-21 01:30:28,485 - INFO - Trial 23 finished with value: 0.7701321328103914 and parameters: {'n_components': 0.9877026099278587, 'svd_solver': 'full', 'whiten': True, 'C': 0.0020844906071640266, 'loss': 'squared_hinge', 'tol': 1.2370220895927373e-06}. Best is trial 14 with value: 0.7705095615291355.
2026-05-21 01:30:28,547 - INFO - Trial 19 finished with value: 0.7704128643163365 and parameters: {'n_components': 0.9882534258571845, 'svd_solver': 'full', 'whiten': True, 'C': 0.002099502691283067, 'loss': 'squared_hinge', 'tol': 1.304350059680774e-06}. Best is trial 14 with value: 0.7705095615291355.
2026-05-21 01:31:57,234 - INFO - Trial 32 pruned. 
2026-05-21 01:31:57,475 - INFO - Trial 30 pruned. 
2026-05-21 01:31:57,481 - INFO - Trial 35 pruned. 
2026-05-21 01:31:57,517 - INFO - Trial 34 pruned. 
2026-05-21 01:31:57,588 - INFO - Trial 29 pruned. 
2026-05-21 01:31:57,597 - INFO - Trial 31 pruned. 
2026-05-21 01:31:57,608 - INFO - Trial 28 pruned. 
2026-05-21 01:31:57,659 - INFO - Trial 27 pruned. 
2026-05-21 01:31:57,765 - INFO - Trial 33 pruned. 
2026-05-21 01:32:28,722 - INFO - Trial 24 finished with value: 0.7676429059026317 and parameters: {'n_components': 0.9812294856356149, 'svd_solver': 'full', 'whiten': False, 'C': 0.00019416250846103025, 'loss': 'squared_hinge', 'tol': 0.00017534536972802742}. Best is trial 14 with value: 0.7705095615291355.
2026-05-21 01:32:28,769 - INFO - Trial 25 finished with value: 0.7708789750219693 and parameters: {'n_components': 0.9898445672383137, 'svd_solver': 'full', 'whiten': False, 'C': 0.00039919834079521423, 'loss': 'squared_hinge', 'tol': 0.00022567853464034986}. Best is trial 25 with value: 0.7708789750219693.
2026-05-21 01:32:59,048 - INFO - Trial 26 finished with value: 0.7687388404567363 and parameters: {'n_components': 0.984432442381061, 'svd_solver': 'full', 'whiten': False, 'C': 0.00014098546310785457, 'loss': 'squared_hinge', 'tol': 1.520381557900679e-06}. Best is trial 25 with value: 0.7708789750219693.
2026-05-21 01:33:28,897 - INFO - Trial 41 pruned. 
2026-05-21 01:33:29,097 - INFO - Trial 40 pruned. 
2026-05-21 01:33:29,146 - INFO - Trial 38 pruned. 
2026-05-21 01:33:29,238 - INFO - Trial 37 pruned. 
2026-05-21 01:33:29,248 - INFO - Trial 36 pruned. 
2026-05-21 01:33:29,264 - INFO - Trial 43 pruned. 
2026-05-21 01:33:29,268 - INFO - Trial 39 pruned. 
2026-05-21 01:33:29,276 - INFO - Trial 42 pruned. 
2026-05-21 01:33:29,299 - INFO - Trial 44 pruned. 
2026-05-21 01:33:59,197 - INFO - Trial 46 pruned. 
2026-05-21 01:33:59,342 - INFO - Trial 45 pruned. 
2026-05-21 01:34:29,116 - INFO - Trial 47 pruned. 
2026-05-21 01:34:58,549 - INFO - Trial 48 pruned. 
2026-05-21 01:34:58,568 - INFO - Trial 52 pruned. 
2026-05-21 01:34:58,647 - INFO - Trial 50 pruned. 
2026-05-21 01:34:58,706 - INFO - Trial 56 pruned. 
2026-05-21 01:34:58,706 - INFO - Trial 49 pruned. 
2026-05-21 01:34:58,728 - INFO - Trial 53 pruned. 
2026-05-21 01:34:58,736 - INFO - Trial 54 pruned. 
2026-05-21 01:34:58,758 - INFO - Trial 51 pruned. 
2026-05-21 01:34:58,799 - INFO - Trial 55 pruned. 
2026-05-21 01:35:29,328 - INFO - Trial 57 pruned. 
2026-05-21 01:35:29,348 - INFO - Trial 58 pruned. 
2026-05-21 01:35:59,787 - INFO - Trial 59 pruned. 
2026-05-21 01:36:30,371 - INFO - Trial 66 pruned. 
2026-05-21 01:36:30,540 - INFO - Trial 68 pruned. 
2026-05-21 01:36:30,753 - INFO - Trial 67 pruned. 
2026-05-21 01:36:30,787 - INFO - Trial 65 pruned. 
2026-05-21 01:36:31,057 - INFO - Trial 60 pruned. 
2026-05-21 01:36:31,080 - INFO - Trial 61 pruned. 
2026-05-21 01:37:01,276 - INFO - Trial 70 pruned. 
2026-05-21 01:37:02,549 - INFO - Trial 69 pruned. 
2026-05-21 01:37:32,462 - INFO - Trial 64 finished with value: 0.7448119406040996 and parameters: {'n_components': 0.9787242603115585, 'svd_solver': 'full', 'whiten': True, 'C': 0.20760485288067698, 'loss': 'squared_hinge', 'tol': 6.810277884578454e-06}. Best is trial 25 with value: 0.7708789750219693.
2026-05-21 01:37:32,509 - INFO - Trial 63 finished with value: 0.744535956336877 and parameters: {'n_components': 0.9782612041335058, 'svd_solver': 'full', 'whiten': True, 'C': 0.004659337009392062, 'loss': 'squared_hinge', 'tol': 7.126643916839805e-06}. Best is trial 25 with value: 0.7708789750219693.
2026-05-21 01:37:34,574 - INFO - Trial 62 finished with value: 0.7709633060196877 and parameters: {'n_components': 0.9899693575840214, 'svd_solver': 'full', 'whiten': True, 'C': 4.7328440768446174e-05, 'loss': 'squared_hinge', 'tol': 6.005650603077046e-05}. Best is trial 62 with value: 0.7709633060196877.
2026-05-21 01:38:37,685 - INFO - Trial 71 finished with value: 0.7708763544176687 and parameters: {'n_components': 0.9899554424532915, 'svd_solver': 'full', 'whiten': False, 'C': 7.075175332355592e-05, 'loss': 'squared_hinge', 'tol': 2.1517338012592677e-06}. Best is trial 62 with value: 0.7709633060196877.
2026-05-21 01:38:42,713 - INFO - Trial 80 pruned. 
2026-05-21 01:39:07,313 - INFO - Trial 75 finished with value: 0.7705076133015694 and parameters: {'n_components': 0.9891692073753929, 'svd_solver': 'full', 'whiten': False, 'C': 0.0015402337597462468, 'loss': 'squared_hinge', 'tol': 2.1838062416118803e-06}. Best is trial 62 with value: 0.7709633060196877.
2026-05-21 01:39:10,816 - INFO - Trial 74 finished with value: 0.7707424711153152 and parameters: {'n_components': 0.989510319311591, 'svd_solver': 'full', 'whiten': False, 'C': 0.0017643606559559187, 'loss': 'squared_hinge', 'tol': 2.150752807445298e-06}. Best is trial 62 with value: 0.7709633060196877.
2026-05-21 01:39:10,845 - INFO - Trial 76 finished with value: 0.7705075758865544 and parameters: {'n_components': 0.9889918930216429, 'svd_solver': 'full', 'whiten': False, 'C': 0.0014285271041183244, 'loss': 'squared_hinge', 'tol': 1.8223217713350356e-06}. Best is trial 62 with value: 0.7709633060196877.
2026-05-21 01:39:11,164 - INFO - Trial 73 finished with value: 0.7707424546855621 and parameters: {'n_components': 0.9894412196162916, 'svd_solver': 'full', 'whiten': False, 'C': 0.001696350023841636, 'loss': 'squared_hinge', 'tol': 2.1684967128828476e-06}. Best is trial 62 with value: 0.7709633060196877.
2026-05-21 01:39:11,256 - INFO - Trial 77 finished with value: 0.7698936418114058 and parameters: {'n_components': 0.9872700331651405, 'svd_solver': 'full', 'whiten': False, 'C': 0.0016290273826437276, 'loss': 'squared_hinge', 'tol': 2.280603287860265e-06}. Best is trial 62 with value: 0.7709633060196877.
2026-05-21 01:39:11,326 - INFO - Trial 72 finished with value: 0.7707424663979323 and parameters: {'n_components': 0.9894277565841031, 'svd_solver': 'full', 'whiten': False, 'C': 0.0016829301671097779, 'loss': 'squared_hinge', 'tol': 1.9855334015998973e-06}. Best is trial 62 with value: 0.7709633060196877.
2026-05-21 01:39:42,146 - INFO - Trial 79 finished with value: 0.7708837044774356 and parameters: {'n_components': 0.9896730243972707, 'svd_solver': 'full', 'whiten': False, 'C': 0.001765615595180372, 'loss': 'squared_hinge', 'tol': 2.341497092190252e-06}. Best is trial 62 with value: 0.7709633060196877.
2026-05-21 01:39:42,618 - INFO - Trial 78 finished with value: 0.7705089128846103 and parameters: {'n_components': 0.9888542629103269, 'svd_solver': 'full', 'whiten': False, 'C': 0.0015099436536753369, 'loss': 'squared_hinge', 'tol': 1.7874462115164987e-06}. Best is trial 62 with value: 0.7709633060196877.
2026-05-21 01:39:49,100 - INFO - Trial 81 finished with value: 0.7705128069342033 and parameters: {'n_components': 0.98925629523079, 'svd_solver': 'full', 'whiten': False, 'C': 0.00039459986707005284, 'loss': 'squared_hinge', 'tol': 0.002436075974650758}. Best is trial 62 with value: 0.7709633060196877.
2026-05-21 01:40:13,430 - INFO - Trial 82 finished with value: 0.7708817756797923 and parameters: {'n_components': 0.9897536432960771, 'svd_solver': 'full', 'whiten': False, 'C': 0.0015664589296559444, 'loss': 'squared_hinge', 'tol': 1.4923400624112008e-06}. Best is trial 62 with value: 0.7709633060196877.
2026-05-21 01:40:43,576 - INFO - Trial 87 pruned. 
2026-05-21 01:40:43,599 - INFO - Trial 86 pruned. 
2026-05-21 01:40:43,939 - INFO - Trial 88 pruned. 
2026-05-21 01:40:44,147 - INFO - Trial 90 pruned. 
2026-05-21 01:40:44,485 - INFO - Trial 89 pruned. 
2026-05-21 01:41:14,242 - INFO - Trial 91 pruned. 
2026-05-21 01:41:14,448 - INFO - Trial 92 pruned. 
2026-05-21 01:41:15,812 - INFO - Trial 83 finished with value: 0.7705088368115094 and parameters: {'n_components': 0.988737482176297, 'svd_solver': 'full', 'whiten': False, 'C': 0.00040553718514200137, 'loss': 'squared_hinge', 'tol': 1.401651540860372e-06}. Best is trial 62 with value: 0.7709633060196877.
2026-05-21 01:41:16,882 - INFO - Trial 84 finished with value: 0.7698958347039123 and parameters: {'n_components': 0.9872105854909807, 'svd_solver': 'full', 'whiten': False, 'C': 0.0017175267087105785, 'loss': 'squared_hinge', 'tol': 2.5820468522754523e-06}. Best is trial 62 with value: 0.7709633060196877.
2026-05-21 01:41:20,424 - INFO - Trial 93 pruned. 
2026-05-21 01:41:35,166 - INFO - Trial 94 pruned. 
2026-05-21 01:41:36,214 - INFO - Trial 85 finished with value: 0.770887069557143 and parameters: {'n_components': 0.9896934681264191, 'svd_solver': 'full', 'whiten': False, 'C': 0.000400344453459912, 'loss': 'squared_hinge', 'tol': 2.6380146748155437e-06}. Best is trial 62 with value: 0.7709633060196877.
2026-05-21 01:41:47,290 - INFO - Trial 99 pruned. 
2026-05-21 01:41:47,790 - INFO - Trial 97 pruned. 
2026-05-21 01:41:47,801 - INFO - Trial 98 pruned. 
2026-05-21 01:41:47,808 - INFO - Trial 96 pruned. 
2026-05-21 01:41:47,810 - INFO - Trial 95 pruned. 
2026-05-21 01:41:47,811 - INFO - Best AUC: 0.7709633060196877 | Best params: {'n_components': 0.9899693575840214, 'svd_solver': 'full', 'whiten': True, 'C': 4.7328440768446174e-05, 'loss': 'squared_hinge', 'tol': 6.005650603077046e-05}
2026-05-21 01:41:47,811 - INFO - ----- Saving Pipeline -----
