2026-05-21 01:03:50,723 - INFO - Trial 5 finished with value: 0.7133161581993583 and parameters: {'n_components': 0.9558625978616477, 'svd_solver': 'full', 'whiten': False, 'iterated_power': 4, 'power_iteration_normalizer': 'QR', 'C': 0.016574341070916584, 'loss': 'squared_hinge', 'tol': 0.0019424454675649513}. Best is trial 5 with value: 0.7133161581993583.
2026-05-21 01:03:50,759 - INFO - Trial 2 finished with value: 0.6095353600764511 and parameters: {'n_components': 0.9263696006072529, 'svd_solver': 'full', 'whiten': False, 'iterated_power': 3, 'power_iteration_normalizer': 'auto', 'C': 0.001195477362905689, 'loss': 'squared_hinge', 'tol': 0.00419914320022039}. Best is trial 5 with value: 0.7133161581993583.
2026-05-21 01:03:51,111 - INFO - Trial 6 finished with value: 0.6784401805713554 and parameters: {'n_components': 0.9311782261795192, 'svd_solver': 'full', 'whiten': False, 'iterated_power': 1, 'power_iteration_normalizer': 'LU', 'C': 0.0001360614926074703, 'loss': 'squared_hinge', 'tol': 0.0003480261499345724}. Best is trial 5 with value: 0.7133161581993583.
2026-05-21 01:03:51,436 - INFO - Trial 11 finished with value: 0.7130992058024146 and parameters: {'n_components': 0.9512466161037358, 'svd_solver': 'full', 'whiten': False, 'iterated_power': 9, 'power_iteration_normalizer': 'LU', 'C': 98.48719933628932, 'loss': 'squared_hinge', 'tol': 9.912145101892615e-06}. Best is trial 5 with value: 0.7133161581993583.
2026-05-21 01:03:51,459 - INFO - Trial 0 finished with value: 0.7148399311083127 and parameters: {'n_components': 0.9657497729089781, 'svd_solver': 'full', 'whiten': False, 'iterated_power': 9, 'power_iteration_normalizer': 'QR', 'C': 2.3518379202828235, 'loss': 'squared_hinge', 'tol': 0.0002935649814074917}. Best is trial 0 with value: 0.7148399311083127.
2026-05-21 01:03:51,463 - INFO - Trial 8 finished with value: 0.7129854445810055 and parameters: {'n_components': 0.9496929732951489, 'svd_solver': 'full', 'whiten': False, 'iterated_power': 3, 'power_iteration_normalizer': 'QR', 'C': 0.13209314934178187, 'loss': 'squared_hinge', 'tol': 0.0002744396063903099}. Best is trial 0 with value: 0.7148399311083127.
2026-05-21 01:03:51,485 - INFO - Trial 1 finished with value: 0.7192271726926489 and parameters: {'n_components': 0.9705464091939489, 'svd_solver': 'full', 'whiten': False, 'iterated_power': 8, 'power_iteration_normalizer': 'LU', 'C': 0.00037397846947323846, 'loss': 'squared_hinge', 'tol': 0.00018333276071366938}. Best is trial 1 with value: 0.7192271726926489.
2026-05-21 01:04:33,092 - INFO - ----- Model Tuning -----
2026-05-21 01:04:33,092 - INFO - A new study created in memory with name: no-name-58b229ee-2adf-4dfa-a32b-af3f452c2532
2026-05-21 01:06:36,501 - INFO - ----- Model Tuning -----
2026-05-21 01:06:36,501 - INFO - A new study created in memory with name: no-name-b800d4df-7ff6-4908-8e35-d93ff9eb76a7
2026-05-21 01:09:14,505 - INFO - Trial 4 finished with value: 0.5303581525797589 and parameters: {'n_components': 0.8254014673260401, 'svd_solver': 'full', 'whiten': False, 'iterated_power': 9, 'power_iteration_normalizer': 'QR', 'C': 6.565814840062073, 'loss': 'squared_hinge', 'tol': 1.4788147363131549e-06}. Best is trial 4 with value: 0.5303581525797589.
2026-05-21 01:09:14,538 - INFO - Trial 9 finished with value: 0.5303581366380276 and parameters: {'n_components': 0.8202094970270787, 'svd_solver': 'full', 'whiten': True, 'iterated_power': 3, 'power_iteration_normalizer': 'LU', 'C': 3.470027703219975, 'loss': 'squared_hinge', 'tol': 5.288680301685803e-06}. Best is trial 4 with value: 0.5303581525797589.
2026-05-21 01:09:14,544 - INFO - Trial 8 finished with value: 0.5303640106216332 and parameters: {'n_components': 0.8443180905885901, 'svd_solver': 'full', 'whiten': True, 'iterated_power': 4, 'power_iteration_normalizer': 'auto', 'C': 0.0027402910983472853, 'loss': 'squared_hinge', 'tol': 2.07919580877757e-06}. Best is trial 8 with value: 0.5303640106216332.
2026-05-21 01:09:14,556 - INFO - Trial 2 finished with value: 0.5224106083817138 and parameters: {'n_components': 0.8070729145503878, 'svd_solver': 'full', 'whiten': False, 'iterated_power': 6, 'power_iteration_normalizer': 'QR', 'C': 1.1443009938733178e-05, 'loss': 'squared_hinge', 'tol': 1.4369381352106542e-05}. Best is trial 8 with value: 0.5303640106216332.
2026-05-21 01:09:14,612 - INFO - Trial 0 finished with value: 0.7123578087739981 and parameters: {'n_components': 0.9383418090777791, 'svd_solver': 'full', 'whiten': True, 'iterated_power': 1, 'power_iteration_normalizer': 'LU', 'C': 0.0007184785267808544, 'loss': 'squared_hinge', 'tol': 0.002520212539672056}. Best is trial 0 with value: 0.7123578087739981.
2026-05-21 01:09:14,782 - INFO - Trial 6 finished with value: 0.7128928540756587 and parameters: {'n_components': 0.947832502140963, 'svd_solver': 'full', 'whiten': False, 'iterated_power': 1, 'power_iteration_normalizer': 'auto', 'C': 8.488721030687863e-05, 'loss': 'squared_hinge', 'tol': 5.7906957431156e-06}. Best is trial 6 with value: 0.7128928540756587.
2026-05-21 01:09:14,813 - INFO - Trial 5 finished with value: 0.5444296440358386 and parameters: {'n_components': 0.9118251671911315, 'svd_solver': 'full', 'whiten': False, 'iterated_power': 4, 'power_iteration_normalizer': 'LU', 'C': 6.296797527062074, 'loss': 'squared_hinge', 'tol': 0.0005104616539889484}. Best is trial 6 with value: 0.7128928540756587.
2026-05-21 01:09:14,816 - INFO - Trial 1 finished with value: 0.5303583002856485 and parameters: {'n_components': 0.8227619041162025, 'svd_solver': 'full', 'whiten': True, 'iterated_power': 6, 'power_iteration_normalizer': 'QR', 'C': 18.758644555930797, 'loss': 'squared_hinge', 'tol': 2.763393182613338e-06}. Best is trial 6 with value: 0.7128928540756587.
2026-05-21 01:09:14,875 - INFO - Trial 10 finished with value: 0.5287673049043375 and parameters: {'n_components': 0.8707779610329915, 'svd_solver': 'full', 'whiten': True, 'iterated_power': 3, 'power_iteration_normalizer': 'QR', 'C': 59.658938223001, 'loss': 'squared_hinge', 'tol': 0.00021768563659488926}. Best is trial 6 with value: 0.7128928540756587.
2026-05-21 01:09:14,948 - INFO - Trial 11 finished with value: 0.7136088659517222 and parameters: {'n_components': 0.9608564048754841, 'svd_solver': 'full', 'whiten': False, 'iterated_power': 9, 'power_iteration_normalizer': 'auto', 'C': 7.346576344500878e-05, 'loss': 'squared_hinge', 'tol': 0.00025339785440471683}. Best is trial 11 with value: 0.7136088659517222.
2026-05-21 01:09:14,978 - INFO - Trial 3 finished with value: 0.5444419472786516 and parameters: {'n_components': 0.8890504531331307, 'svd_solver': 'full', 'whiten': False, 'iterated_power': 4, 'power_iteration_normalizer': 'QR', 'C': 0.002305421969608325, 'loss': 'squared_hinge', 'tol': 4.76781230482943e-06}. Best is trial 11 with value: 0.7136088659517222.
2026-05-21 01:09:15,063 - INFO - Trial 7 finished with value: 0.7694108514214878 and parameters: {'n_components': 0.9870432162754412, 'svd_solver': 'full', 'whiten': True, 'iterated_power': 2, 'power_iteration_normalizer': 'LU', 'C': 3.962407814028763, 'loss': 'squared_hinge', 'tol': 0.0019412297637342586}. Best is trial 7 with value: 0.7694108514214878.
2026-05-21 01:11:50,412 - INFO - Trial 14 finished with value: 0.769035054762909 and parameters: {'n_components': 0.9846302701718344, 'svd_solver': 'full', 'whiten': False, 'iterated_power': 10, 'power_iteration_normalizer': 'auto', 'C': 0.1390707348756247, 'loss': 'squared_hinge', 'tol': 0.007533224146795535}. Best is trial 7 with value: 0.7694108514214878.
2026-05-21 01:11:50,424 - INFO - Trial 15 finished with value: 0.7680685217865424 and parameters: {'n_components': 0.9824150626491412, 'svd_solver': 'full', 'whiten': False, 'iterated_power': 10, 'power_iteration_normalizer': 'auto', 'C': 0.1990916258916828, 'loss': 'squared_hinge', 'tol': 0.009849556882143154}. Best is trial 7 with value: 0.7694108514214878.
2026-05-21 01:11:50,529 - INFO - Trial 21 finished with value: 0.7451424590414512 and parameters: {'n_components': 0.9795650522904199, 'svd_solver': 'full', 'whiten': True, 'iterated_power': 9, 'power_iteration_normalizer': 'auto', 'C': 0.09589667638625389, 'loss': 'squared_hinge', 'tol': 0.007462296641353162}. Best is trial 7 with value: 0.7694108514214878.
2026-05-21 01:11:50,667 - INFO - Trial 13 finished with value: 0.769410927226113 and parameters: {'n_components': 0.9871133086724954, 'svd_solver': 'full', 'whiten': False, 'iterated_power': 10, 'power_iteration_normalizer': 'auto', 'C': 0.12134569070431157, 'loss': 'squared_hinge', 'tol': 0.009121312794624713}. Best is trial 13 with value: 0.769410927226113.
2026-05-21 01:11:50,682 - INFO - Trial 23 finished with value: 0.7684143248267592 and parameters: {'n_components': 0.9829360119915503, 'svd_solver': 'full', 'whiten': False, 'iterated_power': 10, 'power_iteration_normalizer': 'auto', 'C': 0.1682135869545778, 'loss': 'squared_hinge', 'tol': 0.008240458145497658}. Best is trial 13 with value: 0.769410927226113.
2026-05-21 01:11:50,752 - INFO - Trial 12 finished with value: 0.7705095469308688 and parameters: {'n_components': 0.9886219868408617, 'svd_solver': 'full', 'whiten': True, 'iterated_power': 10, 'power_iteration_normalizer': 'auto', 'C': 0.14761188751763923, 'loss': 'squared_hinge', 'tol': 0.005996600214416379}. Best is trial 12 with value: 0.7705095469308688.
2026-05-21 01:11:50,760 - INFO - Trial 19 finished with value: 0.7694109107971014 and parameters: {'n_components': 0.9862456647464578, 'svd_solver': 'full', 'whiten': False, 'iterated_power': 10, 'power_iteration_normalizer': 'auto', 'C': 0.17015686939300417, 'loss': 'squared_hinge', 'tol': 0.009369182580057972}. Best is trial 12 with value: 0.7705095469308688.
2026-05-21 01:11:50,895 - INFO - Trial 16 finished with value: 0.7701355100756038 and parameters: {'n_components': 0.9875451546077537, 'svd_solver': 'full', 'whiten': True, 'iterated_power': 10, 'power_iteration_normalizer': 'auto', 'C': 0.1280559208842355, 'loss': 'squared_hinge', 'tol': 0.006294011565023796}. Best is trial 12 with value: 0.7705095469308688.
2026-05-21 01:11:50,924 - INFO - Trial 20 finished with value: 0.7707440213270912 and parameters: {'n_components': 0.989448048183618, 'svd_solver': 'full', 'whiten': True, 'iterated_power': 10, 'power_iteration_normalizer': 'auto', 'C': 0.23249313586931764, 'loss': 'squared_hinge', 'tol': 0.0025808265259923383}. Best is trial 20 with value: 0.7707440213270912.
2026-05-21 01:11:51,039 - INFO - Trial 17 finished with value: 0.7704163661870969 and parameters: {'n_components': 0.9882405544660929, 'svd_solver': 'full', 'whiten': True, 'iterated_power': 10, 'power_iteration_normalizer': 'auto', 'C': 0.07872225870770966, 'loss': 'squared_hinge', 'tol': 0.006756266242697943}. Best is trial 20 with value: 0.7707440213270912.
2026-05-21 01:11:51,085 - INFO - Trial 22 finished with value: 0.7705095387967333 and parameters: {'n_components': 0.9890164227371888, 'svd_solver': 'full', 'whiten': False, 'iterated_power': 10, 'power_iteration_normalizer': 'auto', 'C': 0.16517391381385296, 'loss': 'squared_hinge', 'tol': 0.008969144660893463}. Best is trial 20 with value: 0.7707440213270912.
2026-05-21 01:11:51,099 - INFO - Trial 18 finished with value: 0.7694108850949462 and parameters: {'n_components': 0.9870662094415742, 'svd_solver': 'full', 'whiten': True, 'iterated_power': 9, 'power_iteration_normalizer': 'auto', 'C': 0.21460220876747413, 'loss': 'squared_hinge', 'tol': 0.007880197696516492}. Best is trial 20 with value: 0.7707440213270912.
2026-05-21 01:12:36,550 - INFO - Trial 29 pruned. 
2026-05-21 01:12:36,583 - INFO - Trial 27 pruned. 
2026-05-21 01:12:36,612 - INFO - Trial 24 pruned. 
2026-05-21 01:12:36,616 - INFO - Trial 28 pruned. 
2026-05-21 01:12:36,620 - INFO - Trial 25 pruned. 
2026-05-21 01:12:36,625 - INFO - Trial 26 pruned. 
2026-05-21 01:15:09,838 - INFO - ----- Model Tuning -----
2026-05-21 01:15:09,839 - INFO - A new study created in memory with name: no-name-29c2569a-7797-42f3-97ea-373c732f9699
2026-05-21 01:17:39,962 - INFO - Trial 8 finished with value: 0.6095394409960198 and parameters: {'n_components': 0.9281439183074076, 'svd_solver': 'full', 'whiten': False, 'C': 0.027813123593290554, 'loss': 'squared_hinge', 'tol': 0.004019285982514077}. Best is trial 8 with value: 0.6095394409960198.
2026-05-21 01:17:40,257 - INFO - Trial 2 finished with value: 0.5303584808458605 and parameters: {'n_components': 0.8229761742848765, 'svd_solver': 'full', 'whiten': True, 'C': 0.6721122311873995, 'loss': 'squared_hinge', 'tol': 0.0003232100644534827}. Best is trial 8 with value: 0.6095394409960198.
2026-05-21 01:17:40,262 - INFO - Trial 1 finished with value: 0.6784397156546196 and parameters: {'n_components': 0.930610152380856, 'svd_solver': 'full', 'whiten': False, 'C': 21.15964464340201, 'loss': 'squared_hinge', 'tol': 2.941707654973954e-06}. Best is trial 1 with value: 0.6784397156546196.
2026-05-21 01:17:40,294 - INFO - Trial 3 finished with value: 0.5444339299305755 and parameters: {'n_components': 0.9106032745293494, 'svd_solver': 'full', 'whiten': True, 'C': 0.01791316454387537, 'loss': 'squared_hinge', 'tol': 0.0024637058589721426}. Best is trial 1 with value: 0.6784397156546196.
2026-05-21 01:17:40,300 - INFO - Trial 10 finished with value: 0.5303581659186973 and parameters: {'n_components': 0.8471094534755501, 'svd_solver': 'full', 'whiten': False, 'C': 0.6527213854248474, 'loss': 'squared_hinge', 'tol': 1.1497245259160666e-05}. Best is trial 1 with value: 0.6784397156546196.
2026-05-21 01:17:40,305 - INFO - Trial 0 finished with value: 0.5445406762989021 and parameters: {'n_components': 0.8984678721994362, 'svd_solver': 'full', 'whiten': True, 'C': 0.0002551360764988297, 'loss': 'squared_hinge', 'tol': 0.002698719815374379}. Best is trial 1 with value: 0.6784397156546196.
2026-05-21 01:17:40,362 - INFO - Trial 6 finished with value: 0.5328695697515089 and parameters: {'n_components': 0.8559496498367983, 'svd_solver': 'full', 'whiten': True, 'C': 0.0001043680478544098, 'loss': 'squared_hinge', 'tol': 0.0026995129470068382}. Best is trial 1 with value: 0.6784397156546196.
2026-05-21 01:17:40,409 - INFO - Trial 11 finished with value: 0.5303584507520639 and parameters: {'n_components': 0.8284923125935189, 'svd_solver': 'full', 'whiten': False, 'C': 14.338701982950187, 'loss': 'squared_hinge', 'tol': 0.000741865739212499}. Best is trial 1 with value: 0.6784397156546196.
2026-05-21 01:17:40,471 - INFO - Trial 4 finished with value: 0.5444299376577761 and parameters: {'n_components': 0.912552020998819, 'svd_solver': 'full', 'whiten': True, 'C': 14.110897561300064, 'loss': 'squared_hinge', 'tol': 1.7483100088349174e-05}. Best is trial 1 with value: 0.6784397156546196.
2026-05-21 01:17:40,493 - INFO - Trial 5 finished with value: 0.5444299282227794 and parameters: {'n_components': 0.88736385799199, 'svd_solver': 'full', 'whiten': True, 'C': 85.98193648476999, 'loss': 'squared_hinge', 'tol': 1.2422513272646915e-05}. Best is trial 1 with value: 0.6784397156546196.
2026-05-21 01:17:40,626 - INFO - Trial 7 finished with value: 0.5444299392845614 and parameters: {'n_components': 0.8979955686096065, 'svd_solver': 'full', 'whiten': True, 'C': 24.105339772650552, 'loss': 'squared_hinge', 'tol': 3.390335531389009e-05}. Best is trial 1 with value: 0.6784397156546196.
2026-05-21 01:17:40,647 - INFO - Trial 9 finished with value: 0.7130983638144222 and parameters: {'n_components': 0.951226641701936, 'svd_solver': 'full', 'whiten': False, 'C': 0.0016279893515809116, 'loss': 'squared_hinge', 'tol': 1.815863197533527e-05}. Best is trial 9 with value: 0.7130983638144222.
2026-05-21 01:20:13,617 - INFO - Trial 18 finished with value: 0.7363868383088839 and parameters: {'n_components': 0.975857591828021, 'svd_solver': 'full', 'whiten': False, 'C': 0.001686567196985917, 'loss': 'squared_hinge', 'tol': 1.0301873128789746e-06}. Best is trial 18 with value: 0.7363868383088839.
2026-05-21 01:20:14,205 - INFO - Trial 13 finished with value: 0.7150006594991904 and parameters: {'n_components': 0.966459153785216, 'svd_solver': 'full', 'whiten': False, 'C': 0.0012574313838818471, 'loss': 'squared_hinge', 'tol': 1.1544728118721054e-06}. Best is trial 18 with value: 0.7363868383088839.
2026-05-21 01:20:14,294 - INFO - Trial 20 finished with value: 0.7261765800483084 and parameters: {'n_components': 0.9743800313165474, 'svd_solver': 'full', 'whiten': False, 'C': 0.0013866714080246092, 'loss': 'squared_hinge', 'tol': 1.1835588832644407e-06}. Best is trial 18 with value: 0.7363868383088839.
2026-05-21 01:20:14,530 - INFO - Trial 15 finished with value: 0.745141881206647 and parameters: {'n_components': 0.9790003545952816, 'svd_solver': 'full', 'whiten': False, 'C': 0.001457333892501947, 'loss': 'squared_hinge', 'tol': 1.4871298299344514e-06}. Best is trial 15 with value: 0.745141881206647.
2026-05-21 01:20:14,833 - INFO - Trial 22 finished with value: 0.7684144124797307 and parameters: {'n_components': 0.9827763962695437, 'svd_solver': 'full', 'whiten': False, 'C': 0.001585056731281738, 'loss': 'squared_hinge', 'tol': 1.2111857989919026e-06}. Best is trial 22 with value: 0.7684144124797307.
2026-05-21 01:20:14,917 - INFO - Trial 23 finished with value: 0.7222488392294453 and parameters: {'n_components': 0.9737786330416848, 'svd_solver': 'full', 'whiten': False, 'C': 0.0013750651930571859, 'loss': 'squared_hinge', 'tol': 1.2500919164235165e-06}. Best is trial 22 with value: 0.7684144124797307.
2026-05-21 01:20:14,946 - INFO - Trial 16 finished with value: 0.7605262849471798 and parameters: {'n_components': 0.9809722587968086, 'svd_solver': 'full', 'whiten': False, 'C': 0.001396177334223881, 'loss': 'squared_hinge', 'tol': 1.0437466393040354e-06}. Best is trial 22 with value: 0.7684144124797307.
2026-05-21 01:20:14,996 - INFO - Trial 17 finished with value: 0.7264738779151366 and parameters: {'n_components': 0.9753523274636653, 'svd_solver': 'full', 'whiten': False, 'C': 0.0021749542267563877, 'loss': 'squared_hinge', 'tol': 1.0075429821400761e-06}. Best is trial 22 with value: 0.7684144124797307.
2026-05-21 01:20:15,055 - INFO - Trial 21 finished with value: 0.7261765333621643 and parameters: {'n_components': 0.9751673932733892, 'svd_solver': 'full', 'whiten': False, 'C': 0.0015085115297833606, 'loss': 'squared_hinge', 'tol': 1.21193549021299e-06}. Best is trial 22 with value: 0.7684144124797307.
2026-05-21 01:20:15,103 - INFO - Trial 19 finished with value: 0.7445357264656216 and parameters: {'n_components': 0.9782154349159897, 'svd_solver': 'full', 'whiten': False, 'C': 0.000894691124808483, 'loss': 'squared_hinge', 'tol': 1.6307877148592883e-06}. Best is trial 22 with value: 0.7684144124797307.
2026-05-21 01:20:15,115 - INFO - Trial 14 finished with value: 0.7174526293034491 and parameters: {'n_components': 0.969416618642048, 'svd_solver': 'full', 'whiten': False, 'C': 0.0011708037288156955, 'loss': 'squared_hinge', 'tol': 1.04345926366534e-06}. Best is trial 22 with value: 0.7684144124797307.
2026-05-21 01:20:15,125 - INFO - Trial 12 finished with value: 0.7370718360210493 and parameters: {'n_components': 0.9780357121753834, 'svd_solver': 'full', 'whiten': False, 'C': 0.001861368037025458, 'loss': 'squared_hinge', 'tol': 1.020557759211369e-06}. Best is trial 22 with value: 0.7684144124797307.
2026-05-21 01:21:45,331 - INFO - Trial 30 pruned. 
2026-05-21 01:21:45,393 - INFO - Trial 35 pruned. 
2026-05-21 01:21:45,458 - INFO - Trial 34 pruned. 
2026-05-21 01:21:45,490 - INFO - Trial 27 pruned. 
2026-05-21 01:21:45,508 - INFO - Trial 26 pruned. 
2026-05-21 01:21:45,531 - INFO - Trial 33 pruned. 
2026-05-21 01:21:45,533 - INFO - Trial 32 pruned. 
2026-05-21 01:21:45,534 - INFO - Trial 31 pruned. 
2026-05-21 01:21:45,571 - INFO - Trial 29 pruned. 
2026-05-21 01:21:45,928 - INFO - Trial 28 pruned. 
2026-05-21 01:22:48,631 - INFO - Trial 25 finished with value: 0.7693739017173037 and parameters: {'n_components': 0.9868048291666712, 'svd_solver': 'full', 'whiten': False, 'C': 3.179538113527557e-05, 'loss': 'squared_hinge', 'tol': 4.2450617497027064e-06}. Best is trial 25 with value: 0.7693739017173037.
2026-05-21 01:22:48,643 - INFO - Trial 24 finished with value: 0.7693082345873765 and parameters: {'n_components': 0.9868131562094294, 'svd_solver': 'full', 'whiten': False, 'C': 1.3936708797772476e-05, 'loss': 'squared_hinge', 'tol': 1.1453653453147122e-06}. Best is trial 25 with value: 0.7693739017173037.
2026-05-21 01:22:53,794 - INFO - Trial 43 pruned. 
2026-05-21 01:22:57,991 - INFO - Trial 37 pruned. 
2026-05-21 01:24:02,136 - INFO - Trial 47 pruned. 
2026-05-21 01:24:25,477 - INFO - Trial 42 finished with value: 0.7684123060474863 and parameters: {'n_components': 0.9833417683483898, 'svd_solver': 'full', 'whiten': False, 'C': 0.0071644620022211294, 'loss': 'squared_hinge', 'tol': 2.432006325992129e-06}. Best is trial 25 with value: 0.7693739017173037.
2026-05-21 01:24:25,505 - INFO - Trial 44 finished with value: 0.7701315021348866 and parameters: {'n_components': 0.9876465542756733, 'svd_solver': 'full', 'whiten': False, 'C': 0.008574781637948085, 'loss': 'squared_hinge', 'tol': 6.60169482718981e-05}. Best is trial 44 with value: 0.7701315021348866.
2026-05-21 01:24:25,510 - INFO - Trial 39 finished with value: 0.769097374028906 and parameters: {'n_components': 0.9856580615007303, 'svd_solver': 'full', 'whiten': False, 'C': 0.007904291667742671, 'loss': 'squared_hinge', 'tol': 2.076806949759212e-06}. Best is trial 44 with value: 0.7701315021348866.
2026-05-21 01:24:25,510 - INFO - Trial 38 finished with value: 0.7704121820738425 and parameters: {'n_components': 0.987943267311917, 'svd_solver': 'full', 'whiten': False, 'C': 0.007046797019797724, 'loss': 'squared_hinge', 'tol': 2.216979605430039e-06}. Best is trial 38 with value: 0.7704121820738425.
