2026-05-21 00:58:43,639 - INFO - ----- Model Tuning -----
2026-05-21 00:58:43,639 - INFO - A new study created in memory with name: no-name-bebc8ebb-334a-4cd4-91b7-f41efe35d40a
2026-05-21 00:59:13,875 - WARNING - Trial 8 failed with parameters: {'n_components': 0.8864576279942021, 'svd_solver': 'full', 'whiten': False, 'iterated_power': 3, 'power_iteration_normalizer': 'LU', 'C': 30.977249753860615, 'loss': 'hinge', 'tol': 0.00019230404153181308} because of the following error: ValueError("Unsupported set of arguments: The combination of penalty='l2' and loss='hinge' are not supported when dual=False, Parameters: penalty='l2', loss='hinge', dual=False").
Traceback (most recent call last):
  File "/home/junior/Documentos/GitHub/prediction-f1-pit-stops-kaggle-competition/.venv/lib/python3.13/site-packages/optuna/study/_optimize.py", line 206, in _run_trial
    value_or_values = func(trial)
  File "/home/junior/Documentos/GitHub/prediction-f1-pit-stops-kaggle-competition/src/pca_linear_svc_tuning.py", line 131, in <lambda>
    study.optimize(lambda trial: objective(trial, X_train, y_train), n_trials=30, n_jobs=-1, show_progress_bar=True)
                                 ~~~~~~~~~^^^^^^^^^^^^^^^^^^^^^^^^^
  File "/home/junior/Documentos/GitHub/prediction-f1-pit-stops-kaggle-competition/src/pca_linear_svc_tuning.py", line 116, in objective
    ).fit(X_train_fold, y_train_fold)
      ~~~^^^^^^^^^^^^^^^^^^^^^^^^^^^^
  File "/home/junior/Documentos/GitHub/prediction-f1-pit-stops-kaggle-competition/.venv/lib/python3.13/site-packages/sklearn/base.py", line 1336, in wrapper
    return fit_method(estimator, *args, **kwargs)
  File "/home/junior/Documentos/GitHub/prediction-f1-pit-stops-kaggle-competition/.venv/lib/python3.13/site-packages/sklearn/pipeline.py", line 621, in fit
    self._final_estimator.fit(Xt, y, **last_step_params["fit"])
    ~~~~~~~~~~~~~~~~~~~~~~~~~^^^^^^^^^^^^^^^^^^^^^^^^^^^^^^^^^^
  File "/home/junior/Documentos/GitHub/prediction-f1-pit-stops-kaggle-competition/.venv/lib/python3.13/site-packages/sklearn/base.py", line 1336, in wrapper
    return fit_method(estimator, *args, **kwargs)
  File "/home/junior/Documentos/GitHub/prediction-f1-pit-stops-kaggle-competition/.venv/lib/python3.13/site-packages/sklearn/svm/_classes.py", line 330, in fit
    self.coef_, self.intercept_, n_iter_ = _fit_liblinear(
                                           ~~~~~~~~~~~~~~^
        X,
        ^^
    ...<13 lines>...
        sample_weight=sample_weight,
        ^^^^^^^^^^^^^^^^^^^^^^^^^^^^
    )
    ^
  File "/home/junior/Documentos/GitHub/prediction-f1-pit-stops-kaggle-competition/.venv/lib/python3.13/site-packages/sklearn/svm/_base.py", line 1237, in _fit_liblinear
    solver_type = _get_liblinear_solver_type(multi_class, penalty, loss, dual)
  File "/home/junior/Documentos/GitHub/prediction-f1-pit-stops-kaggle-competition/.venv/lib/python3.13/site-packages/sklearn/svm/_base.py", line 1068, in _get_liblinear_solver_type
    raise ValueError(
    ...<2 lines>...
    )
ValueError: Unsupported set of arguments: The combination of penalty='l2' and loss='hinge' are not supported when dual=False, Parameters: penalty='l2', loss='hinge', dual=False
2026-05-21 00:59:13,878 - WARNING - Trial 11 failed with parameters: {'n_components': 0.8865628495077518, 'svd_solver': 'full', 'whiten': True, 'iterated_power': 5, 'power_iteration_normalizer': 'QR', 'C': 0.7305411795820855, 'loss': 'hinge', 'tol': 5.2307058789010306e-06} because of the following error: ValueError("Unsupported set of arguments: The combination of penalty='l2' and loss='hinge' are not supported when dual=False, Parameters: penalty='l2', loss='hinge', dual=False").
Traceback (most recent call last):
  File "/home/junior/Documentos/GitHub/prediction-f1-pit-stops-kaggle-competition/.venv/lib/python3.13/site-packages/optuna/study/_optimize.py", line 206, in _run_trial
    value_or_values = func(trial)
  File "/home/junior/Documentos/GitHub/prediction-f1-pit-stops-kaggle-competition/src/pca_linear_svc_tuning.py", line 131, in <lambda>
    study.optimize(lambda trial: objective(trial, X_train, y_train), n_trials=30, n_jobs=-1, show_progress_bar=True)
                                 ~~~~~~~~~^^^^^^^^^^^^^^^^^^^^^^^^^
  File "/home/junior/Documentos/GitHub/prediction-f1-pit-stops-kaggle-competition/src/pca_linear_svc_tuning.py", line 116, in objective
    ).fit(X_train_fold, y_train_fold)
      ~~~^^^^^^^^^^^^^^^^^^^^^^^^^^^^
  File "/home/junior/Documentos/GitHub/prediction-f1-pit-stops-kaggle-competition/.venv/lib/python3.13/site-packages/sklearn/base.py", line 1336, in wrapper
    return fit_method(estimator, *args, **kwargs)
  File "/home/junior/Documentos/GitHub/prediction-f1-pit-stops-kaggle-competition/.venv/lib/python3.13/site-packages/sklearn/pipeline.py", line 621, in fit
    self._final_estimator.fit(Xt, y, **last_step_params["fit"])
    ~~~~~~~~~~~~~~~~~~~~~~~~~^^^^^^^^^^^^^^^^^^^^^^^^^^^^^^^^^^
  File "/home/junior/Documentos/GitHub/prediction-f1-pit-stops-kaggle-competition/.venv/lib/python3.13/site-packages/sklearn/base.py", line 1336, in wrapper
    return fit_method(estimator, *args, **kwargs)
  File "/home/junior/Documentos/GitHub/prediction-f1-pit-stops-kaggle-competition/.venv/lib/python3.13/site-packages/sklearn/svm/_classes.py", line 330, in fit
    self.coef_, self.intercept_, n_iter_ = _fit_liblinear(
                                           ~~~~~~~~~~~~~~^
        X,
        ^^
    ...<13 lines>...
        sample_weight=sample_weight,
        ^^^^^^^^^^^^^^^^^^^^^^^^^^^^
    )
    ^
  File "/home/junior/Documentos/GitHub/prediction-f1-pit-stops-kaggle-competition/.venv/lib/python3.13/site-packages/sklearn/svm/_base.py", line 1237, in _fit_liblinear
    solver_type = _get_liblinear_solver_type(multi_class, penalty, loss, dual)
  File "/home/junior/Documentos/GitHub/prediction-f1-pit-stops-kaggle-competition/.venv/lib/python3.13/site-packages/sklearn/svm/_base.py", line 1068, in _get_liblinear_solver_type
    raise ValueError(
    ...<2 lines>...
    )
ValueError: Unsupported set of arguments: The combination of penalty='l2' and loss='hinge' are not supported when dual=False, Parameters: penalty='l2', loss='hinge', dual=False
2026-05-21 00:59:13,879 - WARNING - Trial 2 failed with parameters: {'n_components': 0.8465881154932668, 'svd_solver': 'full', 'whiten': True, 'iterated_power': 6, 'power_iteration_normalizer': 'auto', 'C': 0.06590833173741956, 'loss': 'hinge', 'tol': 5.582990189578278e-06} because of the following error: ValueError("Unsupported set of arguments: The combination of penalty='l2' and loss='hinge' are not supported when dual=False, Parameters: penalty='l2', loss='hinge', dual=False").
Traceback (most recent call last):
  File "/home/junior/Documentos/GitHub/prediction-f1-pit-stops-kaggle-competition/.venv/lib/python3.13/site-packages/optuna/study/_optimize.py", line 206, in _run_trial
    value_or_values = func(trial)
  File "/home/junior/Documentos/GitHub/prediction-f1-pit-stops-kaggle-competition/src/pca_linear_svc_tuning.py", line 131, in <lambda>
    study.optimize(lambda trial: objective(trial, X_train, y_train), n_trials=30, n_jobs=-1, show_progress_bar=True)
                                 ~~~~~~~~~^^^^^^^^^^^^^^^^^^^^^^^^^
  File "/home/junior/Documentos/GitHub/prediction-f1-pit-stops-kaggle-competition/src/pca_linear_svc_tuning.py", line 116, in objective
    ).fit(X_train_fold, y_train_fold)
      ~~~^^^^^^^^^^^^^^^^^^^^^^^^^^^^
  File "/home/junior/Documentos/GitHub/prediction-f1-pit-stops-kaggle-competition/.venv/lib/python3.13/site-packages/sklearn/base.py", line 1336, in wrapper
    return fit_method(estimator, *args, **kwargs)
  File "/home/junior/Documentos/GitHub/prediction-f1-pit-stops-kaggle-competition/.venv/lib/python3.13/site-packages/sklearn/pipeline.py", line 621, in fit
    self._final_estimator.fit(Xt, y, **last_step_params["fit"])
    ~~~~~~~~~~~~~~~~~~~~~~~~~^^^^^^^^^^^^^^^^^^^^^^^^^^^^^^^^^^
  File "/home/junior/Documentos/GitHub/prediction-f1-pit-stops-kaggle-competition/.venv/lib/python3.13/site-packages/sklearn/base.py", line 1336, in wrapper
    return fit_method(estimator, *args, **kwargs)
  File "/home/junior/Documentos/GitHub/prediction-f1-pit-stops-kaggle-competition/.venv/lib/python3.13/site-packages/sklearn/svm/_classes.py", line 330, in fit
    self.coef_, self.intercept_, n_iter_ = _fit_liblinear(
                                           ~~~~~~~~~~~~~~^
        X,
        ^^
    ...<13 lines>...
        sample_weight=sample_weight,
        ^^^^^^^^^^^^^^^^^^^^^^^^^^^^
    )
    ^
  File "/home/junior/Documentos/GitHub/prediction-f1-pit-stops-kaggle-competition/.venv/lib/python3.13/site-packages/sklearn/svm/_base.py", line 1237, in _fit_liblinear
    solver_type = _get_liblinear_solver_type(multi_class, penalty, loss, dual)
  File "/home/junior/Documentos/GitHub/prediction-f1-pit-stops-kaggle-competition/.venv/lib/python3.13/site-packages/sklearn/svm/_base.py", line 1068, in _get_liblinear_solver_type
    raise ValueError(
    ...<2 lines>...
    )
ValueError: Unsupported set of arguments: The combination of penalty='l2' and loss='hinge' are not supported when dual=False, Parameters: penalty='l2', loss='hinge', dual=False
2026-05-21 00:59:14,012 - WARNING - Trial 4 failed with parameters: {'n_components': 0.8487621595414835, 'svd_solver': 'full', 'whiten': False, 'iterated_power': 3, 'power_iteration_normalizer': 'QR', 'C': 2.2354657298198295, 'loss': 'hinge', 'tol': 0.0010245470772829142} because of the following error: ValueError("Unsupported set of arguments: The combination of penalty='l2' and loss='hinge' are not supported when dual=False, Parameters: penalty='l2', loss='hinge', dual=False").
Traceback (most recent call last):
  File "/home/junior/Documentos/GitHub/prediction-f1-pit-stops-kaggle-competition/.venv/lib/python3.13/site-packages/optuna/study/_optimize.py", line 206, in _run_trial
    value_or_values = func(trial)
  File "/home/junior/Documentos/GitHub/prediction-f1-pit-stops-kaggle-competition/src/pca_linear_svc_tuning.py", line 131, in <lambda>
    study.optimize(lambda trial: objective(trial, X_train, y_train), n_trials=30, n_jobs=-1, show_progress_bar=True)
                                 ~~~~~~~~~^^^^^^^^^^^^^^^^^^^^^^^^^
  File "/home/junior/Documentos/GitHub/prediction-f1-pit-stops-kaggle-competition/src/pca_linear_svc_tuning.py", line 116, in objective
    ).fit(X_train_fold, y_train_fold)
      ~~~^^^^^^^^^^^^^^^^^^^^^^^^^^^^
  File "/home/junior/Documentos/GitHub/prediction-f1-pit-stops-kaggle-competition/.venv/lib/python3.13/site-packages/sklearn/base.py", line 1336, in wrapper
    return fit_method(estimator, *args, **kwargs)
  File "/home/junior/Documentos/GitHub/prediction-f1-pit-stops-kaggle-competition/.venv/lib/python3.13/site-packages/sklearn/pipeline.py", line 621, in fit
    self._final_estimator.fit(Xt, y, **last_step_params["fit"])
    ~~~~~~~~~~~~~~~~~~~~~~~~~^^^^^^^^^^^^^^^^^^^^^^^^^^^^^^^^^^
  File "/home/junior/Documentos/GitHub/prediction-f1-pit-stops-kaggle-competition/.venv/lib/python3.13/site-packages/sklearn/base.py", line 1336, in wrapper
    return fit_method(estimator, *args, **kwargs)
  File "/home/junior/Documentos/GitHub/prediction-f1-pit-stops-kaggle-competition/.venv/lib/python3.13/site-packages/sklearn/svm/_classes.py", line 330, in fit
    self.coef_, self.intercept_, n_iter_ = _fit_liblinear(
                                           ~~~~~~~~~~~~~~^
        X,
        ^^
    ...<13 lines>...
        sample_weight=sample_weight,
        ^^^^^^^^^^^^^^^^^^^^^^^^^^^^
    )
    ^
  File "/home/junior/Documentos/GitHub/prediction-f1-pit-stops-kaggle-competition/.venv/lib/python3.13/site-packages/sklearn/svm/_base.py", line 1237, in _fit_liblinear
    solver_type = _get_liblinear_solver_type(multi_class, penalty, loss, dual)
  File "/home/junior/Documentos/GitHub/prediction-f1-pit-stops-kaggle-competition/.venv/lib/python3.13/site-packages/sklearn/svm/_base.py", line 1068, in _get_liblinear_solver_type
    raise ValueError(
    ...<2 lines>...
    )
ValueError: Unsupported set of arguments: The combination of penalty='l2' and loss='hinge' are not supported when dual=False, Parameters: penalty='l2', loss='hinge', dual=False
2026-05-21 00:59:14,034 - WARNING - Trial 5 failed with parameters: {'n_components': 0.9895698917910145, 'svd_solver': 'full', 'whiten': False, 'iterated_power': 7, 'power_iteration_normalizer': 'LU', 'C': 0.010964043668398123, 'loss': 'hinge', 'tol': 0.0012366886209151798} because of the following error: ValueError("Unsupported set of arguments: The combination of penalty='l2' and loss='hinge' are not supported when dual=False, Parameters: penalty='l2', loss='hinge', dual=False").
Traceback (most recent call last):
  File "/home/junior/Documentos/GitHub/prediction-f1-pit-stops-kaggle-competition/.venv/lib/python3.13/site-packages/optuna/study/_optimize.py", line 206, in _run_trial
    value_or_values = func(trial)
  File "/home/junior/Documentos/GitHub/prediction-f1-pit-stops-kaggle-competition/src/pca_linear_svc_tuning.py", line 131, in <lambda>
    study.optimize(lambda trial: objective(trial, X_train, y_train), n_trials=30, n_jobs=-1, show_progress_bar=True)
                                 ~~~~~~~~~^^^^^^^^^^^^^^^^^^^^^^^^^
  File "/home/junior/Documentos/GitHub/prediction-f1-pit-stops-kaggle-competition/src/pca_linear_svc_tuning.py", line 116, in objective
    ).fit(X_train_fold, y_train_fold)
      ~~~^^^^^^^^^^^^^^^^^^^^^^^^^^^^
  File "/home/junior/Documentos/GitHub/prediction-f1-pit-stops-kaggle-competition/.venv/lib/python3.13/site-packages/sklearn/base.py", line 1336, in wrapper
    return fit_method(estimator, *args, **kwargs)
  File "/home/junior/Documentos/GitHub/prediction-f1-pit-stops-kaggle-competition/.venv/lib/python3.13/site-packages/sklearn/pipeline.py", line 621, in fit
    self._final_estimator.fit(Xt, y, **last_step_params["fit"])
    ~~~~~~~~~~~~~~~~~~~~~~~~~^^^^^^^^^^^^^^^^^^^^^^^^^^^^^^^^^^
  File "/home/junior/Documentos/GitHub/prediction-f1-pit-stops-kaggle-competition/.venv/lib/python3.13/site-packages/sklearn/base.py", line 1336, in wrapper
    return fit_method(estimator, *args, **kwargs)
  File "/home/junior/Documentos/GitHub/prediction-f1-pit-stops-kaggle-competition/.venv/lib/python3.13/site-packages/sklearn/svm/_classes.py", line 330, in fit
    self.coef_, self.intercept_, n_iter_ = _fit_liblinear(
                                           ~~~~~~~~~~~~~~^
        X,
        ^^
    ...<13 lines>...
        sample_weight=sample_weight,
        ^^^^^^^^^^^^^^^^^^^^^^^^^^^^
    )
    ^
  File "/home/junior/Documentos/GitHub/prediction-f1-pit-stops-kaggle-competition/.venv/lib/python3.13/site-packages/sklearn/svm/_base.py", line 1237, in _fit_liblinear
    solver_type = _get_liblinear_solver_type(multi_class, penalty, loss, dual)
  File "/home/junior/Documentos/GitHub/prediction-f1-pit-stops-kaggle-competition/.venv/lib/python3.13/site-packages/sklearn/svm/_base.py", line 1068, in _get_liblinear_solver_type
    raise ValueError(
    ...<2 lines>...
    )
ValueError: Unsupported set of arguments: The combination of penalty='l2' and loss='hinge' are not supported when dual=False, Parameters: penalty='l2', loss='hinge', dual=False
2026-05-21 00:59:14,038 - WARNING - Trial 8 failed with value None.
2026-05-21 00:59:14,039 - WARNING - Trial 6 failed with parameters: {'n_components': 0.938037728291002, 'svd_solver': 'full', 'whiten': True, 'iterated_power': 10, 'power_iteration_normalizer': 'QR', 'C': 0.014338232280110436, 'loss': 'hinge', 'tol': 0.00018152781838098108} because of the following error: ValueError("Unsupported set of arguments: The combination of penalty='l2' and loss='hinge' are not supported when dual=False, Parameters: penalty='l2', loss='hinge', dual=False").
Traceback (most recent call last):
  File "/home/junior/Documentos/GitHub/prediction-f1-pit-stops-kaggle-competition/.venv/lib/python3.13/site-packages/optuna/study/_optimize.py", line 206, in _run_trial
    value_or_values = func(trial)
  File "/home/junior/Documentos/GitHub/prediction-f1-pit-stops-kaggle-competition/src/pca_linear_svc_tuning.py", line 131, in <lambda>
    study.optimize(lambda trial: objective(trial, X_train, y_train), n_trials=30, n_jobs=-1, show_progress_bar=True)
                                 ~~~~~~~~~^^^^^^^^^^^^^^^^^^^^^^^^^
  File "/home/junior/Documentos/GitHub/prediction-f1-pit-stops-kaggle-competition/src/pca_linear_svc_tuning.py", line 116, in objective
    ).fit(X_train_fold, y_train_fold)
      ~~~^^^^^^^^^^^^^^^^^^^^^^^^^^^^
  File "/home/junior/Documentos/GitHub/prediction-f1-pit-stops-kaggle-competition/.venv/lib/python3.13/site-packages/sklearn/base.py", line 1336, in wrapper
    return fit_method(estimator, *args, **kwargs)
  File "/home/junior/Documentos/GitHub/prediction-f1-pit-stops-kaggle-competition/.venv/lib/python3.13/site-packages/sklearn/pipeline.py", line 621, in fit
    self._final_estimator.fit(Xt, y, **last_step_params["fit"])
    ~~~~~~~~~~~~~~~~~~~~~~~~~^^^^^^^^^^^^^^^^^^^^^^^^^^^^^^^^^^
  File "/home/junior/Documentos/GitHub/prediction-f1-pit-stops-kaggle-competition/.venv/lib/python3.13/site-packages/sklearn/base.py", line 1336, in wrapper
    return fit_method(estimator, *args, **kwargs)
  File "/home/junior/Documentos/GitHub/prediction-f1-pit-stops-kaggle-competition/.venv/lib/python3.13/site-packages/sklearn/svm/_classes.py", line 330, in fit
    self.coef_, self.intercept_, n_iter_ = _fit_liblinear(
                                           ~~~~~~~~~~~~~~^
        X,
        ^^
    ...<13 lines>...
        sample_weight=sample_weight,
        ^^^^^^^^^^^^^^^^^^^^^^^^^^^^
    )
    ^
  File "/home/junior/Documentos/GitHub/prediction-f1-pit-stops-kaggle-competition/.venv/lib/python3.13/site-packages/sklearn/svm/_base.py", line 1237, in _fit_liblinear
    solver_type = _get_liblinear_solver_type(multi_class, penalty, loss, dual)
  File "/home/junior/Documentos/GitHub/prediction-f1-pit-stops-kaggle-competition/.venv/lib/python3.13/site-packages/sklearn/svm/_base.py", line 1068, in _get_liblinear_solver_type
    raise ValueError(
    ...<2 lines>...
    )
ValueError: Unsupported set of arguments: The combination of penalty='l2' and loss='hinge' are not supported when dual=False, Parameters: penalty='l2', loss='hinge', dual=False
2026-05-21 00:59:14,040 - WARNING - Trial 11 failed with value None.
2026-05-21 00:59:14,041 - WARNING - Trial 2 failed with value None.
2026-05-21 00:59:14,043 - WARNING - Trial 4 failed with value None.
2026-05-21 00:59:14,044 - WARNING - Trial 5 failed with value None.
2026-05-21 00:59:14,047 - WARNING - Trial 6 failed with value None.
2026-05-21 00:59:14,130 - WARNING - Trial 7 failed with parameters: {'n_components': 0.8039707296442071, 'svd_solver': 'full', 'whiten': True, 'iterated_power': 8, 'power_iteration_normalizer': 'LU', 'C': 0.00020717708622107367, 'loss': 'squared_hinge', 'tol': 4.421698869202296e-05} because of the following error: AttributeError("This 'Pipeline' has no attribute 'predict_proba'").
Traceback (most recent call last):
  File "/home/junior/Documentos/GitHub/prediction-f1-pit-stops-kaggle-competition/.venv/lib/python3.13/site-packages/sklearn/utils/_available_if.py", line 32, in _check
    check_result = self.check(obj)
  File "/home/junior/Documentos/GitHub/prediction-f1-pit-stops-kaggle-competition/.venv/lib/python3.13/site-packages/sklearn/pipeline.py", line 45, in check
    getattr(self._final_estimator, attr)
    ~~~~~~~^^^^^^^^^^^^^^^^^^^^^^^^^^^^^
AttributeError: 'LinearSVC' object has no attribute 'predict_proba'

The above exception was the direct cause of the following exception:

Traceback (most recent call last):
  File "/home/junior/Documentos/GitHub/prediction-f1-pit-stops-kaggle-competition/.venv/lib/python3.13/site-packages/optuna/study/_optimize.py", line 206, in _run_trial
    value_or_values = func(trial)
  File "/home/junior/Documentos/GitHub/prediction-f1-pit-stops-kaggle-competition/src/pca_linear_svc_tuning.py", line 131, in <lambda>
    study.optimize(lambda trial: objective(trial, X_train, y_train), n_trials=30, n_jobs=-1, show_progress_bar=True)
                                 ~~~~~~~~~^^^^^^^^^^^^^^^^^^^^^^^^^
  File "/home/junior/Documentos/GitHub/prediction-f1-pit-stops-kaggle-competition/src/pca_linear_svc_tuning.py", line 118, in objective
    proba = model.predict_proba(X_valid_fold)[:, 1]
            ^^^^^^^^^^^^^^^^^^^
  File "/home/junior/Documentos/GitHub/prediction-f1-pit-stops-kaggle-competition/.venv/lib/python3.13/site-packages/sklearn/utils/_available_if.py", line 43, in __get__
    self._check(obj, owner=owner)
    ~~~~~~~~~~~^^^^^^^^^^^^^^^^^^
  File "/home/junior/Documentos/GitHub/prediction-f1-pit-stops-kaggle-competition/.venv/lib/python3.13/site-packages/sklearn/utils/_available_if.py", line 34, in _check
    raise AttributeError(attr_err_msg) from e
AttributeError: This 'Pipeline' has no attribute 'predict_proba'
2026-05-21 00:59:14,133 - WARNING - Trial 7 failed with value None.
2026-05-21 00:59:14,154 - WARNING - Trial 9 failed with parameters: {'n_components': 0.8663521681103449, 'svd_solver': 'full', 'whiten': True, 'iterated_power': 6, 'power_iteration_normalizer': 'QR', 'C': 35.70380589216738, 'loss': 'squared_hinge', 'tol': 6.340858465566275e-06} because of the following error: AttributeError("This 'Pipeline' has no attribute 'predict_proba'").
Traceback (most recent call last):
  File "/home/junior/Documentos/GitHub/prediction-f1-pit-stops-kaggle-competition/.venv/lib/python3.13/site-packages/sklearn/utils/_available_if.py", line 32, in _check
    check_result = self.check(obj)
  File "/home/junior/Documentos/GitHub/prediction-f1-pit-stops-kaggle-competition/.venv/lib/python3.13/site-packages/sklearn/pipeline.py", line 45, in check
    getattr(self._final_estimator, attr)
    ~~~~~~~^^^^^^^^^^^^^^^^^^^^^^^^^^^^^
AttributeError: 'LinearSVC' object has no attribute 'predict_proba'

The above exception was the dir