2026-05-21 20:26:01,929 - INFO - ----- Fine Tuning -----
2026-05-21 20:26:01,930 - INFO - A new study created in memory with name: no-name-04bc1267-8ad2-485b-ae6b-42b3b2c9a97d
2026-05-21 20:26:48,859 - INFO - Trial 4 finished with value: 0.742780014676614 and parameters: {'loss': 'log_loss', 'penalty': 'l1', 'alpha': 4.82452327367143e-05, 'learning_rate': 'optimal', 'eta0': 0.0021599168939534378, 'l1_ratio': 0.1047194852956268, 'tol': 0.009074154003333761, 'average': True}. Best is trial 4 with value: 0.742780014676614.
2026-05-21 20:26:57,224 - INFO - Trial 9 finished with value: 0.8837441458762072 and parameters: {'loss': 'log_loss', 'penalty': 'l2', 'alpha': 0.001701743926471439, 'learning_rate': 'optimal', 'eta0': 0.0013723599609021524, 'l1_ratio': 0.4419422784300555, 'tol': 1.1172327027313448e-05, 'average': True}. Best is trial 9 with value: 0.8837441458762072.
2026-05-21 20:27:08,356 - INFO - Trial 6 finished with value: 0.8912656062324767 and parameters: {'loss': 'modified_huber', 'penalty': 'elasticnet', 'alpha': 0.0006222903718550905, 'learning_rate': 'adaptive', 'eta0': 0.0002184373127857496, 'l1_ratio': 0.12510755739366486, 'tol': 0.002556384207866627, 'average': False}. Best is trial 6 with value: 0.8912656062324767.
2026-05-21 20:27:12,117 - INFO - Trial 10 finished with value: 0.8818065188271043 and parameters: {'loss': 'log_loss', 'penalty': 'l2', 'alpha': 0.002318713020753238, 'learning_rate': 'adaptive', 'eta0': 0.0017476103870149742, 'l1_ratio': 0.38951985555528446, 'tol': 0.0003812047441926573, 'average': False}. Best is trial 6 with value: 0.8912656062324767.
2026-05-21 20:27:15,252 - INFO - Trial 0 finished with value: 0.8904974505177536 and parameters: {'loss': 'log_loss', 'penalty': 'l2', 'alpha': 0.0003637037488830717, 'learning_rate': 'adaptive', 'eta0': 0.0006452176640672033, 'l1_ratio': 0.8161221044574374, 'tol': 2.9986186736207074e-05, 'average': False}. Best is trial 6 with value: 0.8912656062324767.
2026-05-21 20:27:16,900 - INFO - Trial 1 pruned. 
2026-05-21 20:27:16,940 - INFO - Trial 7 pruned. 
2026-05-21 20:27:21,154 - INFO - Trial 5 pruned. 
2026-05-21 20:27:28,908 - INFO - Trial 11 pruned. 
2026-05-21 20:27:32,604 - INFO - Trial 3 finished with value: 0.8924579981625733 and parameters: {'loss': 'log_loss', 'penalty': 'elasticnet', 'alpha': 3.817888085836387e-07, 'learning_rate': 'adaptive', 'eta0': 0.0028234506124497566, 'l1_ratio': 0.771001498564287, 'tol': 0.0021867926265647, 'average': True}. Best is trial 3 with value: 0.8924579981625733.
2026-05-21 20:27:33,560 - INFO - Trial 8 finished with value: 0.8927811601215717 and parameters: {'loss': 'log_loss', 'penalty': 'l2', 'alpha': 4.0584957396541314e-05, 'learning_rate': 'adaptive', 'eta0': 0.012511137213621334, 'l1_ratio': 0.5370668428235795, 'tol': 5.962699587443659e-05, 'average': False}. Best is trial 8 with value: 0.8927811601215717.
2026-05-21 20:27:35,030 - INFO - Trial 2 finished with value: 0.8912615244132434 and parameters: {'loss': 'log_loss', 'penalty': 'l2', 'alpha': 7.401443521095176e-06, 'learning_rate': 'adaptive', 'eta0': 0.03267381454166781, 'l1_ratio': 0.7030833210304163, 'tol': 0.0022076649823389387, 'average': True}. Best is trial 8 with value: 0.8927811601215717.
2026-05-21 20:27:43,910 - INFO - Trial 13 pruned. 
2026-05-21 20:27:46,442 - INFO - Trial 18 pruned. 
2026-05-21 20:27:52,202 - INFO - Trial 19 pruned. 
2026-05-21 20:27:52,648 - INFO - Trial 14 pruned. 
2026-05-21 20:27:55,138 - INFO - Trial 17 pruned. 
2026-05-21 20:28:17,750 - INFO - Trial 16 finished with value: 0.8921551879643435 and parameters: {'loss': 'modified_huber', 'penalty': 'l2', 'alpha': 2.757238606411709e-05, 'learning_rate': 'adaptive', 'eta0': 0.0022454068540594743, 'l1_ratio': 0.12922324361208004, 'tol': 0.001725418247773973, 'average': False}. Best is trial 8 with value: 0.8927811601215717.
2026-05-21 20:28:23,480 - INFO - Trial 12 finished with value: 0.8914826356781257 and parameters: {'loss': 'modified_huber', 'penalty': 'l1', 'alpha': 3.690678228231474e-07, 'learning_rate': 'adaptive', 'eta0': 0.00022879975896004823, 'l1_ratio': 0.9445203601484934, 'tol': 1.837823851979558e-05, 'average': True}. Best is trial 8 with value: 0.8927811601215717.
2026-05-21 20:28:24,450 - INFO - Trial 21 pruned. 
2026-05-21 20:28:52,050 - INFO - Trial 23 pruned. 
2026-05-21 20:28:54,420 - INFO - Trial 25 pruned. 
2026-05-21 20:28:55,641 - INFO - Trial 22 pruned. 
2026-05-21 20:28:57,545 - INFO - Trial 15 finished with value: 0.8922016313416858 and parameters: {'loss': 'modified_huber', 'penalty': 'l1', 'alpha': 6.024756950230716e-07, 'learning_rate': 'adaptive', 'eta0': 0.001781326633071122, 'l1_ratio': 0.42692930575688104, 'tol': 3.359381675268551e-05, 'average': False}. Best is trial 8 with value: 0.8927811601215717.
2026-05-21 20:28:59,190 - INFO - Trial 20 finished with value: 0.890773599400126 and parameters: {'loss': 'log_loss', 'penalty': 'l1', 'alpha': 0.00037658001118385056, 'learning_rate': 'adaptive', 'eta0': 0.000597467640538065, 'l1_ratio': 0.2733251003541489, 'tol': 5.573253693874885e-05, 'average': False}. Best is trial 8 with value: 0.8927811601215717.
2026-05-21 20:29:03,689 - INFO - Trial 24 pruned. 
2026-05-21 20:29:04,609 - INFO - Trial 26 pruned. 
2026-05-21 20:29:37,988 - INFO - Trial 27 finished with value: 0.8926080659118887 and parameters: {'loss': 'log_loss', 'penalty': 'elasticnet', 'alpha': 1.2978822811483565e-07, 'learning_rate': 'adaptive', 'eta0': 0.009966031064229861, 'l1_ratio': 0.6316907111462619, 'tol': 0.0001445365391203783, 'average': True}. Best is trial 8 with value: 0.8927811601215717.
2026-05-21 20:29:39,889 - INFO - Trial 31 pruned. 
2026-05-21 20:29:50,149 - INFO - Trial 28 finished with value: 0.8926711321195231 and parameters: {'loss': 'log_loss', 'penalty': 'elasticnet', 'alpha': 1.6445859078375853e-07, 'learning_rate': 'adaptive', 'eta0': 0.00869006294641767, 'l1_ratio': 0.5940523452233816, 'tol': 0.00013717889981960092, 'average': True}. Best is trial 8 with value: 0.8927811601215717.
2026-05-21 20:30:03,808 - INFO - Trial 33 finished with value: 0.8925706719570625 and parameters: {'loss': 'log_loss', 'penalty': 'l2', 'alpha': 2.3544327673675223e-06, 'learning_rate': 'adaptive', 'eta0': 0.003998417393287637, 'l1_ratio': 0.6018949952950197, 'tol': 0.000699011113959381, 'average': False}. Best is trial 8 with value: 0.8927811601215717.
2026-05-21 20:30:17,784 - INFO - Trial 30 finished with value: 0.8926354673352582 and parameters: {'loss': 'log_loss', 'penalty': 'elasticnet', 'alpha': 1.1896166651922762e-07, 'learning_rate': 'adaptive', 'eta0': 0.006296355421851278, 'l1_ratio': 0.6498280097120657, 'tol': 0.00010395443218474432, 'average': True}. Best is trial 8 with value: 0.8927811601215717.
2026-05-21 20:30:19,943 - INFO - Trial 29 finished with value: 0.8926892675244892 and parameters: {'loss': 'log_loss', 'penalty': 'elasticnet', 'alpha': 2.6396156561303856e-07, 'learning_rate': 'adaptive', 'eta0': 0.00894118076795477, 'l1_ratio': 0.6071369648552433, 'tol': 0.00013118462857744913, 'average': True}. Best is trial 8 with value: 0.8927811601215717.
2026-05-21 20:30:22,339 - INFO - Trial 32 finished with value: 0.8929087938867856 and parameters: {'loss': 'log_loss', 'penalty': 'l2', 'alpha': 1.4194330632403957e-06, 'learning_rate': 'adaptive', 'eta0': 0.01837313265623149, 'l1_ratio': 0.6389139724319878, 'tol': 0.00015728549969776272, 'average': False}. Best is trial 32 with value: 0.8929087938867856.
2026-05-21 20:30:23,666 - INFO - Trial 38 finished with value: 0.8928047347973003 and parameters: {'loss': 'log_loss', 'penalty': 'l2', 'alpha': 1.2077174932577808e-06, 'learning_rate': 'adaptive', 'eta0': 0.004138995790823871, 'l1_ratio': 0.5818838216691892, 'tol': 0.00020249266823884783, 'average': False}. Best is trial 32 with value: 0.8929087938867856.
2026-05-21 20:30:23,940 - INFO - Trial 35 finished with value: 0.8930728758831481 and parameters: {'loss': 'log_loss', 'penalty': 'l2', 'alpha': 1.8602002950852876e-06, 'learning_rate': 'adaptive', 'eta0': 0.02054788995121368, 'l1_ratio': 0.6145252303776313, 'tol': 0.00017699362701950524, 'average': False}. Best is trial 35 with value: 0.8930728758831481.
2026-05-21 20:30:31,512 - INFO - Trial 40 pruned. 
2026-05-21 20:30:37,004 - INFO - Trial 34 finished with value: 0.893129083108098 and parameters: {'loss': 'log_loss', 'penalty': 'l2', 'alpha': 1.5584095596354467e-06, 'learning_rate': 'adaptive', 'eta0': 0.08626054877820884, 'l1_ratio': 0.6101369336054362, 'tol': 0.00019785562176872958, 'average': False}. Best is trial 34 with value: 0.893129083108098.
2026-05-21 20:30:40,889 - INFO - Trial 37 finished with value: 0.891293505624309 and parameters: {'loss': 'log_loss', 'penalty': 'l2', 'alpha': 1.1787201689654635e-06, 'learning_rate': 'adaptive', 'eta0': 0.00010659497970103742, 'l1_ratio': 0.6000818204961796, 'tol': 0.0001471559832601284, 'average': False}. Best is trial 34 with value: 0.893129083108098.
2026-05-21 20:30:44,714 - INFO - Trial 36 finished with value: 0.8928799690611948 and parameters: {'loss': 'log_loss', 'penalty': 'elasticnet', 'alpha': 1.2260572820060536e-06, 'learning_rate': 'adaptive', 'eta0': 0.0051969499249512685, 'l1_ratio': 0.6160875416601749, 'tol': 0.00019098453710180083, 'average': False}. Best is trial 34 with value: 0.893129083108098.
2026-05-21 20:30:59,761 - INFO - Trial 39 pruned. 
2026-05-21 20:31:14,749 - INFO - Trial 41 finished with value: 0.8909087324142796 and parameters: {'loss': 'log_loss', 'penalty': 'l2', 'alpha': 0.00013317154683995617, 'learning_rate': 'adaptive', 'eta0': 0.01959583138266279, 'l1_ratio': 0.5787195170976427, 'tol': 0.00021677990979064056, 'average': True}. Best is trial 34 with value: 0.893129083108098.
2026-05-21 20:31:22,610 - INFO - Trial 42 finished with value: 0.8931268232521082 and parameters: {'loss': 'log_loss', 'penalty': 'l2', 'alpha': 2.289785835901657e-06, 'learning_rate': 'adaptive', 'eta0': 0.019436385813254617, 'l1_ratio': 0.567556606152593, 'tol': 0.00021230875583853247, 'average': False}. Best is trial 34 with value: 0.893129083108098.
2026-05-21 20:31:23,340 - INFO - Trial 43 pruned. 
2026-05-21 20:31:24,275 - INFO - Trial 44 pruned. 
2026-05-21 20:31:33,712 - INFO - Trial 47 finished with value: 0.8927888049306809 and parameters: {'loss': 'log_loss', 'penalty': 'l2', 'alpha': 3.082878600573299e-06, 'learning_rate': 'adaptive', 'eta0': 0.01648967794266961, 'l1_ratio': 0.5324937849424065, 'tol': 0.00023404857737552173, 'average': False}. Best is trial 34 with value: 0.893129083108098.
2026-05-21 20:31:36,089 - INFO - Trial 46 finished with value: 0.8929877508308002 and parameters: {'loss': 'log_loss', 'penalty': 'l2', 'alpha': 3.834462676533257e-06, 'learning_rate': 'adaptive', 'eta0': 0.019328768712742035, 'l1_ratio': 0.745807849165033, 'tol': 0.0002413280583005918, 'average': False}. Best is trial 34 with value: 0.893129083108098.
2026-05-21 20:31:36,629 - INFO - Trial 45 finished with value: 0.8929163559342295 and parameters: {'loss': 'log_loss', 'penalty': 'l2', 'alpha': 3.6489118783614218e-06, 'learning_rate': 'adaptive', 'eta0': 0.020945437146711193, 'l1_ratio': 0.535724136907266, 'tol': 0.00020195791350963315, 'average': False}. Best is trial 34 with value: 0.893129083108098.
2026-05-21 20:31:36,796 - INFO - Trial 48 finished with value: 0.8930065038220529 and parameters: {'loss': 'log_loss', 'penalty': 'l2', 'alpha': 4.699218987570811e-06, 'learning_rate': 'adaptive', 'eta0': 0.022217348726446973, 'l1_ratio': 0.529659317513362, 'tol': 0.00022023103795965613, 'average': False}. Best is trial 34 with value: 0.893129083108098.
2026-05-21 20:31:38,350 - INFO - Trial 49 finished with value: 0.8930344754739359 and parameters: {'loss': 'log_loss', 'penalty': 'l2', 'alpha': 4.256748106076517e-06, 'learning_rate': 'adaptive', 'eta0': 0.021403886793847585, 'l1_ratio': 0.5349452001895865, 'tol': 0.0001860226923892935, 'average': False}. Best is trial 34 with value: 0.893129083108098.
2026-05-21 20:31:38,353 - INFO - Best AUC: 0.893129083108098 | Best params: {'loss': 'log_loss', 'penalty': 'l2', 'alpha': 1.5584095596354467e-06, 'learning_rate': 'adaptive', 'eta0': 0.08626054877820884, 'l1_ratio': 0.6101369336054362, 'tol': 0.00019785562176872958, 'average': False}
2026-05-21 20:31:38,353 - INFO - ----- Saving Pipeline -----
