2026-05-22 11:24:40,526 - INFO - Trial 37 finished with value: 0.8903575938400081 and parameters: {'truncsvd_n_components': 59, 'algorithm': 'randomized', 'n_iter': 14, 'power_iteration_normalizer': 'auto', 'truncsvd_tol': 3.4440507979532904e-05, 'gamma': 1.4941474546412387e-05, 'n_components': 69, 'loss': 'modified_huber', 'penalty': 'l2', 'alpha': 0.017620064482896405, 'learning_rate': 'adaptive', 'eta0': 0.0024120985004652163, 'l1_ratio': 0.5114582772466937, 'tol': 9.377169234773004e-05, 'average': False}. Best is trial 43 with value: 0.8918755771846332.
2026-05-22 11:24:43,618 - INFO - Trial 39 finished with value: 0.8908707209827116 and parameters: {'truncsvd_n_components': 58, 'algorithm': 'randomized', 'n_iter': 13, 'power_iteration_normalizer': 'auto', 'truncsvd_tol': 1.950068330801999e-05, 'gamma': 1.7225712563282954e-05, 'n_components': 69, 'loss': 'modified_huber', 'penalty': 'l2', 'alpha': 0.021191144851213102, 'learning_rate': 'adaptive', 'eta0': 0.002856768388118357, 'l1_ratio': 0.7551218449855133, 'tol': 9.059944779165385e-05, 'average': False}. Best is trial 43 with value: 0.8918755771846332.
2026-05-22 11:24:43,862 - INFO - Trial 40 finished with value: 0.8910456815025724 and parameters: {'truncsvd_n_components': 57, 'algorithm': 'randomized', 'n_iter': 13, 'power_iteration_normalizer': 'auto', 'truncsvd_tol': 2.047024724074602e-05, 'gamma': 1.3137154177505042e-05, 'n_components': 68, 'loss': 'modified_huber', 'penalty': 'l2', 'alpha': 0.0031441684383664787, 'learning_rate': 'adaptive', 'eta0': 0.0016122226201991008, 'l1_ratio': 0.5111172532796443, 'tol': 0.00012005407642684594, 'average': False}. Best is trial 43 with value: 0.8918755771846332.
2026-05-22 11:24:49,191 - INFO - Trial 42 finished with value: 0.8916581960126543 and parameters: {'truncsvd_n_components': 57, 'algorithm': 'randomized', 'n_iter': 14, 'power_iteration_normalizer': 'auto', 'truncsvd_tol': 2.415384369575291e-05, 'gamma': 1.3415292967910639e-05, 'n_components': 67, 'loss': 'modified_huber', 'penalty': 'l2', 'alpha': 0.002318171992746732, 'learning_rate': 'adaptive', 'eta0': 0.0020303196123712883, 'l1_ratio': 0.5108942609990055, 'tol': 0.00010793139999103582, 'average': False}. Best is trial 43 with value: 0.8918755771846332.
2026-05-22 11:25:02,455 - INFO - Trial 44 finished with value: 0.8929350054167198 and parameters: {'truncsvd_n_components': 61, 'algorithm': 'randomized', 'n_iter': 3, 'power_iteration_normalizer': 'OR', 'truncsvd_tol': 2.1384030821462082e-05, 'gamma': 1.2230180044759903e-05, 'n_components': 74, 'loss': 'modified_huber', 'penalty': 'l2', 'alpha': 0.006577747431118439, 'learning_rate': 'adaptive', 'eta0': 0.0001961375448925662, 'l1_ratio': 0.5150590835621806, 'tol': 0.0002558523321027625, 'average': True}. Best is trial 44 with value: 0.8929350054167198.
2026-05-22 11:25:45,260 - INFO - Trial 49 pruned. 
2026-05-22 11:25:48,125 - INFO - Trial 45 finished with value: 0.8882043166125662 and parameters: {'truncsvd_n_components': 56, 'algorithm': 'randomized', 'n_iter': 13, 'power_iteration_normalizer': 'OR', 'truncsvd_tol': 2.6359565212165336e-05, 'gamma': 1.057375265454425e-05, 'n_components': 74, 'loss': 'modified_huber', 'penalty': 'l2', 'alpha': 0.0031484589614916283, 'learning_rate': 'adaptive', 'eta0': 0.00019497971914784296, 'l1_ratio': 0.5240957721577597, 'tol': 0.0002617716801493385, 'average': True}. Best is trial 44 with value: 0.8929350054167198.
2026-05-22 11:26:02,305 - INFO - Trial 47 finished with value: 0.8898335370686083 and parameters: {'truncsvd_n_components': 56, 'algorithm': 'randomized', 'n_iter': 4, 'power_iteration_normalizer': 'OR', 'truncsvd_tol': 1.4003473028201434e-05, 'gamma': 8.281686805456566e-06, 'n_components': 66, 'loss': 'modified_huber', 'penalty': 'l2', 'alpha': 0.0036109650197891042, 'learning_rate': 'adaptive', 'eta0': 0.0018100006289242536, 'l1_ratio': 0.5116864870369372, 'tol': 0.0002278084944593652, 'average': True}. Best is trial 44 with value: 0.8929350054167198.
2026-05-22 11:26:02,380 - INFO - Trial 46 finished with value: 0.8912143084633748 and parameters: {'truncsvd_n_components': 55, 'algorithm': 'randomized', 'n_iter': 13, 'power_iteration_normalizer': 'OR', 'truncsvd_tol': 2.8127365306140166e-05, 'gamma': 6.5758568343212854e-06, 'n_components': 74, 'loss': 'modified_huber', 'penalty': 'l2', 'alpha': 0.002618982437870904, 'learning_rate': 'adaptive', 'eta0': 0.0002086549703823417, 'l1_ratio': 0.5336462602380603, 'tol': 0.00035792345598028625, 'average': True}. Best is trial 44 with value: 0.8929350054167198.
2026-05-22 11:26:05,568 - INFO - Trial 48 finished with value: 0.8835022200403643 and parameters: {'truncsvd_n_components': 66, 'algorithm': 'randomized', 'n_iter': 3, 'power_iteration_normalizer': 'OR', 'truncsvd_tol': 7.366181102821405e-05, 'gamma': 0.00018507421983483398, 'n_components': 66, 'loss': 'modified_huber', 'penalty': 'l2', 'alpha': 1.9021691590671632e-05, 'learning_rate': 'adaptive', 'eta0': 0.001774291681706591, 'l1_ratio': 0.54161954993081, 'tol': 0.00027081305851894567, 'average': True}. Best is trial 44 with value: 0.8929350054167198.
2026-05-22 11:26:05,572 - INFO - Best AUC: 0.8929350054167198 | Best params: {'truncsvd_n_components': 61, 'algorithm': 'randomized', 'n_iter': 3, 'power_iteration_normalizer': 'OR', 'truncsvd_tol': 2.1384030821462082e-05, 'gamma': 1.2230180044759903e-05, 'n_components': 74, 'loss': 'modified_huber', 'penalty': 'l2', 'alpha': 0.006577747431118439, 'learning_rate': 'adaptive', 'eta0': 0.0001961375448925662, 'l1_ratio': 0.5150590835621806, 'tol': 0.0002558523321027625, 'average': True}
2026-05-22 11:26:05,572 - INFO - ----- Saving Pipeline -----
