2026-05-21 19:12:27,168 - INFO - ----- Fine Tuning -----
2026-05-21 19:12:27,168 - INFO - A new study created in memory with name: no-name-60bdf124-267b-4393-ad71-88ef8df02a81
2026-05-21 19:12:27,953 - WARNING - Trial 4 failed with parameters: {'n_components': 21, 'algorithm': 'randomized', 'n_iter': 10, 'power_iteration_normalizer': 'LU', 'tol': 6.889737641536578e-05, 'gamma': 1.0725004030049288} because of the following error: ValueError('Cannot set different log configuration to the same parameter name.').
Traceback (most recent call last):
  File "/home/junior/Documentos/GitHub/prediction-f1-pit-stops-kaggle-competition/.venv/lib/python3.13/site-packages/optuna/study/_optimize.py", line 206, in _run_trial
    value_or_values = func(trial)
  File "/home/junior/Documentos/GitHub/prediction-f1-pit-stops-kaggle-competition/src/truncatedsvd_rbfsampler_logistic_regression_tuning.py", line 127, in <lambda>
    study.optimize(lambda trial: objective(trial, X_train, y_train), n_trials=30, n_jobs=-1, show_progress_bar=True)
                                 ~~~~~~~~~^^^^^^^^^^^^^^^^^^^^^^^^^
  File "/home/junior/Documentos/GitHub/prediction-f1-pit-stops-kaggle-competition/src/truncatedsvd_rbfsampler_logistic_regression_tuning.py", line 102, in objective
    n_components=trial.suggest_int("n_components", 64, 75, log=True),
                 ~~~~~~~~~~~~~~~~~^^^^^^^^^^^^^^^^^^^^^^^^^^^^^^^^^^
  File "/home/junior/Documentos/GitHub/prediction-f1-pit-stops-kaggle-competition/.venv/lib/python3.13/site-packages/optuna/_convert_positional_args.py", line 127, in converter_wrapper
    return func(**kwargs)  # type: ignore[call-arg]
  File "/home/junior/Documentos/GitHub/prediction-f1-pit-stops-kaggle-competition/.venv/lib/python3.13/site-packages/optuna/trial/_trial.py", line 336, in suggest_int
    suggested_value = int(self._suggest(name, distribution))
                          ~~~~~~~~~~~~~^^^^^^^^^^^^^^^^^^^^
  File "/home/junior/Documentos/GitHub/prediction-f1-pit-stops-kaggle-competition/.venv/lib/python3.13/site-packages/optuna/trial/_trial.py", line 632, in _suggest
    distributions.check_distribution_compatibility(trial.distributions[name], distribution)
    ~~~~~~~~~~~~~~~~~~~~~~~~~~~~~~~~~~~~~~~~~~~~~~^^^^^^^^^^^^^^^^^^^^^^^^^^^^^^^^^^^^^^^^^
  File "/home/junior/Documentos/GitHub/prediction-f1-pit-stops-kaggle-competition/.venv/lib/python3.13/site-packages/optuna/distributions.py", line 649, in check_distribution_compatibility
    raise ValueError("Cannot set different log configuration to the same parameter name.")
ValueError: Cannot set different log configuration to the same parameter name.
2026-05-21 19:12:27,982 - WARNING - Trial 4 failed with value None.
2026-05-21 19:12:28,001 - WARNING - Trial 2 failed with parameters: {'n_components': 19, 'algorithm': 'randomized', 'n_iter': 15, 'power_iteration_normalizer': 'auto', 'tol': 4.634671926169254e-06, 'gamma': 0.28853198761052545} because of the following error: ValueError('Cannot set different log configuration to the same parameter name.').
Traceback (most recent call last):
  File "/home/junior/Documentos/GitHub/prediction-f1-pit-stops-kaggle-competition/.venv/lib/python3.13/site-packages/optuna/study/_optimize.py", line 206, in _run_trial
    value_or_values = func(trial)
  File "/home/junior/Documentos/GitHub/prediction-f1-pit-stops-kaggle-competition/src/truncatedsvd_rbfsampler_logistic_regression_tuning.py", line 127, in <lambda>
    study.optimize(lambda trial: objective(trial, X_train, y_train), n_trials=30, n_jobs=-1, show_progress_bar=True)
                                 ~~~~~~~~~^^^^^^^^^^^^^^^^^^^^^^^^^
  File "/home/junior/Documentos/GitHub/prediction-f1-pit-stops-kaggle-competition/src/truncatedsvd_rbfsampler_logistic_regression_tuning.py", line 102, in objective
    n_components=trial.suggest_int("n_components", 64, 75, log=True),
                 ~~~~~~~~~~~~~~~~~^^^^^^^^^^^^^^^^^^^^^^^^^^^^^^^^^^
  File "/home/junior/Documentos/GitHub/prediction-f1-pit-stops-kaggle-competition/.venv/lib/python3.13/site-packages/optuna/_convert_positional_args.py", line 127, in converter_wrapper
    return func(**kwargs)  # type: ignore[call-arg]
  File "/home/junior/Documentos/GitHub/prediction-f1-pit-stops-kaggle-competition/.venv/lib/python3.13/site-packages/optuna/trial/_trial.py", line 336, in suggest_int
    suggested_value = int(self._suggest(name, distribution))
                          ~~~~~~~~~~~~~^^^^^^^^^^^^^^^^^^^^
  File "/home/junior/Documentos/GitHub/prediction-f1-pit-stops-kaggle-competition/.venv/lib/python3.13/site-packages/optuna/trial/_trial.py", line 632, in _suggest
    distributions.check_distribution_compatibility(trial.distributions[name], distribution)
    ~~~~~~~~~~~~~~~~~~~~~~~~~~~~~~~~~~~~~~~~~~~~~~^^^^^^^^^^^^^^^^^^^^^^^^^^^^^^^^^^^^^^^^^
  File "/home/junior/Documentos/GitHub/prediction-f1-pit-stops-kaggle-competition/.venv/lib/python3.13/site-packages/optuna/distributions.py", line 649, in check_distribution_compatibility
    raise ValueError("Cannot set different log configuration to the same parameter name.")
ValueError: Cannot set different log configuration to the same parameter name.
2026-05-21 19:12:28,008 - WARNING - Trial 2 failed with value None.
2026-05-21 19:12:28,010 - WARNING - Trial 11 failed with parameters: {'n_components': 12, 'algorithm': 'randomized', 'n_iter': 11, 'power_iteration_normalizer': 'OR', 'tol': 0.0009887106155649593, 'gamma': 0.08226276559040033} because of the following error: ValueError('Cannot set different log configuration to the same parameter name.').
Traceback (most recent call last):
  File "/home/junior/Documentos/GitHub/prediction-f1-pit-stops-kaggle-competition/.venv/lib/python3.13/site-packages/optuna/study/_optimize.py", line 206, in _run_trial
    value_or_values = func(trial)
  File "/home/junior/Documentos/GitHub/prediction-f1-pit-stops-kaggle-competition/src/truncatedsvd_rbfsampler_logistic_regression_tuning.py", line 127, in <lambda>
    study.optimize(lambda trial: objective(trial, X_train, y_train), n_trials=30, n_jobs=-1, show_progress_bar=True)
                                 ~~~~~~~~~^^^^^^^^^^^^^^^^^^^^^^^^^
  File "/home/junior/Documentos/GitHub/prediction-f1-pit-stops-kaggle-competition/src/truncatedsvd_rbfsampler_logistic_regression_tuning.py", line 102, in objective
    n_components=trial.suggest_int("n_components", 64, 75, log=True),
                 ~~~~~~~~~~~~~~~~~^^^^^^^^^^^^^^^^^^^^^^^^^^^^^^^^^^
  File "/home/junior/Documentos/GitHub/prediction-f1-pit-stops-kaggle-competition/.venv/lib/python3.13/site-packages/optuna/_convert_positional_args.py", line 127, in converter_wrapper
    return func(**kwargs)  # type: ignore[call-arg]
  File "/home/junior/Documentos/GitHub/prediction-f1-pit-stops-kaggle-competition/.venv/lib/python3.13/site-packages/optuna/trial/_trial.py", line 336, in suggest_int
    suggested_value = int(self._suggest(name, distribution))
                          ~~~~~~~~~~~~~^^^^^^^^^^^^^^^^^^^^
  File "/home/junior/Documentos/GitHub/prediction-f1-pit-stops-kaggle-competition/.venv/lib/python3.13/site-packages/optuna/trial/_trial.py", line 632, in _suggest
    distributions.check_distribution_compatibility(trial.distributions[name], distribution)
    ~~~~~~~~~~~~~~~~~~~~~~~~~~~~~~~~~~~~~~~~~~~~~~^^^^^^^^^^^^^^^^^^^^^^^^^^^^^^^^^^^^^^^^^
  File "/home/junior/Documentos/GitHub/prediction-f1-pit-stops-kaggle-competition/.venv/lib/python3.13/site-packages/optuna/distributions.py", line 649, in check_distribution_compatibility
    raise ValueError("Cannot set different log configuration to the same parameter name.")
ValueError: Cannot set different log configuration to the same parameter name.
2026-05-21 19:12:28,015 - WARNING - Trial 11 failed with value None.
2026-05-21 19:12:28,016 - WARNING - Trial 0 failed with parameters: {'n_components': 38, 'algorithm': 'randomized', 'n_iter': 13, 'power_iteration_normalizer': 'OR', 'tol': 2.1991325550476882e-05, 'gamma': 5.5212371636318505} because of the following error: ValueError('Cannot set different log configuration to the same parameter name.').
Traceback (most recent call last):
  File "/home/junior/Documentos/GitHub/prediction-f1-pit-stops-kaggle-competition/.venv/lib/python3.13/site-packages/optuna/study/_optimize.py", line 206, in _run_trial
    value_or_values = func(trial)
  File "/home/junior/Documentos/GitHub/prediction-f1-pit-stops-kaggle-competition/src/truncatedsvd_rbfsampler_logistic_regression_tuning.py", line 127, in <lambda>
    study.optimize(lambda trial: objective(trial, X_train, y_train), n_trials=30, n_jobs=-1, show_progress_bar=True)
                                 ~~~~~~~~~^^^^^^^^^^^^^^^^^^^^^^^^^
  File "/home/junior/Documentos/GitHub/prediction-f1-pit-stops-kaggle-competition/src/truncatedsvd_rbfsampler_logistic_regression_tuning.py", line 102, in objective
    n_components=trial.suggest_int("n_components", 64, 75, log=True),
                 ~~~~~~~~~~~~~~~~~^^^^^^^^^^^^^^^^^^^^^^^^^^^^^^^^^^
  File "/home/junior/Documentos/GitHub/prediction-f1-pit-stops-kaggle-competition/.venv/lib/python3.13/site-packages/optuna/_convert_positional_args.py", line 127, in converter_wrapper
    return func(**kwargs)  # type: ignore[call-arg]
  File "/home/junior/Documentos/GitHub/prediction-f1-pit-stops-kaggle-competition/.venv/lib/python3.13/site-packages/optuna/trial/_trial.py", line 336, in suggest_int
    suggested_value = int(self._suggest(name, distribution))
                          ~~~~~~~~~~~~~^^^^^^^^^^^^^^^^^^^^
  File "/home/junior/Documentos/GitHub/prediction-f1-pit-stops-kaggle-competition/.venv/lib/python3.13/site-packages/optuna/trial/_trial.py", line 632, in _suggest
    distributions.check_distribution_compatibility(trial.distributions[name], distribution)
    ~~~~~~~~~~~~~~~~~~~~~~~~~~~~~~~~~~~~~~~~~~~~~~^^^^^^^^^^^^^^^^^^^^^^^^^^^^^^^^^^^^^^^^^
  File "/home/junior/Documentos/GitHub/prediction-f1-pit-stops-kaggle-competition/.venv/lib/python3.13/site-packages/optuna/distributions.py", line 649, in check_distribution_compatibility
    raise ValueError("Cannot set different log configuration to the same parameter name.")
ValueError: Cannot set different log configuration to the same parameter name.
2026-05-21 19:12:28,022 - WARNING - Trial 5 failed with parameters: {'n_components': 20, 'algorithm': 'randomized', 'n_iter': 3, 'power_iteration_normalizer': 'OR', 'tol': 1.9367889881953225e-06, 'gamma': 0.0010585859567621833} because of the following error: ValueError('Cannot set different log configuration to the same parameter name.').
Traceback (most recent call last):
  File "/home/junior/Documentos/GitHub/prediction-f1-pit-stops-kaggle-competition/.venv/lib/python3.13/site-packages/optuna/study/_optimize.py", line 206, in _run_trial
    value_or_values = func(trial)
  File "/home/junior/Documentos/GitHub/prediction-f1-pit-stops-kaggle-competition/src/truncatedsvd_rbfsampler_logistic_regression_tuning.py", line 127, in <lambda>
    study.optimize(lambda trial: objective(trial, X_train, y_train), n_trials=30, n_jobs=-1, show_progress_bar=True)
                                 ~~~~~~~~~^^^^^^^^^^^^^^^^^^^^^^^^^
  File "/home/junior/Documentos/GitHub/prediction-f1-pit-stops-kaggle-competition/src/truncatedsvd_rbfsampler_logistic_regression_tuning.py", line 102, in objective
    n_components=trial.suggest_int("n_components", 64, 75, log=True),
                 ~~~~~~~~~~~~~~~~~^^^^^^^^^^^^^^^^^^^^^^^^^^^^^^^^^^
  File "/home/junior/Documentos/GitHub/prediction-f1-pit-stops-kaggle-competition/.venv/lib/python3.13/site-packages/optuna/_convert_positional_args.py", line 127, in converter_wrapper
    return func(**kwargs)  # type: ignore[call-arg]
  File "/home/junior/Documentos/GitHub/prediction-f1-pit-stops-kaggle-competition/.venv/lib/python3.13/site-packages/optuna/trial/_trial.py", line 336, in suggest_int
    suggested_value = int(self._suggest(name, distribution))
                          ~~~~~~~~~~~~~^^^^^^^^^^^^^^^^^^^^
  File "/home/junior/Documentos/GitHub/prediction-f1-pit-stops-kaggle-competition/.venv/lib/python3.13/site-packages/optuna/trial/_trial.py", line 632, in _suggest
    distributions.check_distribution_compatibility(trial.distributions[name], distribution)
    ~~~~~~~~~~~~~~~~~~~~~~~~~~~~~~~~~~~~~~~~~~~~~~^^^^^^^^^^^^^^^^^^^^^^^^^^^^^^^^^^^^^^^^^
  File "/home/junior/Documentos/GitHub/prediction-f1-pit-stops-kaggle-competition/.venv/lib/python3.13/site-packages/optuna/distributions.py", line 649, in check_distribution_compatibility
    raise ValueError("Cannot set different log configuration to the same parameter name.")
ValueError: Cannot set different log configuration to the same parameter name.
2026-05-21 19:12:28,024 - WARNING - Trial 6 failed with parameters: {'n_components': 52, 'algorithm': 'randomized', 'n_iter': 11, 'power_iteration_normalizer': 'OR', 'tol': 2.468658040784686e-06, 'gamma': 0.0010424263720508796} because of the following error: ValueError('Cannot set different log configuration to the same parameter name.').
Traceback (most recent call last):
  File "/home/junior/Documentos/GitHub/prediction-f1-pit-stops-kaggle-competition/.venv/lib/python3.13/site-packages/optuna/study/_optimize.py", line 206, in _run_trial
    value_or_values = func(trial)
  File "/home/junior/Documentos/GitHub/prediction-f1-pit-stops-kaggle-competition/src/truncatedsvd_rbfsampler_logistic_regression_tuning.py", line 127, in <lambda>
    study.optimize(lambda trial: objective(trial, X_train, y_train), n_trials=30, n_jobs=-1, show_progress_bar=True)
                                 ~~~~~~~~~^^^^^^^^^^^^^^^^^^^^^^^^^
  File "/home/junior/Documentos/GitHub/prediction-f1-pit-stops-kaggle-competition/src/truncatedsvd_rbfsampler_logistic_regression_tuning.py", line 102, in objective
    n_components=trial.suggest_int("n_components", 64, 75, log=True),
                 ~~~~~~~~~~~~~~~~~^^^^^^^^^^^^^^^^^^^^^^^^^^^^^^^^^^
  File "/home/junior/Documentos/GitHub/prediction-f1-pit-stops-kaggle-competition/.venv/lib/python3.13/site-packages/optuna/_convert_positional_args.py", line 127, in converter_wrapper
    return func(**kwargs)  # type: ignore[call-arg]
  File "/home/junior/Documentos/GitHub/prediction-f1-pit-stops-kaggle-competition/.venv/lib/python3.13/site-packages/optuna/trial/_trial.py", line 336, in suggest_int
    suggested_value = int(self._suggest(name, distribution))
                          ~~~~~~~~~~~~~^^^^^^^^^^^^^^^^^^^^
  File "/home/junior/Documentos/GitHub/prediction-f1-pit-stops-kaggle-competition/.venv/lib/python3.13/site-packages/optuna/trial/_trial.py", line 632, in _suggest
    distributions.check_distribution_compatibility(trial.distributions[name], distribution)
    ~~~~~~~~~~~~~~~~~~~~~~~~~~~~~~~~~~~~~~~~~~~~~~^^^^^^^^^^^^^^^^^^^^^^^^^^^^^^^^^^^^^^^^^
  File "/home/junior/Documentos/GitHub/prediction-f1-pit-stops-kaggle-competition/.venv/lib/python3.13/site-packages/optuna/distributions.py", line 649, in check_distribution_compatibility
    raise ValueError("Cannot set different log configuration to the same parameter name.")
ValueError: Cannot set different log configuration to the same parameter name.
2026-05-21 19:12:28,025 - WARNING - Trial 3 failed with parameters: {'n_components': 9, 'algorithm': 'randomized', 'n_iter': 10, 'power_iteration_normalizer': 'auto', 'tol': 0.00027072978803036545, 'gamma': 0.04091296496463659} because of the following error: ValueError('Cannot set different log configuration to the same parameter name.').
Traceback (most recent call last):
  File "/home/junior/Documentos/GitHub/prediction-f1-pit-stops-kaggle-competition/.venv/lib/python3.13/site-packages/optuna/study/_optimize.py", line 206, in _run_trial
    value_or_values = func(trial)
  File "/home/junior/Documentos/GitHub/prediction-f1-pit-stops-kaggle-competition/src/truncatedsvd_rbfsampler_logistic_regression_tuning.py", line 127, in <lambda>
    study.optimize(lambda trial: objective(trial, X_train, y_train), n_trials=30, n_jobs=-1, show_progress_bar=True)
                                 ~~~~~~~~~^^^^^^^^^^^^^^^^^^^^^^^^^
  File "/home/junior/Documentos/GitHub/prediction-f1-pit-stops-kaggle-competition/src/truncatedsvd_rbfsampler_logistic_regression_tuning.py", line 102, in objective
    n_components=trial.suggest_int("n_components", 64, 75, log=True),
                 ~~~~~~~~~~~~~~~~~^^^^^^^^^^^^^^^^^^^^^^^^^^^^^^^^^^
  File "/home/junior/Documentos/GitHub/prediction-f1-pit-stops-kaggle-competition/.venv/lib/python3.13/site-packages/optuna/_convert_positional_args.py", line 127, in converter_wrapper
    return func(**kwargs)  # type: ignore[call-arg]
  File "/home/junior/Documentos/GitHub/prediction-f1-pit-stops-kaggle-competition/.venv/lib/python3.13/site-packages/optuna/trial/_trial.py", line 336, in suggest_int
    suggested_value = int(self._suggest(name, distribution))
                          ~~~~~~~~~~~~~^^^^^^^^^^^^^^^^^^^^
  File "/home/junior/Documentos/GitHub/prediction-f1-pit-stops-kaggle-competition/.venv/lib/python3.13/site-packages/optuna/trial/_trial.py", line 632, in _suggest
    distributions.check_distribution_compatibility(trial.distributions[name], distribution)
    ~~~~~~~~~~~~~~~~~~~~~~~~~~~~~~~~~~~~~~~~~~~~~~^^^^^^^^^^^^^^^^^^^^^^^^^^^^^^^^^^^^^^^^^
  File "/home/junior/Documentos/GitHub/prediction-f1-pit-stops-kaggle-competition/.venv/lib/python3.13/site-packages/optuna/distributions.py", line 649, in check_distribution_compatibility
    raise ValueError("Cannot set different log configuration to the same parameter name.")
ValueError: Cannot set different log configuration to the same parameter name.
2026-05-21 19:12:28,027 - WARNING - Trial 10 failed with parameters: {'n_components': 64, 'algorithm': 'randomized', 'n_iter': 8, 'power_iteration_normalizer': 'OR', 'tol': 5.410821949710495e-06, 'gamma': 1.9567806297547908e-05} because of the following error: ValueError('Cannot set different log configuration to the same parameter name.').
Traceback (most recent call last):
  File "/home/junior/Documentos/GitHub/prediction-f1-pit-stops-kaggle-competition/.venv/lib/python3.13/site-packages/optuna/study/_optimize.py", line 206, in _run_trial
    value_or_values = func(trial)
  File "/home/junior/Documentos/GitHub/prediction-f1-pit-stops-kaggle-competition/src/truncatedsvd_rbfsampler_logistic_regression_tuning.py", line 127, in <lambda>
    study.optimize(lambda trial: objective(trial, X_train, y_train), n_trials=30, n_jobs=-1, show_progress_bar=True)
                                 ~~~~~~~~~^^^^^^^^^^^^^^^^^^^^^^^^^
  File "/home/junior/Documentos/GitHub/prediction-f1-pit-stops-kaggle-competition/src/truncatedsvd_rbfsampler_logistic_regression_tuning.py", line 102, in objective
    n_components=trial.suggest_int("n_components", 64, 75, log=True),
                 ~~~~~~~~~~~~~~~~~^^^^^^^^^^^^^^^^^^^^^^^^^^^^^^^^^^
  File "/home/junior/Documentos/GitHub/prediction-f1-pit-stops-kaggle-competition/.venv/lib/python3.13/site-packages/optuna/_convert_positional_args.py", line 127, in converter_wrapper
    return func(**kwargs)  # type: ignore[call-arg]
  File "/home/junior/Documentos/GitHub/prediction-f1-pit-stops-kaggle-competition/.venv/lib/python3.13/site-packages/optuna/trial/_trial.py", line 336, in suggest_int
    suggested_value = int(self._suggest(name, distribution))
                          ~~~~~~~~~~~~~^^^^^^^^^^^^^^^^^^^^
  File "/home/junior/Documentos/GitHub/prediction-f1-pit-stops-kaggle-competition/.venv/lib/python3.13/site-packages/optuna/trial/_trial.py", line 632, in _suggest
    distributions.check_distribution_compatibility(trial.distributions[name], distribution)
    ~~~~~~~~~~~~~~~~~~~~~~~~~~~~~~~~~~~~~~~~~~~~~~^^^^^^^^^^^^^^^^^^^^^^^^^^^^^^^^^^^^^^^^^
  File "/home/junior/Documentos/GitHub/prediction-f1-pit-stops-kaggle-competition/.venv/lib/python3.13/site-packages/optuna/distributions.py", line 649, in check_distribution_compatibility
    raise ValueError("Cannot set different log configuration to the same parameter name.")
ValueError: Cannot set different log configuration to the same parameter name.
2026-05-21 19:12:28,028 - WARNING - Trial 0 failed with value None.
2026-05-21 19:12:28,028 - WARNING - Trial 1 failed with parameters: {'n_components': 21, 'algorithm': 'randomized', 'n_iter': 13, 'power_iteration_normalizer': 'auto', 'tol': 0.0008374942647783186, 'gamma': 1.6387304667900573} because of the following error: ValueError('Cannot set different log configuration to the same parameter name.').
Traceback (most recent call last):
  File "/home/junior/Documentos/GitHub/prediction-f1-pit-stops-kaggle-competition/.venv/lib/python3.13/site-packages/optuna/study/_optimize.py", line 206, in _run_trial
    value_or_values = func(trial)
  File "/home/junior/Documentos/GitHub/prediction-f1-pit-stops-kaggle-competition/src/truncatedsvd_rbfsampler_logistic_regression_tuning.py", line 127, in <lambda>
    study.optimize(lambda trial: objective(trial, X_train, y_train), n_trials=30, n_jobs=-1, show_progress_bar=True)
                                 ~~~~~~~~~^^^^^^^^^^^^^^^^^^^^^^^^^
  File "/home/junior/Documentos/GitHub/prediction-f1-pit-stops-kaggle-competition/src/truncatedsvd_rbfsampler_logistic_regression_tuning.py", line 102, in objective
    n_components=trial.suggest_int("n_components", 64, 75, log=True),
                 ~~~~~~~~~~~~~~~~~^^^^^^^^^^^^^^^^^^^^^^^^^^^^^^^^^^
  File "/home/junior/Documentos/GitHub/prediction-f1-pit-stops-kaggle-competition/.venv/lib/python3.13/site-packages/optuna/_convert_positional_args.py", line 127, in converter_wrapper
    return func(**kwargs)  # type: ignore[call-arg]
  File "/home/junior/Documentos/GitHub/prediction-f1-pit-stops-kaggle-competition/.venv/lib/python3.13/site-packages/optuna/trial/_trial.py", line 336, in suggest_int
    suggested_value = int(self._suggest(name, distribution))
                          ~~~~~~~~~~~~~^^^^^^^^^^^^^^^^^^^^
  File "/home/junior/Documentos/GitHub/prediction-f1-pit-stops-kaggle-competiti