2026-05-20 15:03:12,781 - INFO - Trial 29 finished with value: 0.9364257235191195 and parameters: {'n_components': 63, 'algorithm': 'randomized', 'n_iter': 7, 'power_iteration_normalizer': 'auto', 'tol': 1.7434782965618138e-05, 'num_leaves': 75, 'max_depth': 6, 'learning_rate': 0.03163406324784159, 'lambda_l1': 0.6519425806472249, 'lambda_l2': 0.31234473753435826, 'feature_fraction': 0.8601299982736934, 'bagging_fraction': 0.8822494284685537, 'bagging_freq': 3, 'min_child_samples': 41}. Best is trial 4 with value: 0.939461157020039.
2026-05-20 15:03:12,790 - INFO - Best AUC: 0.939461157020039 | Best params: {'n_components': 59, 'algorithm': 'randomized', 'n_iter': 11, 'power_iteration_normalizer': 'auto', 'tol': 1.3022926982125576e-06, 'num_leaves': 128, 'max_depth': 10, 'learning_rate': 0.03409600347639228, 'lambda_l1': 1.0628563538033857, 'lambda_l2': 7.868471599504208, 'feature_fraction': 0.6626817767126574, 'bagging_fraction': 0.8049311570827886, 'bagging_freq': 2, 'min_child_samples': 78}
2026-05-20 15:03:12,791 - INFO - ----- Saving Pipeline -----
2026-05-20 15:05:54,470 - INFO - ----- Saving Pipeline -----
2026-05-20 15:06:22,517 - INFO - ----- Saving Pipeline -----
2026-05-20 15:07:54,137 - INFO - ----- Saving Pipeline -----
2026-05-20 23:41:55,964 - INFO - ----- Fine Tuning -----
2026-05-20 23:41:55,964 - INFO - A new study created in memory with name: no-name-107032a1-3e17-4b7f-a16d-e4fa6cf68d58
2026-05-20 23:44:02,150 - INFO - Trial 6 finished with value: 0.5 and parameters: {'n_components': 37, 'algorithm': 'randomized', 'n_iter': 4, 'power_iteration_normalizer': 'auto', 'tol': 0.00013330654901350884, 'solver': 'saga', 'C': 1.278258719780785e-05, 'l1_ratio': 0.9440122141218419}. Best is trial 6 with value: 0.5.
2026-05-20 23:44:40,085 - INFO - Trial 3 finished with value: 0.543688243538442 and parameters: {'n_components': 2, 'algorithm': 'randomized', 'n_iter': 12, 'power_iteration_normalizer': 'LU', 'tol': 5.6268228631113415e-05, 'solver': 'saga', 'C': 0.2718102185778679, 'l1_ratio': 0.8298732293554514}. Best is trial 3 with value: 0.543688243538442.
2026-05-20 23:44:43,614 - INFO - Trial 1 finished with value: 0.7602682793586046 and parameters: {'n_components': 11, 'algorithm': 'randomized', 'n_iter': 7, 'power_iteration_normalizer': 'LU', 'tol': 0.000996993501161696, 'solver': 'saga', 'C': 0.00017037344579887118, 'l1_ratio': 0.19129506746996394}. Best is trial 1 with value: 0.7602682793586046.
2026-05-20 23:44:46,271 - INFO - Trial 11 finished with value: 0.8701546262573899 and parameters: {'n_components': 42, 'algorithm': 'randomized', 'n_iter': 5, 'power_iteration_normalizer': 'LU', 'tol': 0.000982455316231765, 'solver': 'saga', 'C': 2.5920442879454717e-05, 'l1_ratio': 0.13845116451680517}. Best is trial 11 with value: 0.8701546262573899.
2026-05-20 23:45:06,635 - INFO - Trial 7 finished with value: 0.888936033293767 and parameters: {'n_components': 62, 'algorithm': 'randomized', 'n_iter': 7, 'power_iteration_normalizer': 'LU', 'tol': 0.0003678467547983055, 'solver': 'saga', 'C': 0.0003569937226367603, 'l1_ratio': 0.8722315472291758}. Best is trial 7 with value: 0.888936033293767.
2026-05-20 23:45:27,522 - INFO - Trial 12 pruned. 
2026-05-20 23:45:55,188 - INFO - Trial 5 finished with value: 0.8934408960655382 and parameters: {'n_components': 64, 'algorithm': 'randomized', 'n_iter': 3, 'power_iteration_normalizer': 'LU', 'tol': 4.876014157296274e-05, 'solver': 'saga', 'C': 1.9476634293736808, 'l1_ratio': 0.0839149546489234}. Best is trial 5 with value: 0.8934408960655382.
2026-05-20 23:46:13,748 - INFO - Trial 2 pruned. 
2026-05-20 23:46:41,030 - INFO - Trial 10 pruned. 
2026-05-20 23:46:46,509 - INFO - Trial 15 pruned. 
2026-05-20 23:46:54,211 - INFO - Trial 9 finished with value: 0.8785637396265148 and parameters: {'n_components': 56, 'algorithm': 'randomized', 'n_iter': 8, 'power_iteration_normalizer': 'OR', 'tol': 0.0008642135525682114, 'solver': 'saga', 'C': 0.0003123988100863186, 'l1_ratio': 0.9711967800779777}. Best is trial 5 with value: 0.8934408960655382.
2026-05-20 23:47:01,882 - INFO - Trial 14 pruned. 
2026-05-20 23:47:28,640 - INFO - Trial 17 pruned. 
2026-05-20 23:50:03,370 - INFO - Trial 20 finished with value: 0.8925647345521039 and parameters: {'n_components': 66, 'algorithm': 'randomized', 'n_iter': 4, 'power_iteration_normalizer': 'auto', 'tol': 1.3964422984312561e-05, 'solver': 'saga', 'C': 0.0016805674525549798, 'l1_ratio': 0.9658052059655445}. Best is trial 5 with value: 0.8934408960655382.
2026-05-20 23:50:57,832 - INFO - Trial 18 pruned. 
2026-05-20 23:58:19,924 - INFO - Trial 4 finished with value: 0.8934172044768373 and parameters: {'n_components': 65, 'algorithm': 'randomized', 'n_iter': 14, 'power_iteration_normalizer': 'OR', 'tol': 0.00010309555605109726, 'solver': 'saga', 'C': 0.02917674715632158, 'l1_ratio': 0.7936193717499858}. Best is trial 5 with value: 0.8934408960655382.
2026-05-21 00:02:58,551 - INFO - Trial 0 finished with value: 0.885729392879148 and parameters: {'n_components': 43, 'algorithm': 'randomized', 'n_iter': 15, 'power_iteration_normalizer': 'OR', 'tol': 3.1640917426286655e-06, 'solver': 'saga', 'C': 0.00678641757270033, 'l1_ratio': 0.0973929448319828}. Best is trial 5 with value: 0.8934408960655382.
2026-05-21 00:04:19,956 - INFO - Trial 16 finished with value: 0.8927273755103153 and parameters: {'n_components': 55, 'algorithm': 'randomized', 'n_iter': 13, 'power_iteration_normalizer': 'auto', 'tol': 0.0005086330470920191, 'solver': 'saga', 'C': 0.045934007546726774, 'l1_ratio': 0.8877415140192075}. Best is trial 5 with value: 0.8934408960655382.
2026-05-21 00:06:32,901 - INFO - Trial 19 pruned. 
2026-05-21 00:06:54,095 - INFO - Trial 8 finished with value: 0.8894104616435822 and parameters: {'n_components': 46, 'algorithm': 'randomized', 'n_iter': 9, 'power_iteration_normalizer': 'LU', 'tol': 3.6966570976999667e-06, 'solver': 'saga', 'C': 0.027093649065176573, 'l1_ratio': 0.10864158632612841}. Best is trial 5 with value: 0.8934408960655382.
2026-05-21 00:49:59,783 - INFO - Trial 13 finished with value: 0.8931895132947709 and parameters: {'n_components': 59, 'algorithm': 'randomized', 'n_iter': 7, 'power_iteration_normalizer': 'LU', 'tol': 9.619346341549262e-05, 'solver': 'saga', 'C': 0.06307053433018894, 'l1_ratio': 0.9603019329622458}. Best is trial 5 with value: 0.8934408960655382.
2026-05-21 00:51:52,767 - INFO - Trial 26 finished with value: 0.8935909096630755 and parameters: {'n_components': 72, 'algorithm': 'randomized', 'n_iter': 3, 'power_iteration_normalizer': 'auto', 'tol': 2.1537849280058203e-05, 'solver': 'saga', 'C': 1.2187656319729034, 'l1_ratio': 0.6928623153472109}. Best is trial 26 with value: 0.8935909096630755.
2026-05-21 02:34:24,267 - INFO - ----- Fine Tuning -----
2026-05-21 02:34:24,268 - INFO - A new study created in memory with name: no-name-64c01e31-2d11-4eb1-a8fd-cb83cddf8a73
2026-05-21 05:22:36,847 - INFO - ----- Fine Tuning -----
2026-05-21 05:22:36,847 - INFO - A new study created in memory with name: no-name-566ae511-0855-40ea-a897-5b2946db8a20
2026-05-21 05:24:59,597 - INFO - Trial 7 finished with value: 0.8750336471054695 and parameters: {'n_components': 66, 'algorithm': 'randomized', 'n_iter': 4, 'power_iteration_normalizer': 'OR', 'tol': 1.7224165249113394e-05, 'solver': 'saga', 'C': 0.00010475224324263944, 'l1_ratio': 0.6968367379363593}. Best is trial 7 with value: 0.8750336471054695.
2026-05-21 05:25:16,563 - INFO - Trial 10 finished with value: 0.8432952365122912 and parameters: {'n_components': 53, 'algorithm': 'randomized', 'n_iter': 10, 'power_iteration_normalizer': 'OR', 'tol': 0.00010079819606661067, 'solver': 'saga', 'C': 4.9864885212858204e-05, 'l1_ratio': 0.3641510287982791}. Best is trial 7 with value: 0.8750336471054695.
2026-05-21 05:26:50,031 - INFO - Trial 9 finished with value: 0.7820178432801799 and parameters: {'n_components': 12, 'algorithm': 'randomized', 'n_iter': 10, 'power_iteration_normalizer': 'LU', 'tol': 0.007252479421162315, 'solver': 'saga', 'C': 0.10114474861899642, 'l1_ratio': 0.5858493643386189}. Best is trial 7 with value: 0.8750336471054695.
2026-05-21 05:27:20,405 - INFO - Trial 4 finished with value: 0.8201683283444998 and parameters: {'n_components': 27, 'algorithm': 'randomized', 'n_iter': 5, 'power_iteration_normalizer': 'OR', 'tol': 0.00014540678491560142, 'solver': 'saga', 'C': 0.0006622243875039486, 'l1_ratio': 0.6240690426306443}. Best is trial 7 with value: 0.8750336471054695.
2026-05-21 05:27:56,101 - INFO - Trial 5 finished with value: 0.8760106480782802 and parameters: {'n_components': 39, 'algorithm': 'randomized', 'n_iter': 8, 'power_iteration_normalizer': 'auto', 'tol': 0.0007703711982372667, 'solver': 'saga', 'C': 0.00039473423346973334, 'l1_ratio': 0.2687107264386581}. Best is trial 5 with value: 0.8760106480782802.
2026-05-21 05:28:08,223 - INFO - Trial 14 pruned. 
2026-05-21 05:28:38,242 - INFO - Trial 6 pruned. 
2026-05-21 05:28:53,678 - INFO - Trial 11 finished with value: 0.8907679184357006 and parameters: {'n_components': 59, 'algorithm': 'randomized', 'n_iter': 9, 'power_iteration_normalizer': 'auto', 'tol': 0.002521173474023529, 'solver': 'saga', 'C': 0.0003089599930592606, 'l1_ratio': 0.2402594628586674}. Best is trial 11 with value: 0.8907679184357006.
2026-05-21 05:29:01,474 - INFO - Trial 12 finished with value: 0.850650252319175 and parameters: {'n_components': 34, 'algorithm': 'randomized', 'n_iter': 9, 'power_iteration_normalizer': 'OR', 'tol': 3.701360279295403e-05, 'solver': 'saga', 'C': 0.0004710174242104127, 'l1_ratio': 0.336637781256095}. Best is trial 11 with value: 0.8907679184357006.
2026-05-21 05:29:21,265 - INFO - Trial 15 pruned. 
2026-05-21 05:29:52,432 - INFO - Trial 18 pruned. 
2026-05-21 05:30:10,428 - INFO - Trial 2 pruned. 
2026-05-21 05:33:01,063 - INFO - Trial 22 finished with value: 0.891605947822765 and parameters: {'n_components': 51, 'algorithm': 'randomized', 'n_iter': 14, 'power_iteration_normalizer': 'auto', 'tol': 0.0008141363628989509, 'solver': 'saga', 'C': 0.008391660953643876, 'l1_ratio': 0.31673940136586165}. Best is trial 22 with value: 0.891605947822765.
2026-05-21 05:34:14,749 - INFO - Trial 13 pruned. 
2026-05-21 05:35:11,501 - INFO - Trial 8 pruned. 
2026-05-21 05:37:11,592 - INFO - Trial 24 finished with value: 0.891899059130866 and parameters: {'n_components': 51, 'algorithm': 'randomized', 'n_iter': 14, 'power_iteration_normalizer': 'auto', 'tol': 0.0006269005876412398, 'solver': 'saga', 'C': 0.01047425792026982, 'l1_ratio': 0.4219720430361281}. Best is trial 24 with value: 0.891899059130866.
2026-05-21 05:38:55,825 - INFO - Trial 1 pruned. 
2026-05-21 05:41:27,686 - INFO - Trial 26 finished with value: 0.8911722570373074 and parameters: {'n_components': 50, 'algorithm': 'randomized', 'n_iter': 15, 'power_iteration_normalizer': 'auto', 'tol': 0.00030537425584114576, 'solver': 'saga', 'C': 0.04242499118877504, 'l1_ratio': 0.016990112930567736}. Best is trial 24 with value: 0.891899059130866.
2026-05-21 05:44:00,298 - INFO - Trial 17 pruned. 
2026-05-21 05:44:30,075 - INFO - Trial 16 pruned. 
2026-05-21 05:44:36,237 - INFO - Trial 20 pruned. 
2026-05-21 05:46:29,852 - INFO - Trial 23 finished with value: 0.890970938741124 and parameters: {'n_components': 49, 'algorithm': 'randomized', 'n_iter': 14, 'power_iteration_normalizer': 'auto', 'tol': 0.0011331958636720339, 'solver': 'saga', 'C': 0.006900750631172455, 'l1_ratio': 0.010522347377791397}. Best is trial 24 with value: 0.891899059130866.
2026-05-21 05:48:27,465 - INFO - Trial 27 finished with value: 0.887726849497362 and parameters: {'n_components': 44, 'algorithm': 'randomized', 'n_iter': 15, 'power_iteration_normalizer': 'auto', 'tol': 0.00026941448658087584, 'solver': 'saga', 'C': 0.05791199098498131, 'l1_ratio': 0.42391942863645654}. Best is trial 24 with value: 0.891899059130866.
2026-05-21 05:51:41,377 - INFO - Trial 25 finished with value: 0.8927516691434073 and parameters: {'n_components': 54, 'algorithm': 'randomized', 'n_iter': 15, 'power_iteration_normalizer': 'auto', 'tol': 0.0007144683508829837, 'solver': 'saga', 'C': 0.033310661890157085, 'l1_ratio': 0.01904376966774668}. Best is trial 25 with value: 0.8927516691434073.
2026-05-21 05:53:04,221 - INFO - Trial 28 finished with value: 0.8893360706968952 and parameters: {'n_components': 47, 'algorithm': 'randomized', 'n_iter': 15, 'power_iteration_normalizer': 'auto', 'tol': 0.000391585756103701, 'solver': 'saga', 'C': 0.006195034009620878, 'l1_ratio': 0.011563055184109383}. Best is trial 25 with value: 0.8927516691434073.
2026-05-21 05:54:34,448 - INFO - Trial 33 finished with value: 0.888778510187388 and parameters: {'n_components': 45, 'algorithm': 'randomized', 'n_iter': 13, 'power_iteration_normalizer': 'auto', 'tol': 0.00028154373300783107, 'solver': 'saga', 'C': 0.005797084471796883, 'l1_ratio': 0.4113851189971054}. Best is trial 25 with value: 0.8927516691434073.
2026-05-21 05:55:39,372 - INFO - Trial 29 pruned. 
2026-05-21 06:00:48,339 - INFO - Trial 19 pruned. 
2026-05-21 06:03:24,336 - INFO - Trial 35 finished with value: 0.8930599968002572 and parameters: {'n_components': 59, 'algorithm': 'randomized', 'n_iter': 13, 'power_iteration_normalizer': 'auto', 'tol': 0.0005046630718730165, 'solver': 'saga', 'C': 0.009339493762138575, 'l1_ratio': 0.41072964466221323}. Best is trial 35 with value: 0.8930599968002572.
2026-05-21 06:03:49,280 - INFO - Trial 31 finished with value: 0.8934279352193162 and parameters: {'n_components': 74, 'algorithm': 'randomized', 'n_iter': 13, 'power_iteration_normalizer': 'auto', 'tol': 0.0003788387833438342, 'solver': 'saga', 'C': 0.0045260864305696645, 'l1_ratio': 0.4280071724895099}. Best is trial 31 with value: 0.8934279352193162.
2026-05-21 06:03:59,649 - INFO - Trial 32 finished with value: 0.8893510127096274 and parameters: {'n_components': 47, 'algorithm': 'randomized', 'n_iter': 13, 'power_iteration_normalizer': 'auto', 'tol': 0.0005025661900959707, 'solver': 'saga', 'C': 0.009560589752998658, 'l1_ratio': 0.006173208541992143}. Best is trial 31 with value: 0.8934279352193162.
2026-05-21 06:10:32,554 - INFO - Trial 34 finished with value: 0.8935033435673333 and parameters: {'n_components': 74, 'algorithm': 'randomized', 'n_iter': 13, 'power_iteration_normalizer': 'auto', 'tol': 0.0003940601008978604, 'solver': 'saga', 'C': 0.0057430437333773334, 'l1_ratio': 0.007032348588466741}. Best is trial 34 with value: 0.8935033435673333.
2026-05-21 06:27:54,628 - INFO - Trial 21 finished with value: 0.8918689849864572 and parameters: {'n_components': 51, 'algorithm': 'randomized', 'n_iter': 14, 'power_iteration_normalizer': 'auto', 'tol': 1.0705877019916966e-06, 'solver': 'saga', 'C': 0.027758230952278137, 'l1_ratio': 0.07422016875669044}. Best is trial 34 with value: 0.8935033435673333.
2026-05-21 06:40:03,434 - INFO - Trial 44 finished with value: 0.8931431638440579 and parameters: {'n_components': 75, 'algorithm': 'randomized', 'n_iter': 12, 'power_iteration_normalizer': 'auto', 'tol': 0.0001415966942305845, 'solver': 'saga', 'C': 0.0017752160624423634, 'l1_ratio': 0.16743001647875722}. Best is trial 34 with value: 0.8935033435673333.
2026-05-21 06:50:13,699 - INFO - Trial 0 finished with value: 0.8935330344042228 and parameters: {'n_components': 69, 'algorithm': 'randomized', 'n_iter': 14, 'power_iteration_normalizer': 'auto', 'tol': 1.754536956369068e-05, 'solver': 'saga', 'C': 0.24936279267643952, 'l1_ratio': 0.3146253165335491}. Best is trial 0 with value: 0.8935330344042228.
2026-05-21 06:53:41,612 - INFO - Trial 45 finished with value: 0.8934007715494185 and parameters: {'n_components': 75, 'algorithm': 'randomized', 'n_iter': 12, 'power_iteration_normalizer': 'LU', 'tol': 0.0001583647955474139, 'solver': 'saga', 'C': 0.0018232756482303072, 'l1_ratio': 0.20226729071760552}. Best is trial 0 with value: 0.8935330344042228.
2026-05-21 06:54:30,732 - INFO - Trial 39 finished with value: 0.8928394839641249 and parameters: {'n_components': 57, 'algorithm': 'randomized', 'n_iter': 13, 'power_iteration_normalizer': 'auto', 'tol': 0.009119112944460984, 'solver': 'saga', 'C': 0.43258854910893546, 'l1_ratio': 0.14077123584021528}. Best is trial 0 with value: 0.8935330344042228.
2026-05-21 06:57:45,882 - INFO - Trial 41 finished with value: 0.893595040283157 and parameters: {'n_components': 74, 'algorithm': 'randomized', 'n_iter': 13, 'power_iteration_normalizer': 'LU', 'tol': 0.00610366333515385, 'solver': 'saga', 'C': 0.3453851953323206, 'l1_ratio': 0.23506844782903394}. Best is trial 41 with value: 0.893595040283157.
2026-05-21 07:06:22,642 - INFO - Trial 46 finished with value: 0.8934633278761979 and parameters: {'n_components': 74, 'algorithm': 'randomized', 'n_iter': 12, 'power_iteration_normalizer': 'LU', 'tol': 6.221886647728268e-05, 'solver': 'saga', 'C': 0.002318388475830151, 'l1_ratio': 0.2033649635782684}. Best is trial 41 with value: 0.893595040283157.
2026-05-21 07:10:50,840 - INFO - Trial 48 finished with value: 0.8932857884310914 and parameters: {'n_components': 75, 'algorithm': 'randomized', 'n_iter': 12, 'power_iteration_normalizer': 'LU', 'tol': 6.597624068589876e-05, 'solver': 'saga', 'C': 0.0020622470248833967, 'l1_ratio': 0.24705357517818205}. Best is trial 41 with value: 0.893595040283157.
2026-05-21 07:30:29,868 - INFO - Trial 36 finished with value: 0.893610190673415 and parameters: {'n_components': 75, 'algorithm': 'randomized', 'n_iter': 13, 'power_iteration_normalizer': 'auto', 'tol': 0.0007877157329164946, 'solver': 'saga', 'C': 0.3803617202118238, 'l1_ratio': 0.4502496478097277}. Best is trial 36 with value: 0.893610190673415.
2026-05-21 07:33:16,661 - INFO - Trial 52 finished with value: 0.8932437791740135 and parameters: {'n_components': 67, 'algorithm': 'randomized', 'n_iter': 11, 'power_iteration_normalizer': 'LU', 'tol': 0.004538059288048477, 'solver': 'saga', 'C': 0.3525703975110837, 'l1_ratio': 0.5593137985321257}. Best is trial 36 with value: 0.893610190673415.
2026-05-21 07:37:38,030 - INFO - Trial 42 finished with value: 0.8935666995995012 and parameters: {'n_components': 74, 'algorithm': 'randomized', 'n_iter': 14, 'power_iteration_normalizer': 'auto', 'tol': 0.00013987978222716366, 'solver': 'saga', 'C': 0.22730189738481282, 'l1_ratio': 0.47453664843707033}. Best is trial 36 with value: 0.893610190673415.
2026-05-21 07:42:43,158 - INFO - Trial 3 finished with value: 0.893576336621574 and parameters: {'n_components': 68, 'algorithm': 'randomized', 'n_iter': 3, 'power_iteration_normalizer': 'LU', 'tol': 1.739262974835816e-06, 'solver': 'saga', 'C': 6.417667710885413, 'l1_ratio': 0.06894154281403708}. Best is trial 36 with value: 0.893610190673415.
2026-05-21 08:00:26,466 - INFO - Trial 51 finished with value: 0.8933881896037608 and parameters: {'n_components': 69, 'algorithm': 'randomized', 'n_iter': 11, 'power_iteration_normalizer': 'LU', 'tol': 9.276157096294863e-06, 'solver': 'saga', 'C': 0.23235132858249843, 'l1_ratio': 0.219933028194764}. Best is trial 36 with value: 0.893610190673415.
2026-05-21 08:02:37,199 - INFO - Trial 56 finished with value: 0.8932613065030713 and parameters: {'n_components': 62, 'algorithm': 'randomized', 'n_iter': 7, 'power_iteration_normalizer': 'LU', 'tol': 0.004629078325299407, 'solver': 'saga', 'C': 1.4319689354563856, 'l1_ratio': 0.6370751243139855}. Best is trial 36 with value: 0.893610190673415.
2026-05-21 08:02:57,187 - INFO - Trial 40 finished with value: 0.8937726214182687 and parameters: {'n_components': 75, 'algorithm': 'randomized', 'n_iter': 13, 'power_iteration_normalizer': 'LU', 'tol': 0.0001392365343269728, 'solver': 'saga', 'C': 0.35655141507820654, 'l1_ratio': 0.17750518257177195}. Best is trial 40 with value: 0.8937726214182687.
2026-05-21 08:09:47,612 - INFO - Trial 47 finished with value: 0.8935291652475945 and parameters: {'n_components': 74, 'algorithm': 'randomized', 'n_iter': 12, 'power_iteration_normalizer': 'LU', 'tol': 8.667953574287185e-05, 'solver': 'saga', 'C': 0.2154672632604651, 'l1_ratio': 0.24700081143827535}. Best is trial 40 with value: 0.8937726214182687.
2026-05-21 08:19:48,643 - INFO - Trial 49 finished with value: 0.8935469428836068 and parameters: {'n_components': 70, 'algorithm': 'randomized', 'n_iter': 11, 'power_iteration_normalizer': 'LU', 'tol': 0.004142200690290943, 'solver': 'saga', 'C': 0.3064854140179993, 'l1_ratio': 0.2492589562240264}. Best is trial 40 with value: 0.8937726214182687.
2026-05-21 08:22:06,136 - INFO - Trial 60 finished with value: 0.8932151836462928 and parameters: {'n_components': 64, 'algorithm': 'randomized', 'n_iter': 6, 'power_iteration_normalizer': 'LU', 'tol': 0.0016031406023502006, 'solver': 'saga', 'C': 1.100670454006161, 'l1_ratio': 0.4659435985478871}. Best is trial 40 with value: 0.8937726214182687.
2026-05-21 08:30:10,610 - INFO - Trial 50 finished with value: 0.8934601217292558 and parameters: {'n_components': 69, 'algorithm': 'randomized', 'n_iter': 11, 'power_iteration_normalizer': 'LU', 'tol': 6.80711918162539e-06, 'solver': 'saga', 'C': 0.3371230374249959, 'l1_ratio': 0.2650519934706255}. Best is trial 40 with value: 0.8937726214182687.
2026-05-21 08:46:55,827 - INFO - Trial 43 finished with value: 0.8935262881503411 and parameters: {'n_components': 75, 'algorithm': 'randomized', 'n_iter': 12, 'power_iteration_normalizer': 'auto', 'tol': 0.00014881296685142397, 'solver': 'saga', 'C': 0.18639317944103292, 'l1_ratio': 0.09814055333080401}. Best is trial 40 with value: 0.8937726214182687.
2026-05-21 08:51:35,656 - INFO - Trial 30 finished with value: 0.8936091862683595 and parameters: {'n_components': 75, 'algorithm': 'randomized', 'n_iter': 13, 'power_iteration_normalizer': 'auto', 'tol': 0.0005897120581989988, 'solver': 'saga', 'C': 0.5120468054884167, 'l1_ratio': 0.45435662930271303}. Best is trial 40 with value: 0.8937726214182687.
