2026-05-21 21:20:21,864 - INFO - Trial 36 finished with value: 0.8818310880063176 and parameters: {'truncsvd_n_components': 59, 'algorithm': 'randomized', 'n_iter': 13, 'power_iteration_normalizer': 'LU', 'truncsvd_tol': 5.265324117632828e-06, 'gamma': 1.4933326970289886e-05, 'n_components': 71, 'loss': 'log_loss', 'penalty': 'l1', 'alpha': 4.6752799571318025e-05, 'learning_rate': 'adaptive', 'eta0': 0.0019011152657875308, 'l1_ratio': 0.3992333973829108, 'tol': 0.004106434632073882, 'average': True}. Best is trial 35 with value: 0.889743237184635.
2026-05-21 21:20:31,748 - INFO - Trial 39 finished with value: 0.882776761467143 and parameters: {'truncsvd_n_components': 60, 'algorithm': 'randomized', 'n_iter': 13, 'power_iteration_normalizer': 'OR', 'truncsvd_tol': 5.415889649024189e-06, 'gamma': 1.2141357192813326e-05, 'n_components': 69, 'loss': 'log_loss', 'penalty': 'l2', 'alpha': 6.119089789645589e-05, 'learning_rate': 'adaptive', 'eta0': 0.0003131368616231043, 'l1_ratio': 0.11793453896021744, 'tol': 0.0029190255791647917, 'average': False}. Best is trial 35 with value: 0.889743237184635.
2026-05-21 21:20:46,647 - INFO - Trial 42 finished with value: 0.889904040645269 and parameters: {'truncsvd_n_components': 59, 'algorithm': 'randomized', 'n_iter': 7, 'power_iteration_normalizer': 'OR', 'truncsvd_tol': 7.624195939148206e-06, 'gamma': 1.3216380566686388e-05, 'n_components': 69, 'loss': 'log_loss', 'penalty': 'l2', 'alpha': 0.00010190334248792909, 'learning_rate': 'adaptive', 'eta0': 0.0004422702125439499, 'l1_ratio': 0.15210908242778737, 'tol': 0.0014164033891247037, 'average': True}. Best is trial 42 with value: 0.889904040645269.
2026-05-21 21:20:57,682 - INFO - Trial 46 pruned. 
2026-05-21 21:20:59,796 - INFO - Trial 43 finished with value: 0.8878667133705545 and parameters: {'truncsvd_n_components': 60, 'algorithm': 'randomized', 'n_iter': 8, 'power_iteration_normalizer': 'OR', 'truncsvd_tol': 2.795936986322151e-05, 'gamma': 1.463245953303114e-05, 'n_components': 69, 'loss': 'log_loss', 'penalty': 'l2', 'alpha': 0.00018179991885474437, 'learning_rate': 'adaptive', 'eta0': 0.0004898035130372186, 'l1_ratio': 0.12232066330861399, 'tol': 0.001309051787707708, 'average': True}. Best is trial 42 with value: 0.889904040645269.
2026-05-21 21:21:04,895 - INFO - Trial 40 finished with value: 0.8886591600470704 and parameters: {'truncsvd_n_components': 59, 'algorithm': 'randomized', 'n_iter': 13, 'power_iteration_normalizer': 'OR', 'truncsvd_tol': 3.162555815385781e-05, 'gamma': 1.2875057019694508e-05, 'n_components': 69, 'loss': 'log_loss', 'penalty': 'l2', 'alpha': 4.539907841897316e-05, 'learning_rate': 'adaptive', 'eta0': 0.000313606587534562, 'l1_ratio': 0.12554100634508103, 'tol': 0.0028783221305317013, 'average': False}. Best is trial 42 with value: 0.889904040645269.
2026-05-21 21:21:12,064 - INFO - Trial 44 finished with value: 0.8834461062741752 and parameters: {'truncsvd_n_components': 58, 'algorithm': 'randomized', 'n_iter': 8, 'power_iteration_normalizer': 'OR', 'truncsvd_tol': 2.6795206971494004e-05, 'gamma': 6.742348655002376e-05, 'n_components': 69, 'loss': 'log_loss', 'penalty': 'l2', 'alpha': 2.4946309873515124e-05, 'learning_rate': 'adaptive', 'eta0': 0.0005195645363480741, 'l1_ratio': 0.12343724368342607, 'tol': 0.0025983519319292795, 'average': True}. Best is trial 42 with value: 0.889904040645269.
2026-05-21 21:21:19,529 - INFO - Trial 47 pruned. 
2026-05-21 21:21:31,207 - INFO - Trial 41 finished with value: 0.8920617648936545 and parameters: {'truncsvd_n_components': 59, 'algorithm': 'randomized', 'n_iter': 13, 'power_iteration_normalizer': 'OR', 'truncsvd_tol': 3.0647976334488604e-05, 'gamma': 1.2173571513229001e-05, 'n_components': 75, 'loss': 'log_loss', 'penalty': 'l2', 'alpha': 7.594770895025272e-05, 'learning_rate': 'adaptive', 'eta0': 0.0003029562065958152, 'l1_ratio': 0.1301155470664575, 'tol': 1.058884309008172e-05, 'average': False}. Best is trial 41 with value: 0.8920617648936545.
2026-05-21 21:21:45,713 - INFO - Trial 45 finished with value: 0.8879148433475192 and parameters: {'truncsvd_n_components': 54, 'algorithm': 'randomized', 'n_iter': 7, 'power_iteration_normalizer': 'OR', 'truncsvd_tol': 2.6060934800551028e-05, 'gamma': 0.00012140758089870953, 'n_components': 75, 'loss': 'log_loss', 'penalty': 'l2', 'alpha': 2.06569405033462e-05, 'learning_rate': 'adaptive', 'eta0': 0.005251291892657114, 'l1_ratio': 0.12603096991403578, 'tol': 2.713975478016747e-05, 'average': True}. Best is trial 41 with value: 0.8920617648936545.
2026-05-21 21:22:00,468 - INFO - Trial 48 finished with value: 0.8895648953868476 and parameters: {'truncsvd_n_components': 55, 'algorithm': 'randomized', 'n_iter': 7, 'power_iteration_normalizer': 'OR', 'truncsvd_tol': 2.6875681591070337e-05, 'gamma': 0.00012504462036607296, 'n_components': 74, 'loss': 'log_loss', 'penalty': 'l2', 'alpha': 2.1135460567754958e-05, 'learning_rate': 'adaptive', 'eta0': 0.0036978488065212345, 'l1_ratio': 0.16430084506600415, 'tol': 2.7231485797872423e-05, 'average': True}. Best is trial 41 with value: 0.8920617648936545.
2026-05-21 21:22:09,863 - INFO - Trial 49 finished with value: 0.8906719592084222 and parameters: {'truncsvd_n_components': 54, 'algorithm': 'randomized', 'n_iter': 7, 'power_iteration_normalizer': 'LU', 'truncsvd_tol': 2.3830735419403998e-05, 'gamma': 0.00015588185846372978, 'n_components': 74, 'loss': 'log_loss', 'penalty': 'l2', 'alpha': 2.62260781086973e-05, 'learning_rate': 'adaptive', 'eta0': 0.004663777438861441, 'l1_ratio': 0.15281951281252615, 'tol': 2.899612992104956e-05, 'average': True}. Best is trial 41 with value: 0.8920617648936545.
2026-05-21 21:22:09,865 - INFO - Best AUC: 0.8920617648936545 | Best params: {'truncsvd_n_components': 59, 'algorithm': 'randomized', 'n_iter': 13, 'power_iteration_normalizer': 'OR', 'truncsvd_tol': 3.0647976334488604e-05, 'gamma': 1.2173571513229001e-05, 'n_components': 75, 'loss': 'log_loss', 'penalty': 'l2', 'alpha': 7.594770895025272e-05, 'learning_rate': 'adaptive', 'eta0': 0.0003029562065958152, 'l1_ratio': 0.1301155470664575, 'tol': 1.058884309008172e-05, 'average': False}
2026-05-21 21:22:09,865 - INFO - ----- Saving Pipeline -----
2026-05-21 21:29:32,201 - INFO - ----- Fine Tuning -----
2026-05-21 21:29:32,202 - INFO - A new study created in memory with name: no-name-137fe0c3-3ab4-4877-aa38-f3f90e53e0e6
2026-05-21 21:34:09,184 - INFO - Trial 8 finished with value: 0.30237093103456136 and parameters: {'truncsvd_n_components': 60, 'algorithm': 'randomized', 'n_iter': 6, 'power_iteration_normalizer': 'auto', 'truncsvd_tol': 0.0012058068973222688, 'gamma': 8.941862577037476e-06, 'n_components': 75, 'loss': 'log_loss', 'penalty': 'l1', 'alpha': 0.0020972100060403323, 'learning_rate': 'optimal', 'eta0': 0.0008336142002544509, 'l1_ratio': 0.65859924778873, 'tol': 0.0070602663817190894, 'average': True}. Best is trial 8 with value: 0.30237093103456136.
2026-05-21 21:34:31,334 - INFO - Trial 10 finished with value: 0.7672815094924533 and parameters: {'truncsvd_n_components': 5, 'algorithm': 'randomized', 'n_iter': 4, 'power_iteration_normalizer': 'OR', 'truncsvd_tol': 1.4831025588859984e-06, 'gamma': 0.0055347742691091014, 'n_components': 74, 'loss': 'log_loss', 'penalty': 'l1', 'alpha': 1.241308324168717e-07, 'learning_rate': 'adaptive', 'eta0': 0.007377525191612243, 'l1_ratio': 0.6963402919312174, 'tol': 0.00031912599716986384, 'average': False}. Best is trial 10 with value: 0.7672815094924533.
2026-05-21 21:35:00,740 - INFO - Trial 6 finished with value: 0.8287854949943881 and parameters: {'truncsvd_n_components': 37, 'algorithm': 'randomized', 'n_iter': 11, 'power_iteration_normalizer': 'auto', 'truncsvd_tol': 3.993773095588584e-05, 'gamma': 0.015853748804255493, 'n_components': 66, 'loss': 'modified_huber', 'penalty': 'l2', 'alpha': 0.00037153771574098896, 'learning_rate': 'optimal', 'eta0': 0.00021388368676827712, 'l1_ratio': 0.5575615137178962, 'tol': 0.004041374571903484, 'average': False}. Best is trial 6 with value: 0.8287854949943881.
2026-05-21 21:35:00,977 - INFO - Trial 0 finished with value: 0.3056570467346746 and parameters: {'truncsvd_n_components': 32, 'algorithm': 'randomized', 'n_iter': 3, 'power_iteration_normalizer': 'OR', 'truncsvd_tol': 6.8836681818385875e-06, 'gamma': 0.0016865351028756503, 'n_components': 69, 'loss': 'log_loss', 'penalty': 'l1', 'alpha': 0.0002091426070057648, 'learning_rate': 'adaptive', 'eta0': 0.0500314753537349, 'l1_ratio': 0.6503239177877258, 'tol': 0.0008664398421869651, 'average': True}. Best is trial 6 with value: 0.8287854949943881.
2026-05-21 21:35:07,220 - INFO - Trial 5 finished with value: 0.7548114429213927 and parameters: {'truncsvd_n_components': 53, 'algorithm': 'randomized', 'n_iter': 7, 'power_iteration_normalizer': 'LU', 'truncsvd_tol': 0.00017655622332490528, 'gamma': 0.026841794491947065, 'n_components': 71, 'loss': 'modified_huber', 'penalty': 'elasticnet', 'alpha': 0.0013363968053378993, 'learning_rate': 'adaptive', 'eta0': 0.00016696826931354516, 'l1_ratio': 0.6612064430638067, 'tol': 0.00010167851131054329, 'average': False}. Best is trial 6 with value: 0.8287854949943881.
2026-05-21 21:35:07,327 - INFO - Trial 7 pruned. 
2026-05-21 21:35:37,627 - INFO - Trial 3 finished with value: 0.8129336411517952 and parameters: {'truncsvd_n_components': 19, 'algorithm': 'randomized', 'n_iter': 5, 'power_iteration_normalizer': 'LU', 'truncsvd_tol': 2.708395419686281e-05, 'gamma': 0.0004026036202554527, 'n_components': 69, 'loss': 'modified_huber', 'penalty': 'l1', 'alpha': 2.793842634696132e-05, 'learning_rate': 'optimal', 'eta0': 0.0006861815333443256, 'l1_ratio': 0.38243925204829177, 'tol': 2.348410747349772e-05, 'average': False}. Best is trial 6 with value: 0.8287854949943881.
2026-05-21 21:35:38,057 - INFO - Trial 1 pruned. 
2026-05-21 21:35:40,882 - INFO - Trial 9 finished with value: 0.8531386706662355 and parameters: {'truncsvd_n_components': 72, 'algorithm': 'randomized', 'n_iter': 13, 'power_iteration_normalizer': 'auto', 'truncsvd_tol': 0.00015101567851000402, 'gamma': 0.0006949576254195914, 'n_components': 68, 'loss': 'log_loss', 'penalty': 'l2', 'alpha': 0.0034466318915170797, 'learning_rate': 'optimal', 'eta0': 0.0194226829836565, 'l1_ratio': 0.07464619179986898, 'tol': 0.0002598262616284889, 'average': True}. Best is trial 9 with value: 0.8531386706662355.
2026-05-21 21:35:45,430 - INFO - Trial 11 finished with value: 0.8224617572952327 and parameters: {'truncsvd_n_components': 73, 'algorithm': 'randomized', 'n_iter': 9, 'power_iteration_normalizer': 'auto', 'truncsvd_tol': 3.299559016172935e-05, 'gamma': 0.00588016092895383, 'n_components': 65, 'loss': 'modified_huber', 'penalty': 'l2', 'alpha': 0.015583773804842115, 'learning_rate': 'adaptive', 'eta0': 0.001042410382319915, 'l1_ratio': 0.28362485730508225, 'tol': 3.526133220412307e-05, 'average': True}. Best is trial 9 with value: 0.8531386706662355.
2026-05-21 21:36:22,261 - INFO - Trial 2 finished with value: 0.8701987511931859 and parameters: {'truncsvd_n_components': 42, 'algorithm': 'randomized', 'n_iter': 11, 'power_iteration_normalizer': 'auto', 'truncsvd_tol': 3.61241453412488e-05, 'gamma': 0.0020394473635889296, 'n_components': 72, 'loss': 'log_loss', 'penalty': 'l2', 'alpha': 7.340448124804561e-05, 'learning_rate': 'adaptive', 'eta0': 0.08554530479620472, 'l1_ratio': 0.8531662374346581, 'tol': 0.0006171298784573258, 'average': True}. Best is trial 2 with value: 0.8701987511931859.
2026-05-21 21:37:25,365 - INFO - Trial 13 pruned. 
2026-05-21 21:37:45,783 - INFO - Trial 4 finished with value: 0.8182003489848819 and parameters: {'truncsvd_n_components': 33, 'algorithm': 'randomized', 'n_iter': 7, 'power_iteration_normalizer': 'auto', 'truncsvd_tol': 0.000292454518245554, 'gamma': 5.292812205498854e-05, 'n_components': 74, 'loss': 'log_loss', 'penalty': 'elasticnet', 'alpha': 1.5205671690577807e-06, 'learning_rate': 'optimal', 'eta0': 0.0016788363626457534, 'l1_ratio': 0.8331126344206288, 'tol': 0.00034571138867929, 'average': False}. Best is trial 2 with value: 0.8701987511931859.
2026-05-21 21:37:50,309 - INFO - Trial 14 pruned. 
2026-05-21 21:38:40,913 - INFO - Trial 17 pruned. 
2026-05-21 21:40:01,786 - INFO - Trial 16 pruned. 
2026-05-21 21:40:41,700 - INFO - Trial 20 pruned. 
2026-05-21 21:41:33,903 - INFO - Trial 15 finished with value: 0.8876502500599521 and parameters: {'truncsvd_n_components': 44, 'algorithm': 'randomized', 'n_iter': 9, 'power_iteration_normalizer': 'LU', 'truncsvd_tol': 1.3030636723041776e-06, 'gamma': 0.00019150417061780805, 'n_components': 64, 'loss': 'modified_huber', 'penalty': 'l2', 'alpha': 0.0001914728715387256, 'learning_rate': 'adaptive', 'eta0': 0.006583531433172238, 'l1_ratio': 0.5686300647450556, 'tol': 0.0018982135074243052, 'average': True}. Best is trial 15 with value: 0.8876502500599521.
2026-05-21 21:42:58,384 - INFO - Trial 19 finished with value: 0.8756709529926429 and parameters: {'truncsvd_n_components': 75, 'algorithm': 'randomized', 'n_iter': 11, 'power_iteration_normalizer': 'LU', 'truncsvd_tol': 0.0024915922272503747, 'gamma': 3.793849572404483e-05, 'n_components': 71, 'loss': 'modified_huber', 'penalty': 'l2', 'alpha': 4.691856160888839e-06, 'learning_rate': 'adaptive', 'eta0': 0.0008806399770768497, 'l1_ratio': 0.474663601380953, 'tol': 0.0001121107562487106, 'average': True}. Best is trial 15 with value: 0.8876502500599521.
2026-05-21 21:44:07,000 - INFO - Trial 21 finished with value: 0.8766843500697519 and parameters: {'truncsvd_n_components': 75, 'algorithm': 'randomized', 'n_iter': 14, 'power_iteration_normalizer': 'auto', 'truncsvd_tol': 0.0004289888666353073, 'gamma': 1.1604847810230788e-05, 'n_components': 67, 'loss': 'log_loss', 'penalty': 'l2', 'alpha': 1.454826226193528e-05, 'learning_rate': 'optimal', 'eta0': 0.09365309124456503, 'l1_ratio': 0.006264896657440927, 'tol': 0.0008185840473853645, 'average': True}. Best is trial 15 with value: 0.8876502500599521.
2026-05-21 21:45:01,980 - INFO - Trial 22 finished with value: 0.876981225363641 and parameters: {'truncsvd_n_components': 73, 'algorithm': 'randomized', 'n_iter': 13, 'power_iteration_normalizer': 'auto', 'truncsvd_tol': 0.0003617403469385516, 'gamma': 2.0649257772821776e-05, 'n_components': 67, 'loss': 'log_loss', 'penalty': 'l2', 'alpha': 1.7297566077708336e-05, 'learning_rate': 'adaptive', 'eta0': 0.06225210854733189, 'l1_ratio': 0.010163197023767168, 'tol': 0.0009616635088058402, 'average': True}. Best is trial 15 with value: 0.8876502500599521.
2026-05-21 21:45:47,563 - INFO - Trial 23 finished with value: 0.8768951948920316 and parameters: {'truncsvd_n_components': 75, 'algorithm': 'randomized', 'n_iter': 13, 'power_iteration_normalizer': 'auto', 'truncsvd_tol': 0.0003019079065011433, 'gamma': 8.563414657521108e-05, 'n_components': 73, 'loss': 'log_loss', 'penalty': 'l2', 'alpha': 1.6375366286734042e-05, 'learning_rate': 'adaptive', 'eta0': 0.012951935902225252, 'l1_ratio': 0.01974951407872793, 'tol': 0.0006632055348615543, 'average': True}. Best is trial 15 with value: 0.8876502500599521.
2026-05-21 21:45:49,695 - INFO - Trial 18 pruned. 
2026-05-21 21:46:37,017 - INFO - Trial 24 finished with value: 0.8726992214166612 and parameters: {'truncsvd_n_components': 75, 'algorithm': 'randomized', 'n_iter': 13, 'power_iteration_normalizer': 'auto', 'truncsvd_tol': 0.0006558521737209194, 'gamma': 0.00016803671269830954, 'n_components': 72, 'loss': 'log_loss', 'penalty': 'l2', 'alpha': 2.484393552925326e-05, 'learning_rate': 'adaptive', 'eta0': 0.016118386215887417, 'l1_ratio': 0.0681214366872094, 'tol': 0.0014532785851036221, 'average': True}. Best is trial 15 with value: 0.8876502500599521.
2026-05-21 21:46:49,483 - INFO - Trial 25 finished with value: 0.856875508066064 and parameters: {'truncsvd_n_components': 75, 'algorithm': 'randomized', 'n_iter': 13, 'power_iteration_normalizer': 'auto', 'truncsvd_tol': 0.0005431754111171657, 'gamma': 0.00020709631328993413, 'n_components': 67, 'loss': 'log_loss', 'penalty': 'l2', 'alpha': 2.047207059387614e-05, 'learning_rate': 'optimal', 'eta0': 0.018864567730435457, 'l1_ratio': 0.9987571978820375, 'tol': 0.0012615359338738166, 'average': True}. Best is trial 15 with value: 0.8876502500599521.
2026-05-21 21:46:51,404 - INFO - Trial 12 pruned. 
2026-05-21 21:47:27,051 - INFO - Trial 27 finished with value: 0.8696860598647105 and parameters: {'truncsvd_n_components': 73, 'algorithm': 'randomized', 'n_iter': 12, 'power_iteration_normalizer': 'auto', 'truncsvd_tol': 0.0004797087280655282, 'gamma': 0.00010268625551755195, 'n_components': 73, 'loss': 'log_loss', 'penalty': 'l2', 'alpha': 0.005871007765184914, 'learning_rate': 'optimal', 'eta0': 0.004593538677781158, 'l1_ratio': 0.06205973946679735, 'tol': 0.0005885504283455186, 'average': True}. Best is trial 15 with value: 0.8876502500599521.
2026-05-21 21:47:31,591 - INFO - Trial 26 finished with value: 0.8701833368144272 and parameters: {'truncsvd_n_components': 75, 'algorithm': 'randomized', 'n_iter': 13, 'power_iteration_normalizer': 'auto', 'truncsvd_tol': 0.0006908439675392032, 'gamma': 0.00020585179646153445, 'n_components': 73, 'loss': 'log_loss', 'penalty': 'l2', 'alpha': 3.378716951547862e-05, 'learning_rate': 'optimal', 'eta0': 0.01646384001494847, 'l1_ratio': 0.004195390842713698, 'tol': 0.0005776036486067495, 'average': True}. Best is trial 15 with value: 0.8876502500599521.
2026-05-21 21:48:17,604 - INFO - Trial 28 finished with value: 0.8807767078551038 and parameters: {'truncsvd_n_components': 59, 'algorithm': 'randomized', 'n_iter': 12, 'power_iteration_normalizer': 'auto', 'truncsvd_tol': 0.0005183442846702138, 'gamma': 0.00013671602990397968, 'n_components': 72, 'loss': 'log_loss', 'penalty': 'l2', 'alpha': 0.011381789861777637, 'learning_rate': 'optimal', 'eta0': 0.005762355877220483, 'l1_ratio': 0.00929501749953851, 'tol': 0.0005647458339919352, 'average': True}. Best is trial 15 with value: 0.8876502500599521.
2026-05-21 21:50:04,782 - INFO - Trial 29 finished with value: 0.8909320958267954 and parameters: {'truncsvd_n_components': 52, 'algorithm': 'randomized', 'n_iter': 12, 'power_iteration_normalizer': 'LU', 'truncsvd_tol': 0.009747336404126533, 'gamma': 1.3233679281504841e-06, 'n_components': 64, 'loss': 'modified_huber', 'penalty': 'l2', 'alpha': 4.81711083329016e-05, 'learning_rate': 'adaptive', 'eta0': 0.005422583119596705, 'l1_ratio': 0.9961216139747648, 'tol': 0.003768635040398251, 'average': True}. Best is trial 29 with value: 0.8909320958267954.
2026-05-21 21:51:45,794 - INFO - Trial 30 finished with value: 0.8792432700008446 and parameters: {'truncsvd_n_components': 61, 'algorithm': 'randomized', 'n_iter': 12, 'power_iteration_normalizer': 'LU', 'truncsvd_tol': 0.009874772937857337, 'gamma': 0.00010445066507539081, 'n_components': 67, 'loss': 'modified_huber', 'penalty': 'l2', 'alpha': 7.1139784574978285e-06, 'learning_rate': 'adaptive', 'eta0': 0.0047419773692188175, 'l1_ratio': 0.48346968678351465, 'tol': 0.0024813879233102467, 'average': True}. Best is trial 29 with value: 0.8909320958267954.
2026-05-21 21:52:36,627 - INFO - Trial 31 finished with value: 0.8923525337673478 and parameters: {'truncsvd_n_components': 60, 'algorithm': 'randomized', 'n_iter': 13, 'power_iteration_normalizer': 'LU', 'truncsvd_tol': 0.000572866305041919, 'gamma': 1.8567350782385432e-06, 'n_components': 64, 'loss': 'log_loss', 'penalty': 'l2', 'alpha': 7.158248375905656e-06, 'learning_rate': 'optimal', 'eta0': 0.005132048952025647, 'l1_ratio': 0.02253891121931112, 'tol': 0.002742814330586443, 'average': True}. Best is trial 31 with value: 0.8923525337673478.
2026-05-21 21:53:32,854 - INFO - Trial 32 finished with value: 0.8907081381370563 and parameters: {'truncsvd_n_components': 63, 'algorithm': 'randomized', 'n_iter': 13, 'power_iteration_normalizer': 'LU', 'truncsvd_tol': 0.0005382969840916198, 'gamma': 1.833546151783501e-06, 'n_components': 64, 'loss': 'log_loss', 'penalty': 'l2', 'alpha': 8.710918832538095e-06, 'learning_rate': 'adaptive', 'eta0': 0.004641620308252799, 'l1_ratio': 0.00871661671092017, 'tol': 0.0021032969842982863, 'average': True}. Best is trial 31 with value: 0.8923525337673478.
2026-05-21 21:54:16,364 - INFO - Trial 34 finished with value: 0.8914583813348725 and parameters: {'truncsvd_n_components': 63, 'algorithm': 'randomized', 'n_iter': 13, 'power_iteration_normalizer': 'LU', 'truncsvd_tol': 0.0006957073790972805, 'gamma': 1.114001677804345e-06, 'n_components': 64, 'loss': 'log_loss', 'penalty': 'l2', 'alpha': 0.00010655098143747503, 'learning_rate': 'adaptive', 'eta0': 0.005248258295866507, 'l1_ratio': 0.20170493297829234, 'tol': 0.0025121645871954857, 'average': True}. Best is trial 31 with value: 0.8923525337673478.
2026-05-21 21:54:17,201 - INFO - Trial 33 finished with value: 0.8842521442314407 and parameters: {'truncsvd_n_components': 65, 'algorithm': 'randomized', 'n_iter': 13, 'power_iteration_normalizer': 'LU', 'truncsvd_tol': 0.0009233915403100393, 'gamma': 1.289352637946285e-06, 'n_components': 65, 'loss': 'log_loss', 'penalty': 'l2', 'alpha': 7.67958056960958e-05, 'learning_rate': 'adaptive', 'eta0': 0.00474163576891987, 'l1_ratio': 0.20576469684272453, 'tol': 0.0019127303286851144, 'average': True}. Best is trial 31 with value: 0.8923525337673478.
2026-05-21 21:55:02,148 - INFO - Trial 37 finished with value: 0.8910669185299985 and parameters: {'truncsvd_n_components': 63, 'algorithm': 'randomized', 'n_iter': 12, 'power_iteration_normalizer': 'LU', 'truncsvd_tol': 0.00830951681137482, 'gamma': 1.4376188702388267e-06, 'n_components': 64, 'loss': 'log_loss', 'penalty': 'l2', 'alpha': 0.00012657626031519287, 'learning_rate': 'adaptive', 'eta0': 0.004756177013014638, 'l1_ratio': 0.2933761214440519, 'tol': 0.0024779774262617387, 'average': True}. Best is trial 31 with value: 0.8923525337673478.
