2026-05-21 21:55:02,237 - INFO - Trial 36 finished with value: 0.8927572770648275 and parameters: {'truncsvd_n_components': 64, 'algorithm': 'randomized', 'n_iter': 12, 'power_iteration_normalizer': 'LU', 'truncsvd_tol': 0.004958006648277391, 'gamma': 1.6973376481199208e-06, 'n_components': 64, 'loss': 'log_loss', 'penalty': 'l2', 'alpha': 0.00010313360812453409, 'learning_rate': 'adaptive', 'eta0': 0.005352435493715508, 'l1_ratio': 0.22589462303848024, 'tol': 0.0034705074527636576, 'average': True}. Best is trial 36 with value: 0.8927572770648275.
2026-05-21 21:55:14,486 - INFO - Trial 35 finished with value: 0.8929089578791647 and parameters: {'truncsvd_n_components': 64, 'algorithm': 'randomized', 'n_iter': 12, 'power_iteration_normalizer': 'LU', 'truncsvd_tol': 0.009162240427992753, 'gamma': 1.805277076127794e-06, 'n_components': 64, 'loss': 'log_loss', 'penalty': 'l2', 'alpha': 6.456650280893594e-06, 'learning_rate': 'adaptive', 'eta0': 0.005497679617395706, 'l1_ratio': 0.19945248823347303, 'tol': 0.0028695436263005236, 'average': True}. Best is trial 35 with value: 0.8929089578791647.
2026-05-21 21:55:57,208 - INFO - Trial 38 finished with value: 0.8924778626893828 and parameters: {'truncsvd_n_components': 64, 'algorithm': 'randomized', 'n_iter': 12, 'power_iteration_normalizer': 'LU', 'truncsvd_tol': 0.005591284332737163, 'gamma': 2.5159626692252215e-06, 'n_components': 64, 'loss': 'log_loss', 'penalty': 'l2', 'alpha': 0.0001329863217444635, 'learning_rate': 'adaptive', 'eta0': 0.004371836919116548, 'l1_ratio': 0.2384388730438826, 'tol': 0.0025308135172316133, 'average': True}. Best is trial 35 with value: 0.8929089578791647.
2026-05-21 21:55:57,255 - INFO - Trial 39 finished with value: 0.8925224589476113 and parameters: {'truncsvd_n_components': 64, 'algorithm': 'randomized', 'n_iter': 10, 'power_iteration_normalizer': 'LU', 'truncsvd_tol': 0.0046837245264221734, 'gamma': 2.9641632857168965e-06, 'n_components': 64, 'loss': 'log_loss', 'penalty': 'l2', 'alpha': 6.414199996425031e-06, 'learning_rate': 'adaptive', 'eta0': 0.004523643219826665, 'l1_ratio': 0.25743845806005283, 'tol': 0.002141623187788557, 'average': True}. Best is trial 35 with value: 0.8929089578791647.
2026-05-21 21:56:32,207 - INFO - Trial 40 finished with value: 0.8929664319435082 and parameters: {'truncsvd_n_components': 64, 'algorithm': 'randomized', 'n_iter': 10, 'power_iteration_normalizer': 'LU', 'truncsvd_tol': 0.006403134581045375, 'gamma': 1.3340539853532999e-06, 'n_components': 64, 'loss': 'log_loss', 'penalty': 'l2', 'alpha': 0.00014922192744177336, 'learning_rate': 'adaptive', 'eta0': 0.0037689389057644737, 'l1_ratio': 0.2112277312065101, 'tol': 0.0027020044839974476, 'average': True}. Best is trial 40 with value: 0.8929664319435082.
2026-05-21 21:57:43,490 - INFO - Trial 41 finished with value: 0.8919552292099139 and parameters: {'truncsvd_n_components': 61, 'algorithm': 'randomized', 'n_iter': 10, 'power_iteration_normalizer': 'LU', 'truncsvd_tol': 0.005995547610210317, 'gamma': 1.0357119229592254e-06, 'n_components': 64, 'loss': 'modified_huber', 'penalty': 'l2', 'alpha': 0.0001414676291121629, 'learning_rate': 'adaptive', 'eta0': 0.0043539446509980725, 'l1_ratio': 0.7352094736328465, 'tol': 0.004693422710046098, 'average': True}. Best is trial 40 with value: 0.8929664319435082.
2026-05-21 21:58:34,074 - INFO - Trial 42 finished with value: 0.8884697922110011 and parameters: {'truncsvd_n_components': 62, 'algorithm': 'randomized', 'n_iter': 10, 'power_iteration_normalizer': 'LU', 'truncsvd_tol': 0.009917232080701537, 'gamma': 1.273948770695917e-06, 'n_components': 64, 'loss': 'modified_huber', 'penalty': 'l2', 'alpha': 0.00020481072854619257, 'learning_rate': 'adaptive', 'eta0': 0.004185520463504205, 'l1_ratio': 0.741642518425788, 'tol': 0.0024607513871900675, 'average': True}. Best is trial 40 with value: 0.8929664319435082.
2026-05-21 21:58:58,910 - INFO - Trial 49 pruned. 
2026-05-21 21:58:58,959 - INFO - Trial 48 pruned. 
2026-05-21 21:59:03,912 - INFO - Trial 47 pruned. 
2026-05-21 21:59:06,536 - INFO - Trial 43 finished with value: 0.8902747056760258 and parameters: {'truncsvd_n_components': 52, 'algorithm': 'randomized', 'n_iter': 10, 'power_iteration_normalizer': 'LU', 'truncsvd_tol': 0.004875673167217113, 'gamma': 1.783510897105611e-06, 'n_components': 64, 'loss': 'modified_huber', 'penalty': 'l2', 'alpha': 0.00030035730776532875, 'learning_rate': 'adaptive', 'eta0': 0.007140542441775838, 'l1_ratio': 0.1772301593189073, 'tol': 0.009988229603697222, 'average': True}. Best is trial 40 with value: 0.8929664319435082.
2026-05-21 21:59:10,492 - INFO - Trial 44 finished with value: 0.8910822773791889 and parameters: {'truncsvd_n_components': 51, 'algorithm': 'randomized', 'n_iter': 10, 'power_iteration_normalizer': 'LU', 'truncsvd_tol': 0.009332740857296802, 'gamma': 1.1421844143225896e-06, 'n_components': 64, 'loss': 'modified_huber', 'penalty': 'l2', 'alpha': 0.0001248070307303541, 'learning_rate': 'adaptive', 'eta0': 0.003034795526956837, 'l1_ratio': 0.18498993668486596, 'tol': 0.003300830047393211, 'average': True}. Best is trial 40 with value: 0.8929664319435082.
2026-05-21 21:59:29,030 - INFO - Trial 46 finished with value: 0.8907085390611951 and parameters: {'truncsvd_n_components': 50, 'algorithm': 'randomized', 'n_iter': 15, 'power_iteration_normalizer': 'LU', 'truncsvd_tol': 0.005329810773146848, 'gamma': 1.1613897589017258e-06, 'n_components': 64, 'loss': 'log_loss', 'penalty': 'l2', 'alpha': 0.00014186614453954273, 'learning_rate': 'adaptive', 'eta0': 0.002572745935142404, 'l1_ratio': 0.3352757136305989, 'tol': 0.0036932032106677896, 'average': True}. Best is trial 40 with value: 0.8929664319435082.
2026-05-21 21:59:29,123 - INFO - Trial 45 finished with value: 0.8913343951306893 and parameters: {'truncsvd_n_components': 51, 'algorithm': 'randomized', 'n_iter': 15, 'power_iteration_normalizer': 'LU', 'truncsvd_tol': 0.004333961908252299, 'gamma': 1.0611848245241757e-06, 'n_components': 64, 'loss': 'log_loss', 'penalty': 'l2', 'alpha': 0.00015514822320201075, 'learning_rate': 'adaptive', 'eta0': 0.0018737205358131024, 'l1_ratio': 0.33888428661169695, 'tol': 0.003483869009145692, 'average': True}. Best is trial 40 with value: 0.8929664319435082.
2026-05-21 21:59:29,125 - INFO - Best AUC: 0.8929664319435082 | Best params: {'truncsvd_n_components': 64, 'algorithm': 'randomized', 'n_iter': 10, 'power_iteration_normalizer': 'LU', 'truncsvd_tol': 0.006403134581045375, 'gamma': 1.3340539853532999e-06, 'n_components': 64, 'loss': 'log_loss', 'penalty': 'l2', 'alpha': 0.00014922192744177336, 'learning_rate': 'adaptive', 'eta0': 0.0037689389057644737, 'l1_ratio': 0.2112277312065101, 'tol': 0.0027020044839974476, 'average': True}
2026-05-21 21:59:29,125 - INFO - ----- Saving Pipeline -----
2026-05-22 11:01:27,768 - INFO - ----- Fine Tuning -----
2026-05-22 11:01:27,771 - INFO - A new study created in memory with name: no-name-7c36d963-0ce8-48d2-8403-66d949e1440e
2026-05-22 11:04:07,801 - INFO - Trial 1 finished with value: 0.7712477081544747 and parameters: {'truncsvd_n_components': 9, 'algorithm': 'randomized', 'n_iter': 12, 'power_iteration_normalizer': 'OR', 'truncsvd_tol': 7.875702632819845e-06, 'gamma': 0.016286651533521372, 'n_components': 64, 'loss': 'log_loss', 'penalty': 'l2', 'alpha': 0.004598793386815004, 'learning_rate': 'optimal', 'eta0': 0.005677070778881229, 'l1_ratio': 0.6394396297161197, 'tol': 0.00022911777407714817, 'average': False}. Best is trial 1 with value: 0.7712477081544747.
2026-05-22 11:04:45,887 - INFO - Trial 0 finished with value: 0.8031665450163278 and parameters: {'truncsvd_n_components': 24, 'algorithm': 'randomized', 'n_iter': 3, 'power_iteration_normalizer': 'auto', 'truncsvd_tol': 4.969388022359857e-06, 'gamma': 0.04191993990936004, 'n_components': 67, 'loss': 'log_loss', 'penalty': 'l1', 'alpha': 2.385682196217634e-06, 'learning_rate': 'adaptive', 'eta0': 0.00011610246379148024, 'l1_ratio': 0.007749524709881772, 'tol': 0.00013092208265194942, 'average': True}. Best is trial 0 with value: 0.8031665450163278.
2026-05-22 11:05:13,747 - INFO - Trial 5 finished with value: 0.8422341219090128 and parameters: {'truncsvd_n_components': 20, 'algorithm': 'randomized', 'n_iter': 9, 'power_iteration_normalizer': 'LU', 'truncsvd_tol': 0.00533633681571169, 'gamma': 0.012810365481896038, 'n_components': 74, 'loss': 'log_loss', 'penalty': 'l2', 'alpha': 0.009253529999921836, 'learning_rate': 'adaptive', 'eta0': 0.009468589062406876, 'l1_ratio': 0.8809223470221904, 'tol': 0.00263186957687946, 'average': False}. Best is trial 5 with value: 0.8422341219090128.
2026-05-22 11:05:29,629 - INFO - Trial 8 finished with value: 0.8890319787232975 and parameters: {'truncsvd_n_components': 55, 'algorithm': 'randomized', 'n_iter': 12, 'power_iteration_normalizer': 'OR', 'truncsvd_tol': 3.374937209155759e-05, 'gamma': 2.6660612197724232e-05, 'n_components': 74, 'loss': 'modified_huber', 'penalty': 'l2', 'alpha': 0.0031388821118570882, 'learning_rate': 'adaptive', 'eta0': 0.00027483342055304285, 'l1_ratio': 0.619141421324498, 'tol': 0.00038981620352913107, 'average': False}. Best is trial 8 with value: 0.8890319787232975.
2026-05-22 11:05:40,287 - INFO - Trial 4 finished with value: 0.8414834367399309 and parameters: {'truncsvd_n_components': 32, 'algorithm': 'randomized', 'n_iter': 11, 'power_iteration_normalizer': 'LU', 'truncsvd_tol': 1.1268426645862388e-05, 'gamma': 4.071132137252364e-05, 'n_components': 64, 'loss': 'log_loss', 'penalty': 'l1', 'alpha': 0.00027324448679825515, 'learning_rate': 'adaptive', 'eta0': 0.00011136785500302132, 'l1_ratio': 0.6840029055744041, 'tol': 0.006753597891344652, 'average': True}. Best is trial 8 with value: 0.8890319787232975.
2026-05-22 11:05:47,517 - INFO - Trial 11 pruned. 
2026-05-22 11:06:05,714 - INFO - Trial 2 pruned. 
2026-05-22 11:06:07,486 - INFO - Trial 3 pruned. 
2026-05-22 11:06:09,136 - INFO - Trial 13 pruned. 
2026-05-22 11:06:49,949 - INFO - Trial 7 pruned. 
2026-05-22 11:07:11,260 - INFO - Trial 9 pruned. 
2026-05-22 11:07:26,019 - INFO - Trial 14 pruned. 
2026-05-22 11:08:20,301 - INFO - Trial 6 pruned. 
2026-05-22 11:08:33,673 - INFO - Trial 12 finished with value: 0.8556910189296442 and parameters: {'truncsvd_n_components': 36, 'algorithm': 'randomized', 'n_iter': 10, 'power_iteration_normalizer': 'OR', 'truncsvd_tol': 4.559560134269882e-06, 'gamma': 0.0042079235482184755, 'n_components': 64, 'loss': 'modified_huber', 'penalty': 'l2', 'alpha': 0.0006766504284741461, 'learning_rate': 'adaptive', 'eta0': 0.00020630592297973563, 'l1_ratio': 0.012445730063141758, 'tol': 7.293989069861846e-05, 'average': False}. Best is trial 8 with value: 0.8890319787232975.
2026-05-22 11:08:48,463 - INFO - Trial 15 pruned. 
2026-05-22 11:09:41,650 - INFO - Trial 16 pruned. 
2026-05-22 11:10:17,359 - INFO - Trial 20 pruned. 
2026-05-22 11:10:54,143 - INFO - Trial 18 pruned. 
2026-05-22 11:11:04,404 - INFO - Trial 10 pruned. 
2026-05-22 11:12:19,389 - INFO - Trial 19 finished with value: 0.8772822034709439 and parameters: {'truncsvd_n_components': 39, 'algorithm': 'randomized', 'n_iter': 4, 'power_iteration_normalizer': 'OR', 'truncsvd_tol': 6.171599527707232e-05, 'gamma': 6.57423656715273e-06, 'n_components': 73, 'loss': 'modified_huber', 'penalty': 'elasticnet', 'alpha': 0.00047023604470947133, 'learning_rate': 'adaptive', 'eta0': 0.00092979488991596, 'l1_ratio': 0.33029726195344733, 'tol': 1.4212787768843754e-05, 'average': False}. Best is trial 8 with value: 0.8890319787232975.
2026-05-22 11:12:56,272 - INFO - Trial 17 finished with value: 0.8819181780714398 and parameters: {'truncsvd_n_components': 40, 'algorithm': 'randomized', 'n_iter': 15, 'power_iteration_normalizer': 'LU', 'truncsvd_tol': 0.00013236888291751395, 'gamma': 0.0005219806450293158, 'n_components': 73, 'loss': 'log_loss', 'penalty': 'l2', 'alpha': 1.4657639139268367e-06, 'learning_rate': 'adaptive', 'eta0': 0.07282675682717199, 'l1_ratio': 0.24379686547800095, 'tol': 0.0004856337221512814, 'average': True}. Best is trial 8 with value: 0.8890319787232975.
2026-05-22 11:14:34,609 - INFO - Trial 21 finished with value: 0.8852715631878425 and parameters: {'truncsvd_n_components': 69, 'algorithm': 'randomized', 'n_iter': 15, 'power_iteration_normalizer': 'auto', 'truncsvd_tol': 1.5054124501785614e-06, 'gamma': 4.4923251964837885e-06, 'n_components': 72, 'loss': 'modified_huber', 'penalty': 'l2', 'alpha': 3.775827727200234e-05, 'learning_rate': 'adaptive', 'eta0': 0.0006565211630472305, 'l1_ratio': 0.36189411058106463, 'tol': 4.555594996208476e-05, 'average': True}. Best is trial 8 with value: 0.8890319787232975.
2026-05-22 11:15:45,448 - INFO - Trial 22 finished with value: 0.8856722693472282 and parameters: {'truncsvd_n_components': 70, 'algorithm': 'randomized', 'n_iter': 15, 'power_iteration_normalizer': 'auto', 'truncsvd_tol': 0.0008716742443290536, 'gamma': 2.0975931417970123e-06, 'n_components': 75, 'loss': 'modified_huber', 'penalty': 'l2', 'alpha': 0.06629373605780942, 'learning_rate': 'adaptive', 'eta0': 0.004177622821740246, 'l1_ratio': 0.9634443341268744, 'tol': 0.001066880018118425, 'average': False}. Best is trial 8 with value: 0.8890319787232975.
2026-05-22 11:15:54,127 - INFO - Trial 23 finished with value: 0.8802940805048541 and parameters: {'truncsvd_n_components': 75, 'algorithm': 'randomized', 'n_iter': 15, 'power_iteration_normalizer': 'auto', 'truncsvd_tol': 0.001239919276920879, 'gamma': 1.516546322385748e-06, 'n_components': 72, 'loss': 'modified_huber', 'penalty': 'l2', 'alpha': 0.07850477459771517, 'learning_rate': 'adaptive', 'eta0': 0.0964570522392614, 'l1_ratio': 0.9646201687123047, 'tol': 0.0007693277370874715, 'average': False}. Best is trial 8 with value: 0.8890319787232975.
2026-05-22 11:16:06,299 - INFO - Trial 24 finished with value: 0.8880375850864141 and parameters: {'truncsvd_n_components': 49, 'algorithm': 'randomized', 'n_iter': 14, 'power_iteration_normalizer': 'auto', 'truncsvd_tol': 1.008862604978625e-06, 'gamma': 1.0035477887692706e-06, 'n_components': 72, 'loss': 'modified_huber', 'penalty': 'l2', 'alpha': 0.08285956022550728, 'learning_rate': 'adaptive', 'eta0': 0.09050822842621432, 'l1_ratio': 0.9444133704947629, 'tol': 0.0005374982610890085, 'average': False}. Best is trial 8 with value: 0.8890319787232975.
2026-05-22 11:16:06,308 - INFO - Trial 26 finished with value: 0.8886903971502814 and parameters: {'truncsvd_n_components': 51, 'algorithm': 'randomized', 'n_iter': 15, 'power_iteration_normalizer': 'auto', 'truncsvd_tol': 1.7959558957426309e-06, 'gamma': 1.617126255275963e-06, 'n_components': 68, 'loss': 'modified_huber', 'penalty': 'l2', 'alpha': 0.04272701638369296, 'learning_rate': 'adaptive', 'eta0': 0.0004375127768716496, 'l1_ratio': 0.39945504536939663, 'tol': 6.1260387972446e-05, 'average': False}. Best is trial 8 with value: 0.8890319787232975.
2026-05-22 11:16:06,318 - INFO - Trial 25 finished with value: 0.8866951328189498 and parameters: {'truncsvd_n_components': 50, 'algorithm': 'randomized', 'n_iter': 15, 'power_iteration_normalizer': 'auto', 'truncsvd_tol': 1.225141964106565e-06, 'gamma': 1.2154598580416324e-06, 'n_components': 68, 'loss': 'modified_huber', 'penalty': 'l2', 'alpha': 0.07766801138558858, 'learning_rate': 'adaptive', 'eta0': 0.0004069515419210646, 'l1_ratio': 0.4285668272602775, 'tol': 4.3248399359156296e-05, 'average': False}. Best is trial 8 with value: 0.8890319787232975.
2026-05-22 11:16:42,000 - INFO - Trial 30 finished with value: 0.8821766915882698 and parameters: {'truncsvd_n_components': 61, 'algorithm': 'randomized', 'n_iter': 5, 'power_iteration_normalizer': 'OR', 'truncsvd_tol': 1.0693679591651407e-06, 'gamma': 2.1568029800082273e-06, 'n_components': 68, 'loss': 'modified_huber', 'penalty': 'l2', 'alpha': 0.08339619112972459, 'learning_rate': 'adaptive', 'eta0': 0.0003561587642129764, 'l1_ratio': 0.43257537791753164, 'tol': 5.858164229009668e-05, 'average': False}. Best is trial 8 with value: 0.8890319787232975.
2026-05-22 11:16:52,318 - INFO - Trial 28 finished with value: 0.8853634839922913 and parameters: {'truncsvd_n_components': 50, 'algorithm': 'randomized', 'n_iter': 14, 'power_iteration_normalizer': 'OR', 'truncsvd_tol': 1.5416254208719904e-06, 'gamma': 1.335792530205219e-06, 'n_components': 67, 'loss': 'modified_huber', 'penalty': 'l2', 'alpha': 0.03859792493165963, 'learning_rate': 'adaptive', 'eta0': 0.00035843495453399094, 'l1_ratio': 0.3909939046981229, 'tol': 6.52856868561623e-05, 'average': False}. Best is trial 8 with value: 0.8890319787232975.
2026-05-22 11:16:57,928 - INFO - Trial 27 finished with value: 0.8901525483451078 and parameters: {'truncsvd_n_components': 50, 'algorithm': 'randomized', 'n_iter': 15, 'power_iteration_normalizer': 'OR', 'truncsvd_tol': 2.9716299817802466e-05, 'gamma': 1.5661307054531114e-06, 'n_components': 68, 'loss': 'modified_huber', 'penalty': 'l2', 'alpha': 0.0009627951733300424, 'learning_rate': 'adaptive', 'eta0': 0.0003420439593203486, 'l1_ratio': 0.40569908415715306, 'tol': 5.915434958791373e-05, 'average': False}. Best is trial 27 with value: 0.8901525483451078.
2026-05-22 11:17:06,085 - INFO - Trial 29 pruned. 
2026-05-22 11:17:36,918 - INFO - Trial 31 finished with value: 0.889275242543263 and parameters: {'truncsvd_n_components': 59, 'algorithm': 'randomized', 'n_iter': 3, 'power_iteration_normalizer': 'OR', 'truncsvd_tol': 3.2024246448080026e-05, 'gamma': 1.3753380754901002e-06, 'n_components': 73, 'loss': 'modified_huber', 'penalty': 'l2', 'alpha': 0.03828733520632105, 'learning_rate': 'adaptive', 'eta0': 0.0004007154958630181, 'l1_ratio': 0.39679870872079526, 'tol': 0.0004890357404056159, 'average': False}. Best is trial 27 with value: 0.8901525483451078.
2026-05-22 11:19:52,857 - INFO - Trial 32 finished with value: 0.8907493070955705 and parameters: {'truncsvd_n_components': 58, 'algorithm': 'randomized', 'n_iter': 15, 'power_iteration_normalizer': 'OR', 'truncsvd_tol': 3.617554736394724e-05, 'gamma': 2.163987754257961e-06, 'n_components': 72, 'loss': 'modified_huber', 'penalty': 'l2', 'alpha': 2.504598957798226e-05, 'learning_rate': 'adaptive', 'eta0': 0.000430946461824078, 'l1_ratio': 0.38563829322260446, 'tol': 0.0006896735980595704, 'average': True}. Best is trial 32 with value: 0.8907493070955705.
2026-05-22 11:21:07,413 - INFO - Trial 38 pruned. 
2026-05-22 11:23:08,009 - INFO - Trial 33 finished with value: 0.886064062834307 and parameters: {'truncsvd_n_components': 63, 'algorithm': 'randomized', 'n_iter': 15, 'power_iteration_normalizer': 'auto', 'truncsvd_tol': 1.0267684732778073e-06, 'gamma': 1.6857946237487925e-06, 'n_components': 73, 'loss': 'modified_huber', 'penalty': 'l2', 'alpha': 0.08121610872175314, 'learning_rate': 'adaptive', 'eta0': 0.00042925531113181847, 'l1_ratio': 0.43112470608845777, 'tol': 0.0006313862923565547, 'average': True}. Best is trial 32 with value: 0.8907493070955705.
2026-05-22 11:23:31,908 - INFO - Trial 43 finished with value: 0.8918755771846332 and parameters: {'truncsvd_n_components': 57, 'algorithm': 'randomized', 'n_iter': 3, 'power_iteration_normalizer': 'OR', 'truncsvd_tol': 2.322730876418852e-05, 'gamma': 1.1495765600535147e-05, 'n_components': 67, 'loss': 'modified_huber', 'penalty': 'l2', 'alpha': 0.0038158651470405376, 'learning_rate': 'adaptive', 'eta0': 0.0018662686716607885, 'l1_ratio': 0.5254223921862408, 'tol': 0.00010873997091787171, 'average': False}. Best is trial 43 with value: 0.8918755771846332.
2026-05-22 11:23:48,801 - INFO - Trial 41 finished with value: 0.8840253725561105 and parameters: {'truncsvd_n_components': 59, 'algorithm': 'randomized', 'n_iter': 13, 'power_iteration_normalizer': 'OR', 'truncsvd_tol': 2.1573897854592823e-05, 'gamma': 1.119479331844405e-05, 'n_components': 67, 'loss': 'modified_huber', 'penalty': 'l2', 'alpha': 0.0015979382862838442, 'learning_rate': 'adaptive', 'eta0': 0.00023241623828101755, 'l1_ratio': 0.47851919681029, 'tol': 0.00010803964472662602, 'average': False}. Best is trial 43 with value: 0.8918755771846332.
2026-05-22 11:23:54,998 - INFO - Trial 34 finished with value: 0.8855677781881951 and parameters: {'truncsvd_n_components': 62, 'algorithm': 'randomized', 'n_iter': 15, 'power_iteration_normalizer': 'auto', 'truncsvd_tol': 0.001129516990574927, 'gamma': 1.0375916691283886e-06, 'n_components': 75, 'loss': 'modified_huber', 'penalty': 'l2', 'alpha': 0.09648690581374512, 'learning_rate': 'adaptive', 'eta0': 0.0003411803780207277, 'l1_ratio': 0.4173793429016315, 'tol': 0.0006737447746350181, 'average': True}. Best is trial 43 with value: 0.8918755771846332.
2026-05-22 11:24:12,874 - INFO - Trial 36 finished with value: 0.8853447366381012 and parameters: {'truncsvd_n_components': 61, 'algorithm': 'randomized', 'n_iter': 13, 'power_iteration_normalizer': 'auto', 'truncsvd_tol': 2.1442076310063543e-05, 'gamma': 1.180381633858689e-05, 'n_components': 68, 'loss': 'modified_huber', 'penalty': 'l2', 'alpha': 0.014929847512953403, 'learning_rate': 'adaptive', 'eta0': 0.0020044846413269047, 'l1_ratio': 0.4704331625918902, 'tol': 9.805173771923433e-05, 'average': False}. Best is trial 43 with value: 0.8918755771846332.
2026-05-22 11:24:14,783 - INFO - Trial 35 finished with value: 0.8860963991379661 and parameters: {'truncsvd_n_components': 63, 'algorithm': 'randomized', 'n_iter': 14, 'power_iteration_normalizer': 'auto', 'truncsvd_tol': 1.1975762788449091e-06, 'gamma': 1.079274869140346e-06, 'n_components': 75, 'loss': 'modified_huber', 'penalty': 'l2', 'alpha': 0.07246395930697831, 'learning_rate': 'adaptive', 'eta0': 0.00042453718132595567, 'l1_ratio': 0.41315722336070426, 'tol': 4.5187878875067395e-05, 'average': True}. Best is trial 43 with value: 0.8918755771846332.
