2026-05-21 21:22:11,125 - INFO - ----- Fine Tuning -----
2026-05-21 21:22:11,126 - INFO - A new study created in memory with name: no-name-f76c4c64-1457-4ea2-b3ac-71bdd9e36d22
2026-05-21 21:22:11,919 - WARNING - Trial 5 failed with parameters: {'trunsvd_n_components': 5, 'algorithm': 'randomized', 'n_iter': 10, 'power_iteration_normalizer': 'OR', 'tol': 1.3529913417811162e-06, 'kernel': 'sigmoid', 'gamma': 0.004020993311830097, 'n_components': 64, 'loss': 'modified_huber', 'penalty': 'elasticnet', 'alpha': 2.5529576479570225e-05, 'learning_rate': 'optimal'} because of the following error: NameError("name 'best_params' is not defined").
Traceback (most recent call last):
  File "/home/junior/Documentos/GitHub/prediction-f1-pit-stops-kaggle-competition/.venv/lib/python3.13/site-packages/optuna/study/_optimize.py", line 206, in _run_trial
    value_or_values = func(trial)
  File "/home/junior/Documentos/GitHub/prediction-f1-pit-stops-kaggle-competition/src/truncatedsvd_nystroem_sgdclassifier.py", line 135, in <lambda>
    study.optimize(lambda trial: objective(trial, X_train, y_train), n_trials=50, n_jobs=-1, show_progress_bar=True)
                                 ~~~~~~~~~^^^^^^^^^^^^^^^^^^^^^^^^^
  File "/home/junior/Documentos/GitHub/prediction-f1-pit-stops-kaggle-competition/src/truncatedsvd_nystroem_sgdclassifier.py", line 111, in objective
    eta0=best_params["eta0"],
         ^^^^^^^^^^^
NameError: name 'best_params' is not defined
2026-05-21 21:22:11,944 - WARNING - Trial 5 failed with value None.
2026-05-21 21:22:11,955 - WARNING - Trial 1 failed with parameters: {'trunsvd_n_components': 59, 'algorithm': 'randomized', 'n_iter': 11, 'power_iteration_normalizer': 'auto', 'tol': 0.0007237041176025009, 'kernel': 'sigmoid', 'gamma': 1.6379971634708517, 'n_components': 72, 'loss': 'log_loss', 'penalty': 'l1', 'alpha': 0.0037504487915163928, 'learning_rate': 'optimal'} because of the following error: NameError("name 'best_params' is not defined").
Traceback (most recent call last):
  File "/home/junior/Documentos/GitHub/prediction-f1-pit-stops-kaggle-competition/.venv/lib/python3.13/site-packages/optuna/study/_optimize.py", line 206, in _run_trial
    value_or_values = func(trial)
  File "/home/junior/Documentos/GitHub/prediction-f1-pit-stops-kaggle-competition/src/truncatedsvd_nystroem_sgdclassifier.py", line 135, in <lambda>
    study.optimize(lambda trial: objective(trial, X_train, y_train), n_trials=50, n_jobs=-1, show_progress_bar=True)
                                 ~~~~~~~~~^^^^^^^^^^^^^^^^^^^^^^^^^
  File "/home/junior/Documentos/GitHub/prediction-f1-pit-stops-kaggle-competition/src/truncatedsvd_nystroem_sgdclassifier.py", line 111, in objective
    eta0=best_params["eta0"],
         ^^^^^^^^^^^
NameError: name 'best_params' is not defined
2026-05-21 21:22:11,960 - WARNING - Trial 1 failed with value None.
2026-05-21 21:22:11,963 - WARNING - Trial 3 failed with parameters: {'trunsvd_n_components': 3, 'algorithm': 'randomized', 'n_iter': 6, 'power_iteration_normalizer': 'LU', 'tol': 0.00390003161112347, 'kernel': 'rbf', 'gamma': 1.4492874502546738, 'n_components': 74, 'loss': 'log_loss', 'penalty': 'elasticnet', 'alpha': 4.6490605912133735e-06, 'learning_rate': 'optimal'} because of the following error: NameError("name 'best_params' is not defined").
Traceback (most recent call last):
  File "/home/junior/Documentos/GitHub/prediction-f1-pit-stops-kaggle-competition/.venv/lib/python3.13/site-packages/optuna/study/_optimize.py", line 206, in _run_trial
    value_or_values = func(trial)
  File "/home/junior/Documentos/GitHub/prediction-f1-pit-stops-kaggle-competition/src/truncatedsvd_nystroem_sgdclassifier.py", line 135, in <lambda>
    study.optimize(lambda trial: objective(trial, X_train, y_train), n_trials=50, n_jobs=-1, show_progress_bar=True)
                                 ~~~~~~~~~^^^^^^^^^^^^^^^^^^^^^^^^^
  File "/home/junior/Documentos/GitHub/prediction-f1-pit-stops-kaggle-competition/src/truncatedsvd_nystroem_sgdclassifier.py", line 111, in objective
    eta0=best_params["eta0"],
         ^^^^^^^^^^^
NameError: name 'best_params' is not defined
2026-05-21 21:22:11,963 - WARNING - Trial 10 failed with parameters: {'trunsvd_n_components': 58, 'algorithm': 'randomized', 'n_iter': 4, 'power_iteration_normalizer': 'LU', 'tol': 0.00024434282141079137, 'kernel': 'sigmoid', 'gamma': 4.377125649987269e-05, 'n_components': 65, 'loss': 'log_loss', 'penalty': 'elasticnet', 'alpha': 0.04741325828128534, 'learning_rate': 'optimal'} because of the following error: NameError("name 'best_params' is not defined").
Traceback (most recent call last):
  File "/home/junior/Documentos/GitHub/prediction-f1-pit-stops-kaggle-competition/.venv/lib/python3.13/site-packages/optuna/study/_optimize.py", line 206, in _run_trial
    value_or_values = func(trial)
  File "/home/junior/Documentos/GitHub/prediction-f1-pit-stops-kaggle-competition/src/truncatedsvd_nystroem_sgdclassifier.py", line 135, in <lambda>
    study.optimize(lambda trial: objective(trial, X_train, y_train), n_trials=50, n_jobs=-1, show_progress_bar=True)
                                 ~~~~~~~~~^^^^^^^^^^^^^^^^^^^^^^^^^
  File "/home/junior/Documentos/GitHub/prediction-f1-pit-stops-kaggle-competition/src/truncatedsvd_nystroem_sgdclassifier.py", line 111, in objective
    eta0=best_params["eta0"],
         ^^^^^^^^^^^
NameError: name 'best_params' is not defined
2026-05-21 21:22:11,965 - WARNING - Trial 4 failed with parameters: {'trunsvd_n_components': 68, 'algorithm': 'randomized', 'n_iter': 14, 'power_iteration_normalizer': 'LU', 'tol': 0.00011778267917716883, 'kernel': 'cosine', 'gamma': 8.803453054990114e-05, 'n_components': 67, 'loss': 'log_loss', 'penalty': 'l2', 'alpha': 1.1811811013345314e-06, 'learning_rate': 'adaptive'} because of the following error: NameError("name 'best_params' is not defined").
Traceback (most recent call last):
  File "/home/junior/Documentos/GitHub/prediction-f1-pit-stops-kaggle-competition/.venv/lib/python3.13/site-packages/optuna/study/_optimize.py", line 206, in _run_trial
    value_or_values = func(trial)
  File "/home/junior/Documentos/GitHub/prediction-f1-pit-stops-kaggle-competition/src/truncatedsvd_nystroem_sgdclassifier.py", line 135, in <lambda>
    study.optimize(lambda trial: objective(trial, X_train, y_train), n_trials=50, n_jobs=-1, show_progress_bar=True)
                                 ~~~~~~~~~^^^^^^^^^^^^^^^^^^^^^^^^^
  File "/home/junior/Documentos/GitHub/prediction-f1-pit-stops-kaggle-competition/src/truncatedsvd_nystroem_sgdclassifier.py", line 111, in objective
    eta0=best_params["eta0"],
         ^^^^^^^^^^^
NameError: name 'best_params' is not defined
2026-05-21 21:22:11,969 - WARNING - Trial 3 failed with value None.
2026-05-21 21:22:11,970 - WARNING - Trial 10 failed with value None.
2026-05-21 21:22:11,972 - WARNING - Trial 2 failed with parameters: {'trunsvd_n_components': 73, 'algorithm': 'randomized', 'n_iter': 3, 'power_iteration_normalizer': 'auto', 'tol': 8.495725412349402e-05, 'kernel': 'cosine', 'gamma': 0.00577082289929084, 'n_components': 69, 'loss': 'log_loss', 'penalty': 'l1', 'alpha': 5.395477942703739e-05, 'learning_rate': 'optimal'} because of the following error: NameError("name 'best_params' is not defined").
Traceback (most recent call last):
  File "/home/junior/Documentos/GitHub/prediction-f1-pit-stops-kaggle-competition/.venv/lib/python3.13/site-packages/optuna/study/_optimize.py", line 206, in _run_trial
    value_or_values = func(trial)
  File "/home/junior/Documentos/GitHub/prediction-f1-pit-stops-kaggle-competition/src/truncatedsvd_nystroem_sgdclassifier.py", line 135, in <lambda>
    study.optimize(lambda trial: objective(trial, X_train, y_train), n_trials=50, n_jobs=-1, show_progress_bar=True)
                                 ~~~~~~~~~^^^^^^^^^^^^^^^^^^^^^^^^^
  File "/home/junior/Documentos/GitHub/prediction-f1-pit-stops-kaggle-competition/src/truncatedsvd_nystroem_sgdclassifier.py", line 111, in objective
    eta0=best_params["eta0"],
         ^^^^^^^^^^^
NameError: name 'best_params' is not defined
2026-05-21 21:22:11,972 - WARNING - Trial 4 failed with value None.
2026-05-21 21:22:11,974 - WARNING - Trial 0 failed with parameters: {'trunsvd_n_components': 62, 'algorithm': 'randomized', 'n_iter': 6, 'power_iteration_normalizer': 'LU', 'tol': 0.00018578580006877279, 'kernel': 'sigmoid', 'gamma': 5.709831929975151, 'n_components': 73, 'loss': 'log_loss', 'penalty': 'l2', 'alpha': 5.331589413662096e-07, 'learning_rate': 'optimal'} because of the following error: NameError("name 'best_params' is not defined").
Traceback (most recent call last):
  File "/home/junior/Documentos/GitHub/prediction-f1-pit-stops-kaggle-competition/.venv/lib/python3.13/site-packages/optuna/study/_optimize.py", line 206, in _run_trial
    value_or_values = func(trial)
  File "/home/junior/Documentos/GitHub/prediction-f1-pit-stops-kaggle-competition/src/truncatedsvd_nystroem_sgdclassifier.py", line 135, in <lambda>
    study.optimize(lambda trial: objective(trial, X_train, y_train), n_trials=50, n_jobs=-1, show_progress_bar=True)
                                 ~~~~~~~~~^^^^^^^^^^^^^^^^^^^^^^^^^
  File "/home/junior/Documentos/GitHub/prediction-f1-pit-stops-kaggle-competition/src/truncatedsvd_nystroem_sgdclassifier.py", line 111, in objective
    eta0=best_params["eta0"],
         ^^^^^^^^^^^
NameError: name 'best_params' is not defined
2026-05-21 21:22:11,977 - WARNING - Trial 9 failed with parameters: {'trunsvd_n_components': 18, 'algorithm': 'randomized', 'n_iter': 6, 'power_iteration_normalizer': 'LU', 'tol': 0.0026265588501856326, 'kernel': 'sigmoid', 'gamma': 0.023891941743221005, 'n_components': 65, 'loss': 'log_loss', 'penalty': 'l2', 'alpha': 3.8074201374984296e-07, 'learning_rate': 'optimal'} because of the following error: NameError("name 'best_params' is not defined").
Traceback (most recent call last):
  File "/home/junior/Documentos/GitHub/prediction-f1-pit-stops-kaggle-competition/.venv/lib/python3.13/site-packages/optuna/study/_optimize.py", line 206, in _run_trial
    value_or_values = func(trial)
  File "/home/junior/Documentos/GitHub/prediction-f1-pit-stops-kaggle-competition/src/truncatedsvd_nystroem_sgdclassifier.py", line 135, in <lambda>
    study.optimize(lambda trial: objective(trial, X_train, y_train), n_trials=50, n_jobs=-1, show_progress_bar=True)
                                 ~~~~~~~~~^^^^^^^^^^^^^^^^^^^^^^^^^
  File "/home/junior/Documentos/GitHub/prediction-f1-pit-stops-kaggle-competition/src/truncatedsvd_nystroem_sgdclassifier.py", line 111, in objective
    eta0=best_params["eta0"],
         ^^^^^^^^^^^
NameError: name 'best_params' is not defined
2026-05-21 21:22:11,979 - WARNING - Trial 6 failed with parameters: {'trunsvd_n_components': 38, 'algorithm': 'randomized', 'n_iter': 3, 'power_iteration_normalizer': 'LU', 'tol': 0.006296950677937416, 'kernel': 'sigmoid', 'gamma': 0.0007871986183621081, 'n_components': 72, 'loss': 'log_loss', 'penalty': 'l1', 'alpha': 0.006690139571211216, 'learning_rate': 'optimal'} because of the following error: NameError("name 'best_params' is not defined").
Traceback (most recent call last):
  File "/home/junior/Documentos/GitHub/prediction-f1-pit-stops-kaggle-competition/.venv/lib/python3.13/site-packages/optuna/study/_optimize.py", line 206, in _run_trial
    value_or_values = func(trial)
  File "/home/junior/Documentos/GitHub/prediction-f1-pit-stops-kaggle-competition/src/truncatedsvd_nystroem_sgdclassifier.py", line 135, in <lambda>
    study.optimize(lambda trial: objective(trial, X_train, y_train), n_trials=50, n_jobs=-1, show_progress_bar=True)
                                 ~~~~~~~~~^^^^^^^^^^^^^^^^^^^^^^^^^
  File "/home/junior/Documentos/GitHub/prediction-f1-pit-stops-kaggle-competition/src/truncatedsvd_nystroem_sgdclassifier.py", line 111, in objective
    eta0=best_params["eta0"],
         ^^^^^^^^^^^
NameError: name 'best_params' is not defined
2026-05-21 21:22:11,980 - WARNING - Trial 8 failed with parameters: {'trunsvd_n_components': 52, 'algorithm': 'randomized', 'n_iter': 6, 'power_iteration_normalizer': 'auto', 'tol': 1.0766499300731274e-06, 'kernel': 'rbf', 'gamma': 0.2853969184372309, 'n_components': 73, 'loss': 'modified_huber', 'penalty': 'elasticnet', 'alpha': 0.09452858747827944, 'learning_rate': 'adaptive'} because of the following error: NameError("name 'best_params' is not defined").
Traceback (most recent call last):
  File "/home/junior/Documentos/GitHub/prediction-f1-pit-stops-kaggle-competition/.venv/lib/python3.13/site-packages/optuna/study/_optimize.py", line 206, in _run_trial
    value_or_values = func(trial)
  File "/home/junior/Documentos/GitHub/prediction-f1-pit-stops-kaggle-competition/src/truncatedsvd_nystroem_sgdclassifier.py", line 135, in <lambda>
    study.optimize(lambda trial: objective(trial, X_train, y_train), n_trials=50, n_jobs=-1, show_progress_bar=True)
                                 ~~~~~~~~~^^^^^^^^^^^^^^^^^^^^^^^^^
  File "/home/junior/Documentos/GitHub/prediction-f1-pit-stops-kaggle-competition/src/truncatedsvd_nystroem_sgdclassifier.py", line 111, in objective
    eta0=best_params["eta0"],
         ^^^^^^^^^^^
NameError: name 'best_params' is not defined
2026-05-21 21:22:11,980 - WARNING - Trial 2 failed with value None.
2026-05-21 21:22:11,981 - WARNING - Trial 0 failed with value None.
2026-05-21 21:22:11,983 - WARNING - Trial 7 failed with parameters: {'trunsvd_n_components': 36, 'algorithm': 'randomized', 'n_iter': 8, 'power_iteration_normalizer': 'LU', 'tol': 4.2296074093589726e-05, 'kernel': 'sigmoid', 'gamma': 4.729460383548088, 'n_components': 67, 'loss': 'modified_huber', 'penalty': 'l2', 'alpha': 0.005639951736582298, 'learning_rate': 'optimal'} because of the following error: NameError("name 'best_params' is not defined").
Traceback (most recent call last):
  File "/home/junior/Documentos/GitHub/prediction-f1-pit-stops-kaggle-competition/.venv/lib/python3.13/site-packages/optuna/study/_optimize.py", line 206, in _run_trial
    value_or_values = func(trial)
  File "/home/junior/Documentos/GitHub/prediction-f1-pit-stops-kaggle-competition/src/truncatedsvd_nystroem_sgdclassifier.py", line 135, in <lambda>
    study.optimize(lambda trial: objective(trial, X_train, y_train), n_trials=50, n_jobs=-1, show_progress_bar=True)
                                 ~~~~~~~~~^^^^^^^^^^^^^^^^^^^^^^^^^
  File "/home/junior/Documentos/GitHub/prediction-f1-pit-stops-kaggle-competition/src/truncatedsvd_nystroem_sgdclassifier.py", line 111, in objective
    eta0=best_params["eta0"],
         ^^^^^^^^^^^
NameError: name 'best_params' is not defined
2026-05-21 21:22:11,984 - WARNING - Trial 11 failed with parameters: {'trunsvd_n_components': 21, 'algorithm': 'randomized', 'n_iter': 9, 'power_iteration_normalizer': 'auto', 'tol': 2.4393068448161204e-06, 'kernel': 'sigmoid', 'gamma': 2.427610204819148, 'n_components': 65, 'loss': 'modified_huber', 'penalty': 'l1', 'alpha': 0.010791317834039407, 'learning_rate': 'adaptive'} because of the following error: NameError("name 'best_params' is not defined").
Traceback (most recent call last):
  File "/home/junior/Documentos/GitHub/prediction-f1-pit-stops-kaggle-competition/.venv/lib/python3.13/site-packages/optuna/study/_optimize.py", line 206, in _run_trial
    value_or_values = func(trial)
  File "/home/junior/Documentos/GitHub/prediction-f1-pit-stops-kaggle-competition/src/truncatedsvd_nystroem_sgdclassifier.py", line 135, in <lambda>
    study.optimize(lambda trial: objective(trial, X_train, y_train), n_trials=50, n_jobs=-1, show_progress_bar=True)
                                 ~~~~~~~~~^^^^^^^^^^^^^^^^^^^^^^^^^
  File "/home/junior/Documentos/GitHub/prediction-f1-pit-stops-kaggle-competition/src/truncatedsvd_nystroem_sgdclassifier.py", line 111, in objective
    eta0=best_params["eta0"],
         ^^^^^^^^^^^
NameError: name 'best_params' is not defined
2026-05-21 21:22:11,984 - WARNING - Trial 9 failed with value None.
2026-05-21 21:22:11,985 - WARNING - Trial 6 failed with value None.
2026-05-21 21:22:11,986 - WARNING - Trial 8 failed with value None.
2026-05-21 21:22:11,986 - WARNING - Trial 7 failed with value None.
2026-05-21 21:22:11,986 - WARNING - Trial 11 failed with value None.
2026-05-21 22:03:03,623 - INFO - ----- Fine Tuning -----
2026-05-21 22:03:03,623 - INFO - A new study created in memory with name: no-name-469302da-0cd1-48b4-9f74-d60c9f982697
2026-05-21 22:03:04,437 - WARNING - Trial 4 failed with parameters: {'trunsvd_n_components': 6, 'algorithm': 'randomized', 'n_iter': 5, 'power_iteration_normalizer': 'auto', 'tol': 4.283220290509868e-05, 'kernel': 'sigmoid', 'gamma': 6.404514800663287e-05, 'n_components': 68, 'loss': 'log_loss', 'penalty': 'elasticnet', 'alpha': 7.967929416927045e-05, 'learning_rate': 'optimal'} because of the following error: NameError("name 'best_params' is not defined").
Traceback (most recent call last):
  File "/home/junior/Documentos/GitHub/prediction-f1-pit-stops-kaggle-competition/.venv/lib/python3.13/site-packages/optuna/study/_optimize.py", line 206, in _run_trial
    value_or_values = func(trial)
  File "/home/junior/Documentos/GitHub/prediction-f1-pit-stops-kaggle-competition/src/truncatedsvd_nystroem_sgdclassifier.py", line 135, in <lambda>
    study.optimize(lambda trial: objective(trial, X_train, y_train), n_trials=50, n_jobs=-1, show_progress_bar=True)
                                 ~~~~~~~~~^^^^^^^^^^^^^^^^^^^^^^^^^
  File "/home/junior/Documentos/GitHub/prediction-f1-pit-stops-kaggle-competition/src/truncatedsvd_nystroem_sgdclassifier.py", line 111, in objective
    eta0=best_params["eta0"],
         ^^^^^^^^^^^
NameError: name 'best_params' is not defined
2026-05-21 22:03:04,438 - WARNING - Trial 5 failed with parameters: {'trunsvd_n_components': 66, 'algorithm': 'randomized', 'n_iter': 13, 'power_iteration_normalizer': 'auto', 'tol': 4.034357068010576e-05, 'kernel': 'cosine', 'gamma': 0.5713660104309908, 'n_components': 67, 'loss': 'log_loss', 'penalty': 'l2', 'alpha': 0.0037346169923398436, 'learning_rate': 'adaptive'} because of the following error: NameError("name 'best_params' is not defined").
Traceback (most recent call last):
  File "/home/junior/Documentos/GitHub/prediction-f1-pit-stops-kaggle-competition/.venv/lib/python3.13/site-packages/optuna/study/_optimize.py", line 206, in _run_trial
    value_or_values = func(trial)
  File "/home/junior/Documentos/GitHub/prediction-f1-pit-stops-kaggle-competition/src/truncatedsvd_nystroem_sgdclassifier.py", line 135, in <lambda>
    study.optimize(lambda trial: objective(trial, X_train, y_train), n_trials=50, n_jobs=-1, show_progress_bar=True)
                                 ~~~~~~~~~^^^^^^^^^^^^^^^^^^^^^^^^^
  File "/home/junior/Documentos/GitHub/prediction-f1-pit-stops-kaggle-competition/src/truncatedsvd_nystroem_sgdclassifier.py", line 111, in objective
    eta0=best_params["eta0"],
         ^^^^^^^^^^^
NameError: name 'best_params' is not defined
2026-05-21 22:03:04,448 - WARNING - Trial 4 failed with value None.
2026-05-21 22:03:04,449 - WARNING - Trial 5 failed with value None.
2026-05-21 22:03:04,456 - WARNING - Trial 9 failed with parameters: {'trunsvd_n_components': 60, 'algorithm': 'randomized', 'n_iter': 10, 'power_iteration_normalizer': 'OR', 'tol': 7.166189728518262e-06, 'kernel': 'sigmoid', 'gamma': 2.093190624568186, 'n_components': 68, 'loss': 'modified_huber', 'penalty': 'elasticnet', 'alpha': 0.0007419899114238797, 'learning_rate': 'adaptive'} because of the following error: NameError("name 'best_params' is not defined").
Traceback (most recent call last):
  File "/home/junior/Documentos/GitHub/prediction-f1-pit-stops-kaggle-competition/.venv/lib/python3.13/site-packages/optuna/study/_optimize.py", line 206, in _run_trial
    value_or_values = func(trial)
  File "/home/junior/Documentos/GitHub/prediction-f1-pit-stops-kaggle-competition/src/truncatedsvd_nystroem_sgdclassifier.py", line 135, in <lambda>
    study.optimize(lambda trial: objective(trial, X_train, y_train), n_trials=50, n_jobs=-1, show_progress_bar=True)
                                 ~~~~~~~~~^^^^^^^^^^^^^^^^^^^^^^^^^
  File "/home/junior/Documentos/GitHub/prediction-f1-pit-stops-kaggle-competition/src/truncatedsvd_nystroem_sgdclassifier.py", line 111, in objective
    eta0=best_params["eta0"],
         ^^^^^^^^^^^
NameError: name 'best_params' is not defined
2026-05-21 22:03:04,461 - WARNING - Trial 6 failed with parameters: {'trunsvd_n_components': 19, 'algorithm': 'randomized', 'n_iter': 12, 'power_iteration_normalizer': 'OR', 'tol': 1.3431320982206407e-06, 'kernel': 'cosine', 'gamma': 0.0001723898990790718, 'n_components': 68, 'loss': 'log_loss', 'penalty': 'l2', 'alpha': 0.0005766689558828925, 'learning_rate': 'optimal'} because of the following error: NameError("name 'best_params' is not defined").
Traceback (most recent call last):
  File "/home/junior/Documentos/GitHub/prediction-f1-pit-stops-kaggle-competition/.venv/lib/python3.13/site-packages/optuna/study/_optimize.py", line 206, in _run_trial
    value_or_values = func(trial)
  File "/home/junior/Documentos/GitHub/prediction-f1-pit-stops-kaggle-competition/src/truncatedsvd_nystroem_sgdclassifier.py", line 135, in <lambda>
    study.optimize(lambda trial: objective(trial, X_train, y_train), n_trials=50, n_jobs=-1, show_progress_bar=True)
                                 ~~~~~~~~~^^^^^^^^^^^^^^^^^^^^^^^^^
  File "/home/junior/Documentos/GitHub/prediction-f1-pit-stops-kaggle-competition/src/truncatedsvd_nystroem_sgdclassifier.py", line 111, in objective
    eta0=best_params["eta0"],
         ^^^^^^^^^^^
NameError: name 'best_params' is not defined
2026-05-21 22:03:04,462 - WARNING - Trial 10 failed with parameters: {'trunsvd_n_components': 23, 'algorithm': 'randomized', 'n_iter': 11, 'power_iteration_normalizer': 'OR', 'tol': 5.207114833993528e-06, 'kernel': 'cosine', 'gamma': 0.0008043357170898289, 'n_components': 68, 'loss': 'log_loss', 'pe