2026-05-21 09:03:12,680 - INFO - Trial 55 finished with value: 0.8935343467090915 and parameters: {'n_components': 69, 'algorithm': 'randomized', 'n_iter': 7, 'power_iteration_normalizer': 'LU', 'tol': 5.9222617708309665e-06, 'solver': 'saga', 'C': 1.0188974696812192, 'l1_ratio': 0.6506561570068732}. Best is trial 40 with value: 0.8937726214182687.
2026-05-21 09:11:12,823 - INFO - Trial 38 finished with value: 0.8936078333271056 and parameters: {'n_components': 74, 'algorithm': 'randomized', 'n_iter': 13, 'power_iteration_normalizer': 'auto', 'tol': 0.008723554402661308, 'solver': 'saga', 'C': 0.716600820815213, 'l1_ratio': 0.24306176490325443}. Best is trial 40 with value: 0.8937726214182687.
2026-05-21 09:19:08,359 - INFO - Trial 37 finished with value: 0.8932683060812276 and parameters: {'n_components': 59, 'algorithm': 'randomized', 'n_iter': 13, 'power_iteration_normalizer': 'auto', 'tol': 0.006648905566237594, 'solver': 'saga', 'C': 0.45885698714672624, 'l1_ratio': 0.20624955761370162}. Best is trial 40 with value: 0.8937726214182687.
2026-05-21 09:20:59,048 - INFO - Trial 67 finished with value: 0.8932176439657399 and parameters: {'n_components': 65, 'algorithm': 'randomized', 'n_iter': 3, 'power_iteration_normalizer': 'LU', 'tol': 0.0010088666089435, 'solver': 'saga', 'C': 11.308462097459516, 'l1_ratio': 0.3702877661778767}. Best is trial 40 with value: 0.8937726214182687.
2026-05-21 09:40:47,457 - INFO - Trial 54 finished with value: 0.8933488048039478 and parameters: {'n_components': 70, 'algorithm': 'randomized', 'n_iter': 14, 'power_iteration_normalizer': 'LU', 'tol': 0.001380454696263478, 'solver': 'saga', 'C': 1.1953585324930707, 'l1_ratio': 0.660752101596765}. Best is trial 40 with value: 0.8937726214182687.
2026-05-21 09:42:29,774 - INFO - Trial 59 finished with value: 0.8935322671958618 and parameters: {'n_components': 70, 'algorithm': 'randomized', 'n_iter': 6, 'power_iteration_normalizer': 'LU', 'tol': 0.001119493273429766, 'solver': 'saga', 'C': 1.113581072290807, 'l1_ratio': 0.08771152627334225}. Best is trial 40 with value: 0.8937726214182687.
2026-05-21 09:45:08,899 - INFO - Trial 70 finished with value: 0.8932929237565805 and parameters: {'n_components': 62, 'algorithm': 'randomized', 'n_iter': 10, 'power_iteration_normalizer': 'LU', 'tol': 0.0023469287402562524, 'solver': 'saga', 'C': 3.5952056334765374, 'l1_ratio': 0.2889130951035199}. Best is trial 40 with value: 0.8937726214182687.
2026-05-21 09:47:49,747 - INFO - Trial 71 pruned. 
2026-05-21 10:06:02,239 - INFO - Trial 57 finished with value: 0.8935250945634745 and parameters: {'n_components': 70, 'algorithm': 'randomized', 'n_iter': 14, 'power_iteration_normalizer': 'LU', 'tol': 2.5236536573781756e-06, 'solver': 'saga', 'C': 1.278786919788431, 'l1_ratio': 0.4852571667835728}. Best is trial 40 with value: 0.8937726214182687.
2026-05-21 10:11:35,943 - INFO - Trial 62 finished with value: 0.8934777217535771 and parameters: {'n_components': 70, 'algorithm': 'randomized', 'n_iter': 8, 'power_iteration_normalizer': 'LU', 'tol': 0.004019153320902779, 'solver': 'saga', 'C': 17.94034680809726, 'l1_ratio': 0.10929986204012994}. Best is trial 40 with value: 0.8937726214182687.
2026-05-21 10:31:28,489 - INFO - Trial 66 finished with value: 0.893557855697426 and parameters: {'n_components': 71, 'algorithm': 'randomized', 'n_iter': 3, 'power_iteration_normalizer': 'LU', 'tol': 0.0029764080174621496, 'solver': 'saga', 'C': 9.196463160886687, 'l1_ratio': 0.0691149503855773}. Best is trial 40 with value: 0.8937726214182687.
2026-05-21 10:34:31,457 - INFO - Trial 72 finished with value: 0.8935296354733037 and parameters: {'n_components': 72, 'algorithm': 'randomized', 'n_iter': 14, 'power_iteration_normalizer': 'auto', 'tol': 0.006629008543178793, 'solver': 'saga', 'C': 0.09609103414073178, 'l1_ratio': 0.48575951791490857}. Best is trial 40 with value: 0.8937726214182687.
2026-05-21 10:35:37,456 - INFO - Trial 58 finished with value: 0.8935763080114973 and parameters: {'n_components': 70, 'algorithm': 'randomized', 'n_iter': 6, 'power_iteration_normalizer': 'LU', 'tol': 0.0001680901070656326, 'solver': 'saga', 'C': 1.1214027127312396, 'l1_ratio': 0.08011272642289527}. Best is trial 40 with value: 0.8937726214182687.
2026-05-21 10:36:53,650 - INFO - Trial 76 finished with value: 0.8934413328357966 and parameters: {'n_components': 66, 'algorithm': 'randomized', 'n_iter': 4, 'power_iteration_normalizer': 'auto', 'tol': 0.0002084491852209592, 'solver': 'saga', 'C': 41.27819716212274, 'l1_ratio': 0.5539558169448583}. Best is trial 40 with value: 0.8937726214182687.
2026-05-21 10:38:03,269 - INFO - Trial 77 finished with value: 0.8935277724905367 and parameters: {'n_components': 67, 'algorithm': 'randomized', 'n_iter': 4, 'power_iteration_normalizer': 'LU', 'tol': 1.2105475942335064e-06, 'solver': 'saga', 'C': 4.567564720193899, 'l1_ratio': 0.04235693698595621}. Best is trial 40 with value: 0.8937726214182687.
2026-05-21 10:38:59,079 - INFO - Trial 78 finished with value: 0.8933966886895366 and parameters: {'n_components': 67, 'algorithm': 'randomized', 'n_iter': 4, 'power_iteration_normalizer': 'LU', 'tol': 0.00942231060065083, 'solver': 'saga', 'C': 5.065361593101034, 'l1_ratio': 0.06398253230379831}. Best is trial 40 with value: 0.8937726214182687.
2026-05-21 10:40:44,036 - INFO - Trial 53 finished with value: 0.8935656702892161 and parameters: {'n_components': 70, 'algorithm': 'randomized', 'n_iter': 14, 'power_iteration_normalizer': 'LU', 'tol': 7.329322437560472e-06, 'solver': 'saga', 'C': 1.0585000904750135, 'l1_ratio': 0.19898232048826742}. Best is trial 40 with value: 0.8937726214182687.
2026-05-21 10:46:53,348 - INFO - Trial 81 finished with value: 0.8932787818179717 and parameters: {'n_components': 63, 'algorithm': 'randomized', 'n_iter': 6, 'power_iteration_normalizer': 'OR', 'tol': 5.2891757614561424e-05, 'solver': 'saga', 'C': 2.367431096202422, 'l1_ratio': 0.37361646410698346}. Best is trial 40 with value: 0.8937726214182687.
2026-05-21 10:59:15,821 - INFO - Trial 65 finished with value: 0.8934366307232885 and parameters: {'n_components': 71, 'algorithm': 'randomized', 'n_iter': 14, 'power_iteration_normalizer': 'LU', 'tol': 0.001040576943943908, 'solver': 'saga', 'C': 9.498950880359109, 'l1_ratio': 0.05470090107242134}. Best is trial 40 with value: 0.8937726214182687.
2026-05-21 11:04:13,032 - INFO - Trial 73 finished with value: 0.8935071279290694 and parameters: {'n_components': 71, 'algorithm': 'randomized', 'n_iter': 14, 'power_iteration_normalizer': 'auto', 'tol': 0.00021791679769451013, 'solver': 'saga', 'C': 0.10842098930181925, 'l1_ratio': 0.5908209404462569}. Best is trial 40 with value: 0.8937726214182687.
2026-05-21 11:29:48,764 - INFO - Trial 61 finished with value: 0.8934291735266873 and parameters: {'n_components': 70, 'algorithm': 'randomized', 'n_iter': 8, 'power_iteration_normalizer': 'LU', 'tol': 0.00018150630956775861, 'solver': 'saga', 'C': 13.249749898450915, 'l1_ratio': 0.079086745521487}. Best is trial 40 with value: 0.8937726214182687.
2026-05-21 11:43:07,675 - INFO - Trial 75 finished with value: 0.8936663967735907 and parameters: {'n_components': 72, 'algorithm': 'randomized', 'n_iter': 14, 'power_iteration_normalizer': 'auto', 'tol': 0.00017515201778230824, 'solver': 'saga', 'C': 0.10301352058602206, 'l1_ratio': 0.5292286225972714}. Best is trial 40 with value: 0.8937726214182687.
2026-05-21 11:44:30,557 - INFO - Trial 68 finished with value: 0.8935699776646056 and parameters: {'n_components': 71, 'algorithm': 'randomized', 'n_iter': 14, 'power_iteration_normalizer': 'LU', 'tol': 0.003471463767261772, 'solver': 'saga', 'C': 2.690976055221984, 'l1_ratio': 0.29633327404850757}. Best is trial 40 with value: 0.8937726214182687.
2026-05-21 11:48:25,958 - INFO - Trial 63 finished with value: 0.8935933018445871 and parameters: {'n_components': 70, 'algorithm': 'randomized', 'n_iter': 8, 'power_iteration_normalizer': 'LU', 'tol': 0.0038444563846196417, 'solver': 'saga', 'C': 7.472381894109, 'l1_ratio': 0.29197183990285897}. Best is trial 40 with value: 0.8937726214182687.
2026-05-21 11:58:36,517 - INFO - Trial 64 finished with value: 0.8935363103308933 and parameters: {'n_components': 71, 'algorithm': 'randomized', 'n_iter': 8, 'power_iteration_normalizer': 'LU', 'tol': 0.0001915253881967271, 'solver': 'saga', 'C': 9.074321043064812, 'l1_ratio': 0.4793076718843232}. Best is trial 40 with value: 0.8937726214182687.
2026-05-21 12:05:26,364 - INFO - Trial 69 finished with value: 0.8936158124032616 and parameters: {'n_components': 71, 'algorithm': 'randomized', 'n_iter': 10, 'power_iteration_normalizer': 'LU', 'tol': 0.003006446202578881, 'solver': 'saga', 'C': 4.152996973318097, 'l1_ratio': 0.07458506193901021}. Best is trial 40 with value: 0.8937726214182687.
2026-05-21 12:08:27,066 - INFO - Trial 82 finished with value: 0.8935192928893312 and parameters: {'n_components': 72, 'algorithm': 'randomized', 'n_iter': 13, 'power_iteration_normalizer': 'auto', 'tol': 0.00010310457278630863, 'solver': 'saga', 'C': 0.6764696756117591, 'l1_ratio': 0.595134411991599}. Best is trial 40 with value: 0.8937726214182687.
2026-05-21 12:14:56,778 - INFO - Trial 83 finished with value: 0.8935354527911459 and parameters: {'n_components': 72, 'algorithm': 'randomized', 'n_iter': 5, 'power_iteration_normalizer': 'auto', 'tol': 0.00010038507695953829, 'solver': 'saga', 'C': 0.1165537104626847, 'l1_ratio': 0.592881141508548}. Best is trial 40 with value: 0.8937726214182687.
2026-05-21 12:52:53,093 - INFO - Trial 91 finished with value: 0.8935378448541813 and parameters: {'n_components': 73, 'algorithm': 'randomized', 'n_iter': 9, 'power_iteration_normalizer': 'auto', 'tol': 0.001998060561181446, 'solver': 'saga', 'C': 0.018602886788351435, 'l1_ratio': 0.33754588479170955}. Best is trial 40 with value: 0.8937726214182687.
2026-05-21 13:08:20,869 - INFO - Trial 89 finished with value: 0.8935614070002634 and parameters: {'n_components': 73, 'algorithm': 'randomized', 'n_iter': 13, 'power_iteration_normalizer': 'auto', 'tol': 0.005778650777565393, 'solver': 'saga', 'C': 0.6201949288792218, 'l1_ratio': 0.7235715906524085}. Best is trial 40 with value: 0.8937726214182687.
2026-05-21 13:10:08,166 - INFO - Trial 74 finished with value: 0.8934523962459702 and parameters: {'n_components': 72, 'algorithm': 'randomized', 'n_iter': 14, 'power_iteration_normalizer': 'auto', 'tol': 0.00023323573269246569, 'solver': 'saga', 'C': 4.593795687851763, 'l1_ratio': 0.5807124856910303}. Best is trial 40 with value: 0.8937726214182687.
2026-05-21 13:17:48,720 - INFO - Trial 84 finished with value: 0.8936028896562854 and parameters: {'n_components': 73, 'algorithm': 'randomized', 'n_iter': 5, 'power_iteration_normalizer': 'auto', 'tol': 0.00010074993134954442, 'solver': 'saga', 'C': 0.5297156221818411, 'l1_ratio': 0.12442872194102203}. Best is trial 40 with value: 0.8937726214182687.
2026-05-21 13:21:28,550 - INFO - Trial 96 finished with value: 0.8932871342174448 and parameters: {'n_components': 67, 'algorithm': 'randomized', 'n_iter': 15, 'power_iteration_normalizer': 'auto', 'tol': 4.227977482032056e-05, 'solver': 'saga', 'C': 0.07152092447180614, 'l1_ratio': 0.1768187148041667}. Best is trial 40 with value: 0.8937726214182687.
2026-05-21 13:29:22,230 - INFO - Trial 88 finished with value: 0.8936652774360546 and parameters: {'n_components': 73, 'algorithm': 'randomized', 'n_iter': 15, 'power_iteration_normalizer': 'auto', 'tol': 0.00010504625829966503, 'solver': 'saga', 'C': 0.5984446898456979, 'l1_ratio': 0.33254939805308265}. Best is trial 40 with value: 0.8937726214182687.
2026-05-21 13:42:55,091 - INFO - Trial 86 finished with value: 0.8936207829654232 and parameters: {'n_components': 73, 'algorithm': 'randomized', 'n_iter': 5, 'power_iteration_normalizer': 'auto', 'tol': 9.848887479207864e-05, 'solver': 'saga', 'C': 0.12000732153377755, 'l1_ratio': 0.13011069832907635}. Best is trial 40 with value: 0.8937726214182687.
2026-05-21 13:47:17,710 - INFO - Trial 99 finished with value: 0.8933325981008423 and parameters: {'n_components': 65, 'algorithm': 'randomized', 'n_iter': 15, 'power_iteration_normalizer': 'auto', 'tol': 7.95243242960615e-05, 'solver': 'saga', 'C': 0.14975334163673226, 'l1_ratio': 0.12418092416094778}. Best is trial 40 with value: 0.8937726214182687.
2026-05-21 13:49:57,915 - INFO - Trial 95 finished with value: 0.8935192770070535 and parameters: {'n_components': 68, 'algorithm': 'randomized', 'n_iter': 15, 'power_iteration_normalizer': 'OR', 'tol': 0.005262748046999393, 'solver': 'saga', 'C': 0.6270152035121177, 'l1_ratio': 0.12669364724441762}. Best is trial 40 with value: 0.8937726214182687.
2026-05-21 13:53:56,087 - INFO - Trial 98 pruned. 
2026-05-21 14:01:18,540 - INFO - Trial 80 finished with value: 0.893509439868016 and parameters: {'n_components': 73, 'algorithm': 'randomized', 'n_iter': 6, 'power_iteration_normalizer': 'OR', 'tol': 2.6280494751706715e-05, 'solver': 'saga', 'C': 0.6169739989593203, 'l1_ratio': 0.3738935611119519}. Best is trial 40 with value: 0.8937726214182687.
2026-05-21 14:06:37,835 - INFO - Trial 90 finished with value: 0.8935771779011439 and parameters: {'n_components': 73, 'algorithm': 'randomized', 'n_iter': 9, 'power_iteration_normalizer': 'auto', 'tol': 0.005822449150089993, 'solver': 'saga', 'C': 0.6045754814324377, 'l1_ratio': 0.3361820288915325}. Best is trial 40 with value: 0.8937726214182687.
2026-05-21 14:09:31,105 - INFO - Trial 79 finished with value: 0.89347305418495 and parameters: {'n_components': 72, 'algorithm': 'randomized', 'n_iter': 5, 'power_iteration_normalizer': 'OR', 'tol': 0.00011356835592015807, 'solver': 'saga', 'C': 0.6368657787199431, 'l1_ratio': 0.059950402332789185}. Best is trial 40 with value: 0.8937726214182687.
2026-05-21 14:13:52,839 - INFO - Trial 93 finished with value: 0.8933176770738948 and parameters: {'n_components': 68, 'algorithm': 'randomized', 'n_iter': 15, 'power_iteration_normalizer': 'auto', 'tol': 0.007657329188258368, 'solver': 'saga', 'C': 0.632500356296281, 'l1_ratio': 0.12594285045381787}. Best is trial 40 with value: 0.8937726214182687.
2026-05-21 14:25:18,414 - INFO - Trial 92 finished with value: 0.893483795307106 and parameters: {'n_components': 73, 'algorithm': 'randomized', 'n_iter': 15, 'power_iteration_normalizer': 'auto', 'tol': 0.005795492261124535, 'solver': 'saga', 'C': 0.5993142185176847, 'l1_ratio': 0.12939505207005716}. Best is trial 40 with value: 0.8937726214182687.
2026-05-21 14:25:33,298 - INFO - Trial 85 finished with value: 0.8936715767977021 and parameters: {'n_components': 73, 'algorithm': 'randomized', 'n_iter': 5, 'power_iteration_normalizer': 'auto', 'tol': 2.958933987882121e-05, 'solver': 'saga', 'C': 0.6212556850278836, 'l1_ratio': 0.29618360939526084}. Best is trial 40 with value: 0.8937726214182687.
2026-05-21 14:26:02,746 - INFO - Trial 87 finished with value: 0.8934489708663707 and parameters: {'n_components': 73, 'algorithm': 'randomized', 'n_iter': 15, 'power_iteration_normalizer': 'auto', 'tol': 0.00011073869615317288, 'solver': 'saga', 'C': 0.6176294674110989, 'l1_ratio': 0.523173690588205}. Best is trial 40 with value: 0.8937726214182687.
2026-05-21 14:36:27,898 - INFO - Trial 94 finished with value: 0.893478208153827 and parameters: {'n_components': 68, 'algorithm': 'randomized', 'n_iter': 12, 'power_iteration_normalizer': 'auto', 'tol': 0.005744810780310283, 'solver': 'saga', 'C': 2.1584447272806613, 'l1_ratio': 0.12655530306335389}. Best is trial 40 with value: 0.8937726214182687.
2026-05-21 14:41:18,743 - INFO - Trial 97 finished with value: 0.893534802184585 and parameters: {'n_components': 75, 'algorithm': 'randomized', 'n_iter': 12, 'power_iteration_normalizer': 'auto', 'tol': 0.005411179449003807, 'solver': 'saga', 'C': 0.15576606047723804, 'l1_ratio': 0.12972319292667772}. Best is trial 40 with value: 0.8937726214182687.
2026-05-21 14:41:18,747 - INFO - Best AUC: 0.8937726214182687 | Best params: {'n_components': 75, 'algorithm': 'randomized', 'n_iter': 13, 'power_iteration_normalizer': 'LU', 'tol': 0.0001392365343269728, 'solver': 'saga', 'C': 0.35655141507820654, 'l1_ratio': 0.17750518257177195}
2026-05-21 14:41:18,748 - INFO - ----- Saving Pipeline -----
