2026-05-21 04:33:12,658 - INFO - Trial 140 finished with value: 0.8921707140253099 and parameters: {'n_components': 72, 'algorithm': 'randomized', 'n_iter': 9, 'power_iteration_normalizer': 'auto', 'tol': 4.3490240167414736e-05, 'C': 10.473002398819471, 'loss': 'squared_hinge', 'tol_linear_svc': 0.0002560927179062585}. Best is trial 108 with value: 0.8922651583859675.
2026-05-21 04:33:55,280 - INFO - Trial 151 pruned. 
2026-05-21 04:34:12,349 - INFO - Trial 144 finished with value: 0.8921716080274822 and parameters: {'n_components': 72, 'algorithm': 'randomized', 'n_iter': 7, 'power_iteration_normalizer': 'auto', 'tol': 0.00012293319578829203, 'C': 10.859517263579388, 'loss': 'squared_hinge', 'tol_linear_svc': 9.061290788132737e-05}. Best is trial 108 with value: 0.8922651583859675.
2026-05-21 04:34:20,678 - INFO - Trial 143 finished with value: 0.8921512394793547 and parameters: {'n_components': 72, 'algorithm': 'randomized', 'n_iter': 7, 'power_iteration_normalizer': 'auto', 'tol': 6.496400457043009e-05, 'C': 13.231496599337532, 'loss': 'squared_hinge', 'tol_linear_svc': 2.8474972078703084e-05}. Best is trial 108 with value: 0.8922651583859675.
2026-05-21 04:34:31,007 - INFO - Trial 145 finished with value: 0.8920263424181002 and parameters: {'n_components': 72, 'algorithm': 'randomized', 'n_iter': 7, 'power_iteration_normalizer': 'auto', 'tol': 5.884720932738714e-05, 'C': 11.719741218866378, 'loss': 'squared_hinge', 'tol_linear_svc': 0.00036541686001570646}. Best is trial 108 with value: 0.8922651583859675.
2026-05-21 04:36:39,920 - INFO - Trial 147 finished with value: 0.8918996621713451 and parameters: {'n_components': 72, 'algorithm': 'randomized', 'n_iter': 7, 'power_iteration_normalizer': 'auto', 'tol': 5.945684636695922e-05, 'C': 12.206294459288205, 'loss': 'squared_hinge', 'tol_linear_svc': 0.000622107427812667}. Best is trial 108 with value: 0.8922651583859675.
2026-05-21 04:37:01,770 - INFO - Trial 148 finished with value: 0.8920712530382022 and parameters: {'n_components': 72, 'algorithm': 'randomized', 'n_iter': 7, 'power_iteration_normalizer': 'auto', 'tol': 0.0023262967458405268, 'C': 16.29139198896658, 'loss': 'squared_hinge', 'tol_linear_svc': 0.001440136155468706}. Best is trial 108 with value: 0.8922651583859675.
2026-05-21 04:37:13,570 - INFO - Trial 146 finished with value: 0.892071653098294 and parameters: {'n_components': 72, 'algorithm': 'randomized', 'n_iter': 7, 'power_iteration_normalizer': 'auto', 'tol': 0.00012156512894033826, 'C': 3.4880643489012555, 'loss': 'squared_hinge', 'tol_linear_svc': 0.00031909444070005774}. Best is trial 108 with value: 0.8922651583859675.
2026-05-21 04:37:26,395 - INFO - Trial 150 finished with value: 0.8919141716780412 and parameters: {'n_components': 73, 'algorithm': 'randomized', 'n_iter': 7, 'power_iteration_normalizer': 'auto', 'tol': 0.005972801568865705, 'C': 18.7457938680906, 'loss': 'squared_hinge', 'tol_linear_svc': 0.002328429624210416}. Best is trial 108 with value: 0.8922651583859675.
2026-05-21 04:38:10,120 - INFO - Trial 149 finished with value: 0.8921499205200358 and parameters: {'n_components': 73, 'algorithm': 'randomized', 'n_iter': 7, 'power_iteration_normalizer': 'auto', 'tol': 0.0016823231247617852, 'C': 17.608651897660703, 'loss': 'squared_hinge', 'tol_linear_svc': 0.0008060557304852844}. Best is trial 108 with value: 0.8922651583859675.
2026-05-21 04:39:13,455 - INFO - Trial 153 finished with value: 0.8921705679916261 and parameters: {'n_components': 73, 'algorithm': 'randomized', 'n_iter': 7, 'power_iteration_normalizer': 'auto', 'tol': 0.0058851623323174194, 'C': 16.04875198202355, 'loss': 'squared_hinge', 'tol_linear_svc': 0.0036777228684143526}. Best is trial 108 with value: 0.8922651583859675.
2026-05-21 04:39:58,335 - INFO - Trial 152 finished with value: 0.8921768746832385 and parameters: {'n_components': 73, 'algorithm': 'randomized', 'n_iter': 7, 'power_iteration_normalizer': 'auto', 'tol': 0.0021279109607441763, 'C': 22.843472938493818, 'loss': 'squared_hinge', 'tol_linear_svc': 0.00271477369449641}. Best is trial 108 with value: 0.8922651583859675.
2026-05-21 04:40:32,529 - INFO - Trial 156 finished with value: 0.8919634787849761 and parameters: {'n_components': 70, 'algorithm': 'randomized', 'n_iter': 9, 'power_iteration_normalizer': 'auto', 'tol': 0.0013702554853991984, 'C': 0.0050452722738551425, 'loss': 'squared_hinge', 'tol_linear_svc': 0.00031295762536838603}. Best is trial 108 with value: 0.8922651583859675.
2026-05-21 04:40:40,076 - INFO - Trial 154 finished with value: 0.8919874110633597 and parameters: {'n_components': 71, 'algorithm': 'randomized', 'n_iter': 9, 'power_iteration_normalizer': 'auto', 'tol': 0.004685840281571573, 'C': 19.78800774675919, 'loss': 'squared_hinge', 'tol_linear_svc': 9.465585832545342e-05}. Best is trial 108 with value: 0.8922651583859675.
2026-05-21 04:41:08,908 - INFO - Trial 155 finished with value: 0.8920524496126896 and parameters: {'n_components': 70, 'algorithm': 'randomized', 'n_iter': 9, 'power_iteration_normalizer': 'auto', 'tol': 0.002231666305331879, 'C': 15.192764553979032, 'loss': 'squared_hinge', 'tol_linear_svc': 0.0008022207025926466}. Best is trial 108 with value: 0.8922651583859675.
2026-05-21 04:41:35,312 - INFO - Trial 159 finished with value: 0.8911465721122263 and parameters: {'n_components': 70, 'algorithm': 'randomized', 'n_iter': 4, 'power_iteration_normalizer': 'OR', 'tol': 2.8214169408872707e-05, 'C': 24.330095265579345, 'loss': 'squared_hinge', 'tol_linear_svc': 0.001344879773435757}. Best is trial 108 with value: 0.8922651583859675.
2026-05-21 04:44:07,511 - INFO - Trial 165 finished with value: 0.8920372241260628 and parameters: {'n_components': 70, 'algorithm': 'randomized', 'n_iter': 6, 'power_iteration_normalizer': 'OR', 'tol': 0.0067345136529527085, 'C': 4.704499839261695, 'loss': 'squared_hinge', 'tol_linear_svc': 0.0039565135062534715}. Best is trial 108 with value: 0.8922651583859675.
2026-05-21 04:44:41,425 - INFO - Trial 164 finished with value: 0.8920615747025232 and parameters: {'n_components': 70, 'algorithm': 'randomized', 'n_iter': 6, 'power_iteration_normalizer': 'OR', 'tol': 8.015763153109601e-05, 'C': 7.942432737980606, 'loss': 'squared_hinge', 'tol_linear_svc': 0.003711527738964258}. Best is trial 108 with value: 0.8922651583859675.
2026-05-21 04:45:45,933 - INFO - Trial 167 finished with value: 0.8920000007435588 and parameters: {'n_components': 74, 'algorithm': 'randomized', 'n_iter': 6, 'power_iteration_normalizer': 'OR', 'tol': 2.8409818307271708e-05, 'C': 7.724051997717772, 'loss': 'squared_hinge', 'tol_linear_svc': 0.004179909149432029}. Best is trial 108 with value: 0.8922651583859675.
2026-05-21 04:47:15,309 - INFO - Trial 168 finished with value: 0.8920605884923125 and parameters: {'n_components': 74, 'algorithm': 'randomized', 'n_iter': 6, 'power_iteration_normalizer': 'OR', 'tol': 0.003461582847181448, 'C': 7.372352684689758, 'loss': 'squared_hinge', 'tol_linear_svc': 0.0036037710400377617}. Best is trial 108 with value: 0.8922651583859675.
2026-05-21 04:47:27,223 - INFO - Trial 166 finished with value: 0.8920166837093181 and parameters: {'n_components': 74, 'algorithm': 'randomized', 'n_iter': 6, 'power_iteration_normalizer': 'OR', 'tol': 0.004177335571818771, 'C': 7.470140069610918, 'loss': 'squared_hinge', 'tol_linear_svc': 0.004009591982615148}. Best is trial 108 with value: 0.8922651583859675.
2026-05-21 04:49:35,427 - INFO - Trial 170 finished with value: 0.892073684694554 and parameters: {'n_components': 74, 'algorithm': 'randomized', 'n_iter': 6, 'power_iteration_normalizer': 'LU', 'tol': 0.00892985068766715, 'C': 7.249072218822742, 'loss': 'squared_hinge', 'tol_linear_svc': 0.0034374985502106004}. Best is trial 108 with value: 0.8922651583859675.
2026-05-21 04:50:00,873 - INFO - Trial 160 finished with value: 0.8921225918788277 and parameters: {'n_components': 70, 'algorithm': 'randomized', 'n_iter': 4, 'power_iteration_normalizer': 'OR', 'tol': 0.00640091818727525, 'C': 23.685510805059533, 'loss': 'squared_hinge', 'tol_linear_svc': 9.183559258629857e-05}. Best is trial 108 with value: 0.8922651583859675.
2026-05-21 04:50:33,571 - INFO - Trial 163 finished with value: 0.8917964100462206 and parameters: {'n_components': 70, 'algorithm': 'randomized', 'n_iter': 6, 'power_iteration_normalizer': 'OR', 'tol': 8.227397593823945e-05, 'C': 4.632521604040896, 'loss': 'squared_hinge', 'tol_linear_svc': 0.0010494571037936288}. Best is trial 108 with value: 0.8922651583859675.
2026-05-21 04:50:44,313 - INFO - Trial 171 finished with value: 0.8920032496019841 and parameters: {'n_components': 74, 'algorithm': 'randomized', 'n_iter': 6, 'power_iteration_normalizer': 'LU', 'tol': 0.003607699407118924, 'C': 55.7826109531186, 'loss': 'squared_hinge', 'tol_linear_svc': 0.003958422336261996}. Best is trial 108 with value: 0.8922651583859675.
2026-05-21 04:50:45,130 - INFO - Trial 172 finished with value: 0.8920307092656561 and parameters: {'n_components': 74, 'algorithm': 'randomized', 'n_iter': 6, 'power_iteration_normalizer': 'auto', 'tol': 1.6535954826579588e-05, 'C': 28.44177885761537, 'loss': 'squared_hinge', 'tol_linear_svc': 0.002692037253715365}. Best is trial 108 with value: 0.8922651583859675.
2026-05-21 04:55:25,878 - INFO - Trial 175 finished with value: 0.8919092008944831 and parameters: {'n_components': 67, 'algorithm': 'randomized', 'n_iter': 7, 'power_iteration_normalizer': 'auto', 'tol': 7.603275421071417e-05, 'C': 26.003748544406772, 'loss': 'squared_hinge', 'tol_linear_svc': 0.006420944622441732}. Best is trial 108 with value: 0.8922651583859675.
2026-05-21 04:55:37,432 - INFO - Trial 161 finished with value: 0.892222386988276 and parameters: {'n_components': 74, 'algorithm': 'randomized', 'n_iter': 4, 'power_iteration_normalizer': 'OR', 'tol': 7.35009770354357e-05, 'C': 22.85376342623792, 'loss': 'squared_hinge', 'tol_linear_svc': 8.793008179339185e-05}. Best is trial 108 with value: 0.8922651583859675.
2026-05-21 04:55:49,850 - INFO - Trial 174 finished with value: 0.8921170201826725 and parameters: {'n_components': 74, 'algorithm': 'randomized', 'n_iter': 14, 'power_iteration_normalizer': 'auto', 'tol': 1.7704633429646404e-05, 'C': 26.45064630284291, 'loss': 'squared_hinge', 'tol_linear_svc': 0.007007877371455166}. Best is trial 108 with value: 0.8922651583859675.
2026-05-21 04:56:25,797 - INFO - Trial 173 finished with value: 0.8920074314636383 and parameters: {'n_components': 74, 'algorithm': 'randomized', 'n_iter': 14, 'power_iteration_normalizer': 'auto', 'tol': 7.100466803941724e-05, 'C': 25.651283776107785, 'loss': 'squared_hinge', 'tol_linear_svc': 0.00011280979490152557}. Best is trial 108 with value: 0.8922651583859675.
2026-05-21 04:57:15,178 - INFO - Trial 178 finished with value: 0.8920345645394459 and parameters: {'n_components': 67, 'algorithm': 'randomized', 'n_iter': 8, 'power_iteration_normalizer': 'auto', 'tol': 6.2567530695755435e-06, 'C': 0.32952203600135854, 'loss': 'squared_hinge', 'tol_linear_svc': 2.818331082347562e-05}. Best is trial 108 with value: 0.8922651583859675.
2026-05-21 04:57:59,368 - INFO - Trial 176 finished with value: 0.8921262322731692 and parameters: {'n_components': 74, 'algorithm': 'randomized', 'n_iter': 14, 'power_iteration_normalizer': 'auto', 'tol': 1.7896746876967105e-05, 'C': 50.53145899770454, 'loss': 'squared_hinge', 'tol_linear_svc': 0.007495187308891414}. Best is trial 108 with value: 0.8922651583859675.
2026-05-21 04:59:04,997 - INFO - Trial 181 pruned. 
2026-05-21 05:01:22,924 - INFO - Trial 182 finished with value: 0.8920837263465502 and parameters: {'n_components': 75, 'algorithm': 'randomized', 'n_iter': 3, 'power_iteration_normalizer': 'auto', 'tol': 5.0224332553758456e-05, 'C': 0.35682984329510375, 'loss': 'squared_hinge', 'tol_linear_svc': 0.009525332812134673}. Best is trial 108 with value: 0.8922651583859675.
2026-05-21 05:01:56,765 - INFO - Trial 177 finished with value: 0.8921942819801295 and parameters: {'n_components': 75, 'algorithm': 'randomized', 'n_iter': 14, 'power_iteration_normalizer': 'auto', 'tol': 0.0007970694474579885, 'C': 52.27659230179346, 'loss': 'squared_hinge', 'tol_linear_svc': 6.864148827432514e-05}. Best is trial 108 with value: 0.8922651583859675.
2026-05-21 05:02:06,529 - INFO - Trial 179 finished with value: 0.8920719202623987 and parameters: {'n_components': 75, 'algorithm': 'randomized', 'n_iter': 14, 'power_iteration_normalizer': 'auto', 'tol': 6.397566593098016e-06, 'C': 23.534043490962944, 'loss': 'squared_hinge', 'tol_linear_svc': 6.784583990991112e-05}. Best is trial 108 with value: 0.8922651583859675.
2026-05-21 05:03:47,994 - INFO - Trial 183 finished with value: 0.8920149144894648 and parameters: {'n_components': 75, 'algorithm': 'randomized', 'n_iter': 8, 'power_iteration_normalizer': 'auto', 'tol': 6.5930974132637985e-06, 'C': 0.0017389002780430532, 'loss': 'squared_hinge', 'tol_linear_svc': 6.535952952052302e-05}. Best is trial 108 with value: 0.8922651583859675.
2026-05-21 05:05:15,240 - INFO - Trial 180 finished with value: 0.8921696938042001 and parameters: {'n_components': 75, 'algorithm': 'randomized', 'n_iter': 14, 'power_iteration_normalizer': 'auto', 'tol': 6.058595182718888e-06, 'C': 0.33487050425029, 'loss': 'squared_hinge', 'tol_linear_svc': 7.382921877166699e-05}. Best is trial 108 with value: 0.8922651583859675.
2026-05-21 05:06:14,107 - INFO - Trial 158 finished with value: 0.8921365309853597 and parameters: {'n_components': 74, 'algorithm': 'randomized', 'n_iter': 6, 'power_iteration_normalizer': 'OR', 'tol': 8.177059417352211e-05, 'C': 21.720124589353663, 'loss': 'squared_hinge', 'tol_linear_svc': 0.0007089049818874294}. Best is trial 108 with value: 0.8922651583859675.
2026-05-21 05:06:51,465 - INFO - Trial 186 finished with value: 0.8920438751046662 and parameters: {'n_components': 73, 'algorithm': 'randomized', 'n_iter': 8, 'power_iteration_normalizer': 'LU', 'tol': 6.744845320646802e-05, 'C': 99.28754391688753, 'loss': 'squared_hinge', 'tol_linear_svc': 6.052773301828761e-05}. Best is trial 108 with value: 0.8922651583859675.
2026-05-21 05:07:56,754 - INFO - Trial 184 finished with value: 0.8920019904450633 and parameters: {'n_components': 75, 'algorithm': 'randomized', 'n_iter': 3, 'power_iteration_normalizer': 'LU', 'tol': 4.6322195196753795e-05, 'C': 34.869096998690296, 'loss': 'squared_hinge', 'tol_linear_svc': 5.958792123892074e-05}. Best is trial 108 with value: 0.8922651583859675.
2026-05-21 05:08:23,837 - INFO - Trial 187 finished with value: 0.8920997452287066 and parameters: {'n_components': 75, 'algorithm': 'randomized', 'n_iter': 3, 'power_iteration_normalizer': 'LU', 'tol': 6.970944793016729e-05, 'C': 0.0019358081914651315, 'loss': 'squared_hinge', 'tol_linear_svc': 7.651991395564159e-05}. Best is trial 108 with value: 0.8922651583859675.
2026-05-21 05:08:26,976 - INFO - Trial 190 pruned. 
2026-05-21 05:10:02,896 - INFO - Trial 185 finished with value: 0.8921630224421273 and parameters: {'n_components': 75, 'algorithm': 'randomized', 'n_iter': 3, 'power_iteration_normalizer': 'LU', 'tol': 4.75766433467995e-05, 'C': 37.33686228486732, 'loss': 'squared_hinge', 'tol_linear_svc': 6.64482046463302e-05}. Best is trial 108 with value: 0.8922651583859675.
2026-05-21 05:10:54,696 - INFO - Trial 188 finished with value: 0.8920866576591321 and parameters: {'n_components': 75, 'algorithm': 'randomized', 'n_iter': 13, 'power_iteration_normalizer': 'LU', 'tol': 0.0026688171471616487, 'C': 0.0016127402651157814, 'loss': 'squared_hinge', 'tol_linear_svc': 7.589093838688495e-05}. Best is trial 108 with value: 0.8922651583859675.
2026-05-21 05:13:01,177 - INFO - Trial 157 finished with value: 0.8920332128333008 and parameters: {'n_components': 70, 'algorithm': 'randomized', 'n_iter': 7, 'power_iteration_normalizer': 'OR', 'tol': 7.724511536882136e-05, 'C': 15.392119593523667, 'loss': 'squared_hinge', 'tol_linear_svc': 8.336649369822744e-05}. Best is trial 108 with value: 0.8922651583859675.
2026-05-21 05:13:30,483 - INFO - Trial 189 finished with value: 0.8920173305467805 and parameters: {'n_components': 75, 'algorithm': 'randomized', 'n_iter': 13, 'power_iteration_normalizer': 'LU', 'tol': 0.0028706030332730555, 'C': 35.525212844710595, 'loss': 'squared_hinge', 'tol_linear_svc': 8.552905759279898e-05}. Best is trial 108 with value: 0.8922651583859675.
2026-05-21 05:14:24,294 - INFO - Trial 191 finished with value: 0.8920281602280221 and parameters: {'n_components': 73, 'algorithm': 'randomized', 'n_iter': 13, 'power_iteration_normalizer': 'auto', 'tol': 0.000819235254972695, 'C': 98.61743380840608, 'loss': 'squared_hinge', 'tol_linear_svc': 8.170562224424073e-05}. Best is trial 108 with value: 0.8922651583859675.
2026-05-21 05:15:18,224 - INFO - Trial 192 finished with value: 0.8921511791939281 and parameters: {'n_components': 73, 'algorithm': 'randomized', 'n_iter': 13, 'power_iteration_normalizer': 'LU', 'tol': 0.0008314051410593353, 'C': 55.204154922657686, 'loss': 'squared_hinge', 'tol_linear_svc': 8.66050611386229e-05}. Best is trial 108 with value: 0.8922651583859675.
2026-05-21 05:16:51,806 - INFO - Trial 197 finished with value: 0.8921727623176562 and parameters: {'n_components': 73, 'algorithm': 'randomized', 'n_iter': 4, 'power_iteration_normalizer': 'auto', 'tol': 0.0007449772942177478, 'C': 55.21858953919262, 'loss': 'squared_hinge', 'tol_linear_svc': 8.197806782425063e-05}. Best is trial 108 with value: 0.8922651583859675.
2026-05-21 05:16:52,062 - INFO - Trial 196 finished with value: 0.8921155329699119 and parameters: {'n_components': 73, 'algorithm': 'randomized', 'n_iter': 15, 'power_iteration_normalizer': 'auto', 'tol': 0.0007012185862251222, 'C': 54.77374352475357, 'loss': 'squared_hinge', 'tol_linear_svc': 7.051976957873964e-05}. Best is trial 108 with value: 0.8922651583859675.
2026-05-21 05:17:30,807 - INFO - Trial 193 finished with value: 0.8921470711524545 and parameters: {'n_components': 73, 'algorithm': 'randomized', 'n_iter': 15, 'power_iteration_normalizer': 'auto', 'tol': 0.0010780659742191938, 'C': 34.64344229798617, 'loss': 'squared_hinge', 'tol_linear_svc': 8.67868963834373e-05}. Best is trial 108 with value: 0.8922651583859675.
2026-05-21 05:17:34,859 - INFO - Trial 195 finished with value: 0.8921767216261254 and parameters: {'n_components': 73, 'algorithm': 'randomized', 'n_iter': 13, 'power_iteration_normalizer': 'auto', 'tol': 1.2103633173394611e-05, 'C': 0.5100292239260565, 'loss': 'squared_hinge', 'tol_linear_svc': 8.665913334876629e-05}. Best is trial 108 with value: 0.8922651583859675.
2026-05-21 05:18:00,456 - INFO - Trial 198 finished with value: 0.8919555098444516 and parameters: {'n_components': 73, 'algorithm': 'randomized', 'n_iter': 4, 'power_iteration_normalizer': 'auto', 'tol': 2.501582578268211e-06, 'C': 55.62451468712498, 'loss': 'squared_hinge', 'tol_linear_svc': 0.00010914365478604065}. Best is trial 108 with value: 0.8922651583859675.
2026-05-21 05:18:26,583 - INFO - Trial 194 finished with value: 0.8919434087738562 and parameters: {'n_components': 73, 'algorithm': 'randomized', 'n_iter': 15, 'power_iteration_normalizer': 'auto', 'tol': 0.0010219658816344095, 'C': 40.53182177563563, 'loss': 'squared_hinge', 'tol_linear_svc': 9.280896324608683e-05}. Best is trial 108 with value: 0.8922651583859675.
2026-05-21 05:18:55,233 - INFO - Trial 199 finished with value: 0.8922033765801711 and parameters: {'n_components': 73, 'algorithm': 'randomized', 'n_iter': 15, 'power_iteration_normalizer': 'auto', 'tol': 0.0005577367121378805, 'C': 54.518278190532754, 'loss': 'squared_hinge', 'tol_linear_svc': 0.00011996439677165503}. Best is trial 108 with value: 0.8922651583859675.
2026-05-21 05:19:43,865 - INFO - Trial 169 finished with value: 0.8919461960348951 and parameters: {'n_components': 74, 'algorithm': 'randomized', 'n_iter': 6, 'power_iteration_normalizer': 'OR', 'tol': 0.008364248078489919, 'C': 7.755107154964537, 'loss': 'squared_hinge', 'tol_linear_svc': 0.0001146108828158131}. Best is trial 108 with value: 0.8922651583859675.
2026-05-21 05:22:10,591 - INFO - Trial 162 finished with value: 0.8920029526191312 and parameters: {'n_components': 70, 'algorithm': 'randomized', 'n_iter': 9, 'power_iteration_normalizer': 'OR', 'tol': 0.002397098625195652, 'C': 22.73019026723582, 'loss': 'squared_hinge', 'tol_linear_svc': 9.16076309899962e-05}. Best is trial 108 with value: 0.8922651583859675.
2026-05-21 05:22:10,594 - INFO - Best AUC: 0.8922651583859675 | Best params: {'n_components': 75, 'algorithm': 'randomized', 'n_iter': 13, 'power_iteration_normalizer': 'LU', 'tol': 0.00013141482794734764, 'C': 0.47270366930575447, 'loss': 'squared_hinge', 'tol_linear_svc': 1.8479517614754465e-05}
2026-05-21 05:22:10,595 - INFO - ----- Saving Pipeline -----
