2026-05-20 12:26:07,731 - INFO - Trial 4 finished with value: 0.5 and parameters: {'n_components': 3, 'algorithm': 'randomized', 'n_iter': 14, 'power_iteration_normalizer': 'OR', 'tol': 8.925638252789607e-06, 'solver': 'saga', 'C': 2.620037923127566e-05, 'l1_ratio': 0.38948821611812146}. Best is trial 4 with value: 0.5.
2026-05-20 12:26:22,415 - INFO - Trial 9 finished with value: 0.7094842954395669 and parameters: {'n_components': 20, 'algorithm': 'randomized', 'n_iter': 4, 'power_iteration_normalizer': 'LU', 'tol': 2.8443665628314203e-06, 'solver': 'saga', 'C': 1.5226760981017798e-05, 'l1_ratio': 0.704131337848698}. Best is trial 9 with value: 0.7094842954395669.
2026-05-20 12:26:34,911 - INFO - Trial 5 finished with value: 0.8329242691413781 and parameters: {'n_components': 32, 'algorithm': 'randomized', 'n_iter': 4, 'power_iteration_normalizer': 'OR', 'tol': 5.454744601849945e-05, 'solver': 'saga', 'C': 5.3521740460498944e-05, 'l1_ratio': 0.3459000969203845}. Best is trial 5 with value: 0.8329242691413781.
2026-05-20 12:28:17,855 - INFO - Trial 3 finished with value: 0.8886529691329832 and parameters: {'n_components': 68, 'algorithm': 'randomized', 'n_iter': 9, 'power_iteration_normalizer': 'auto', 'tol': 0.00023564244406115156, 'solver': 'saga', 'C': 0.00035492200558840883, 'l1_ratio': 0.8926154638108101}. Best is trial 3 with value: 0.8886529691329832.
2026-05-20 12:29:19,719 - INFO - Trial 7 finished with value: 0.8872656713832805 and parameters: {'n_components': 72, 'algorithm': 'randomized', 'n_iter': 9, 'power_iteration_normalizer': 'auto', 'tol': 0.00022226236091905482, 'solver': 'saga', 'C': 0.00015799625132995615, 'l1_ratio': 0.4795087350428977}. Best is trial 3 with value: 0.8886529691329832.
2026-05-20 12:29:40,893 - INFO - Trial 8 finished with value: 0.89004723118193 and parameters: {'n_components': 69, 'algorithm': 'randomized', 'n_iter': 10, 'power_iteration_normalizer': 'auto', 'tol': 0.0002323062426738737, 'solver': 'saga', 'C': 8.495947696776449e-05, 'l1_ratio': 0.09201025005657382}. Best is trial 8 with value: 0.89004723118193.
2026-05-20 12:29:53,100 - INFO - Trial 6 pruned. 
2026-05-20 12:30:00,311 - INFO - Trial 13 finished with value: 0.8905450918162497 and parameters: {'n_components': 52, 'algorithm': 'randomized', 'n_iter': 4, 'power_iteration_normalizer': 'OR', 'tol': 0.006369052314660639, 'solver': 'saga', 'C': 0.0002167727087826551, 'l1_ratio': 0.029594222992525343}. Best is trial 13 with value: 0.8905450918162497.
2026-05-20 12:30:44,732 - INFO - Trial 15 pruned. 
2026-05-20 12:31:01,088 - INFO - Trial 16 pruned. 
2026-05-20 12:31:22,899 - INFO - Trial 17 pruned. 
2026-05-20 12:31:23,785 - INFO - Trial 19 pruned. 
2026-05-20 12:32:16,180 - INFO - Trial 20 pruned. 
2026-05-20 12:32:44,630 - INFO - Trial 12 pruned. 
2026-05-20 12:33:38,202 - INFO - Trial 0 pruned. 
2026-05-20 12:37:24,294 - INFO - Trial 1 pruned. 
2026-05-20 12:46:12,898 - INFO - ----- Fine Tuning -----
2026-05-20 12:46:12,898 - INFO - A new study created in memory with name: no-name-d7a749dc-b051-4e42-afaa-9f6256fdc708
2026-05-20 12:47:40,402 - INFO - Trial 0 finished with value: 0.7098745268370148 and parameters: {'n_components': 5, 'algorithm': 'randomized', 'n_iter': 4, 'power_iteration_normalizer': 'OR', 'tol': 3.587680459173283e-05, 'solver': 'saga', 'C': 1.802592750085776, 'l1_ratio': 0.7305267091027153}. Best is trial 0 with value: 0.7098745268370148.
2026-05-20 12:47:43,853 - INFO - Trial 9 finished with value: 0.7094526374416783 and parameters: {'n_components': 4, 'algorithm': 'randomized', 'n_iter': 9, 'power_iteration_normalizer': 'auto', 'tol': 0.000440238930856418, 'solver': 'saga', 'C': 27.99543002680004, 'l1_ratio': 0.34979793375549295}. Best is trial 0 with value: 0.7098745268370148.
2026-05-20 12:47:55,712 - INFO - Trial 7 finished with value: 0.7098753053829764 and parameters: {'n_components': 5, 'algorithm': 'randomized', 'n_iter': 8, 'power_iteration_normalizer': 'auto', 'tol': 3.852187839648536e-05, 'solver': 'saga', 'C': 1.2918813643431584, 'l1_ratio': 0.9032244716434507}. Best is trial 7 with value: 0.7098753053829764.
2026-05-20 12:48:18,188 - INFO - Trial 6 finished with value: 0.7428017327026446 and parameters: {'n_components': 21, 'algorithm': 'randomized', 'n_iter': 7, 'power_iteration_normalizer': 'auto', 'tol': 0.0001358054195543164, 'solver': 'saga', 'C': 2.353991299752265e-05, 'l1_ratio': 0.8068763037817502}. Best is trial 6 with value: 0.7428017327026446.
2026-05-20 12:49:06,715 - INFO - Trial 13 finished with value: 0.5380375729251881 and parameters: {'n_components': 2, 'algorithm': 'randomized', 'n_iter': 5, 'power_iteration_normalizer': 'LU', 'tol': 0.004539994789014129, 'solver': 'saga', 'C': 0.0002741616151381497, 'l1_ratio': 0.1944284592634492}. Best is trial 6 with value: 0.7428017327026446.
2026-05-20 12:49:09,994 - INFO - Trial 14 finished with value: 0.7094595672593329 and parameters: {'n_components': 4, 'algorithm': 'randomized', 'n_iter': 12, 'power_iteration_normalizer': 'auto', 'tol': 0.0059674596454822905, 'solver': 'saga', 'C': 0.02607152786378257, 'l1_ratio': 0.06497427061355665}. Best is trial 6 with value: 0.7428017327026446.
2026-05-20 12:49:52,122 - INFO - Trial 2 finished with value: 0.776703216580035 and parameters: {'n_components': 11, 'algorithm': 'randomized', 'n_iter': 5, 'power_iteration_normalizer': 'OR', 'tol': 0.001773979340768086, 'solver': 'saga', 'C': 4.0789886240759445, 'l1_ratio': 0.6296854983130611}. Best is trial 2 with value: 0.776703216580035.
2026-05-20 12:51:13,422 - INFO - Trial 17 finished with value: 0.7809958590853301 and parameters: {'n_components': 12, 'algorithm': 'randomized', 'n_iter': 4, 'power_iteration_normalizer': 'LU', 'tol': 3.5161951280449618e-06, 'solver': 'saga', 'C': 0.0005743067035392047, 'l1_ratio': 0.680909007993979}. Best is trial 17 with value: 0.7809958590853301.
2026-05-20 13:00:26,462 - INFO - Trial 16 finished with value: 0.8926413242755171 and parameters: {'n_components': 55, 'algorithm': 'randomized', 'n_iter': 15, 'power_iteration_normalizer': 'LU', 'tol': 0.00012945997659423976, 'solver': 'saga', 'C': 0.00629800331854468, 'l1_ratio': 0.3889805888793645}. Best is trial 16 with value: 0.8926413242755171.
2026-05-20 13:01:28,298 - INFO - Trial 12 finished with value: 0.8934698061815045 and parameters: {'n_components': 60, 'algorithm': 'randomized', 'n_iter': 8, 'power_iteration_normalizer': 'LU', 'tol': 0.00098084205584177, 'solver': 'saga', 'C': 5.060768912585233, 'l1_ratio': 0.20522524065502867}. Best is trial 12 with value: 0.8934698061815045.
2026-05-20 13:01:38,478 - INFO - Trial 15 finished with value: 0.8406213679904854 and parameters: {'n_components': 29, 'algorithm': 'randomized', 'n_iter': 15, 'power_iteration_normalizer': 'LU', 'tol': 0.0007121489455485085, 'solver': 'saga', 'C': 0.004757720273702963, 'l1_ratio': 0.9418922316265516}. Best is trial 12 with value: 0.8934698061815045.
2026-05-20 13:04:59,196 - INFO - Trial 22 finished with value: 0.8933709308314752 and parameters: {'n_components': 61, 'algorithm': 'randomized', 'n_iter': 11, 'power_iteration_normalizer': 'LU', 'tol': 0.0001653324444268343, 'solver': 'saga', 'C': 0.15389843836067935, 'l1_ratio': 0.40810723343194777}. Best is trial 12 with value: 0.8934698061815045.
2026-05-20 13:05:32,596 - INFO - Trial 4 finished with value: 0.8290469269121559 and parameters: {'n_components': 27, 'algorithm': 'randomized', 'n_iter': 3, 'power_iteration_normalizer': 'LU', 'tol': 1.1356234333602957e-05, 'solver': 'saga', 'C': 0.11096964109055335, 'l1_ratio': 0.0066521342816882045}. Best is trial 12 with value: 0.8934698061815045.
2026-05-20 13:05:32,705 - INFO - Trial 1 finished with value: 0.8596222491970019 and parameters: {'n_components': 35, 'algorithm': 'randomized', 'n_iter': 13, 'power_iteration_normalizer': 'OR', 'tol': 7.104389887773207e-06, 'solver': 'saga', 'C': 0.9220597247690787, 'l1_ratio': 0.7839023669507349}. Best is trial 12 with value: 0.8934698061815045.
2026-05-20 13:06:21,773 - INFO - Trial 20 finished with value: 0.891397925895788 and parameters: {'n_components': 52, 'algorithm': 'randomized', 'n_iter': 15, 'power_iteration_normalizer': 'LU', 'tol': 4.738469866159301e-06, 'solver': 'saga', 'C': 0.0005008700700348581, 'l1_ratio': 0.18629584726788373}. Best is trial 12 with value: 0.8934698061815045.
2026-05-20 13:07:34,257 - INFO - Trial 10 finished with value: 0.8291938404015158 and parameters: {'n_components': 28, 'algorithm': 'randomized', 'n_iter': 3, 'power_iteration_normalizer': 'LU', 'tol': 0.002003832952140287, 'solver': 'saga', 'C': 15.754260951654766, 'l1_ratio': 0.3341393760904474}. Best is trial 12 with value: 0.8934698061815045.
2026-05-20 13:09:28,828 - INFO - Trial 18 finished with value: 0.8290261803460041 and parameters: {'n_components': 27, 'algorithm': 'randomized', 'n_iter': 10, 'power_iteration_normalizer': 'LU', 'tol': 0.0007510828637797936, 'solver': 'saga', 'C': 2.2733345066835424, 'l1_ratio': 0.5131165459849027}. Best is trial 12 with value: 0.8934698061815045.
2026-05-20 13:43:24,091 - INFO - ----- Fine Tuning -----
2026-05-20 13:43:24,091 - INFO - A new study created in memory with name: no-name-3a835272-8e08-4548-b161-1ada4ea9b571
2026-05-20 13:51:33,020 - INFO - Trial 8 finished with value: 0.8943670553660142 and parameters: {'n_components': 20, 'algorithm': 'randomized', 'n_iter': 3, 'power_iteration_normalizer': 'LU', 'tol': 0.0010149913026866993, 'num_leaves': 220, 'max_depth': 3, 'learning_rate': 0.016239663455265393, 'lambda_l1': 0.009987297957903448, 'lambda_l2': 0.0017337567678018832, 'feature_fraction': 0.6701113316049467, 'bagging_fraction': 0.8097265786643473, 'bagging_freq': 3, 'min_child_samples': 22}. Best is trial 8 with value: 0.8943670553660142.
2026-05-20 13:56:37,152 - INFO - Trial 9 finished with value: 0.9304228003818931 and parameters: {'n_components': 69, 'algorithm': 'randomized', 'n_iter': 12, 'power_iteration_normalizer': 'LU', 'tol': 2.0454034090627375e-06, 'num_leaves': 139, 'max_depth': 3, 'learning_rate': 0.10111284122439886, 'lambda_l1': 0.10793708890412199, 'lambda_l2': 0.012001259404231796, 'feature_fraction': 0.6871295540789624, 'bagging_fraction': 0.704841279965814, 'bagging_freq': 4, 'min_child_samples': 65}. Best is trial 9 with value: 0.9304228003818931.
2026-05-20 14:00:37,544 - INFO - Trial 10 finished with value: 0.9263597781328929 and parameters: {'n_components': 53, 'algorithm': 'randomized', 'n_iter': 5, 'power_iteration_normalizer': 'OR', 'tol': 8.099486363693116e-06, 'num_leaves': 246, 'max_depth': 4, 'learning_rate': 0.029123422261971423, 'lambda_l1': 0.10294196659436745, 'lambda_l2': 0.0024893283274015957, 'feature_fraction': 0.9613385503397383, 'bagging_fraction': 0.8129634092813841, 'bagging_freq': 4, 'min_child_samples': 97}. Best is trial 9 with value: 0.9304228003818931.
2026-05-20 14:02:32,544 - INFO - Trial 11 finished with value: 0.9314055479270692 and parameters: {'n_components': 73, 'algorithm': 'randomized', 'n_iter': 7, 'power_iteration_normalizer': 'auto', 'tol': 0.0005463615594995925, 'num_leaves': 30, 'max_depth': 4, 'learning_rate': 0.04619621094499463, 'lambda_l1': 0.007396827798996783, 'lambda_l2': 0.010168402492429516, 'feature_fraction': 0.7179580112553181, 'bagging_fraction': 0.9780420405091808, 'bagging_freq': 7, 'min_child_samples': 91}. Best is trial 11 with value: 0.9314055479270692.
2026-05-20 14:06:12,388 - INFO - Trial 1 finished with value: 0.8612075680236618 and parameters: {'n_components': 7, 'algorithm': 'randomized', 'n_iter': 12, 'power_iteration_normalizer': 'OR', 'tol': 0.0007794141169151102, 'num_leaves': 192, 'max_depth': 12, 'learning_rate': 0.12423754821566209, 'lambda_l1': 0.017774387319163334, 'lambda_l2': 0.05195493005161798, 'feature_fraction': 0.6743722514031563, 'bagging_fraction': 0.8091094727002932, 'bagging_freq': 1, 'min_child_samples': 25}. Best is trial 11 with value: 0.9314055479270692.
2026-05-20 14:06:50,564 - INFO - Trial 12 pruned. 
2026-05-20 14:07:25,968 - INFO - Trial 0 pruned. 
2026-05-20 14:09:15,221 - INFO - Trial 2 finished with value: 0.92859926173254 and parameters: {'n_components': 42, 'algorithm': 'randomized', 'n_iter': 4, 'power_iteration_normalizer': 'LU', 'tol': 0.0027683941601047545, 'num_leaves': 33, 'max_depth': 10, 'learning_rate': 0.011222274088168416, 'lambda_l1': 0.0014990948641045384, 'lambda_l2': 0.11134106696457369, 'feature_fraction': 0.9970192633485226, 'bagging_fraction': 0.6084398209611869, 'bagging_freq': 1, 'min_child_samples': 26}. Best is trial 11 with value: 0.9314055479270692.
2026-05-20 14:10:52,779 - INFO - Trial 16 pruned. 
2026-05-20 14:13:14,278 - INFO - Trial 17 pruned. 
2026-05-20 14:13:24,792 - INFO - Trial 6 pruned. 
2026-05-20 14:26:08,819 - INFO - Trial 5 finished with value: 0.9328512018805594 and parameters: {'n_components': 30, 'algorithm': 'randomized', 'n_iter': 9, 'power_iteration_normalizer': 'LU', 'tol': 5.951745368693615e-05, 'num_leaves': 211, 'max_depth': 12, 'learning_rate': 0.05660486444995508, 'lambda_l1': 0.0783149654863201, 'lambda_l2': 0.7351575806597243, 'feature_fraction': 0.711059307963051, 'bagging_fraction': 0.8021935591045166, 'bagging_freq': 2, 'min_child_samples': 59}. Best is trial 5 with value: 0.9328512018805594.
2026-05-20 14:27:50,136 - INFO - Trial 7 finished with value: 0.9315794132260734 and parameters: {'n_components': 52, 'algorithm': 'randomized', 'n_iter': 11, 'power_iteration_normalizer': 'OR', 'tol': 0.00018910623430581528, 'num_leaves': 109, 'max_depth': 8, 'learning_rate': 0.0717615231520183, 'lambda_l1': 0.007710382021913472, 'lambda_l2': 0.0667222651246705, 'feature_fraction': 0.9353362553890802, 'bagging_fraction': 0.706396408624711, 'bagging_freq': 5, 'min_child_samples': 26}. Best is trial 5 with value: 0.9328512018805594.
2026-05-20 14:28:30,193 - INFO - Trial 20 pruned. 
2026-05-20 14:29:09,817 - INFO - Trial 19 pruned. 
2026-05-20 14:29:24,141 - INFO - Trial 18 finished with value: 0.9359604004098717 and parameters: {'n_components': 64, 'algorithm': 'randomized', 'n_iter': 9, 'power_iteration_normalizer': 'LU', 'tol': 1.1850556766671812e-05, 'num_leaves': 41, 'max_depth': 12, 'learning_rate': 0.08721207670657674, 'lambda_l1': 0.0034522765784322264, 'lambda_l2': 0.0954475657868849, 'feature_fraction': 0.7479584463552109, 'bagging_fraction': 0.9091867530568217, 'bagging_freq': 3, 'min_child_samples': 43}. Best is trial 18 with value: 0.9359604004098717.
2026-05-20 14:37:40,246 - INFO - Trial 22 finished with value: 0.934746463893626 and parameters: {'n_components': 75, 'algorithm': 'randomized', 'n_iter': 8, 'power_iteration_normalizer': 'auto', 'tol': 0.00012126293571747227, 'num_leaves': 64, 'max_depth': 5, 'learning_rate': 0.039335165457236476, 'lambda_l1': 0.12997511808696727, 'lambda_l2': 0.013621709846048501, 'feature_fraction': 0.7587988262002334, 'bagging_fraction': 0.7068800352636226, 'bagging_freq': 5, 'min_child_samples': 75}. Best is trial 18 with value: 0.9359604004098717.
2026-05-20 14:40:46,192 - INFO - Trial 21 finished with value: 0.9354018462121566 and parameters: {'n_components': 65, 'algorithm': 'randomized', 'n_iter': 8, 'power_iteration_normalizer': 'auto', 'tol': 0.00014811324956331802, 'num_leaves': 38, 'max_depth': 6, 'learning_rate': 0.03594466341299631, 'lambda_l1': 0.644746393369563, 'lambda_l2': 0.8325720018328577, 'feature_fraction': 0.7817366242037869, 'bagging_fraction': 0.9769720739253301, 'bagging_freq': 7, 'min_child_samples': 78}. Best is trial 18 with value: 0.9359604004098717.
2026-05-20 14:41:55,967 - INFO - Trial 4 finished with value: 0.939461157020039 and parameters: {'n_components': 59, 'algorithm': 'randomized', 'n_iter': 11, 'power_iteration_normalizer': 'auto', 'tol': 1.3022926982125576e-06, 'num_leaves': 128, 'max_depth': 10, 'learning_rate': 0.03409600347639228, 'lambda_l1': 1.0628563538033857, 'lambda_l2': 7.868471599504208, 'feature_fraction': 0.6626817767126574, 'bagging_fraction': 0.8049311570827886, 'bagging_freq': 2, 'min_child_samples': 78}. Best is trial 4 with value: 0.939461157020039.
2026-05-20 14:47:25,887 - INFO - Trial 13 finished with value: 0.9342245295015811 and parameters: {'n_components': 36, 'algorithm': 'randomized', 'n_iter': 7, 'power_iteration_normalizer': 'LU', 'tol': 1.0651082406349519e-05, 'num_leaves': 229, 'max_depth': 11, 'learning_rate': 0.040175999425781234, 'lambda_l1': 0.02871815308039905, 'lambda_l2': 0.04703775717546453, 'feature_fraction': 0.8103246277850004, 'bagging_fraction': 0.9664857395386383, 'bagging_freq': 3, 'min_child_samples': 57}. Best is trial 4 with value: 0.939461157020039.
2026-05-20 14:49:47,146 - INFO - Trial 27 finished with value: 0.9328336991609755 and parameters: {'n_components': 29, 'algorithm': 'randomized', 'n_iter': 9, 'power_iteration_normalizer': 'LU', 'tol': 2.2946581671571756e-05, 'num_leaves': 70, 'max_depth': 12, 'learning_rate': 0.035494043949514775, 'lambda_l1': 0.03883075974627215, 'lambda_l2': 0.7329196317408951, 'feature_fraction': 0.7733568900021824, 'bagging_fraction': 0.8682512985205202, 'bagging_freq': 3, 'min_child_samples': 73}. Best is trial 4 with value: 0.939461157020039.
2026-05-20 14:52:45,719 - INFO - Trial 14 finished with value: 0.9337489441659024 and parameters: {'n_components': 26, 'algorithm': 'randomized', 'n_iter': 9, 'power_iteration_normalizer': 'auto', 'tol': 2.3517132455966204e-05, 'num_leaves': 231, 'max_depth': 11, 'learning_rate': 0.021696368446489183, 'lambda_l1': 0.0028821099031636527, 'lambda_l2': 3.037414209020825, 'feature_fraction': 0.8894855992361811, 'bagging_fraction': 0.8827806718933013, 'bagging_freq': 5, 'min_child_samples': 91}. Best is trial 4 with value: 0.939461157020039.
2026-05-20 14:55:45,697 - INFO - Trial 26 pruned. 
2026-05-20 14:57:12,887 - INFO - Trial 23 finished with value: 0.9365853369220183 and parameters: {'n_components': 75, 'algorithm': 'randomized', 'n_iter': 8, 'power_iteration_normalizer': 'auto', 'tol': 0.00013669318891723018, 'num_leaves': 54, 'max_depth': 12, 'learning_rate': 0.04023333542823333, 'lambda_l1': 0.5701542236772802, 'lambda_l2': 0.3191939686520223, 'feature_fraction': 0.7677318035840084, 'bagging_fraction': 0.9995113235353297, 'bagging_freq': 6, 'min_child_samples': 76}. Best is trial 4 with value: 0.939461157020039.
2026-05-20 14:58:44,690 - INFO - Trial 25 finished with value: 0.9382370092387327 and parameters: {'n_components': 54, 'algorithm': 'randomized', 'n_iter': 9, 'power_iteration_normalizer': 'LU', 'tol': 9.543861192903146e-05, 'num_leaves': 86, 'max_depth': 12, 'learning_rate': 0.030074775449567086, 'lambda_l1': 0.5039803205476858, 'lambda_l2': 0.37242718826214166, 'feature_fraction': 0.7983272284841055, 'bagging_fraction': 0.7078782461074108, 'bagging_freq': 3, 'min_child_samples': 67}. Best is trial 4 with value: 0.939461157020039.
2026-05-20 14:58:48,692 - INFO - Trial 24 finished with value: 0.9379699774401272 and parameters: {'n_components': 56, 'algorithm': 'randomized', 'n_iter': 9, 'power_iteration_normalizer': 'LU', 'tol': 9.107511978493904e-05, 'num_leaves': 77, 'max_depth': 12, 'learning_rate': 0.030725817572696507, 'lambda_l1': 0.5614173586097623, 'lambda_l2': 0.36015729707776195, 'feature_fraction': 0.7986238590346277, 'bagging_fraction': 0.7074304203667447, 'bagging_freq': 3, 'min_child_samples': 64}. Best is trial 4 with value: 0.939461157020039.
2026-05-20 15:01:22,055 - INFO - Trial 28 finished with value: 0.9364514310300475 and parameters: {'n_components': 62, 'algorithm': 'randomized', 'n_iter': 8, 'power_iteration_normalizer': 'auto', 'tol': 1.7756457783839418e-05, 'num_leaves': 75, 'max_depth': 6, 'learning_rate': 0.030844213498266593, 'lambda_l1': 0.5375249992233333, 'lambda_l2': 0.29128300022384507, 'feature_fraction': 0.7886501571451492, 'bagging_fraction': 0.8874705973336088, 'bagging_freq': 3, 'min_child_samples': 75}. Best is trial 4 with value: 0.939461157020039.
2026-05-20 15:01:42,250 - INFO - Trial 3 finished with value: 0.9382685403923432 and parameters: {'n_components': 72, 'algorithm': 'randomized', 'n_iter': 15, 'power_iteration_normalizer': 'auto', 'tol': 0.0015659258236704933, 'num_leaves': 178, 'max_depth': 11, 'learning_rate': 0.015470797117604757, 'lambda_l1': 1.5467637095134998, 'lambda_l2': 0.028112238677261266, 'feature_fraction': 0.9702294321199334, 'bagging_fraction': 0.7989339026088087, 'bagging_freq': 5, 'min_child_samples': 13}. Best is trial 4 with value: 0.939461157020039.
2026-05-20 15:01:52,544 - INFO - Trial 15 finished with value: 0.9382731719558987 and parameters: {'n_components': 61, 'algorithm': 'randomized', 'n_iter': 13, 'power_iteration_normalizer': 'LU', 'tol': 0.0006922739798819307, 'num_leaves': 149, 'max_depth': 9, 'learning_rate': 0.06364682855575064, 'lambda_l1': 7.68976025599429, 'lambda_l2': 0.0040346354636227565, 'feature_fraction': 0.906177241757369, 'bagging_fraction': 0.7002044249988554, 'bagging_freq': 5, 'min_child_samples': 89}. Best is trial 4 with value: 0.939461157020039.
