2026-05-22 11:30:04,229 - INFO - ----- Fine Tuning -----
2026-05-22 11:30:04,230 - INFO - A new study created in memory with name: no-name-c8bd63cc-dcbb-48b4-b606-78addd66a638
2026-05-22 11:54:13,716 - INFO - Trial 1 finished with value: 0.8965857991211024 and parameters: {'trunsvd_n_components': 23, 'algorithm': 'randomized', 'n_iter': 3, 'power_iteration_normalizer': 'OR', 'tol': 0.0004795622597171543, 'kernel': 'cosine', 'gamma': 0.0004461580629870672, 'n_components': 66, 'n_neighbors': 7, 'weights': 'uniform', 'metric': 'euclidean', 'p': 2, 'leaf_size': 55}. Best is trial 1 with value: 0.8965857991211024.
2026-05-22 11:56:25,503 - INFO - Trial 5 finished with value: 0.8163572175130659 and parameters: {'trunsvd_n_components': 9, 'algorithm': 'randomized', 'n_iter': 13, 'power_iteration_normalizer': 'LU', 'tol': 0.0006431789115678758, 'kernel': 'sigmoid', 'gamma': 0.020906060818616158, 'n_components': 65, 'n_neighbors': 4, 'weights': 'distance', 'metric': 'minkowski', 'p': 2, 'leaf_size': 85}. Best is trial 1 with value: 0.8965857991211024.
2026-05-22 11:56:41,859 - INFO - Trial 8 finished with value: 0.8765650530207918 and parameters: {'trunsvd_n_components': 32, 'algorithm': 'randomized', 'n_iter': 4, 'power_iteration_normalizer': 'OR', 'tol': 1.3466255993143595e-05, 'kernel': 'cosine', 'gamma': 0.8154656210047344, 'n_components': 73, 'n_neighbors': 4, 'weights': 'distance', 'metric': 'euclidean', 'p': 2, 'leaf_size': 14}. Best is trial 1 with value: 0.8965857991211024.
2026-05-22 11:58:48,483 - INFO - Trial 11 finished with value: 0.8696849295081547 and parameters: {'trunsvd_n_components': 13, 'algorithm': 'randomized', 'n_iter': 8, 'power_iteration_normalizer': 'OR', 'tol': 0.00905435283826901, 'kernel': 'cosine', 'gamma': 0.01815418647771519, 'n_components': 73, 'n_neighbors': 5, 'weights': 'distance', 'metric': 'euclidean', 'p': 1, 'leaf_size': 87}. Best is trial 1 with value: 0.8965857991211024.
2026-05-22 11:58:59,650 - INFO - Trial 6 finished with value: 0.885714998736743 and parameters: {'trunsvd_n_components': 18, 'algorithm': 'randomized', 'n_iter': 7, 'power_iteration_normalizer': 'auto', 'tol': 6.850845354187376e-06, 'kernel': 'cosine', 'gamma': 0.0015879488352636658, 'n_components': 69, 'n_neighbors': 6, 'weights': 'distance', 'metric': 'minkowski', 'p': 2, 'leaf_size': 82}. Best is trial 1 with value: 0.8965857991211024.
2026-05-22 11:59:42,202 - INFO - Trial 2 pruned. 
2026-05-22 12:00:06,591 - INFO - Trial 0 finished with value: 0.8933736383814919 and parameters: {'trunsvd_n_components': 55, 'algorithm': 'randomized', 'n_iter': 5, 'power_iteration_normalizer': 'auto', 'tol': 0.008525332717514617, 'kernel': 'cosine', 'gamma': 0.03404977473714571, 'n_components': 68, 'n_neighbors': 5, 'weights': 'distance', 'metric': 'euclidean', 'p': 2, 'leaf_size': 76}. Best is trial 1 with value: 0.8965857991211024.
2026-05-22 12:00:09,122 - INFO - Trial 7 finished with value: 0.9071620645451148 and parameters: {'trunsvd_n_components': 68, 'algorithm': 'randomized', 'n_iter': 9, 'power_iteration_normalizer': 'auto', 'tol': 4.7009952431581346e-05, 'kernel': 'sigmoid', 'gamma': 0.0008110871164464996, 'n_components': 64, 'n_neighbors': 10, 'weights': 'uniform', 'metric': 'minkowski', 'p': 2, 'leaf_size': 50}. Best is trial 7 with value: 0.9071620645451148.
2026-05-22 12:01:30,184 - INFO - Trial 10 pruned. 
2026-05-22 12:03:50,691 - INFO - Trial 4 finished with value: 0.9035040093898493 and parameters: {'trunsvd_n_components': 55, 'algorithm': 'randomized', 'n_iter': 11, 'power_iteration_normalizer': 'LU', 'tol': 0.0015655859805727462, 'kernel': 'rbf', 'gamma': 0.0002582826234199285, 'n_components': 72, 'n_neighbors': 7, 'weights': 'distance', 'metric': 'euclidean', 'p': 2, 'leaf_size': 62}. Best is trial 7 with value: 0.9071620645451148.
2026-05-22 12:18:04,586 - INFO - Trial 15 pruned. 
2026-05-22 12:18:08,768 - INFO - Trial 16 pruned. 
2026-05-22 12:18:56,396 - INFO - Trial 18 pruned. 
2026-05-22 12:29:42,597 - INFO - Trial 20 finished with value: 0.9013407399373964 and parameters: {'trunsvd_n_components': 56, 'algorithm': 'randomized', 'n_iter': 11, 'power_iteration_normalizer': 'OR', 'tol': 1.1605292248621733e-06, 'kernel': 'sigmoid', 'gamma': 0.0003548159415874492, 'n_components': 71, 'n_neighbors': 8, 'weights': 'distance', 'metric': 'euclidean', 'p': 1, 'leaf_size': 67}. Best is trial 7 with value: 0.9071620645451148.
2026-05-22 12:42:37,142 - INFO - Trial 9 pruned. 
2026-05-22 12:46:06,098 - INFO - Trial 3 pruned. 
2026-05-22 13:25:22,250 - INFO - Trial 13 pruned. 
2026-05-22 13:28:57,337 - INFO - Trial 17 pruned. 
2026-05-22 16:01:56,180 - INFO - ----- Fine Tuning -----
2026-05-22 16:01:56,180 - INFO - A new study created in memory with name: no-name-37bda1ea-55a8-40c8-a187-1eceb1ffb495
2026-05-22 16:31:17,729 - INFO - Trial 0 finished with value: 0.8740649844655449 and parameters: {'trunsvd_n_components': 37, 'algorithm': 'randomized', 'n_iter': 4, 'power_iteration_normalizer': 'LU', 'tol': 0.0014979347668454637, 'kernel': 'sigmoid', 'gamma': 0.5460027800448499, 'n_components': 64, 'n_neighbors': 6, 'weights': 'distance', 'metric': 'minkowski', 'p': 2, 'leaf_size': 84}. Best is trial 0 with value: 0.8740649844655449.
2026-05-22 16:32:01,270 - INFO - Trial 8 finished with value: 0.877978515001594 and parameters: {'trunsvd_n_components': 16, 'algorithm': 'randomized', 'n_iter': 4, 'power_iteration_normalizer': 'LU', 'tol': 0.00751643327161604, 'kernel': 'rbf', 'gamma': 0.022680733526264252, 'n_components': 65, 'n_neighbors': 6, 'weights': 'distance', 'metric': 'minkowski', 'p': 2, 'leaf_size': 82}. Best is trial 8 with value: 0.877978515001594.
2026-05-22 16:32:04,106 - INFO - Trial 10 finished with value: 0.9003647476371107 and parameters: {'trunsvd_n_components': 29, 'algorithm': 'randomized', 'n_iter': 4, 'power_iteration_normalizer': 'LU', 'tol': 1.7569155165906427e-06, 'kernel': 'cosine', 'gamma': 0.0013307661468208985, 'n_components': 64, 'n_neighbors': 8, 'weights': 'uniform', 'metric': 'euclidean', 'p': 2, 'leaf_size': 24}. Best is trial 10 with value: 0.9003647476371107.
2026-05-22 16:35:18,732 - INFO - Trial 6 finished with value: 0.8222521327721299 and parameters: {'trunsvd_n_components': 5, 'algorithm': 'randomized', 'n_iter': 12, 'power_iteration_normalizer': 'LU', 'tol': 1.322491526572895e-05, 'kernel': 'sigmoid', 'gamma': 0.0002231881731075069, 'n_components': 75, 'n_neighbors': 9, 'weights': 'distance', 'metric': 'euclidean', 'p': 2, 'leaf_size': 51}. Best is trial 10 with value: 0.9003647476371107.
2026-05-22 16:35:47,047 - INFO - Trial 1 finished with value: 0.9021216776386961 and parameters: {'trunsvd_n_components': 21, 'algorithm': 'randomized', 'n_iter': 10, 'power_iteration_normalizer': 'LU', 'tol': 0.0003497652609690343, 'kernel': 'sigmoid', 'gamma': 0.00036557932446624407, 'n_components': 75, 'n_neighbors': 9, 'weights': 'distance', 'metric': 'minkowski', 'p': 2, 'leaf_size': 44}. Best is trial 1 with value: 0.9021216776386961.
2026-05-22 16:36:17,934 - INFO - Trial 11 pruned. 
2026-05-22 16:47:22,641 - INFO - Trial 13 pruned. 
2026-05-22 16:51:56,532 - INFO - Trial 16 pruned. 
2026-05-22 16:55:53,971 - INFO - Trial 12 finished with value: 0.88872732470925 and parameters: {'trunsvd_n_components': 26, 'algorithm': 'randomized', 'n_iter': 9, 'power_iteration_normalizer': 'OR', 'tol': 1.9203936886575807e-06, 'kernel': 'sigmoid', 'gamma': 0.086437118988533, 'n_components': 66, 'n_neighbors': 7, 'weights': 'distance', 'metric': 'euclidean', 'p': 1, 'leaf_size': 10}. Best is trial 1 with value: 0.9021216776386961.
2026-05-22 17:01:05,647 - INFO - Trial 17 finished with value: 0.8830563385416946 and parameters: {'trunsvd_n_components': 15, 'algorithm': 'randomized', 'n_iter': 3, 'power_iteration_normalizer': 'OR', 'tol': 0.0013903175944284913, 'kernel': 'sigmoid', 'gamma': 0.003255616686418787, 'n_components': 74, 'n_neighbors': 7, 'weights': 'uniform', 'metric': 'minkowski', 'p': 2, 'leaf_size': 100}. Best is trial 1 with value: 0.9021216776386961.
2026-05-22 17:12:05,016 - INFO - Trial 18 finished with value: 0.8874839370622782 and parameters: {'trunsvd_n_components': 20, 'algorithm': 'randomized', 'n_iter': 10, 'power_iteration_normalizer': 'OR', 'tol': 0.002878772237500876, 'kernel': 'sigmoid', 'gamma': 0.000123581730926412, 'n_components': 72, 'n_neighbors': 6, 'weights': 'distance', 'metric': 'euclidean', 'p': 2, 'leaf_size': 80}. Best is trial 1 with value: 0.9021216776386961.
2026-05-22 17:16:59,468 - INFO - Trial 19 finished with value: 0.8946960182504811 and parameters: {'trunsvd_n_components': 73, 'algorithm': 'randomized', 'n_iter': 3, 'power_iteration_normalizer': 'OR', 'tol': 4.6494987615941704e-05, 'kernel': 'rbf', 'gamma': 0.000760502740035411, 'n_components': 68, 'n_neighbors': 6, 'weights': 'distance', 'metric': 'euclidean', 'p': 2, 'leaf_size': 16}. Best is trial 1 with value: 0.9021216776386961.
2026-05-22 17:20:43,242 - INFO - Trial 20 finished with value: 0.9013116372386157 and parameters: {'trunsvd_n_components': 21, 'algorithm': 'randomized', 'n_iter': 11, 'power_iteration_normalizer': 'OR', 'tol': 0.0001261164495783385, 'kernel': 'cosine', 'gamma': 3.9767419925709104, 'n_components': 69, 'n_neighbors': 10, 'weights': 'uniform', 'metric': 'euclidean', 'p': 2, 'leaf_size': 23}. Best is trial 1 with value: 0.9021216776386961.
2026-05-22 17:22:18,253 - INFO - Trial 9 pruned. 
2026-05-22 17:27:27,997 - INFO - Trial 2 pruned. 
2026-05-22 17:28:15,416 - INFO - Trial 3 pruned. 
2026-05-22 17:29:28,131 - INFO - Trial 5 pruned. 
2026-05-22 17:41:53,147 - INFO - Trial 27 pruned. 
2026-05-22 17:43:38,752 - INFO - Trial 28 pruned. 
2026-05-22 17:54:49,715 - INFO - Trial 14 pruned. 
2026-05-22 18:02:19,664 - INFO - Trial 29 finished with value: 0.901381846147298 and parameters: {'trunsvd_n_components': 22, 'algorithm': 'randomized', 'n_iter': 9, 'power_iteration_normalizer': 'OR', 'tol': 0.00016007034088067382, 'kernel': 'cosine', 'gamma': 7.272766174515377, 'n_components': 70, 'n_neighbors': 9, 'weights': 'uniform', 'metric': 'minkowski', 'p': 2, 'leaf_size': 55}. Best is trial 1 with value: 0.9021216776386961.
2026-05-22 18:09:24,967 - INFO - Trial 4 finished with value: 0.9080034434025002 and parameters: {'trunsvd_n_components': 39, 'algorithm': 'randomized', 'n_iter': 12, 'power_iteration_normalizer': 'LU', 'tol': 0.0006108053794233863, 'kernel': 'cosine', 'gamma': 0.6916775613510883, 'n_components': 64, 'n_neighbors': 10, 'weights': 'distance', 'metric': 'manhattan', 'p': 2, 'leaf_size': 99}. Best is trial 4 with value: 0.9080034434025002.
2026-05-22 18:17:24,104 - INFO - Trial 21 pruned. 
2026-05-22 18:20:44,390 - INFO - Trial 7 finished with value: 0.9051093163621721 and parameters: {'trunsvd_n_components': 41, 'algorithm': 'randomized', 'n_iter': 3, 'power_iteration_normalizer': 'LU', 'tol': 0.0015964521731416036, 'kernel': 'sigmoid', 'gamma': 0.0003674463730820388, 'n_components': 74, 'n_neighbors': 9, 'weights': 'uniform', 'metric': 'manhattan', 'p': 1, 'leaf_size': 47}. Best is trial 4 with value: 0.9080034434025002.
2026-05-22 18:27:47,833 - INFO - Trial 24 pruned. 
2026-05-22 18:28:40,427 - INFO - Trial 25 pruned. 
2026-05-22 18:30:31,710 - INFO - Trial 26 pruned. 
2026-05-22 18:32:25,975 - INFO - Trial 15 finished with value: 0.9031547930751221 and parameters: {'trunsvd_n_components': 33, 'algorithm': 'randomized', 'n_iter': 9, 'power_iteration_normalizer': 'LU', 'tol': 1.7388669315771617e-06, 'kernel': 'sigmoid', 'gamma': 0.00020628177039741516, 'n_components': 70, 'n_neighbors': 9, 'weights': 'distance', 'metric': 'manhattan', 'p': 1, 'leaf_size': 68}. Best is trial 4 with value: 0.9080034434025002.
2026-05-22 18:38:28,887 - INFO - Trial 22 finished with value: 0.9055160766896322 and parameters: {'trunsvd_n_components': 32, 'algorithm': 'randomized', 'n_iter': 8, 'power_iteration_normalizer': 'LU', 'tol': 0.00022474492131039308, 'kernel': 'cosine', 'gamma': 1.014072738537171e-05, 'n_components': 69, 'n_neighbors': 10, 'weights': 'uniform', 'metric': 'manhattan', 'p': 1, 'leaf_size': 34}. Best is trial 4 with value: 0.9080034434025002.
2026-05-22 18:39:08,281 - INFO - Trial 23 finished with value: 0.9057691138935795 and parameters: {'trunsvd_n_components': 33, 'algorithm': 'randomized', 'n_iter': 15, 'power_iteration_normalizer': 'LU', 'tol': 0.00026851924178339565, 'kernel': 'cosine', 'gamma': 1.0836286585756297e-05, 'n_components': 69, 'n_neighbors': 10, 'weights': 'uniform', 'metric': 'manhattan', 'p': 1, 'leaf_size': 35}. Best is trial 4 with value: 0.9080034434025002.
2026-05-22 18:39:08,282 - INFO - Best AUC: 0.9080034434025002 | Best params: {'trunsvd_n_components': 39, 'algorithm': 'randomized', 'n_iter': 12, 'power_iteration_normalizer': 'LU', 'tol': 0.0006108053794233863, 'kernel': 'cosine', 'gamma': 0.6916775613510883, 'n_components': 64, 'n_neighbors': 10, 'weights': 'distance', 'metric': 'manhattan', 'p': 2, 'leaf_size': 99}
2026-05-22 18:39:08,283 - INFO - ----- Saving Pipeline -----
