2026-05-21 02:34:21,954 - INFO - ----- Model Tuning -----
2026-05-21 02:34:21,954 - INFO - A new study created in memory with name: no-name-141721f6-5dd7-463e-8598-7fc518ffde92
2026-05-21 02:34:22,723 - WARNING - Trial 1 failed with parameters: {} because of the following error: NameError("name 'TruncatedSVD' is not defined").
Traceback (most recent call last):
  File "/home/junior/Documentos/GitHub/prediction-f1-pit-stops-kaggle-competition/.venv/lib/python3.13/site-packages/optuna/study/_optimize.py", line 206, in _run_trial
    value_or_values = func(trial)
  File "/home/junior/Documentos/GitHub/prediction-f1-pit-stops-kaggle-competition/src/truncatedsvd_linear_svc_tuning.py", line 132, in <lambda>
    study.optimize(lambda trial: objective(trial, X_train, y_train), n_trials=500, n_jobs=-1, show_progress_bar=True)
                                 ~~~~~~~~~^^^^^^^^^^^^^^^^^^^^^^^^^
  File "/home/junior/Documentos/GitHub/prediction-f1-pit-stops-kaggle-competition/src/truncatedsvd_linear_svc_tuning.py", line 100, in objective
    TruncatedSVD(
    ^^^^^^^^^^^^
NameError: name 'TruncatedSVD' is not defined
2026-05-21 02:34:22,746 - WARNING - Trial 1 failed with value None.
2026-05-21 02:34:22,825 - WARNING - Trial 5 failed with parameters: {} because of the following error: NameError("name 'TruncatedSVD' is not defined").
Traceback (most recent call last):
  File "/home/junior/Documentos/GitHub/prediction-f1-pit-stops-kaggle-competition/.venv/lib/python3.13/site-packages/optuna/study/_optimize.py", line 206, in _run_trial
    value_or_values = func(trial)
  File "/home/junior/Documentos/GitHub/prediction-f1-pit-stops-kaggle-competition/src/truncatedsvd_linear_svc_tuning.py", line 132, in <lambda>
    study.optimize(lambda trial: objective(trial, X_train, y_train), n_trials=500, n_jobs=-1, show_progress_bar=True)
                                 ~~~~~~~~~^^^^^^^^^^^^^^^^^^^^^^^^^
  File "/home/junior/Documentos/GitHub/prediction-f1-pit-stops-kaggle-competition/src/truncatedsvd_linear_svc_tuning.py", line 100, in objective
    TruncatedSVD(
    ^^^^^^^^^^^^
NameError: name 'TruncatedSVD' is not defined
2026-05-21 02:34:22,829 - WARNING - Trial 3 failed with parameters: {} because of the following error: NameError("name 'TruncatedSVD' is not defined").
Traceback (most recent call last):
  File "/home/junior/Documentos/GitHub/prediction-f1-pit-stops-kaggle-competition/.venv/lib/python3.13/site-packages/optuna/study/_optimize.py", line 206, in _run_trial
    value_or_values = func(trial)
  File "/home/junior/Documentos/GitHub/prediction-f1-pit-stops-kaggle-competition/src/truncatedsvd_linear_svc_tuning.py", line 132, in <lambda>
    study.optimize(lambda trial: objective(trial, X_train, y_train), n_trials=500, n_jobs=-1, show_progress_bar=True)
                                 ~~~~~~~~~^^^^^^^^^^^^^^^^^^^^^^^^^
  File "/home/junior/Documentos/GitHub/prediction-f1-pit-stops-kaggle-competition/src/truncatedsvd_linear_svc_tuning.py", line 100, in objective
    TruncatedSVD(
    ^^^^^^^^^^^^
NameError: name 'TruncatedSVD' is not defined
2026-05-21 02:34:22,833 - WARNING - Trial 5 failed with value None.
2026-05-21 02:34:22,838 - WARNING - Trial 3 failed with value None.
2026-05-21 02:34:22,842 - WARNING - Trial 10 failed with parameters: {} because of the following error: NameError("name 'TruncatedSVD' is not defined").
Traceback (most recent call last):
  File "/home/junior/Documentos/GitHub/prediction-f1-pit-stops-kaggle-competition/.venv/lib/python3.13/site-packages/optuna/study/_optimize.py", line 206, in _run_trial
    value_or_values = func(trial)
  File "/home/junior/Documentos/GitHub/prediction-f1-pit-stops-kaggle-competition/src/truncatedsvd_linear_svc_tuning.py", line 132, in <lambda>
    study.optimize(lambda trial: objective(trial, X_train, y_train), n_trials=500, n_jobs=-1, show_progress_bar=True)
                                 ~~~~~~~~~^^^^^^^^^^^^^^^^^^^^^^^^^
  File "/home/junior/Documentos/GitHub/prediction-f1-pit-stops-kaggle-competition/src/truncatedsvd_linear_svc_tuning.py", line 100, in objective
    TruncatedSVD(
    ^^^^^^^^^^^^
NameError: name 'TruncatedSVD' is not defined
2026-05-21 02:34:22,846 - WARNING - Trial 0 failed with parameters: {} because of the following error: NameError("name 'TruncatedSVD' is not defined").
Traceback (most recent call last):
  File "/home/junior/Documentos/GitHub/prediction-f1-pit-stops-kaggle-competition/.venv/lib/python3.13/site-packages/optuna/study/_optimize.py", line 206, in _run_trial
    value_or_values = func(trial)
  File "/home/junior/Documentos/GitHub/prediction-f1-pit-stops-kaggle-competition/src/truncatedsvd_linear_svc_tuning.py", line 132, in <lambda>
    study.optimize(lambda trial: objective(trial, X_train, y_train), n_trials=500, n_jobs=-1, show_progress_bar=True)
                                 ~~~~~~~~~^^^^^^^^^^^^^^^^^^^^^^^^^
  File "/home/junior/Documentos/GitHub/prediction-f1-pit-stops-kaggle-competition/src/truncatedsvd_linear_svc_tuning.py", line 100, in objective
    TruncatedSVD(
    ^^^^^^^^^^^^
NameError: name 'TruncatedSVD' is not defined
2026-05-21 02:34:22,848 - WARNING - Trial 10 failed with value None.
2026-05-21 02:34:22,853 - WARNING - Trial 4 failed with parameters: {} because of the following error: NameError("name 'TruncatedSVD' is not defined").
Traceback (most recent call last):
  File "/home/junior/Documentos/GitHub/prediction-f1-pit-stops-kaggle-competition/.venv/lib/python3.13/site-packages/optuna/study/_optimize.py", line 206, in _run_trial
    value_or_values = func(trial)
  File "/home/junior/Documentos/GitHub/prediction-f1-pit-stops-kaggle-competition/src/truncatedsvd_linear_svc_tuning.py", line 132, in <lambda>
    study.optimize(lambda trial: objective(trial, X_train, y_train), n_trials=500, n_jobs=-1, show_progress_bar=True)
                                 ~~~~~~~~~^^^^^^^^^^^^^^^^^^^^^^^^^
  File "/home/junior/Documentos/GitHub/prediction-f1-pit-stops-kaggle-competition/src/truncatedsvd_linear_svc_tuning.py", line 100, in objective
    TruncatedSVD(
    ^^^^^^^^^^^^
NameError: name 'TruncatedSVD' is not defined
2026-05-21 02:34:22,856 - WARNING - Trial 0 failed with value None.
2026-05-21 02:34:22,857 - WARNING - Trial 2 failed with parameters: {} because of the following error: NameError("name 'TruncatedSVD' is not defined").
Traceback (most recent call last):
  File "/home/junior/Documentos/GitHub/prediction-f1-pit-stops-kaggle-competition/.venv/lib/python3.13/site-packages/optuna/study/_optimize.py", line 206, in _run_trial
    value_or_values = func(trial)
  File "/home/junior/Documentos/GitHub/prediction-f1-pit-stops-kaggle-competition/src/truncatedsvd_linear_svc_tuning.py", line 132, in <lambda>
    study.optimize(lambda trial: objective(trial, X_train, y_train), n_trials=500, n_jobs=-1, show_progress_bar=True)
                                 ~~~~~~~~~^^^^^^^^^^^^^^^^^^^^^^^^^
  File "/home/junior/Documentos/GitHub/prediction-f1-pit-stops-kaggle-competition/src/truncatedsvd_linear_svc_tuning.py", line 100, in objective
    TruncatedSVD(
    ^^^^^^^^^^^^
NameError: name 'TruncatedSVD' is not defined
2026-05-21 02:34:22,858 - WARNING - Trial 4 failed with value None.
2026-05-21 02:34:22,861 - WARNING - Trial 6 failed with parameters: {} because of the following error: NameError("name 'TruncatedSVD' is not defined").
Traceback (most recent call last):
  File "/home/junior/Documentos/GitHub/prediction-f1-pit-stops-kaggle-competition/.venv/lib/python3.13/site-packages/optuna/study/_optimize.py", line 206, in _run_trial
    value_or_values = func(trial)
  File "/home/junior/Documentos/GitHub/prediction-f1-pit-stops-kaggle-competition/src/truncatedsvd_linear_svc_tuning.py", line 132, in <lambda>
    study.optimize(lambda trial: objective(trial, X_train, y_train), n_trials=500, n_jobs=-1, show_progress_bar=True)
                                 ~~~~~~~~~^^^^^^^^^^^^^^^^^^^^^^^^^
  File "/home/junior/Documentos/GitHub/prediction-f1-pit-stops-kaggle-competition/src/truncatedsvd_linear_svc_tuning.py", line 100, in objective
    TruncatedSVD(
    ^^^^^^^^^^^^
NameError: name 'TruncatedSVD' is not defined
2026-05-21 02:34:22,862 - WARNING - Trial 9 failed with parameters: {} because of the following error: NameError("name 'TruncatedSVD' is not defined").
Traceback (most recent call last):
  File "/home/junior/Documentos/GitHub/prediction-f1-pit-stops-kaggle-competition/.venv/lib/python3.13/site-packages/optuna/study/_optimize.py", line 206, in _run_trial
    value_or_values = func(trial)
  File "/home/junior/Documentos/GitHub/prediction-f1-pit-stops-kaggle-competition/src/truncatedsvd_linear_svc_tuning.py", line 132, in <lambda>
    study.optimize(lambda trial: objective(trial, X_train, y_train), n_trials=500, n_jobs=-1, show_progress_bar=True)
                                 ~~~~~~~~~^^^^^^^^^^^^^^^^^^^^^^^^^
  File "/home/junior/Documentos/GitHub/prediction-f1-pit-stops-kaggle-competition/src/truncatedsvd_linear_svc_tuning.py", line 100, in objective
    TruncatedSVD(
    ^^^^^^^^^^^^
NameError: name 'TruncatedSVD' is not defined
2026-05-21 02:34:22,863 - WARNING - Trial 2 failed with value None.
2026-05-21 02:34:22,865 - WARNING - Trial 6 failed with value None.
2026-05-21 02:34:22,866 - WARNING - Trial 9 failed with value None.
2026-05-21 02:34:22,867 - WARNING - Trial 11 failed with parameters: {} because of the following error: NameError("name 'TruncatedSVD' is not defined").
Traceback (most recent call last):
  File "/home/junior/Documentos/GitHub/prediction-f1-pit-stops-kaggle-competition/.venv/lib/python3.13/site-packages/optuna/study/_optimize.py", line 206, in _run_trial
    value_or_values = func(trial)
  File "/home/junior/Documentos/GitHub/prediction-f1-pit-stops-kaggle-competition/src/truncatedsvd_linear_svc_tuning.py", line 132, in <lambda>
    study.optimize(lambda trial: objective(trial, X_train, y_train), n_trials=500, n_jobs=-1, show_progress_bar=True)
                                 ~~~~~~~~~^^^^^^^^^^^^^^^^^^^^^^^^^
  File "/home/junior/Documentos/GitHub/prediction-f1-pit-stops-kaggle-competition/src/truncatedsvd_linear_svc_tuning.py", line 100, in objective
    TruncatedSVD(
    ^^^^^^^^^^^^
NameError: name 'TruncatedSVD' is not defined
2026-05-21 02:34:22,868 - WARNING - Trial 11 failed with value None.
2026-05-21 02:34:22,868 - WARNING - Trial 8 failed with parameters: {} because of the following error: NameError("name 'TruncatedSVD' is not defined").
Traceback (most recent call last):
  File "/home/junior/Documentos/GitHub/prediction-f1-pit-stops-kaggle-competition/.venv/lib/python3.13/site-packages/optuna/study/_optimize.py", line 206, in _run_trial
    value_or_values = func(trial)
  File "/home/junior/Documentos/GitHub/prediction-f1-pit-stops-kaggle-competition/src/truncatedsvd_linear_svc_tuning.py", line 132, in <lambda>
    study.optimize(lambda trial: objective(trial, X_train, y_train), n_trials=500, n_jobs=-1, show_progress_bar=True)
                                 ~~~~~~~~~^^^^^^^^^^^^^^^^^^^^^^^^^
  File "/home/junior/Documentos/GitHub/prediction-f1-pit-stops-kaggle-competition/src/truncatedsvd_linear_svc_tuning.py", line 100, in objective
    TruncatedSVD(
    ^^^^^^^^^^^^
NameError: name 'TruncatedSVD' is not defined
2026-05-21 02:34:22,869 - WARNING - Trial 8 failed with value None.
2026-05-21 02:34:22,870 - WARNING - Trial 7 failed with parameters: {} because of the following error: NameError("name 'TruncatedSVD' is not defined").
Traceback (most recent call last):
  File "/home/junior/Documentos/GitHub/prediction-f1-pit-stops-kaggle-competition/.venv/lib/python3.13/site-packages/optuna/study/_optimize.py", line 206, in _run_trial
    value_or_values = func(trial)
  File "/home/junior/Documentos/GitHub/prediction-f1-pit-stops-kaggle-competition/src/truncatedsvd_linear_svc_tuning.py", line 132, in <lambda>
    study.optimize(lambda trial: objective(trial, X_train, y_train), n_trials=500, n_jobs=-1, show_progress_bar=True)
                                 ~~~~~~~~~^^^^^^^^^^^^^^^^^^^^^^^^^
  File "/home/junior/Documentos/GitHub/prediction-f1-pit-stops-kaggle-competition/src/truncatedsvd_linear_svc_tuning.py", line 100, in objective
    TruncatedSVD(
    ^^^^^^^^^^^^
NameError: name 'TruncatedSVD' is not defined
2026-05-21 02:34:22,870 - WARNING - Trial 7 failed with value None.
2026-05-21 02:34:46,377 - INFO - ----- Model Tuning -----
2026-05-21 02:34:46,377 - INFO - A new study created in memory with name: no-name-38847e08-5093-4f00-a058-6bfbc47f013c
2026-05-21 02:37:36,527 - INFO - Trial 5 finished with value: 0.7118509839121787 and parameters: {'n_components': 6, 'algorithm': 'randomized', 'n_iter': 5, 'power_iteration_normalizer': 'auto', 'tol': 0.0012220033663959842, 'C': 0.00025691398706670967, 'loss': 'squared_hinge', 'tol_linear_svc': 1.408597938860387e-06}. Best is trial 5 with value: 0.7118509839121787.
2026-05-21 02:37:49,480 - INFO - Trial 3 finished with value: 0.8283371096329668 and parameters: {'n_components': 27, 'algorithm': 'randomized', 'n_iter': 3, 'power_iteration_normalizer': 'OR', 'tol': 3.724324397451846e-05, 'C': 26.76428981389407, 'loss': 'squared_hinge', 'tol_linear_svc': 1.0732480379300003e-06}. Best is trial 3 with value: 0.8283371096329668.
2026-05-21 02:37:57,916 - INFO - Trial 8 finished with value: 0.8437058497745398 and parameters: {'n_components': 34, 'algorithm': 'randomized', 'n_iter': 4, 'power_iteration_normalizer': 'OR', 'tol': 0.002071053893384042, 'C': 0.00040903569721714006, 'loss': 'squared_hinge', 'tol_linear_svc': 1.5572272042763522e-06}. Best is trial 8 with value: 0.8437058497745398.
2026-05-21 02:37:58,634 - INFO - Trial 1 finished with value: 0.815634779568432 and parameters: {'n_components': 22, 'algorithm': 'randomized', 'n_iter': 6, 'power_iteration_normalizer': 'auto', 'tol': 6.91659644509189e-06, 'C': 4.10730268287655e-05, 'loss': 'squared_hinge', 'tol_linear_svc': 0.0026421614625663204}. Best is trial 8 with value: 0.8437058497745398.
2026-05-21 02:37:58,990 - INFO - Trial 0 finished with value: 0.5452979227026635 and parameters: {'n_components': 2, 'algorithm': 'randomized', 'n_iter': 11, 'power_iteration_normalizer': 'auto', 'tol': 0.0001609847004458423, 'C': 0.040825212673584445, 'loss': 'squared_hinge', 'tol_linear_svc': 0.0006487291789042482}. Best is trial 8 with value: 0.8437058497745398.
2026-05-21 02:37:59,861 - INFO - Trial 6 finished with value: 0.8200431042819725 and parameters: {'n_components': 24, 'algorithm': 'randomized', 'n_iter': 6, 'power_iteration_normalizer': 'LU', 'tol': 0.005059351834830443, 'C': 50.33201316430299, 'loss': 'squared_hinge', 'tol_linear_svc': 7.169203802259246e-05}. Best is trial 8 with value: 0.8437058497745398.
2026-05-21 02:38:38,150 - INFO - Trial 11 finished with value: 0.8917482005049315 and parameters: {'n_components': 67, 'algorithm': 'randomized', 'n_iter': 7, 'power_iteration_normalizer': 'auto', 'tol': 0.00022713717289118797, 'C': 0.039475226351239734, 'loss': 'squared_hinge', 'tol_linear_svc': 0.0008868556027889647}. Best is trial 11 with value: 0.8917482005049315.
2026-05-21 02:38:48,204 - INFO - Trial 2 finished with value: 0.8755169322759025 and parameters: {'n_components': 36, 'algorithm': 'randomized', 'n_iter': 8, 'power_iteration_normalizer': 'LU', 'tol': 5.218270721399725e-05, 'C': 0.00878663671472065, 'loss': 'squared_hinge', 'tol_linear_svc': 0.00021781545563276866}. Best is trial 11 with value: 0.8917482005049315.
2026-05-21 02:39:05,383 - INFO - Trial 9 finished with value: 0.879067704096334 and parameters: {'n_components': 41, 'algorithm': 'randomized', 'n_iter': 10, 'power_iteration_normalizer': 'LU', 'tol': 2.9718290832153007e-05, 'C': 0.2184229396255577, 'loss': 'squared_hinge', 'tol_linear_svc': 0.007504912429196006}. Best is trial 11 with value: 0.8917482005049315.
2026-05-21 02:39:06,832 - INFO - Trial 4 finished with value: 0.8918927832890502 and parameters: {'n_components': 62, 'algorithm': 'randomized', 'n_iter': 9, 'power_iteration_normalizer': 'LU', 'tol': 1.6898021574812687e-06, 'C': 0.00036166525644333906, 'loss': 'squared_hinge', 'tol_linear_svc': 0.00021148562889456546}. Best is trial 4 with value: 0.8918927832890502.
2026-05-21 02:39:41,458 - INFO - Trial 13 pruned. 
2026-05-21 02:40:24,881 - INFO - Trial 14 pruned. 
2026-05-21 02:40:46,828 - INFO - Trial 17 pruned. 
2026-05-21 02:41:19,110 - INFO - Trial 7 finished with value: 0.8894446229470546 and parameters: {'n_components': 50, 'algorithm': 'randomized', 'n_iter': 8, 'power_iteration_normalizer': 'OR', 'tol': 1.7614504074918555e-06, 'C': 0.07513585644898324, 'loss': 'squared_hinge', 'tol_linear_svc': 0.0005350062217822883}. Best is trial 4 with value: 0.8918927832890502.
2026-05-21 02:42:33,318 - INFO - Trial 15 finished with value: 0.8864757691172794 and parameters: {'n_components': 43, 'algorithm': 'randomized', 'n_iter': 4, 'power_iteration_normalizer': 'OR', 'tol': 0.0002767715943680487, 'C': 43.30036638143843, 'loss': 'squared_hinge', 'tol_linear_svc': 0.00018196278842944974}. Best is trial 4 with value: 0.8918927832890502.
2026-05-21 02:42:58,651 - INFO - Trial 20 pruned. 
2026-05-21 02:43:21,368 - INFO - ----- Model Tuning -----
2026-05-21 02:43:21,368 - INFO - A new study created in memory with name: no-name-c6b25cf5-3382-4092-b6a5-3c66995e04ac
2026-05-21 02:45:44,547 - INFO - Trial 8 finished with value: 0.5503104824896246 and parameters: {'n_components': 3, 'algorithm': 'randomized', 'n_iter': 4, 'power_iteration_normalizer': 'LU', 'tol': 3.223429067797448e-05, 'C': 22.276730493899354, 'loss': 'squared_hinge', 'tol_linear_svc': 1.4339886771509951e-06}. Best is trial 8 with value: 0.5503104824896246.
2026-05-21 02:46:27,580 - INFO - Trial 9 finished with value: 0.5882330609022205 and parameters: {'n_components': 4, 'algorithm': 'randomized', 'n_iter': 14, 'power_iteration_normalizer': 'OR', 'tol': 6.526229510293528e-05, 'C': 3.8284855815744043, 'loss': 'squared_hinge', 'tol_linear_svc': 0.00013176482401605925}. Best is trial 9 with value: 0.5882330609022205.
2026-05-21 02:46:27,790 - INFO - Trial 4 finished with value: 0.8406977212758842 and parameters: {'n_components': 31, 'algorithm': 'randomized', 'n_iter': 4, 'power_iteration_normalizer': 'auto', 'tol': 3.230955668501256e-05, 'C': 0.0007425345261635809, 'loss': 'squared_hinge', 'tol_linear_svc': 0.00031671260716890074}. Best is trial 4 with value: 0.8406977212758842.
2026-05-21 02:46:54,524 - INFO - Trial 0 finished with value: 0.7983432122965191 and parameters: {'n_components': 15, 'algorithm': 'randomized', 'n_iter': 15, 'power_iteration_normalizer': 'OR', 'tol': 1.5516417775589667e-06, 'C': 2.4503276628130433, 'loss': 'squared_hinge', 'tol_linear_svc': 3.12522372441104e-06}. Best is trial 4 with value: 0.8406977212758842.
2026-05-21 02:46:54,562 - INFO - Trial 10 finished with value: 0.8399645287117006 and parameters: {'n_components': 29, 'algorithm': 'randomized', 'n_iter': 10, 'power_iteration_normalizer': 'auto', 'tol': 0.006274294458746742, 'C': 0.0008688057341966558, 'loss': 'squared_hinge', 'tol_linear_svc': 0.006706627544407955}. Best is trial 4 with value: 0.8406977212758842.
2026-05-21 02:47:12,184 - INFO - Trial 11 finished with value: 0.8159810196884081 and parameters: {'n_components': 23, 'algorithm': 'randomized', 'n_iter': 12, 'power_iteration_normalizer': 'auto', 'tol': 0.0033451165933841964, 'C': 7.303887465393694e-05, 'loss': 'squared_hinge', 'tol_linear_svc': 0.0004287565132338608}. Best is trial 4 with value: 0.8406977212758842.
2026-05-21 02:47:27,108 - INFO - Trial 2 finished with value: 0.8632336161931455 and parameters: {'n_components': 37, 'algorithm': 'randomized', 'n_iter': 9, 'power_iteration_normalizer': 'OR', 'tol': 0.0004789545897667033, 'C': 1.6506915850711303, 'loss': 'squared_hinge', 'tol_linear_svc': 0.008315997324413656}. Best is trial 2 with value: 0.8632336161931455.
2026-05-21 02:47:56,985 - INFO - Trial 5 finished with value: 0.8757587601372372 and parameters: {'n_components': 37, 'algorithm': 'randomized', 'n_iter': 15, 'power_iteration_normalizer': 'auto', 'tol': 5.602073127814217e-06, 'C': 0.0002939151717775303, 'loss': 'squared_hinge', 'tol_linear_svc': 5.385658562386833e-06}. Best is trial 5 with value: 0.8757587601372372.
2026-05-21 02:47:57,540 - INFO - Trial 14 pruned. 
2026-05-21 02:48:13,013 - INFO - Trial 13 pruned. 
2026-05-21 02:48:23,394 - INFO - Trial 7 finished with value: 0.8907749656119718 and parameters: {'n_components': 52, 'algorithm': 'randomized', 'n_iter': 9, 'power_iteration_normalizer': 'auto', 'tol': 1.926618494404807e-06, 'C': 0.0824625681229889, 'loss': 'squared_hinge', 'tol_linear_svc': 0.0010242849148385095}. Best is trial 7 with value: 0.8907749656119718.
2026-05-21 02:48:51,810 - INFO - Trial 1 finished with value: 0.8911006373532416 and parameters: {'n_components': 72, 'algorithm': 'randomized', 'n_iter': 3, 'power_iteration_normalizer': 'LU', 'tol': 0.00013420706381876693, 'C': 0.015774810537195618, 'loss': 'squared_hinge', 'tol_linear_svc': 1.5494209742878745e-06}. Best is trial 1 with value: 0.8911006373532416.
2026-05-21 02:49:00,631 - INFO - Trial 12 finished with value: 0.8399621211706402 and parameters: {'n_components': 29, 'algorithm': 'randomized', 'n_iter': 3, 'power_iteration_normalizer': 'auto', 'tol': 0.0011978627974829426, 'C': 0.0003195039667532244, 'loss': 'squared_hinge', 'tol_linear_svc': 1.6037545153484512e-06}. Best is trial 1 with value: 0.8911006373532416.
2026-05-21 02:49:11,840 - INFO - Trial 16 pruned. 
2026-05-21 02:49:18,834 - INFO - Trial 6 finished with value: 0.8920338174802241 and parameters: {'n_components': 73, 'algorithm': 'randomized', 'n_iter': 15, 'power_iteration_normalizer': 'LU', 'tol': 6.691818433269383e-05, 'C': 0.06512206050621147, 'loss': 'squared_hinge', 'tol_linear_svc': 0.0011365539464118619}. Best is trial 6 with value: 0.8920338174802241.
2026-05-21 02:49:19,474 - INFO - Trial 15 pruned. 
2026-05-21 02:49:43,239 - INFO - Trial 20 pruned. 
