2026-05-21 19:49:56,673 - INFO - ----- Fine Tuning -----
2026-05-21 19:49:56,673 - INFO - A new study created in memory with name: no-name-7dacd673-f981-45d6-9d0f-bc1f69ce27f8
2026-05-21 19:49:57,473 - WARNING - Trial 8 failed with parameters: {'n_components': 7, 'algorithm': 'randomized', 'n_iter': 12, 'power_iteration_normalizer': 'OR', 'tol': 3.04295856132677e-05, 'gamma': 9.719310643637593e-06} because of the following error: ValueError('Cannot set different log configuration to the same parameter name.').
Traceback (most recent call last):
  File "/home/junior/Documentos/GitHub/prediction-f1-pit-stops-kaggle-competition/.venv/lib/python3.13/site-packages/optuna/study/_optimize.py", line 206, in _run_trial
    value_or_values = func(trial)
  File "/home/junior/Documentos/GitHub/prediction-f1-pit-stops-kaggle-competition/src/truncatedsvd_rbfsampler_knn_tuning.py", line 127, in <lambda>
    study.optimize(lambda trial: objective(trial, X_train, y_train), n_trials=30, n_jobs=-1, show_progress_bar=True)
                                 ~~~~~~~~~^^^^^^^^^^^^^^^^^^^^^^^^^
  File "/home/junior/Documentos/GitHub/prediction-f1-pit-stops-kaggle-competition/src/truncatedsvd_rbfsampler_knn_tuning.py", line 102, in objective
    n_components=trial.suggest_int("n_components", 64, 75, log=True),
                 ~~~~~~~~~~~~~~~~~^^^^^^^^^^^^^^^^^^^^^^^^^^^^^^^^^^
  File "/home/junior/Documentos/GitHub/prediction-f1-pit-stops-kaggle-competition/.venv/lib/python3.13/site-packages/optuna/_convert_positional_args.py", line 127, in converter_wrapper
    return func(**kwargs)  # type: ignore[call-arg]
  File "/home/junior/Documentos/GitHub/prediction-f1-pit-stops-kaggle-competition/.venv/lib/python3.13/site-packages/optuna/trial/_trial.py", line 336, in suggest_int
    suggested_value = int(self._suggest(name, distribution))
                          ~~~~~~~~~~~~~^^^^^^^^^^^^^^^^^^^^
  File "/home/junior/Documentos/GitHub/prediction-f1-pit-stops-kaggle-competition/.venv/lib/python3.13/site-packages/optuna/trial/_trial.py", line 632, in _suggest
    distributions.check_distribution_compatibility(trial.distributions[name], distribution)
    ~~~~~~~~~~~~~~~~~~~~~~~~~~~~~~~~~~~~~~~~~~~~~~^^^^^^^^^^^^^^^^^^^^^^^^^^^^^^^^^^^^^^^^^
  File "/home/junior/Documentos/GitHub/prediction-f1-pit-stops-kaggle-competition/.venv/lib/python3.13/site-packages/optuna/distributions.py", line 649, in check_distribution_compatibility
    raise ValueError("Cannot set different log configuration to the same parameter name.")
ValueError: Cannot set different log configuration to the same parameter name.
2026-05-21 19:49:57,493 - WARNING - Trial 7 failed with parameters: {'n_components': 52, 'algorithm': 'randomized', 'n_iter': 6, 'power_iteration_normalizer': 'OR', 'tol': 3.3882832054610013e-06, 'gamma': 2.1189283467586074e-05} because of the following error: ValueError('Cannot set different log configuration to the same parameter name.').
Traceback (most recent call last):
  File "/home/junior/Documentos/GitHub/prediction-f1-pit-stops-kaggle-competition/.venv/lib/python3.13/site-packages/optuna/study/_optimize.py", line 206, in _run_trial
    value_or_values = func(trial)
  File "/home/junior/Documentos/GitHub/prediction-f1-pit-stops-kaggle-competition/src/truncatedsvd_rbfsampler_knn_tuning.py", line 127, in <lambda>
    study.optimize(lambda trial: objective(trial, X_train, y_train), n_trials=30, n_jobs=-1, show_progress_bar=True)
                                 ~~~~~~~~~^^^^^^^^^^^^^^^^^^^^^^^^^
  File "/home/junior/Documentos/GitHub/prediction-f1-pit-stops-kaggle-competition/src/truncatedsvd_rbfsampler_knn_tuning.py", line 102, in objective
    n_components=trial.suggest_int("n_components", 64, 75, log=True),
                 ~~~~~~~~~~~~~~~~~^^^^^^^^^^^^^^^^^^^^^^^^^^^^^^^^^^
  File "/home/junior/Documentos/GitHub/prediction-f1-pit-stops-kaggle-competition/.venv/lib/python3.13/site-packages/optuna/_convert_positional_args.py", line 127, in converter_wrapper
    return func(**kwargs)  # type: ignore[call-arg]
  File "/home/junior/Documentos/GitHub/prediction-f1-pit-stops-kaggle-competition/.venv/lib/python3.13/site-packages/optuna/trial/_trial.py", line 336, in suggest_int
    suggested_value = int(self._suggest(name, distribution))
                          ~~~~~~~~~~~~~^^^^^^^^^^^^^^^^^^^^
  File "/home/junior/Documentos/GitHub/prediction-f1-pit-stops-kaggle-competition/.venv/lib/python3.13/site-packages/optuna/trial/_trial.py", line 632, in _suggest
    distributions.check_distribution_compatibility(trial.distributions[name], distribution)
    ~~~~~~~~~~~~~~~~~~~~~~~~~~~~~~~~~~~~~~~~~~~~~~^^^^^^^^^^^^^^^^^^^^^^^^^^^^^^^^^^^^^^^^^
  File "/home/junior/Documentos/GitHub/prediction-f1-pit-stops-kaggle-competition/.venv/lib/python3.13/site-packages/optuna/distributions.py", line 649, in check_distribution_compatibility
    raise ValueError("Cannot set different log configuration to the same parameter name.")
ValueError: Cannot set different log configuration to the same parameter name.
2026-05-21 19:49:57,494 - WARNING - Trial 1 failed with parameters: {'n_components': 20, 'algorithm': 'randomized', 'n_iter': 4, 'power_iteration_normalizer': 'auto', 'tol': 2.0674442941046094e-05, 'gamma': 0.00046812640471680095} because of the following error: ValueError('Cannot set different log configuration to the same parameter name.').
Traceback (most recent call last):
  File "/home/junior/Documentos/GitHub/prediction-f1-pit-stops-kaggle-competition/.venv/lib/python3.13/site-packages/optuna/study/_optimize.py", line 206, in _run_trial
    value_or_values = func(trial)
  File "/home/junior/Documentos/GitHub/prediction-f1-pit-stops-kaggle-competition/src/truncatedsvd_rbfsampler_knn_tuning.py", line 127, in <lambda>
    study.optimize(lambda trial: objective(trial, X_train, y_train), n_trials=30, n_jobs=-1, show_progress_bar=True)
                                 ~~~~~~~~~^^^^^^^^^^^^^^^^^^^^^^^^^
  File "/home/junior/Documentos/GitHub/prediction-f1-pit-stops-kaggle-competition/src/truncatedsvd_rbfsampler_knn_tuning.py", line 102, in objective
    n_components=trial.suggest_int("n_components", 64, 75, log=True),
                 ~~~~~~~~~~~~~~~~~^^^^^^^^^^^^^^^^^^^^^^^^^^^^^^^^^^
  File "/home/junior/Documentos/GitHub/prediction-f1-pit-stops-kaggle-competition/.venv/lib/python3.13/site-packages/optuna/_convert_positional_args.py", line 127, in converter_wrapper
    return func(**kwargs)  # type: ignore[call-arg]
  File "/home/junior/Documentos/GitHub/prediction-f1-pit-stops-kaggle-competition/.venv/lib/python3.13/site-packages/optuna/trial/_trial.py", line 336, in suggest_int
    suggested_value = int(self._suggest(name, distribution))
                          ~~~~~~~~~~~~~^^^^^^^^^^^^^^^^^^^^
  File "/home/junior/Documentos/GitHub/prediction-f1-pit-stops-kaggle-competition/.venv/lib/python3.13/site-packages/optuna/trial/_trial.py", line 632, in _suggest
    distributions.check_distribution_compatibility(trial.distributions[name], distribution)
    ~~~~~~~~~~~~~~~~~~~~~~~~~~~~~~~~~~~~~~~~~~~~~~^^^^^^^^^^^^^^^^^^^^^^^^^^^^^^^^^^^^^^^^^
  File "/home/junior/Documentos/GitHub/prediction-f1-pit-stops-kaggle-competition/.venv/lib/python3.13/site-packages/optuna/distributions.py", line 649, in check_distribution_compatibility
    raise ValueError("Cannot set different log configuration to the same parameter name.")
ValueError: Cannot set different log configuration to the same parameter name.
2026-05-21 19:49:57,497 - WARNING - Trial 2 failed with parameters: {'n_components': 28, 'algorithm': 'randomized', 'n_iter': 14, 'power_iteration_normalizer': 'auto', 'tol': 0.00044517196801787556, 'gamma': 0.0002693769678974672} because of the following error: ValueError('Cannot set different log configuration to the same parameter name.').
Traceback (most recent call last):
  File "/home/junior/Documentos/GitHub/prediction-f1-pit-stops-kaggle-competition/.venv/lib/python3.13/site-packages/optuna/study/_optimize.py", line 206, in _run_trial
    value_or_values = func(trial)
  File "/home/junior/Documentos/GitHub/prediction-f1-pit-stops-kaggle-competition/src/truncatedsvd_rbfsampler_knn_tuning.py", line 127, in <lambda>
    study.optimize(lambda trial: objective(trial, X_train, y_train), n_trials=30, n_jobs=-1, show_progress_bar=True)
                                 ~~~~~~~~~^^^^^^^^^^^^^^^^^^^^^^^^^
  File "/home/junior/Documentos/GitHub/prediction-f1-pit-stops-kaggle-competition/src/truncatedsvd_rbfsampler_knn_tuning.py", line 102, in objective
    n_components=trial.suggest_int("n_components", 64, 75, log=True),
                 ~~~~~~~~~~~~~~~~~^^^^^^^^^^^^^^^^^^^^^^^^^^^^^^^^^^
  File "/home/junior/Documentos/GitHub/prediction-f1-pit-stops-kaggle-competition/.venv/lib/python3.13/site-packages/optuna/_convert_positional_args.py", line 127, in converter_wrapper
    return func(**kwargs)  # type: ignore[call-arg]
  File "/home/junior/Documentos/GitHub/prediction-f1-pit-stops-kaggle-competition/.venv/lib/python3.13/site-packages/optuna/trial/_trial.py", line 336, in suggest_int
    suggested_value = int(self._suggest(name, distribution))
                          ~~~~~~~~~~~~~^^^^^^^^^^^^^^^^^^^^
  File "/home/junior/Documentos/GitHub/prediction-f1-pit-stops-kaggle-competition/.venv/lib/python3.13/site-packages/optuna/trial/_trial.py", line 632, in _suggest
    distributions.check_distribution_compatibility(trial.distributions[name], distribution)
    ~~~~~~~~~~~~~~~~~~~~~~~~~~~~~~~~~~~~~~~~~~~~~~^^^^^^^^^^^^^^^^^^^^^^^^^^^^^^^^^^^^^^^^^
  File "/home/junior/Documentos/GitHub/prediction-f1-pit-stops-kaggle-competition/.venv/lib/python3.13/site-packages/optuna/distributions.py", line 649, in check_distribution_compatibility
    raise ValueError("Cannot set different log configuration to the same parameter name.")
ValueError: Cannot set different log configuration to the same parameter name.
2026-05-21 19:49:57,543 - WARNING - Trial 5 failed with parameters: {'n_components': 18, 'algorithm': 'randomized', 'n_iter': 14, 'power_iteration_normalizer': 'OR', 'tol': 6.0641104394510104e-05, 'gamma': 0.002153896556815113} because of the following error: ValueError('Cannot set different log configuration to the same parameter name.').
Traceback (most recent call last):
  File "/home/junior/Documentos/GitHub/prediction-f1-pit-stops-kaggle-competition/.venv/lib/python3.13/site-packages/optuna/study/_optimize.py", line 206, in _run_trial
    value_or_values = func(trial)
  File "/home/junior/Documentos/GitHub/prediction-f1-pit-stops-kaggle-competition/src/truncatedsvd_rbfsampler_knn_tuning.py", line 127, in <lambda>
    study.optimize(lambda trial: objective(trial, X_train, y_train), n_trials=30, n_jobs=-1, show_progress_bar=True)
                                 ~~~~~~~~~^^^^^^^^^^^^^^^^^^^^^^^^^
  File "/home/junior/Documentos/GitHub/prediction-f1-pit-stops-kaggle-competition/src/truncatedsvd_rbfsampler_knn_tuning.py", line 102, in objective
    n_components=trial.suggest_int("n_components", 64, 75, log=True),
                 ~~~~~~~~~~~~~~~~~^^^^^^^^^^^^^^^^^^^^^^^^^^^^^^^^^^
  File "/home/junior/Documentos/GitHub/prediction-f1-pit-stops-kaggle-competition/.venv/lib/python3.13/site-packages/optuna/_convert_positional_args.py", line 127, in converter_wrapper
    return func(**kwargs)  # type: ignore[call-arg]
  File "/home/junior/Documentos/GitHub/prediction-f1-pit-stops-kaggle-competition/.venv/lib/python3.13/site-packages/optuna/trial/_trial.py", line 336, in suggest_int
    suggested_value = int(self._suggest(name, distribution))
                          ~~~~~~~~~~~~~^^^^^^^^^^^^^^^^^^^^
  File "/home/junior/Documentos/GitHub/prediction-f1-pit-stops-kaggle-competition/.venv/lib/python3.13/site-packages/optuna/trial/_trial.py", line 632, in _suggest
    distributions.check_distribution_compatibility(trial.distributions[name], distribution)
    ~~~~~~~~~~~~~~~~~~~~~~~~~~~~~~~~~~~~~~~~~~~~~~^^^^^^^^^^^^^^^^^^^^^^^^^^^^^^^^^^^^^^^^^
  File "/home/junior/Documentos/GitHub/prediction-f1-pit-stops-kaggle-competition/.venv/lib/python3.13/site-packages/optuna/distributions.py", line 649, in check_distribution_compatibility
    raise ValueError("Cannot set different log configuration to the same parameter name.")
ValueError: Cannot set different log configuration to the same parameter name.
2026-05-21 19:49:57,544 - WARNING - Trial 8 failed with value None.
2026-05-21 19:49:57,547 - WARNING - Trial 7 failed with value None.
2026-05-21 19:49:57,548 - WARNING - Trial 4 failed with parameters: {'n_components': 25, 'algorithm': 'randomized', 'n_iter': 5, 'power_iteration_normalizer': 'OR', 'tol': 1.1271326631582007e-06, 'gamma': 0.000260922020483269} because of the following error: ValueError('Cannot set different log configuration to the same parameter name.').
Traceback (most recent call last):
  File "/home/junior/Documentos/GitHub/prediction-f1-pit-stops-kaggle-competition/.venv/lib/python3.13/site-packages/optuna/study/_optimize.py", line 206, in _run_trial
    value_or_values = func(trial)
  File "/home/junior/Documentos/GitHub/prediction-f1-pit-stops-kaggle-competition/src/truncatedsvd_rbfsampler_knn_tuning.py", line 127, in <lambda>
    study.optimize(lambda trial: objective(trial, X_train, y_train), n_trials=30, n_jobs=-1, show_progress_bar=True)
                                 ~~~~~~~~~^^^^^^^^^^^^^^^^^^^^^^^^^
  File "/home/junior/Documentos/GitHub/prediction-f1-pit-stops-kaggle-competition/src/truncatedsvd_rbfsampler_knn_tuning.py", line 102, in objective
    n_components=trial.suggest_int("n_components", 64, 75, log=True),
                 ~~~~~~~~~~~~~~~~~^^^^^^^^^^^^^^^^^^^^^^^^^^^^^^^^^^
  File "/home/junior/Documentos/GitHub/prediction-f1-pit-stops-kaggle-competition/.venv/lib/python3.13/site-packages/optuna/_convert_positional_args.py", line 127, in converter_wrapper
    return func(**kwargs)  # type: ignore[call-arg]
  File "/home/junior/Documentos/GitHub/prediction-f1-pit-stops-kaggle-competition/.venv/lib/python3.13/site-packages/optuna/trial/_trial.py", line 336, in suggest_int
    suggested_value = int(self._suggest(name, distribution))
                          ~~~~~~~~~~~~~^^^^^^^^^^^^^^^^^^^^
  File "/home/junior/Documentos/GitHub/prediction-f1-pit-stops-kaggle-competition/.venv/lib/python3.13/site-packages/optuna/trial/_trial.py", line 632, in _suggest
    distributions.check_distribution_compatibility(trial.distributions[name], distribution)
    ~~~~~~~~~~~~~~~~~~~~~~~~~~~~~~~~~~~~~~~~~~~~~~^^^^^^^^^^^^^^^^^^^^^^^^^^^^^^^^^^^^^^^^^
  File "/home/junior/Documentos/GitHub/prediction-f1-pit-stops-kaggle-competition/.venv/lib/python3.13/site-packages/optuna/distributions.py", line 649, in check_distribution_compatibility
    raise ValueError("Cannot set different log configuration to the same parameter name.")
ValueError: Cannot set different log configuration to the same parameter name.
2026-05-21 19:49:57,549 - WARNING - Trial 6 failed with parameters: {'n_components': 66, 'algorithm': 'randomized', 'n_iter': 15, 'power_iteration_normalizer': 'OR', 'tol': 0.003535237940237214, 'gamma': 6.176955424026156} because of the following error: ValueError('Cannot set different log configuration to the same parameter name.').
Traceback (most recent call last):
  File "/home/junior/Documentos/GitHub/prediction-f1-pit-stops-kaggle-competition/.venv/lib/python3.13/site-packages/optuna/study/_optimize.py", line 206, in _run_trial
    value_or_values = func(trial)
  File "/home/junior/Documentos/GitHub/prediction-f1-pit-stops-kaggle-competition/src/truncatedsvd_rbfsampler_knn_tuning.py", line 127, in <lambda>
    study.optimize(lambda trial: objective(trial, X_train, y_train), n_trials=30, n_jobs=-1, show_progress_bar=True)
                                 ~~~~~~~~~^^^^^^^^^^^^^^^^^^^^^^^^^
  File "/home/junior/Documentos/GitHub/prediction-f1-pit-stops-kaggle-competition/src/truncatedsvd_rbfsampler_knn_tuning.py", line 102, in objective
    n_components=trial.suggest_int("n_components", 64, 75, log=True),
                 ~~~~~~~~~~~~~~~~~^^^^^^^^^^^^^^^^^^^^^^^^^^^^^^^^^^
  File "/home/junior/Documentos/GitHub/prediction-f1-pit-stops-kaggle-competition/.venv/lib/python3.13/site-packages/optuna/_convert_positional_args.py", line 127, in converter_wrapper
    return func(**kwargs)  # type: ignore[call-arg]
  File "/home/junior/Documentos/GitHub/prediction-f1-pit-stops-kaggle-competition/.venv/lib/python3.13/site-packages/optuna/trial/_trial.py", line 336, in suggest_int
    suggested_value = int(self._suggest(name, distribution))
                          ~~~~~~~~~~~~~^^^^^^^^^^^^^^^^^^^^
  File "/home/junior/Documentos/GitHub/prediction-f1-pit-stops-kaggle-competition/.venv/lib/python3.13/site-packages/optuna/trial/_trial.py", line 632, in _suggest
    distributions.check_distribution_compatibility(trial.distributions[name], distribution)
    ~~~~~~~~~~~~~~~~~~~~~~~~~~~~~~~~~~~~~~~~~~~~~~^^^^^^^^^^^^^^^^^^^^^^^^^^^^^^^^^^^^^^^^^
  File "/home/junior/Documentos/GitHub/prediction-f1-pit-stops-kaggle-competition/.venv/lib/python3.13/site-packages/optuna/distributions.py", line 649, in check_distribution_compatibility
    raise ValueError("Cannot set different log configuration to the same parameter name.")
ValueError: Cannot set different log configuration to the same parameter name.
2026-05-21 19:49:57,551 - WARNING - Trial 1 failed with value None.
2026-05-21 19:49:57,552 - WARNING - Trial 0 failed with parameters: {'n_components': 43, 'algorithm': 'randomized', 'n_iter': 9, 'power_iteration_normalizer': 'LU', 'tol': 0.0009219292898748076, 'gamma': 7.905156829659834e-06} because of the following error: ValueError('Cannot set different log configuration to the same parameter name.').
Traceback (most recent call last):
  File "/home/junior/Documentos/GitHub/prediction-f1-pit-stops-kaggle-competition/.venv/lib/python3.13/site-packages/optuna/study/_optimize.py", line 206, in _run_trial
    value_or_values = func(trial)
  File "/home/junior/Documentos/GitHub/prediction-f1-pit-stops-kaggle-competition/src/truncatedsvd_rbfsampler_knn_tuning.py", line 127, in <lambda>
    study.optimize(lambda trial: objective(trial, X_train, y_train), n_trials=30, n_jobs=-1, show_progress_bar=True)
                                 ~~~~~~~~~^^^^^^^^^^^^^^^^^^^^^^^^^
  File "/home/junior/Documentos/GitHub/prediction-f1-pit-stops-kaggle-competition/src/truncatedsvd_rbfsampler_knn_tuning.py", line 102, in objective
    n_components=trial.suggest_int("n_components", 64, 75, log=True),
                 ~~~~~~~~~~~~~~~~~^^^^^^^^^^^^^^^^^^^^^^^^^^^^^^^^^^
  File "/home/junior/Documentos/GitHub/prediction-f1-pit-stops-kaggle-competition/.venv/lib/python3.13/site-packages/optuna/_convert_positional_args.py", line 127, in converter_wrapper
    return func(**kwargs)  # type: ignore[call-arg]
  File "/home/junior/Documentos/GitHub/prediction-f1-pit-stops-kaggle-competition/.venv/lib/python3.13/site-packages/optuna/trial/_trial.py", line 336, in suggest_int
    suggested_value = int(self._suggest(name, distribution))
                          ~~~~~~~~~~~~~^^^^^^^^^^^^^^^^^^^^
  File "/home/junior/Documentos/GitHub/prediction-f1-pit-stops-kaggle-competition/.venv/lib/python3.13/site-packages/optuna/trial/_trial.py", line 632, in _suggest
    distributions.check_distribution_compatibility(trial.distributions[name], distribution)
    ~~~~~~~~~~~~~~~~~~~~~~~~~~~~~~~~~~~~~~~~~~~~~~^^^^^^^^^^^^^^^^^^^^^^^^^^^^^^^^^^^^^^^^^
  File "/home/junior/Documentos/GitHub/prediction-f1-pit-stops-kaggle-competition/.venv/lib/python3.13/site-packages/optuna/distributions.py", line 649, in check_distribution_compatibility
    raise ValueError("Cannot set different log configuration to the same parameter name.")
ValueError: Cannot set different log configuration to the same parameter name.
2026-05-21 19:49:57,553 - WARNING - Trial 11 failed with parameters: {'n_components': 15, 'algorithm': 'randomized', 'n_iter': 5, 'power_iteration_normalizer': 'OR', 'tol': 1.5573314712608233e-05, 'gamma': 6.710495262260087e-05} because of the following error: ValueError('Cannot set different log configuration to the same parameter name.').
Traceback (most recent call last):
  File "/home/junior/Documentos/GitHub/prediction-f1-pit-stops-kaggle-competition/.venv/lib/python3.13/site-packages/optuna/study/_optimize.py", line 206, in _run_trial
    value_or_values = func(trial)
  File "/home/junior/Documentos/GitHub/prediction-f1-pit-stops-kaggle-competition/src/truncatedsvd_rbfsampler_knn_tuning.py", line 127, in <lambda>
    study.optimize(lambda trial: objective(trial, X_train, y_train), n_trials=30, n_jobs=-1, show_progress_bar=True)
                                 ~~~~~~~~~^^^^^^^^^^^^^^^^^^^^^^^^^
  File "/home/junior/Documentos/GitHub/prediction-f1-pit-stops-kaggle-competition/src/truncatedsvd_rbfsampler_knn_tuning.py", line 102, in objective
    n_components=trial.suggest_int("n_components", 64, 75, log=True),
                 ~~~~~~~~~~~~~~~~~^^^^^^^^^^^^^^^^^^^^^^^^^^^^^^^^^^
  File "/home/junior/Documentos/GitHub/prediction-f1-pit-stops-kaggle-competition/.venv/lib/python3.13/site-packages/optuna/_convert_positional_args.py", line 127, in converter_wrapper
    return func(**kwargs)  # type: ignore[call-arg]
  File "/home/junior/Documentos/GitHub/prediction-f1-pit-stops-kaggle-competition/.venv/lib/python3.13/site-packages/optuna/trial/_trial.py", line 336, in suggest_int
    suggested_value = int(self._suggest(name, distribution))
                          ~~~~~~~~~~~~~^^^^^^^^^^^^^^^^^^^^
  File "/home/junior/Documentos/GitHub/prediction-f1-pit-stops-kaggle-competition/.venv/lib/python3.13/site-packages/optuna/trial/_trial.py", line 632, in _suggest
    distributions.check_distribution_compatibility(trial.distributions[name], distribution)
    ~~~~~~~~~~~~~~~~~~~~~~~~~~~~~~~~~~~~~~~~~~~~~~^^^^^^^^^^^^^^^^^^^^^^^^^^^^^^^^^^^^^^^^^
  File "/home/junior/Documentos/GitHub/prediction-f1-pit-stops-kaggle-competition/.