2026-05-21 20:46:45,045 - INFO - ----- Fine Tuning -----
2026-05-21 20:46:45,046 - INFO - A new study created in memory with name: no-name-7d453aa4-ea06-4556-ae15-aa580eafc096
2026-05-21 20:50:14,317 - INFO - Trial 1 finished with value: 0.5529927247962872 and parameters: {'truncsvd_n_components': 6, 'algorithm': 'randomized', 'n_iter': 11, 'power_iteration_normalizer': 'OR', 'truncsvd_tol': 0.0003465174444383691, 'gamma': 2.651644511371433, 'n_components': 73, 'loss': 'log_loss', 'penalty': 'elasticnet', 'alpha': 0.012857565448964004, 'learning_rate': 'optimal', 'eta0': 0.006520889840663304, 'l1_ratio': 0.942062927550113, 'tol': 0.0013041628238745894, 'average': False}. Best is trial 1 with value: 0.5529927247962872.
2026-05-21 20:50:23,830 - INFO - Trial 10 finished with value: 0.5532186185819665 and parameters: {'truncsvd_n_components': 31, 'algorithm': 'randomized', 'n_iter': 6, 'power_iteration_normalizer': 'LU', 'truncsvd_tol': 8.034529547368391e-05, 'gamma': 0.29034227108995037, 'n_components': 68, 'loss': 'log_loss', 'penalty': 'l2', 'alpha': 0.000693704967795547, 'learning_rate': 'optimal', 'eta0': 0.00032474645563737445, 'l1_ratio': 0.5552047194101043, 'tol': 0.0004168543501128792, 'average': False}. Best is trial 10 with value: 0.5532186185819665.
2026-05-21 20:50:26,829 - INFO - Trial 0 finished with value: 0.42708509980075726 and parameters: {'truncsvd_n_components': 48, 'algorithm': 'randomized', 'n_iter': 7, 'power_iteration_normalizer': 'auto', 'truncsvd_tol': 6.197131568794549e-06, 'gamma': 0.11471729554422672, 'n_components': 67, 'loss': 'modified_huber', 'penalty': 'l1', 'alpha': 0.07521168934983578, 'learning_rate': 'optimal', 'eta0': 0.018409968377661373, 'l1_ratio': 0.41422334065272604, 'tol': 0.0012632945505408066, 'average': True}. Best is trial 10 with value: 0.5532186185819665.
2026-05-21 20:50:39,496 - INFO - Trial 9 finished with value: 0.7577073946369977 and parameters: {'truncsvd_n_components': 5, 'algorithm': 'randomized', 'n_iter': 13, 'power_iteration_normalizer': 'auto', 'truncsvd_tol': 1.6075761364704674e-06, 'gamma': 0.7862414640525469, 'n_components': 68, 'loss': 'modified_huber', 'penalty': 'l1', 'alpha': 0.011450733526433401, 'learning_rate': 'optimal', 'eta0': 0.01054522456718284, 'l1_ratio': 0.19496662207706528, 'tol': 3.3974059579279136e-05, 'average': False}. Best is trial 9 with value: 0.7577073946369977.
2026-05-21 20:50:49,043 - INFO - Trial 6 finished with value: 0.5 and parameters: {'truncsvd_n_components': 48, 'algorithm': 'randomized', 'n_iter': 10, 'power_iteration_normalizer': 'auto', 'truncsvd_tol': 0.0014870097648210197, 'gamma': 0.01127688733459657, 'n_components': 68, 'loss': 'log_loss', 'penalty': 'elasticnet', 'alpha': 0.06023637289033888, 'learning_rate': 'optimal', 'eta0': 0.0054197304795197965, 'l1_ratio': 0.32133906213922114, 'tol': 0.003121956918500281, 'average': False}. Best is trial 9 with value: 0.7577073946369977.
2026-05-21 20:51:17,244 - INFO - Trial 3 finished with value: 0.5505232131055097 and parameters: {'truncsvd_n_components': 2, 'algorithm': 'randomized', 'n_iter': 9, 'power_iteration_normalizer': 'LU', 'truncsvd_tol': 3.508475049401681e-05, 'gamma': 1.601879520839238e-05, 'n_components': 70, 'loss': 'log_loss', 'penalty': 'elasticnet', 'alpha': 1.514188575958388e-07, 'learning_rate': 'adaptive', 'eta0': 0.001679411624993776, 'l1_ratio': 0.4981707896359786, 'tol': 0.0030811960509717256, 'average': True}. Best is trial 9 with value: 0.7577073946369977.
2026-05-21 20:51:20,699 - INFO - Trial 5 finished with value: 0.6697383198979645 and parameters: {'truncsvd_n_components': 14, 'algorithm': 'randomized', 'n_iter': 5, 'power_iteration_normalizer': 'auto', 'truncsvd_tol': 0.004137232958137239, 'gamma': 0.001551013243766413, 'n_components': 66, 'loss': 'modified_huber', 'penalty': 'elasticnet', 'alpha': 3.47143649218889e-05, 'learning_rate': 'adaptive', 'eta0': 0.0377483829214513, 'l1_ratio': 0.22216932954758362, 'tol': 0.0005294430528852072, 'average': True}. Best is trial 9 with value: 0.7577073946369977.
2026-05-21 20:51:55,588 - INFO - Trial 11 finished with value: 0.7740516871811123 and parameters: {'truncsvd_n_components': 40, 'algorithm': 'randomized', 'n_iter': 15, 'power_iteration_normalizer': 'LU', 'truncsvd_tol': 0.006250139773324059, 'gamma': 0.035211917223850725, 'n_components': 73, 'loss': 'modified_huber', 'penalty': 'l2', 'alpha': 0.00013537423599115284, 'learning_rate': 'adaptive', 'eta0': 0.00010123830642500466, 'l1_ratio': 0.007581577933504113, 'tol': 0.0011694977124650115, 'average': False}. Best is trial 11 with value: 0.7740516871811123.
2026-05-21 20:52:02,626 - INFO - Trial 7 finished with value: 0.8611578474776447 and parameters: {'truncsvd_n_components': 46, 'algorithm': 'randomized', 'n_iter': 14, 'power_iteration_normalizer': 'OR', 'truncsvd_tol': 0.0004929940381444256, 'gamma': 0.00010725732201754514, 'n_components': 75, 'loss': 'modified_huber', 'penalty': 'elasticnet', 'alpha': 0.00014595400678721484, 'learning_rate': 'adaptive', 'eta0': 0.02764367849770598, 'l1_ratio': 0.829857495925072, 'tol': 0.002642566728898143, 'average': False}. Best is trial 7 with value: 0.8611578474776447.
2026-05-21 20:52:41,941 - INFO - Trial 8 finished with value: 0.8057208951666652 and parameters: {'truncsvd_n_components': 70, 'algorithm': 'randomized', 'n_iter': 8, 'power_iteration_normalizer': 'auto', 'truncsvd_tol': 1.989179600728153e-05, 'gamma': 0.006049700126045027, 'n_components': 71, 'loss': 'log_loss', 'penalty': 'l2', 'alpha': 1.2424428041531949e-05, 'learning_rate': 'adaptive', 'eta0': 0.00022601110126754248, 'l1_ratio': 0.6266534455199744, 'tol': 0.0001277866924572593, 'average': True}. Best is trial 7 with value: 0.8611578474776447.
2026-05-21 20:52:49,853 - INFO - Trial 4 finished with value: 0.8240648274984685 and parameters: {'truncsvd_n_components': 60, 'algorithm': 'randomized', 'n_iter': 13, 'power_iteration_normalizer': 'LU', 'truncsvd_tol': 4.63042116102693e-05, 'gamma': 1.1178891466054093e-06, 'n_components': 75, 'loss': 'modified_huber', 'penalty': 'l2', 'alpha': 1.9566955410676344e-06, 'learning_rate': 'adaptive', 'eta0': 0.005818587058372045, 'l1_ratio': 0.877469887278082, 'tol': 0.009852191156742738, 'average': True}. Best is trial 7 with value: 0.8611578474776447.
2026-05-21 20:53:06,842 - INFO - Trial 15 pruned. 
2026-05-21 20:53:18,190 - INFO - Trial 16 pruned. 
2026-05-21 20:53:31,326 - INFO - Trial 2 finished with value: 0.886809096597748 and parameters: {'truncsvd_n_components': 51, 'algorithm': 'randomized', 'n_iter': 4, 'power_iteration_normalizer': 'auto', 'truncsvd_tol': 4.977659959269388e-06, 'gamma': 3.312062970101043e-05, 'n_components': 72, 'loss': 'modified_huber', 'penalty': 'l2', 'alpha': 2.953744497345384e-06, 'learning_rate': 'optimal', 'eta0': 0.004934248930782761, 'l1_ratio': 0.339212211115814, 'tol': 1.032740717310905e-05, 'average': False}. Best is trial 2 with value: 0.886809096597748.
2026-05-21 20:54:04,334 - INFO - Trial 13 pruned. 
2026-05-21 20:54:38,829 - INFO - Trial 14 finished with value: 0.7852414938634633 and parameters: {'truncsvd_n_components': 36, 'algorithm': 'randomized', 'n_iter': 6, 'power_iteration_normalizer': 'OR', 'truncsvd_tol': 0.0013181204598604714, 'gamma': 2.9981044505776006e-06, 'n_components': 70, 'loss': 'log_loss', 'penalty': 'elasticnet', 'alpha': 1.1348439846104181e-06, 'learning_rate': 'adaptive', 'eta0': 0.007347257561339006, 'l1_ratio': 0.25405676236741526, 'tol': 0.002980547483230742, 'average': False}. Best is trial 2 with value: 0.886809096597748.
2026-05-21 20:56:29,149 - INFO - Trial 20 finished with value: 0.7660993035074833 and parameters: {'truncsvd_n_components': 6, 'algorithm': 'randomized', 'n_iter': 9, 'power_iteration_normalizer': 'LU', 'truncsvd_tol': 0.005142783982654506, 'gamma': 0.696572706804148, 'n_components': 72, 'loss': 'modified_huber', 'penalty': 'elasticnet', 'alpha': 0.0017975680055559884, 'learning_rate': 'adaptive', 'eta0': 0.00023479967250345443, 'l1_ratio': 0.31369021181726175, 'tol': 0.0006877779319806816, 'average': False}. Best is trial 2 with value: 0.886809096597748.
2026-05-21 20:56:43,959 - INFO - Trial 18 finished with value: 0.7729653656314156 and parameters: {'truncsvd_n_components': 55, 'algorithm': 'randomized', 'n_iter': 13, 'power_iteration_normalizer': 'LU', 'truncsvd_tol': 0.0065995635278289526, 'gamma': 0.00023345114279133258, 'n_components': 65, 'loss': 'log_loss', 'penalty': 'l2', 'alpha': 0.010160022792606237, 'learning_rate': 'optimal', 'eta0': 0.08142570507972978, 'l1_ratio': 0.3060262087925991, 'tol': 0.0013582306342130842, 'average': False}. Best is trial 2 with value: 0.886809096597748.
2026-05-21 20:57:01,271 - INFO - Trial 19 finished with value: 0.8123325835713653 and parameters: {'truncsvd_n_components': 61, 'algorithm': 'randomized', 'n_iter': 7, 'power_iteration_normalizer': 'LU', 'truncsvd_tol': 1.313652518598221e-06, 'gamma': 4.294381508708857e-06, 'n_components': 75, 'loss': 'log_loss', 'penalty': 'elasticnet', 'alpha': 4.503600862798702e-06, 'learning_rate': 'adaptive', 'eta0': 0.00023973978757322315, 'l1_ratio': 0.4556552015935409, 'tol': 0.004909368625962501, 'average': False}. Best is trial 2 with value: 0.886809096597748.
2026-05-21 20:58:37,399 - INFO - ----- Fine Tuning -----
2026-05-21 20:58:37,399 - INFO - A new study created in memory with name: no-name-4d9d5c20-ce03-436b-9509-a8dc3158dbbc
2026-05-21 21:02:00,204 - INFO - Trial 5 finished with value: 0.338393839322945 and parameters: {'truncsvd_n_components': 33, 'algorithm': 'randomized', 'n_iter': 3, 'power_iteration_normalizer': 'auto', 'truncsvd_tol': 1.4477372727988384e-05, 'gamma': 0.042101489674497936, 'n_components': 64, 'loss': 'modified_huber', 'penalty': 'elasticnet', 'alpha': 0.040165918895657966, 'learning_rate': 'optimal', 'eta0': 0.00854968799652817, 'l1_ratio': 0.18676626005454577, 'tol': 6.774084259831405e-05, 'average': True}. Best is trial 5 with value: 0.338393839322945.
2026-05-21 21:02:58,776 - INFO - Trial 1 finished with value: 0.8868512456748092 and parameters: {'truncsvd_n_components': 70, 'algorithm': 'randomized', 'n_iter': 3, 'power_iteration_normalizer': 'LU', 'truncsvd_tol': 1.3707750373127106e-05, 'gamma': 2.9041678117402764e-05, 'n_components': 70, 'loss': 'log_loss', 'penalty': 'l2', 'alpha': 9.53564982582166e-06, 'learning_rate': 'optimal', 'eta0': 0.00026735038261417837, 'l1_ratio': 0.04156152113900302, 'tol': 0.003537667887799923, 'average': True}. Best is trial 1 with value: 0.8868512456748092.
2026-05-21 21:03:04,847 - INFO - Trial 6 finished with value: 0.8507496923439504 and parameters: {'truncsvd_n_components': 30, 'algorithm': 'randomized', 'n_iter': 5, 'power_iteration_normalizer': 'OR', 'truncsvd_tol': 0.00044839175537027596, 'gamma': 0.0007099323196394253, 'n_components': 74, 'loss': 'log_loss', 'penalty': 'elasticnet', 'alpha': 6.353550310947659e-05, 'learning_rate': 'adaptive', 'eta0': 0.005254431817745798, 'l1_ratio': 0.8026900569292437, 'tol': 0.0015302983088959971, 'average': False}. Best is trial 1 with value: 0.8868512456748092.
2026-05-21 21:03:08,382 - INFO - Trial 8 finished with value: 0.831009976332771 and parameters: {'truncsvd_n_components': 15, 'algorithm': 'randomized', 'n_iter': 5, 'power_iteration_normalizer': 'LU', 'truncsvd_tol': 0.002060446050863722, 'gamma': 0.003938960416829968, 'n_components': 70, 'loss': 'modified_huber', 'penalty': 'elasticnet', 'alpha': 6.181487439240251e-06, 'learning_rate': 'adaptive', 'eta0': 0.0007261456320073836, 'l1_ratio': 0.08051548751871984, 'tol': 0.0001658009509920506, 'average': False}. Best is trial 1 with value: 0.8868512456748092.
2026-05-21 21:04:06,044 - INFO - Trial 11 finished with value: 0.8857359549505951 and parameters: {'truncsvd_n_components': 61, 'algorithm': 'randomized', 'n_iter': 13, 'power_iteration_normalizer': 'OR', 'truncsvd_tol': 4.978185523535167e-06, 'gamma': 4.063410837179611e-06, 'n_components': 65, 'loss': 'log_loss', 'penalty': 'l1', 'alpha': 0.00031024347888494703, 'learning_rate': 'adaptive', 'eta0': 0.0010372600245511217, 'l1_ratio': 0.25835788248691205, 'tol': 0.004238226527308738, 'average': False}. Best is trial 1 with value: 0.8868512456748092.
2026-05-21 21:04:12,779 - INFO - Trial 2 finished with value: 0.8652922484415747 and parameters: {'truncsvd_n_components': 53, 'algorithm': 'randomized', 'n_iter': 9, 'power_iteration_normalizer': 'auto', 'truncsvd_tol': 0.003528018663296825, 'gamma': 0.0029195010036101965, 'n_components': 72, 'loss': 'log_loss', 'penalty': 'l2', 'alpha': 1.1818860442997762e-05, 'learning_rate': 'adaptive', 'eta0': 0.00142089314226914, 'l1_ratio': 0.9276004461608703, 'tol': 0.00035607585802540465, 'average': True}. Best is trial 1 with value: 0.8868512456748092.
2026-05-21 21:04:18,642 - INFO - Trial 0 pruned. 
2026-05-21 21:04:30,433 - INFO - Trial 4 pruned. 
2026-05-21 21:05:00,287 - INFO - Trial 3 pruned. 
2026-05-21 21:05:11,560 - INFO - Trial 9 pruned. 
2026-05-21 21:05:21,268 - INFO - Trial 13 pruned. 
2026-05-21 21:05:30,844 - INFO - Trial 12 pruned. 
2026-05-21 21:05:30,979 - INFO - Trial 7 pruned. 
2026-05-21 21:05:41,912 - INFO - Trial 18 pruned. 
2026-05-21 21:05:45,483 - INFO - Trial 15 pruned. 
2026-05-21 21:07:13,435 - INFO - Trial 10 pruned. 
2026-05-21 21:08:51,226 - INFO - Trial 16 pruned. 
2026-05-21 21:09:38,202 - INFO - Trial 21 pruned. 
2026-05-21 21:10:00,693 - INFO - Trial 20 finished with value: 0.8566896812230057 and parameters: {'truncsvd_n_components': 70, 'algorithm': 'randomized', 'n_iter': 6, 'power_iteration_normalizer': 'LU', 'truncsvd_tol': 0.0013517625329314005, 'gamma': 0.00032967787488685985, 'n_components': 65, 'loss': 'modified_huber', 'penalty': 'l2', 'alpha': 0.0031468972784773155, 'learning_rate': 'optimal', 'eta0': 0.0670338936987781, 'l1_ratio': 0.24856627948083088, 'tol': 0.0006223717774953868, 'average': True}. Best is trial 1 with value: 0.8868512456748092.
2026-05-21 21:10:55,539 - INFO - Trial 19 pruned. 
2026-05-21 21:11:12,637 - INFO - Trial 14 pruned. 
2026-05-21 21:11:26,250 - INFO - Trial 17 finished with value: 0.8833139900775574 and parameters: {'truncsvd_n_components': 42, 'algorithm': 'randomized', 'n_iter': 15, 'power_iteration_normalizer': 'LU', 'truncsvd_tol': 0.00022751367465006556, 'gamma': 1.5669258520144846e-06, 'n_components': 72, 'loss': 'log_loss', 'penalty': 'l1', 'alpha': 3.848232723023437e-06, 'learning_rate': 'adaptive', 'eta0': 0.0024318767584119564, 'l1_ratio': 0.4146295585940849, 'tol': 0.0002604920089762672, 'average': True}. Best is trial 1 with value: 0.8868512456748092.
2026-05-21 21:11:39,769 - INFO - Trial 22 finished with value: 0.8813732975822093 and parameters: {'truncsvd_n_components': 74, 'algorithm': 'randomized', 'n_iter': 15, 'power_iteration_normalizer': 'OR', 'truncsvd_tol': 2.1883885395955104e-06, 'gamma': 1.1170320746259092e-06, 'n_components': 67, 'loss': 'log_loss', 'penalty': 'l1', 'alpha': 0.0006016898739808597, 'learning_rate': 'optimal', 'eta0': 0.00012997020349696188, 'l1_ratio': 0.009481883544236402, 'tol': 0.007076903652500857, 'average': False}. Best is trial 1 with value: 0.8868512456748092.
2026-05-21 21:11:54,870 - INFO - Trial 24 finished with value: 0.8807710213267754 and parameters: {'truncsvd_n_components': 71, 'algorithm': 'randomized', 'n_iter': 15, 'power_iteration_normalizer': 'OR', 'truncsvd_tol': 2.135458566908944e-06, 'gamma': 1.5954531829628306e-06, 'n_components': 66, 'loss': 'log_loss', 'penalty': 'l2', 'alpha': 0.00026062776163322793, 'learning_rate': 'optimal', 'eta0': 0.0003905324436271722, 'l1_ratio': 0.016076600506593652, 'tol': 0.009677204514775405, 'average': False}. Best is trial 1 with value: 0.8868512456748092.
2026-05-21 21:12:24,146 - INFO - Trial 23 finished with value: 0.8817758629466337 and parameters: {'truncsvd_n_components': 74, 'algorithm': 'randomized', 'n_iter': 15, 'power_iteration_normalizer': 'OR', 'truncsvd_tol': 2.257053652736106e-06, 'gamma': 1.5188411268177178e-06, 'n_components': 67, 'loss': 'log_loss', 'penalty': 'l2', 'alpha': 0.000771983017057647, 'learning_rate': 'optimal', 'eta0': 0.0004069752591102124, 'l1_ratio': 0.03259320785576101, 'tol': 0.009688807383250014, 'average': False}. Best is trial 1 with value: 0.8868512456748092.
2026-05-21 21:12:59,437 - INFO - Trial 26 finished with value: 0.8863825661991618 and parameters: {'truncsvd_n_components': 73, 'algorithm': 'randomized', 'n_iter': 15, 'power_iteration_normalizer': 'OR', 'truncsvd_tol': 5.3626690132177904e-06, 'gamma': 1.273633181835448e-06, 'n_components': 71, 'loss': 'log_loss', 'penalty': 'l2', 'alpha': 0.00045508842815940764, 'learning_rate': 'optimal', 'eta0': 0.0016367765351540725, 'l1_ratio': 0.020427321322456008, 'tol': 0.008653877939862985, 'average': False}. Best is trial 1 with value: 0.8868512456748092.
2026-05-21 21:12:59,480 - INFO - Trial 25 pruned. 
2026-05-21 21:14:55,000 - INFO - Trial 27 finished with value: 0.8822567793971727 and parameters: {'truncsvd_n_components': 72, 'algorithm': 'randomized', 'n_iter': 14, 'power_iteration_normalizer': 'LU', 'truncsvd_tol': 3.6003677011275326e-06, 'gamma': 1.0013682313012025e-06, 'n_components': 71, 'loss': 'log_loss', 'penalty': 'l2', 'alpha': 0.0008572988144007893, 'learning_rate': 'optimal', 'eta0': 0.0018090960297289273, 'l1_ratio': 0.34272829642255287, 'tol': 0.007807462630692308, 'average': False}. Best is trial 1 with value: 0.8868512456748092.
2026-05-21 21:15:50,329 - INFO - Trial 28 finished with value: 0.8855788716370279 and parameters: {'truncsvd_n_components': 72, 'algorithm': 'randomized', 'n_iter': 15, 'power_iteration_normalizer': 'OR', 'truncsvd_tol': 4.686538557922607e-06, 'gamma': 2.58675906985901e-06, 'n_components': 71, 'loss': 'log_loss', 'penalty': 'l2', 'alpha': 0.0006992917928820429, 'learning_rate': 'optimal', 'eta0': 0.001985583777304144, 'l1_ratio': 0.04095555034863468, 'tol': 0.008344974879924803, 'average': False}. Best is trial 1 with value: 0.8868512456748092.
2026-05-21 21:16:00,827 - INFO - Trial 29 finished with value: 0.880542718666194 and parameters: {'truncsvd_n_components': 69, 'algorithm': 'randomized', 'n_iter': 15, 'power_iteration_normalizer': 'OR', 'truncsvd_tol': 3.8093999579799825e-06, 'gamma': 1.5365909688274994e-05, 'n_components': 71, 'loss': 'log_loss', 'penalty': 'l1', 'alpha': 0.0011593122434814971, 'learning_rate': 'optimal', 'eta0': 0.0019149271525548098, 'l1_ratio': 0.019094337674057278, 'tol': 0.004745858500742076, 'average': False}. Best is trial 1 with value: 0.8868512456748092.
2026-05-21 21:16:25,591 - INFO - Trial 32 finished with value: 0.8886940684759764 and parameters: {'truncsvd_n_components': 58, 'algorithm': 'randomized', 'n_iter': 7, 'power_iteration_normalizer': 'OR', 'truncsvd_tol': 4.748257915848733e-06, 'gamma': 1.6824386170283722e-05, 'n_components': 71, 'loss': 'log_loss', 'penalty': 'l2', 'alpha': 0.0002615072260384471, 'learning_rate': 'adaptive', 'eta0': 0.0017490444663016, 'l1_ratio': 0.031845239008798605, 'tol': 1.2592530160695915e-05, 'average': True}. Best is trial 32 with value: 0.8886940684759764.
2026-05-21 21:16:40,269 - INFO - Trial 34 pruned. 
2026-05-21 21:16:52,709 - INFO - Trial 33 pruned. 
2026-05-21 21:17:50,708 - INFO - Trial 31 finished with value: 0.8858245546563562 and parameters: {'truncsvd_n_components': 62, 'algorithm': 'randomized', 'n_iter': 15, 'power_iteration_normalizer': 'OR', 'truncsvd_tol': 4.303906719257285e-06, 'gamma': 3.212172563789904e-05, 'n_components': 71, 'loss': 'log_loss', 'penalty': 'l1', 'alpha': 0.0002217115611982837, 'learning_rate': 'adaptive', 'eta0': 0.0018243657096088841, 'l1_ratio': 0.005992934120033197, 'tol': 1.4022396534730789e-05, 'average': False}. Best is trial 32 with value: 0.8886940684759764.
2026-05-21 21:17:51,951 - INFO - Trial 30 finished with value: 0.8893872442419735 and parameters: {'truncsvd_n_components': 63, 'algorithm': 'randomized', 'n_iter': 15, 'power_iteration_normalizer': 'OR', 'truncsvd_tol': 5.546255675251199e-06, 'gamma': 1.9461769283191858e-05, 'n_components': 71, 'loss': 'log_loss', 'penalty': 'l1', 'alpha': 0.0002029554064664711, 'learning_rate': 'adaptive', 'eta0': 0.0020535400181045343, 'l1_ratio': 0.012741643079413847, 'tol': 1.1745008669791654e-05, 'average': False}. Best is trial 30 with value: 0.8893872442419735.
2026-05-21 21:18:39,460 - INFO - Trial 38 finished with value: 0.883455811475969 and parameters: {'truncsvd_n_components': 61, 'algorithm': 'randomized', 'n_iter': 13, 'power_iteration_normalizer': 'OR', 'truncsvd_tol': 6.802494001698905e-06, 'gamma': 1.4892026067035699e-05, 'n_components': 70, 'loss': 'log_loss', 'penalty': 'l2', 'alpha': 6.0844801484520484e-05, 'learning_rate': 'optimal', 'eta0': 0.001870884095768918, 'l1_ratio': 0.11710938294020662, 'tol': 0.003358030462765888, 'average': False}. Best is trial 30 with value: 0.8893872442419735.
2026-05-21 21:19:17,990 - INFO - Trial 37 finished with value: 0.8806835712660769 and parameters: {'truncsvd_n_components': 60, 'algorithm': 'randomized', 'n_iter': 13, 'power_iteration_normalizer': 'OR', 'truncsvd_tol': 5.430985420492616e-06, 'gamma': 1.3400356215052498e-05, 'n_components': 70, 'loss': 'log_loss', 'penalty': 'l2', 'alpha': 6.283178365198772e-05, 'learning_rate': 'optimal', 'eta0': 0.0018558716510203492, 'l1_ratio': 0.3446418121777303, 'tol': 0.0034088685972984913, 'average': False}. Best is trial 30 with value: 0.8893872442419735.
2026-05-21 21:19:34,662 - INFO - Trial 35 finished with value: 0.889743237184635 and parameters: {'truncsvd_n_components': 58, 'algorithm': 'randomized', 'n_iter': 14, 'power_iteration_normalizer': 'LU', 'truncsvd_tol': 5.345477185886708e-06, 'gamma': 1.1365714002828486e-05, 'n_components': 71, 'loss': 'log_loss', 'penalty': 'l1', 'alpha': 4.323885772173619e-05, 'learning_rate': 'adaptive', 'eta0': 0.0016395685844481553, 'l1_ratio': 0.35912712102204425, 'tol': 0.003332450445616339, 'average': True}. Best is trial 35 with value: 0.889743237184635.
