2026-05-21 02:50:13,722 - INFO - Trial 19 pruned. 
2026-05-21 02:52:44,077 - INFO - Trial 17 finished with value: 0.875100657116666 and parameters: {'n_components': 39, 'algorithm': 'randomized', 'n_iter': 11, 'power_iteration_normalizer': 'OR', 'tol': 0.00025160550107278094, 'C': 1.3958930778618064, 'loss': 'squared_hinge', 'tol_linear_svc': 0.00027270043551920497}. Best is trial 6 with value: 0.8920338174802241.
2026-05-21 02:53:01,515 - INFO - Trial 18 finished with value: 0.8469985323695042 and parameters: {'n_components': 30, 'algorithm': 'randomized', 'n_iter': 11, 'power_iteration_normalizer': 'OR', 'tol': 0.0040821396536505905, 'C': 0.002235686735645007, 'loss': 'squared_hinge', 'tol_linear_svc': 3.761480677935626e-05}. Best is trial 6 with value: 0.8920338174802241.
2026-05-21 02:53:12,791 - INFO - Trial 3 finished with value: 0.8903726719590435 and parameters: {'n_components': 52, 'algorithm': 'randomized', 'n_iter': 5, 'power_iteration_normalizer': 'OR', 'tol': 6.12454183238986e-06, 'C': 0.7498446845299923, 'loss': 'squared_hinge', 'tol_linear_svc': 3.4399969740708458e-06}. Best is trial 6 with value: 0.8920338174802241.
2026-05-21 02:54:50,080 - INFO - Trial 22 finished with value: 0.8913349297797085 and parameters: {'n_components': 58, 'algorithm': 'randomized', 'n_iter': 7, 'power_iteration_normalizer': 'auto', 'tol': 1.1988948500483235e-06, 'C': 0.020071059407912647, 'loss': 'squared_hinge', 'tol_linear_svc': 9.770198206714204e-06}. Best is trial 6 with value: 0.8920338174802241.
2026-05-21 02:54:54,456 - INFO - Trial 23 finished with value: 0.8918746902562968 and parameters: {'n_components': 67, 'algorithm': 'randomized', 'n_iter': 7, 'power_iteration_normalizer': 'LU', 'tol': 5.681495675564667e-06, 'C': 0.028538902070871373, 'loss': 'squared_hinge', 'tol_linear_svc': 1.369479139153591e-05}. Best is trial 6 with value: 0.8920338174802241.
2026-05-21 02:55:02,485 - INFO - Trial 21 finished with value: 0.8917887804055316 and parameters: {'n_components': 59, 'algorithm': 'randomized', 'n_iter': 12, 'power_iteration_normalizer': 'auto', 'tol': 2.0212270213157666e-06, 'C': 0.018457414200936644, 'loss': 'squared_hinge', 'tol_linear_svc': 2.14709059141258e-05}. Best is trial 6 with value: 0.8920338174802241.
2026-05-21 02:55:12,648 - INFO - Trial 24 finished with value: 0.8919256258321256 and parameters: {'n_components': 68, 'algorithm': 'randomized', 'n_iter': 6, 'power_iteration_normalizer': 'LU', 'tol': 7.686753879924093e-06, 'C': 0.02439286291000889, 'loss': 'squared_hinge', 'tol_linear_svc': 2.1364961070499212e-05}. Best is trial 6 with value: 0.8920338174802241.
2026-05-21 02:55:38,133 - INFO - Trial 25 finished with value: 0.8920561180371012 and parameters: {'n_components': 69, 'algorithm': 'randomized', 'n_iter': 6, 'power_iteration_normalizer': 'LU', 'tol': 8.298102141578165e-06, 'C': 0.022654957859640678, 'loss': 'squared_hinge', 'tol_linear_svc': 1.471522631872424e-05}. Best is trial 25 with value: 0.8920561180371012.
2026-05-21 02:58:50,373 - INFO - Trial 26 finished with value: 0.8919438180250351 and parameters: {'n_components': 75, 'algorithm': 'randomized', 'n_iter': 12, 'power_iteration_normalizer': 'LU', 'tol': 0.00018915371876514157, 'C': 0.01077542762959423, 'loss': 'squared_hinge', 'tol_linear_svc': 2.0901316663449753e-05}. Best is trial 25 with value: 0.8920561180371012.
2026-05-21 02:58:50,397 - INFO - Trial 27 finished with value: 0.8920501203162765 and parameters: {'n_components': 75, 'algorithm': 'randomized', 'n_iter': 12, 'power_iteration_normalizer': 'LU', 'tol': 0.00016752424450134309, 'C': 0.007233839720089486, 'loss': 'squared_hinge', 'tol_linear_svc': 1.829898288488265e-05}. Best is trial 25 with value: 0.8920561180371012.
2026-05-21 02:59:42,308 - INFO - Trial 28 finished with value: 0.8921214545459446 and parameters: {'n_components': 74, 'algorithm': 'randomized', 'n_iter': 12, 'power_iteration_normalizer': 'LU', 'tol': 0.0001782057295392039, 'C': 0.008010611868697108, 'loss': 'squared_hinge', 'tol_linear_svc': 2.0057504241713533e-05}. Best is trial 28 with value: 0.8921214545459446.
2026-05-21 02:59:46,997 - INFO - Trial 31 pruned. 
2026-05-21 03:01:06,280 - INFO - Trial 29 finished with value: 0.8921063391388317 and parameters: {'n_components': 75, 'algorithm': 'randomized', 'n_iter': 13, 'power_iteration_normalizer': 'LU', 'tol': 0.0002004327475749177, 'C': 0.014566711780159586, 'loss': 'squared_hinge', 'tol_linear_svc': 2.007905135866393e-05}. Best is trial 28 with value: 0.8921214545459446.
2026-05-21 03:02:02,489 - INFO - Trial 30 finished with value: 0.8920984895025674 and parameters: {'n_components': 74, 'algorithm': 'randomized', 'n_iter': 13, 'power_iteration_normalizer': 'LU', 'tol': 0.00013108247014402734, 'C': 0.009248865832045683, 'loss': 'squared_hinge', 'tol_linear_svc': 2.5494287083320478e-05}. Best is trial 28 with value: 0.8921214545459446.
2026-05-21 03:02:46,328 - INFO - Trial 33 finished with value: 0.8918707539984766 and parameters: {'n_components': 73, 'algorithm': 'randomized', 'n_iter': 5, 'power_iteration_normalizer': 'LU', 'tol': 0.0001520700283420917, 'C': 0.01082510105105161, 'loss': 'squared_hinge', 'tol_linear_svc': 1.3141779159836016e-05}. Best is trial 28 with value: 0.8921214545459446.
2026-05-21 03:03:36,187 - INFO - Trial 37 finished with value: 0.8920331437658516 and parameters: {'n_components': 74, 'algorithm': 'randomized', 'n_iter': 5, 'power_iteration_normalizer': 'LU', 'tol': 1.3536353272594721e-05, 'C': 0.004236029309372485, 'loss': 'squared_hinge', 'tol_linear_svc': 6.653366714603241e-05}. Best is trial 28 with value: 0.8921214545459446.
2026-05-21 03:03:40,923 - INFO - Trial 36 finished with value: 0.8921553670674193 and parameters: {'n_components': 74, 'algorithm': 'randomized', 'n_iter': 6, 'power_iteration_normalizer': 'LU', 'tol': 8.409552765336808e-06, 'C': 0.0045764955931919754, 'loss': 'squared_hinge', 'tol_linear_svc': 4.470337297238584e-05}. Best is trial 36 with value: 0.8921553670674193.
2026-05-21 03:03:42,788 - INFO - Trial 34 finished with value: 0.8920072647351759 and parameters: {'n_components': 73, 'algorithm': 'randomized', 'n_iter': 6, 'power_iteration_normalizer': 'LU', 'tol': 1.0233410141085135e-06, 'C': 0.00451737926577085, 'loss': 'squared_hinge', 'tol_linear_svc': 2.711565703120418e-05}. Best is trial 36 with value: 0.8921553670674193.
2026-05-21 03:04:24,931 - INFO - Trial 32 finished with value: 0.892132149399362 and parameters: {'n_components': 75, 'algorithm': 'randomized', 'n_iter': 13, 'power_iteration_normalizer': 'LU', 'tol': 1.0684180522268552e-06, 'C': 0.033497642997548115, 'loss': 'squared_hinge', 'tol_linear_svc': 3.618817610322364e-05}. Best is trial 36 with value: 0.8921553670674193.
2026-05-21 03:04:40,347 - INFO - Trial 35 finished with value: 0.8921735458687682 and parameters: {'n_components': 75, 'algorithm': 'randomized', 'n_iter': 13, 'power_iteration_normalizer': 'LU', 'tol': 3.3743478371986252e-06, 'C': 0.0039231626785511285, 'loss': 'squared_hinge', 'tol_linear_svc': 3.120749746435579e-05}. Best is trial 35 with value: 0.8921735458687682.
2026-05-21 03:07:52,148 - INFO - Trial 38 finished with value: 0.8919375182327544 and parameters: {'n_components': 63, 'algorithm': 'randomized', 'n_iter': 14, 'power_iteration_normalizer': 'LU', 'tol': 1.5234153321084844e-05, 'C': 0.0022267726186839063, 'loss': 'squared_hinge', 'tol_linear_svc': 5.477839599705649e-05}. Best is trial 35 with value: 0.8921735458687682.
2026-05-21 03:07:57,374 - INFO - Trial 39 finished with value: 0.8918953634794369 and parameters: {'n_components': 62, 'algorithm': 'randomized', 'n_iter': 14, 'power_iteration_normalizer': 'LU', 'tol': 1.433825268167492e-05, 'C': 0.002427052068632386, 'loss': 'squared_hinge', 'tol_linear_svc': 4.837145665897142e-05}. Best is trial 35 with value: 0.8921735458687682.
2026-05-21 03:08:51,643 - INFO - Trial 40 finished with value: 0.8919736190409729 and parameters: {'n_components': 61, 'algorithm': 'randomized', 'n_iter': 13, 'power_iteration_normalizer': 'LU', 'tol': 0.0011233702504946355, 'C': 0.0039548136560074, 'loss': 'squared_hinge', 'tol_linear_svc': 4.0427480914152154e-05}. Best is trial 35 with value: 0.8921735458687682.
2026-05-21 03:08:52,251 - INFO - Trial 41 finished with value: 0.8919694253200745 and parameters: {'n_components': 63, 'algorithm': 'randomized', 'n_iter': 13, 'power_iteration_normalizer': 'LU', 'tol': 0.0006373225802035973, 'C': 0.0032041851767317976, 'loss': 'squared_hinge', 'tol_linear_svc': 5.6782390450032115e-05}. Best is trial 35 with value: 0.8921735458687682.
2026-05-21 03:09:41,769 - INFO - Trial 42 finished with value: 0.8919905229998687 and parameters: {'n_components': 64, 'algorithm': 'randomized', 'n_iter': 13, 'power_iteration_normalizer': 'LU', 'tol': 0.00043098318408289575, 'C': 0.0032980135751659316, 'loss': 'squared_hinge', 'tol_linear_svc': 6.534463117924189e-05}. Best is trial 35 with value: 0.8921735458687682.
2026-05-21 03:10:40,935 - INFO - Trial 43 finished with value: 0.8920358796264866 and parameters: {'n_components': 65, 'algorithm': 'randomized', 'n_iter': 14, 'power_iteration_normalizer': 'LU', 'tol': 0.0006518430801337098, 'C': 0.0038919872817208953, 'loss': 'squared_hinge', 'tol_linear_svc': 5.8082202976533067e-05}. Best is trial 35 with value: 0.8921735458687682.
2026-05-21 03:11:25,889 - INFO - Trial 44 finished with value: 0.8918670224477527 and parameters: {'n_components': 66, 'algorithm': 'randomized', 'n_iter': 14, 'power_iteration_normalizer': 'LU', 'tol': 0.0005009342043948647, 'C': 0.0028993920550805055, 'loss': 'squared_hinge', 'tol_linear_svc': 5.787705920626932e-05}. Best is trial 35 with value: 0.8921735458687682.
2026-05-21 03:12:15,901 - INFO - Trial 45 finished with value: 0.8919657550241201 and parameters: {'n_components': 66, 'algorithm': 'randomized', 'n_iter': 14, 'power_iteration_normalizer': 'LU', 'tol': 0.0003651773004585227, 'C': 0.09462721903886304, 'loss': 'squared_hinge', 'tol_linear_svc': 5.797910874758183e-05}. Best is trial 35 with value: 0.8921735458687682.
2026-05-21 03:12:16,227 - INFO - Trial 47 finished with value: 0.8919433353562134 and parameters: {'n_components': 63, 'algorithm': 'randomized', 'n_iter': 14, 'power_iteration_normalizer': 'LU', 'tol': 0.0005286592430828095, 'C': 0.0979556900666669, 'loss': 'squared_hinge', 'tol_linear_svc': 6.708301737511607e-05}. Best is trial 35 with value: 0.8921735458687682.
2026-05-21 03:12:19,788 - INFO - Trial 46 finished with value: 0.8919447885069569 and parameters: {'n_components': 62, 'algorithm': 'randomized', 'n_iter': 14, 'power_iteration_normalizer': 'LU', 'tol': 0.00038562266466275383, 'C': 0.09651562548367638, 'loss': 'squared_hinge', 'tol_linear_svc': 6.0121797868561715e-05}. Best is trial 35 with value: 0.8921735458687682.
2026-05-21 03:13:09,374 - INFO - Trial 48 finished with value: 0.8920069829604355 and parameters: {'n_components': 63, 'algorithm': 'randomized', 'n_iter': 14, 'power_iteration_normalizer': 'LU', 'tol': 0.00040961891480419067, 'C': 0.0016733422079744445, 'loss': 'squared_hinge', 'tol_linear_svc': 5.123653978805598e-05}. Best is trial 35 with value: 0.8921735458687682.
2026-05-21 03:13:10,524 - INFO - Trial 49 finished with value: 0.8920288912266121 and parameters: {'n_components': 62, 'algorithm': 'randomized', 'n_iter': 14, 'power_iteration_normalizer': 'LU', 'tol': 3.0703119462606303e-06, 'C': 0.09281591384746246, 'loss': 'squared_hinge', 'tol_linear_svc': 6.357165942076297e-05}. Best is trial 35 with value: 0.8921735458687682.
2026-05-21 03:16:04,604 - INFO - Trial 56 pruned. 
2026-05-21 03:16:04,632 - INFO - Trial 51 finished with value: 0.8907481833500995 and parameters: {'n_components': 51, 'algorithm': 'randomized', 'n_iter': 11, 'power_iteration_normalizer': 'LU', 'tol': 2.9632226369918233e-06, 'C': 0.08732209541063865, 'loss': 'squared_hinge', 'tol_linear_svc': 4.129430363865518e-06}. Best is trial 35 with value: 0.8921735458687682.
2026-05-21 03:16:04,662 - INFO - Trial 50 finished with value: 0.8907483404884674 and parameters: {'n_components': 51, 'algorithm': 'randomized', 'n_iter': 11, 'power_iteration_normalizer': 'LU', 'tol': 2.3340974762547024e-06, 'C': 0.08537242854266197, 'loss': 'squared_hinge', 'tol_linear_svc': 6.973570531764068e-06}. Best is trial 35 with value: 0.8921735458687682.
2026-05-21 03:16:54,436 - INFO - Trial 53 finished with value: 0.8908374477015413 and parameters: {'n_components': 53, 'algorithm': 'randomized', 'n_iter': 11, 'power_iteration_normalizer': 'LU', 'tol': 2.7978499110583746e-06, 'C': 0.06383985010327166, 'loss': 'squared_hinge', 'tol_linear_svc': 7.471790767740004e-06}. Best is trial 35 with value: 0.8921735458687682.
2026-05-21 03:17:00,852 - INFO - Trial 52 finished with value: 0.8913137062533615 and parameters: {'n_components': 69, 'algorithm': 'randomized', 'n_iter': 15, 'power_iteration_normalizer': 'LU', 'tol': 3.0431180353939203e-06, 'C': 0.0012434199701096026, 'loss': 'squared_hinge', 'tol_linear_svc': 6.901906956463113e-06}. Best is trial 35 with value: 0.8921735458687682.
2026-05-21 03:18:20,062 - INFO - Trial 55 finished with value: 0.8913924711073292 and parameters: {'n_components': 54, 'algorithm': 'randomized', 'n_iter': 11, 'power_iteration_normalizer': 'LU', 'tol': 2.8289233017540553e-06, 'C': 0.07380183305284305, 'loss': 'squared_hinge', 'tol_linear_svc': 7.75485978005134e-06}. Best is trial 35 with value: 0.8921735458687682.
2026-05-21 03:18:30,682 - INFO - Trial 54 finished with value: 0.8920815587582279 and parameters: {'n_components': 69, 'algorithm': 'randomized', 'n_iter': 11, 'power_iteration_normalizer': 'LU', 'tol': 3.245148097561349e-06, 'C': 0.07919534982137097, 'loss': 'squared_hinge', 'tol_linear_svc': 7.196016674130677e-06}. Best is trial 35 with value: 0.8921735458687682.
2026-05-21 03:19:53,145 - INFO - Trial 58 finished with value: 0.8907103237533617 and parameters: {'n_components': 52, 'algorithm': 'randomized', 'n_iter': 11, 'power_iteration_normalizer': 'LU', 'tol': 2.968626294357997e-06, 'C': 0.001060237433857253, 'loss': 'squared_hinge', 'tol_linear_svc': 4.62419306581532e-06}. Best is trial 35 with value: 0.8921735458687682.
2026-05-21 03:19:55,245 - INFO - Trial 57 finished with value: 0.8893541657780268 and parameters: {'n_components': 54, 'algorithm': 'randomized', 'n_iter': 11, 'power_iteration_normalizer': 'LU', 'tol': 3.539610238056503e-06, 'C': 0.04627389206458999, 'loss': 'squared_hinge', 'tol_linear_svc': 5.4587392357455195e-06}. Best is trial 35 with value: 0.8921735458687682.
2026-05-21 03:19:55,997 - INFO - Trial 59 finished with value: 0.890380912370522 and parameters: {'n_components': 51, 'algorithm': 'randomized', 'n_iter': 11, 'power_iteration_normalizer': 'LU', 'tol': 3.116688464607661e-06, 'C': 0.00011981033631739894, 'loss': 'squared_hinge', 'tol_linear_svc': 5.630447293676356e-06}. Best is trial 35 with value: 0.8921735458687682.
2026-05-21 03:20:21,204 - INFO - Trial 60 finished with value: 0.8905425171978998 and parameters: {'n_components': 53, 'algorithm': 'randomized', 'n_iter': 11, 'power_iteration_normalizer': 'LU', 'tol': 2.4656691526020594e-06, 'C': 0.00014368268440199917, 'loss': 'squared_hinge', 'tol_linear_svc': 3.6190076630721676e-06}. Best is trial 35 with value: 0.8921735458687682.
2026-05-21 03:20:22,718 - INFO - Trial 61 finished with value: 0.8912853315243027 and parameters: {'n_components': 54, 'algorithm': 'randomized', 'n_iter': 11, 'power_iteration_normalizer': 'LU', 'tol': 3.3314258716257582e-06, 'C': 0.00017471677614951163, 'loss': 'squared_hinge', 'tol_linear_svc': 6.391756475214029e-06}. Best is trial 35 with value: 0.8921735458687682.
2026-05-21 03:23:22,278 - INFO - Trial 64 finished with value: 0.8917794170121083 and parameters: {'n_components': 70, 'algorithm': 'randomized', 'n_iter': 10, 'power_iteration_normalizer': 'LU', 'tol': 0.00010564877461289153, 'C': 0.0001969428372377551, 'loss': 'squared_hinge', 'tol_linear_svc': 1.0508643680528366e-05}. Best is trial 35 with value: 0.8921735458687682.
2026-05-21 03:23:28,558 - INFO - Trial 62 finished with value: 0.8917049318579633 and parameters: {'n_components': 71, 'algorithm': 'randomized', 'n_iter': 10, 'power_iteration_normalizer': 'LU', 'tol': 9.105303957189484e-05, 'C': 0.00016959644592843, 'loss': 'squared_hinge', 'tol_linear_svc': 9.685572906946198e-05}. Best is trial 35 with value: 0.8921735458687682.
2026-05-21 03:23:47,852 - INFO - Trial 63 finished with value: 0.891982650780038 and parameters: {'n_components': 70, 'algorithm': 'randomized', 'n_iter': 10, 'power_iteration_normalizer': 'LU', 'tol': 4.798822378046319e-05, 'C': 0.04561305391985045, 'loss': 'squared_hinge', 'tol_linear_svc': 9.38324896846001e-06}. Best is trial 35 with value: 0.8921735458687682.
2026-05-21 03:24:02,254 - INFO - Trial 65 finished with value: 0.8918767445331346 and parameters: {'n_components': 70, 'algorithm': 'randomized', 'n_iter': 13, 'power_iteration_normalizer': 'LU', 'tol': 0.00011179994133221136, 'C': 0.0002389683441551405, 'loss': 'squared_hinge', 'tol_linear_svc': 3.371271170443238e-05}. Best is trial 35 with value: 0.8921735458687682.
2026-05-21 03:25:30,164 - INFO - Trial 67 finished with value: 0.8912498889769009 and parameters: {'n_components': 70, 'algorithm': 'randomized', 'n_iter': 13, 'power_iteration_normalizer': 'OR', 'tol': 0.00010055986435038006, 'C': 0.00018626439864052223, 'loss': 'squared_hinge', 'tol_linear_svc': 0.00010278901282684781}. Best is trial 35 with value: 0.8921735458687682.
2026-05-21 03:25:47,283 - INFO - Trial 66 finished with value: 0.8916073608190851 and parameters: {'n_components': 71, 'algorithm': 'randomized', 'n_iter': 13, 'power_iteration_normalizer': 'OR', 'tol': 9.675363272998736e-05, 'C': 0.00030252907106813776, 'loss': 'squared_hinge', 'tol_linear_svc': 3.0293344782089705e-05}. Best is trial 35 with value: 0.8921735458687682.
2026-05-21 03:26:30,662 - INFO - Trial 68 finished with value: 0.8917517448022035 and parameters: {'n_components': 71, 'algorithm': 'randomized', 'n_iter': 10, 'power_iteration_normalizer': 'OR', 'tol': 9.429307642495366e-05, 'C': 0.0005258091925469349, 'loss': 'squared_hinge', 'tol_linear_svc': 2.898675266053152e-05}. Best is trial 35 with value: 0.8921735458687682.
2026-05-21 03:27:37,762 - INFO - Trial 70 finished with value: 0.8917507998995389 and parameters: {'n_components': 71, 'algorithm': 'randomized', 'n_iter': 10, 'power_iteration_normalizer': 'OR', 'tol': 0.00010181032224179303, 'C': 0.0005356650530342973, 'loss': 'squared_hinge', 'tol_linear_svc': 9.423574367822102e-05}. Best is trial 35 with value: 0.8921735458687682.
2026-05-21 03:28:41,296 - INFO - Trial 73 finished with value: 0.8917891815195105 and parameters: {'n_components': 71, 'algorithm': 'randomized', 'n_iter': 12, 'power_iteration_normalizer': 'OR', 'tol': 0.0001003249267211634, 'C': 0.00041141541005151536, 'loss': 'squared_hinge', 'tol_linear_svc': 3.0289812880224023e-05}. Best is trial 35 with value: 0.8921735458687682.
2026-05-21 03:29:11,652 - INFO - Trial 78 pruned. 
2026-05-21 03:32:49,678 - INFO - Trial 75 finished with value: 0.891787264931353 and parameters: {'n_components': 72, 'algorithm': 'randomized', 'n_iter': 13, 'power_iteration_normalizer': 'OR', 'tol': 5.2234209488769446e-05, 'C': 0.0006378250181798588, 'loss': 'squared_hinge', 'tol_linear_svc': 2.3697323926447536e-06}. Best is trial 35 with value: 0.8921735458687682.
2026-05-21 03:34:01,706 - INFO - Trial 83 finished with value: 0.8920052789582142 and parameters: {'n_components': 68, 'algorithm': 'randomized', 'n_iter': 6, 'power_iteration_normalizer': 'LU', 'tol': 7.732966614519316e-06, 'C': 0.2595460894394556, 'loss': 'squared_hinge', 'tol_linear_svc': 1.4366968280339087e-05}. Best is trial 35 with value: 0.8921735458687682.
2026-05-21 03:34:55,171 - INFO - Trial 79 finished with value: 0.892040912409281 and parameters: {'n_components': 75, 'algorithm': 'randomized', 'n_iter': 8, 'power_iteration_normalizer': 'auto', 'tol': 1.4441682516122759e-06, 'C': 0.2772909890797617, 'loss': 'squared_hinge', 'tol_linear_svc': 1.6040238496125056e-05}. Best is trial 35 with value: 0.8921735458687682.
2026-05-21 03:35:56,444 - INFO - Trial 80 finished with value: 0.892017051395418 and parameters: {'n_components': 75, 'algorithm': 'randomized', 'n_iter': 12, 'power_iteration_normalizer': 'auto', 'tol': 1.2968248363092461e-06, 'C': 0.007368295298052699, 'loss': 'squared_hinge', 'tol_linear_svc': 2.259693908332261e-06}. Best is trial 35 with value: 0.8921735458687682.
2026-05-21 03:36:54,802 - INFO - Trial 81 finished with value: 0.8920092578193838 and parameters: {'n_components': 75, 'algorithm': 'randomized', 'n_iter': 12, 'power_iteration_normalizer': 'auto', 'tol': 1.494227876490121e-06, 'C': 0.2422134281947073, 'loss': 'squared_hinge', 'tol_linear_svc': 2.7595007012547595e-06}. Best is trial 35 with value: 0.8921735458687682.
2026-05-21 03:37:37,265 - INFO - Trial 82 finished with value: 0.8921654542278634 and parameters: {'n_components': 75, 'algorithm': 'randomized', 'n_iter': 8, 'power_iteration_normalizer': 'auto', 'tol': 1.5915312357716896e-06, 'C': 0.17545362266144945, 'loss': 'squared_hinge', 'tol_linear_svc': 1.7531999512178842e-05}. Best is trial 35 with value: 0.8921735458687682.
2026-05-21 03:37:55,181 - INFO - Trial 84 finished with value: 0.8919935929188456 and parameters: {'n_components': 67, 'algorithm': 'randomized', 'n_iter': 8, 'power_iteration_normalizer': 'LU', 'tol': 1.508006527140043e-06, 'C': 0.1816779798400638, 'loss': 'squared_hinge', 'tol_linear_svc': 1.5703500143160538e-05}. Best is trial 35 with value: 0.8921735458687682.
