2026-05-21 17:46:06,571 - INFO - ----- Fine Tuning -----
2026-05-21 17:46:06,571 - INFO - A new study created in memory with name: no-name-eaa26c83-94bc-4744-847e-4d42e3774f5f
2026-05-21 17:46:07,373 - WARNING - Trial 0 failed with parameters: {'n_components': 25, 'algorithm': 'randomized', 'n_iter': 10, 'power_iteration_normalizer': 'LU', 'tol': 0.0003032841082663266, 'kernel': 'sigmoid', 'gamma': 1.4002871955435554} because of the following error: ValueError('Cannot set different log configuration to the same parameter name.').
Traceback (most recent call last):
  File "/home/junior/Documentos/GitHub/prediction-f1-pit-stops-kaggle-competition/.venv/lib/python3.13/site-packages/optuna/study/_optimize.py", line 206, in _run_trial
    value_or_values = func(trial)
  File "/home/junior/Documentos/GitHub/prediction-f1-pit-stops-kaggle-competition/src/truncatedsvd_nystroem_logistic_regression_tuning.py", line 127, in <lambda>
    study.optimize(lambda trial: objective(trial, X_train, y_train), n_trials=30, n_jobs=-1, show_progress_bar=True)
                                 ~~~~~~~~~^^^^^^^^^^^^^^^^^^^^^^^^^
  File "/home/junior/Documentos/GitHub/prediction-f1-pit-stops-kaggle-competition/src/truncatedsvd_nystroem_logistic_regression_tuning.py", line 103, in objective
    n_components = trial.suggest_int("n_components", 64, 75, log=True)
  File "/home/junior/Documentos/GitHub/prediction-f1-pit-stops-kaggle-competition/.venv/lib/python3.13/site-packages/optuna/_convert_positional_args.py", line 127, in converter_wrapper
    return func(**kwargs)  # type: ignore[call-arg]
  File "/home/junior/Documentos/GitHub/prediction-f1-pit-stops-kaggle-competition/.venv/lib/python3.13/site-packages/optuna/trial/_trial.py", line 336, in suggest_int
    suggested_value = int(self._suggest(name, distribution))
                          ~~~~~~~~~~~~~^^^^^^^^^^^^^^^^^^^^
  File "/home/junior/Documentos/GitHub/prediction-f1-pit-stops-kaggle-competition/.venv/lib/python3.13/site-packages/optuna/trial/_trial.py", line 632, in _suggest
    distributions.check_distribution_compatibility(trial.distributions[name], distribution)
    ~~~~~~~~~~~~~~~~~~~~~~~~~~~~~~~~~~~~~~~~~~~~~~^^^^^^^^^^^^^^^^^^^^^^^^^^^^^^^^^^^^^^^^^
  File "/home/junior/Documentos/GitHub/prediction-f1-pit-stops-kaggle-competition/.venv/lib/python3.13/site-packages/optuna/distributions.py", line 649, in check_distribution_compatibility
    raise ValueError("Cannot set different log configuration to the same parameter name.")
ValueError: Cannot set different log configuration to the same parameter name.
2026-05-21 17:46:07,381 - WARNING - Trial 1 failed with parameters: {'n_components': 30, 'algorithm': 'randomized', 'n_iter': 4, 'power_iteration_normalizer': 'auto', 'tol': 0.0077217384707491295, 'kernel': 'cosine', 'gamma': 0.00022413016173122472} because of the following error: ValueError('Cannot set different log configuration to the same parameter name.').
Traceback (most recent call last):
  File "/home/junior/Documentos/GitHub/prediction-f1-pit-stops-kaggle-competition/.venv/lib/python3.13/site-packages/optuna/study/_optimize.py", line 206, in _run_trial
    value_or_values = func(trial)
  File "/home/junior/Documentos/GitHub/prediction-f1-pit-stops-kaggle-competition/src/truncatedsvd_nystroem_logistic_regression_tuning.py", line 127, in <lambda>
    study.optimize(lambda trial: objective(trial, X_train, y_train), n_trials=30, n_jobs=-1, show_progress_bar=True)
                                 ~~~~~~~~~^^^^^^^^^^^^^^^^^^^^^^^^^
  File "/home/junior/Documentos/GitHub/prediction-f1-pit-stops-kaggle-competition/src/truncatedsvd_nystroem_logistic_regression_tuning.py", line 103, in objective
    n_components = trial.suggest_int("n_components", 64, 75, log=True)
  File "/home/junior/Documentos/GitHub/prediction-f1-pit-stops-kaggle-competition/.venv/lib/python3.13/site-packages/optuna/_convert_positional_args.py", line 127, in converter_wrapper
    return func(**kwargs)  # type: ignore[call-arg]
  File "/home/junior/Documentos/GitHub/prediction-f1-pit-stops-kaggle-competition/.venv/lib/python3.13/site-packages/optuna/trial/_trial.py", line 336, in suggest_int
    suggested_value = int(self._suggest(name, distribution))
                          ~~~~~~~~~~~~~^^^^^^^^^^^^^^^^^^^^
  File "/home/junior/Documentos/GitHub/prediction-f1-pit-stops-kaggle-competition/.venv/lib/python3.13/site-packages/optuna/trial/_trial.py", line 632, in _suggest
    distributions.check_distribution_compatibility(trial.distributions[name], distribution)
    ~~~~~~~~~~~~~~~~~~~~~~~~~~~~~~~~~~~~~~~~~~~~~~^^^^^^^^^^^^^^^^^^^^^^^^^^^^^^^^^^^^^^^^^
  File "/home/junior/Documentos/GitHub/prediction-f1-pit-stops-kaggle-competition/.venv/lib/python3.13/site-packages/optuna/distributions.py", line 649, in check_distribution_compatibility
    raise ValueError("Cannot set different log configuration to the same parameter name.")
ValueError: Cannot set different log configuration to the same parameter name.
2026-05-21 17:46:07,395 - WARNING - Trial 11 failed with parameters: {'n_components': 61, 'algorithm': 'randomized', 'n_iter': 11, 'power_iteration_normalizer': 'OR', 'tol': 0.004338812252238752, 'kernel': 'cosine', 'gamma': 0.7632524515045884} because of the following error: ValueError('Cannot set different log configuration to the same parameter name.').
Traceback (most recent call last):
  File "/home/junior/Documentos/GitHub/prediction-f1-pit-stops-kaggle-competition/.venv/lib/python3.13/site-packages/optuna/study/_optimize.py", line 206, in _run_trial
    value_or_values = func(trial)
  File "/home/junior/Documentos/GitHub/prediction-f1-pit-stops-kaggle-competition/src/truncatedsvd_nystroem_logistic_regression_tuning.py", line 127, in <lambda>
    study.optimize(lambda trial: objective(trial, X_train, y_train), n_trials=30, n_jobs=-1, show_progress_bar=True)
                                 ~~~~~~~~~^^^^^^^^^^^^^^^^^^^^^^^^^
  File "/home/junior/Documentos/GitHub/prediction-f1-pit-stops-kaggle-competition/src/truncatedsvd_nystroem_logistic_regression_tuning.py", line 103, in objective
    n_components = trial.suggest_int("n_components", 64, 75, log=True)
  File "/home/junior/Documentos/GitHub/prediction-f1-pit-stops-kaggle-competition/.venv/lib/python3.13/site-packages/optuna/_convert_positional_args.py", line 127, in converter_wrapper
    return func(**kwargs)  # type: ignore[call-arg]
  File "/home/junior/Documentos/GitHub/prediction-f1-pit-stops-kaggle-competition/.venv/lib/python3.13/site-packages/optuna/trial/_trial.py", line 336, in suggest_int
    suggested_value = int(self._suggest(name, distribution))
                          ~~~~~~~~~~~~~^^^^^^^^^^^^^^^^^^^^
  File "/home/junior/Documentos/GitHub/prediction-f1-pit-stops-kaggle-competition/.venv/lib/python3.13/site-packages/optuna/trial/_trial.py", line 632, in _suggest
    distributions.check_distribution_compatibility(trial.distributions[name], distribution)
    ~~~~~~~~~~~~~~~~~~~~~~~~~~~~~~~~~~~~~~~~~~~~~~^^^^^^^^^^^^^^^^^^^^^^^^^^^^^^^^^^^^^^^^^
  File "/home/junior/Documentos/GitHub/prediction-f1-pit-stops-kaggle-competition/.venv/lib/python3.13/site-packages/optuna/distributions.py", line 649, in check_distribution_compatibility
    raise ValueError("Cannot set different log configuration to the same parameter name.")
ValueError: Cannot set different log configuration to the same parameter name.
2026-05-21 17:46:07,396 - WARNING - Trial 5 failed with parameters: {'n_components': 13, 'algorithm': 'randomized', 'n_iter': 10, 'power_iteration_normalizer': 'OR', 'tol': 0.00300456917134128, 'kernel': 'sigmoid', 'gamma': 6.386169737315608e-05} because of the following error: ValueError('Cannot set different log configuration to the same parameter name.').
Traceback (most recent call last):
  File "/home/junior/Documentos/GitHub/prediction-f1-pit-stops-kaggle-competition/.venv/lib/python3.13/site-packages/optuna/study/_optimize.py", line 206, in _run_trial
    value_or_values = func(trial)
  File "/home/junior/Documentos/GitHub/prediction-f1-pit-stops-kaggle-competition/src/truncatedsvd_nystroem_logistic_regression_tuning.py", line 127, in <lambda>
    study.optimize(lambda trial: objective(trial, X_train, y_train), n_trials=30, n_jobs=-1, show_progress_bar=True)
                                 ~~~~~~~~~^^^^^^^^^^^^^^^^^^^^^^^^^
  File "/home/junior/Documentos/GitHub/prediction-f1-pit-stops-kaggle-competition/src/truncatedsvd_nystroem_logistic_regression_tuning.py", line 103, in objective
    n_components = trial.suggest_int("n_components", 64, 75, log=True)
  File "/home/junior/Documentos/GitHub/prediction-f1-pit-stops-kaggle-competition/.venv/lib/python3.13/site-packages/optuna/_convert_positional_args.py", line 127, in converter_wrapper
    return func(**kwargs)  # type: ignore[call-arg]
  File "/home/junior/Documentos/GitHub/prediction-f1-pit-stops-kaggle-competition/.venv/lib/python3.13/site-packages/optuna/trial/_trial.py", line 336, in suggest_int
    suggested_value = int(self._suggest(name, distribution))
                          ~~~~~~~~~~~~~^^^^^^^^^^^^^^^^^^^^
  File "/home/junior/Documentos/GitHub/prediction-f1-pit-stops-kaggle-competition/.venv/lib/python3.13/site-packages/optuna/trial/_trial.py", line 632, in _suggest
    distributions.check_distribution_compatibility(trial.distributions[name], distribution)
    ~~~~~~~~~~~~~~~~~~~~~~~~~~~~~~~~~~~~~~~~~~~~~~^^^^^^^^^^^^^^^^^^^^^^^^^^^^^^^^^^^^^^^^^
  File "/home/junior/Documentos/GitHub/prediction-f1-pit-stops-kaggle-competition/.venv/lib/python3.13/site-packages/optuna/distributions.py", line 649, in check_distribution_compatibility
    raise ValueError("Cannot set different log configuration to the same parameter name.")
ValueError: Cannot set different log configuration to the same parameter name.
2026-05-21 17:46:07,405 - WARNING - Trial 6 failed with parameters: {'n_components': 43, 'algorithm': 'randomized', 'n_iter': 12, 'power_iteration_normalizer': 'auto', 'tol': 0.00021212427883608904, 'kernel': 'rbf', 'gamma': 0.30154831795576414} because of the following error: ValueError('Cannot set different log configuration to the same parameter name.').
Traceback (most recent call last):
  File "/home/junior/Documentos/GitHub/prediction-f1-pit-stops-kaggle-competition/.venv/lib/python3.13/site-packages/optuna/study/_optimize.py", line 206, in _run_trial
    value_or_values = func(trial)
  File "/home/junior/Documentos/GitHub/prediction-f1-pit-stops-kaggle-competition/src/truncatedsvd_nystroem_logistic_regression_tuning.py", line 127, in <lambda>
    study.optimize(lambda trial: objective(trial, X_train, y_train), n_trials=30, n_jobs=-1, show_progress_bar=True)
                                 ~~~~~~~~~^^^^^^^^^^^^^^^^^^^^^^^^^
  File "/home/junior/Documentos/GitHub/prediction-f1-pit-stops-kaggle-competition/src/truncatedsvd_nystroem_logistic_regression_tuning.py", line 103, in objective
    n_components = trial.suggest_int("n_components", 64, 75, log=True)
  File "/home/junior/Documentos/GitHub/prediction-f1-pit-stops-kaggle-competition/.venv/lib/python3.13/site-packages/optuna/_convert_positional_args.py", line 127, in converter_wrapper
    return func(**kwargs)  # type: ignore[call-arg]
  File "/home/junior/Documentos/GitHub/prediction-f1-pit-stops-kaggle-competition/.venv/lib/python3.13/site-packages/optuna/trial/_trial.py", line 336, in suggest_int
    suggested_value = int(self._suggest(name, distribution))
                          ~~~~~~~~~~~~~^^^^^^^^^^^^^^^^^^^^
  File "/home/junior/Documentos/GitHub/prediction-f1-pit-stops-kaggle-competition/.venv/lib/python3.13/site-packages/optuna/trial/_trial.py", line 632, in _suggest
    distributions.check_distribution_compatibility(trial.distributions[name], distribution)
    ~~~~~~~~~~~~~~~~~~~~~~~~~~~~~~~~~~~~~~~~~~~~~~^^^^^^^^^^^^^^^^^^^^^^^^^^^^^^^^^^^^^^^^^
  File "/home/junior/Documentos/GitHub/prediction-f1-pit-stops-kaggle-competition/.venv/lib/python3.13/site-packages/optuna/distributions.py", line 649, in check_distribution_compatibility
    raise ValueError("Cannot set different log configuration to the same parameter name.")
ValueError: Cannot set different log configuration to the same parameter name.
2026-05-21 17:46:07,406 - WARNING - Trial 7 failed with parameters: {'n_components': 24, 'algorithm': 'randomized', 'n_iter': 15, 'power_iteration_normalizer': 'auto', 'tol': 0.00010381331521377205, 'kernel': 'rbf', 'gamma': 0.0492967124155963} because of the following error: ValueError('Cannot set different log configuration to the same parameter name.').
Traceback (most recent call last):
  File "/home/junior/Documentos/GitHub/prediction-f1-pit-stops-kaggle-competition/.venv/lib/python3.13/site-packages/optuna/study/_optimize.py", line 206, in _run_trial
    value_or_values = func(trial)
  File "/home/junior/Documentos/GitHub/prediction-f1-pit-stops-kaggle-competition/src/truncatedsvd_nystroem_logistic_regression_tuning.py", line 127, in <lambda>
    study.optimize(lambda trial: objective(trial, X_train, y_train), n_trials=30, n_jobs=-1, show_progress_bar=True)
                                 ~~~~~~~~~^^^^^^^^^^^^^^^^^^^^^^^^^
  File "/home/junior/Documentos/GitHub/prediction-f1-pit-stops-kaggle-competition/src/truncatedsvd_nystroem_logistic_regression_tuning.py", line 103, in objective
    n_components = trial.suggest_int("n_components", 64, 75, log=True)
  File "/home/junior/Documentos/GitHub/prediction-f1-pit-stops-kaggle-competition/.venv/lib/python3.13/site-packages/optuna/_convert_positional_args.py", line 127, in converter_wrapper
    return func(**kwargs)  # type: ignore[call-arg]
  File "/home/junior/Documentos/GitHub/prediction-f1-pit-stops-kaggle-competition/.venv/lib/python3.13/site-packages/optuna/trial/_trial.py", line 336, in suggest_int
    suggested_value = int(self._suggest(name, distribution))
                          ~~~~~~~~~~~~~^^^^^^^^^^^^^^^^^^^^
  File "/home/junior/Documentos/GitHub/prediction-f1-pit-stops-kaggle-competition/.venv/lib/python3.13/site-packages/optuna/trial/_trial.py", line 632, in _suggest
    distributions.check_distribution_compatibility(trial.distributions[name], distribution)
    ~~~~~~~~~~~~~~~~~~~~~~~~~~~~~~~~~~~~~~~~~~~~~~^^^^^^^^^^^^^^^^^^^^^^^^^^^^^^^^^^^^^^^^^
  File "/home/junior/Documentos/GitHub/prediction-f1-pit-stops-kaggle-competition/.venv/lib/python3.13/site-packages/optuna/distributions.py", line 649, in check_distribution_compatibility
    raise ValueError("Cannot set different log configuration to the same parameter name.")
ValueError: Cannot set different log configuration to the same parameter name.
2026-05-21 17:46:07,407 - WARNING - Trial 10 failed with parameters: {'n_components': 21, 'algorithm': 'randomized', 'n_iter': 6, 'power_iteration_normalizer': 'LU', 'tol': 0.00025102800634554587, 'kernel': 'cosine', 'gamma': 3.995343709170552} because of the following error: ValueError('Cannot set different log configuration to the same parameter name.').
Traceback (most recent call last):
  File "/home/junior/Documentos/GitHub/prediction-f1-pit-stops-kaggle-competition/.venv/lib/python3.13/site-packages/optuna/study/_optimize.py", line 206, in _run_trial
    value_or_values = func(trial)
  File "/home/junior/Documentos/GitHub/prediction-f1-pit-stops-kaggle-competition/src/truncatedsvd_nystroem_logistic_regression_tuning.py", line 127, in <lambda>
    study.optimize(lambda trial: objective(trial, X_train, y_train), n_trials=30, n_jobs=-1, show_progress_bar=True)
                                 ~~~~~~~~~^^^^^^^^^^^^^^^^^^^^^^^^^
  File "/home/junior/Documentos/GitHub/prediction-f1-pit-stops-kaggle-competition/src/truncatedsvd_nystroem_logistic_regression_tuning.py", line 103, in objective
    n_components = trial.suggest_int("n_components", 64, 75, log=True)
  File "/home/junior/Documentos/GitHub/prediction-f1-pit-stops-kaggle-competition/.venv/lib/python3.13/site-packages/optuna/_convert_positional_args.py", line 127, in converter_wrapper
    return func(**kwargs)  # type: ignore[call-arg]
  File "/home/junior/Documentos/GitHub/prediction-f1-pit-stops-kaggle-competition/.venv/lib/python3.13/site-packages/optuna/trial/_trial.py", line 336, in suggest_int
    suggested_value = int(self._suggest(name, distribution))
                          ~~~~~~~~~~~~~^^^^^^^^^^^^^^^^^^^^
  File "/home/junior/Documentos/GitHub/prediction-f1-pit-stops-kaggle-competition/.venv/lib/python3.13/site-packages/optuna/trial/_trial.py", line 632, in _suggest
    distributions.check_distribution_compatibility(trial.distributions[name], distribution)
    ~~~~~~~~~~~~~~~~~~~~~~~~~~~~~~~~~~~~~~~~~~~~~~^^^^^^^^^^^^^^^^^^^^^^^^^^^^^^^^^^^^^^^^^
  File "/home/junior/Documentos/GitHub/prediction-f1-pit-stops-kaggle-competition/.venv/lib/python3.13/site-packages/optuna/distributions.py", line 649, in check_distribution_compatibility
    raise ValueError("Cannot set different log configuration to the same parameter name.")
ValueError: Cannot set different log configuration to the same parameter name.
2026-05-21 17:46:07,410 - WARNING - Trial 0 failed with value None.
2026-05-21 17:46:07,411 - WARNING - Trial 4 failed with parameters: {'n_components': 39, 'algorithm': 'randomized', 'n_iter': 8, 'power_iteration_normalizer': 'auto', 'tol': 0.0014169176201721547, 'kernel': 'sigmoid', 'gamma': 0.0012651575353334846} because of the following error: ValueError('Cannot set different log configuration to the same parameter name.').
Traceback (most recent call last):
  File "/home/junior/Documentos/GitHub/prediction-f1-pit-stops-kaggle-competition/.venv/lib/python3.13/site-packages/optuna/study/_optimize.py", line 206, in _run_trial
    value_or_values = func(trial)
  File "/home/junior/Documentos/GitHub/prediction-f1-pit-stops-kaggle-competition/src/truncatedsvd_nystroem_logistic_regression_tuning.py", line 127, in <lambda>
    study.optimize(lambda trial: objective(trial, X_train, y_train), n_trials=30, n_jobs=-1, show_progress_bar=True)
                                 ~~~~~~~~~^^^^^^^^^^^^^^^^^^^^^^^^^
  File "/home/junior/Documentos/GitHub/prediction-f1-pit-stops-kaggle-competition/src/truncatedsvd_nystroem_logistic_regression_tuning.py", line 103, in objective
    n_components = trial.suggest_int("n_components", 64, 75, log=True)
  File "/home/junior/Documentos/GitHub/prediction-f1-pit-stops-kaggle-competition/.venv/lib/python3.13/site-packages/optuna/_convert_positional_args.py", line 127, in converter_wrapper
    return func(**kwargs)  # type: ignore[call-arg]
  File "/home/junior/Documentos/GitHub/prediction-f1-pit-stops-kaggle-competition/.venv/lib/python3.13/site-packages/optuna/trial/_trial.py", line 336, in suggest_int
    suggested_value = int(self._suggest(name, distribution))
                          ~~~~~~~~~~~~~^^^^^^^^^^^^^^^^^^^^
  File "/home/junior/Documentos/GitHub/prediction-f1-pit-stops-kaggle-competition/.venv/lib/python3.13/site-packages/optuna/trial/_trial.py", line 632, in _suggest
    distributions.check_distribution_compatibility(trial.distributions[name], distribution)
    ~~~~~~~~~~~~~~~~~~~~~~~~~~~~~~~~~~~~~~~~~~~~~~^^^^^^^^^^^^^^^^^^^^^^^^^^^^^^^^^^^^^^^^^
  File "/home/junior/Documentos/GitHub/prediction-f1-pit-stops-kaggle-competition/.venv/lib/python3.13/site-packages/optuna/distributions.py", line 649, in check_distribution_compatibility
    raise ValueError("Cannot set different log configuration to the same parameter name.")
ValueError: Cannot set different log configuration to the same parameter name.
2026-05-21 17:46:07,412 - WARNING - Trial 2 failed with parameters: {'n_components': 75, 'algorithm': 'randomized', 'n_iter': 8, 'power_iteration_normalizer': 'LU', 'tol': 0.00243745772513292, 'kernel': 'cosine', 'gamma': 6.573963166439852e-05} because of the following error: ValueError('Cannot set different log configuration to the same parameter name.').
Traceback (most recent call last):
  File "/home/junior/Documentos/GitHub/prediction-f1-pit-stops-kaggle-competition/.venv/lib/python3.13/site-packages/optuna/study/_optimize.py", line 206, in _run_trial
    value_or_values = func(trial)
  File "/home/junior/Documentos/GitHub/prediction-f1-pit-stops-kaggle-competition/src/truncatedsvd_nystroem_logistic_regression_tuning.py", line 127, in <lambda>
    study.optimize(lambda trial: objective(trial, X_train, y_train), n_trials=30, n_jobs=-1, show_progress_bar=True)
                                 ~~~~~~~~~^^^^^^^^^^^^^^^^^^^^^^^^^
  File "/home/junior/Documentos/GitHub/prediction-f1-pit-stops-kaggle-competition/src/truncatedsvd_nystroem_logistic_regression_tuning.py", line 103, in objective
    n_components = trial.suggest_int("n_components", 64, 75, log=True)
  File "/home/junior/Documentos/GitHub/prediction-f1-pit-stops-kaggle-competition/.venv/lib/python3.13/site-packages/optuna/_convert_positional_args.py", line 127, in converter_wrapper
    return func(**kwargs)  # type: ignore[call-arg]
  File "/home/junior/Documentos/GitHub/prediction-f1-pit-stops-kaggle-competition/.venv/lib/python3.13/site-packages/optuna/trial/_trial.py", line 336, in suggest_int
    suggested_value = int(self._suggest(name, distribution))
                          ~~~~~~~~~~~~~^^^^^^^^^^^^^^^^^^^^
  File "/home/junior/Documentos/GitHub/prediction-f1-pit-stops-kaggle-competition/.venv/lib/python3.13/site-packages/optuna/trial/_trial.py", line 632, in _suggest
    distributions.check_distribution_compatibility(trial.distributions[name], distribution)
    ~~~~~~~~~~~~~~~~~~~~~~~~~~~~~~~~~~~~~~~~~~~~~~^^^^^^^^^^^^^^^^^^^^^^^^^^^^^^^^^^^^^^^^^
  File "/home/junior/Documentos/GitHub/prediction-f1-pit-stops-kaggle-competition/.venv/lib/python3.13/site-packages/optuna/distributions.py", line 649, in check_distribution_compatibility
    raise ValueError("Cannot set different log configuration to the same parameter name.")
ValueError: Cannot set different log configuration to the same parameter name.
2026-05-21 17:46:07,412 - WARNING - Trial 3 failed w