2026-05-21 03:39:50,562 - INFO - Trial 85 finished with value: 0.8919379169507211 and parameters: {'n_components': 67, 'algorithm': 'randomized', 'n_iter': 8, 'power_iteration_normalizer': 'auto', 'tol': 2.3433161219659104e-05, 'C': 0.006988180363928587, 'loss': 'squared_hinge', 'tol_linear_svc': 1.6919207759361888e-05}. Best is trial 35 with value: 0.8921735458687682.
2026-05-21 03:41:36,528 - INFO - Trial 87 finished with value: 0.8918877684216764 and parameters: {'n_components': 68, 'algorithm': 'randomized', 'n_iter': 6, 'power_iteration_normalizer': 'LU', 'tol': 2.1201531582724114e-05, 'C': 0.012614799587192351, 'loss': 'squared_hinge', 'tol_linear_svc': 2.1620860403638114e-05}. Best is trial 35 with value: 0.8921735458687682.
2026-05-21 03:41:48,150 - INFO - Trial 88 finished with value: 0.8917723719970632 and parameters: {'n_components': 59, 'algorithm': 'randomized', 'n_iter': 4, 'power_iteration_normalizer': 'LU', 'tol': 8.618892864027967e-06, 'C': 0.017173033180589145, 'loss': 'squared_hinge', 'tol_linear_svc': 2.3493775148364275e-05}. Best is trial 35 with value: 0.8921735458687682.
2026-05-21 03:41:56,896 - INFO - Trial 86 finished with value: 0.8919003333112085 and parameters: {'n_components': 68, 'algorithm': 'randomized', 'n_iter': 12, 'power_iteration_normalizer': 'LU', 'tol': 2.3390605343279942e-05, 'C': 0.006619958114563655, 'loss': 'squared_hinge', 'tol_linear_svc': 2.287131502685636e-05}. Best is trial 35 with value: 0.8921735458687682.
2026-05-21 03:43:07,086 - INFO - Trial 89 finished with value: 0.8920498748380797 and parameters: {'n_components': 67, 'algorithm': 'randomized', 'n_iter': 9, 'power_iteration_normalizer': 'auto', 'tol': 4.637665608642869e-06, 'C': 6.3519060333820585, 'loss': 'squared_hinge', 'tol_linear_svc': 2.1847508019683025e-05}. Best is trial 35 with value: 0.8921735458687682.
2026-05-21 03:47:13,012 - INFO - Trial 92 finished with value: 0.8920578663351657 and parameters: {'n_components': 73, 'algorithm': 'randomized', 'n_iter': 5, 'power_iteration_normalizer': 'auto', 'tol': 4.638975785588359e-06, 'C': 0.8827066263832801, 'loss': 'squared_hinge', 'tol_linear_svc': 1.1540037718415178e-05}. Best is trial 35 with value: 0.8921735458687682.
2026-05-21 03:47:47,465 - INFO - Trial 91 finished with value: 0.8920110736609221 and parameters: {'n_components': 73, 'algorithm': 'randomized', 'n_iter': 12, 'power_iteration_normalizer': 'auto', 'tol': 4.626525743385457e-06, 'C': 5.455253491814253, 'loss': 'squared_hinge', 'tol_linear_svc': 3.9008985075661575e-05}. Best is trial 35 with value: 0.8921735458687682.
2026-05-21 03:48:26,314 - INFO - Trial 93 finished with value: 0.8919557824427926 and parameters: {'n_components': 73, 'algorithm': 'randomized', 'n_iter': 5, 'power_iteration_normalizer': 'auto', 'tol': 4.479066226933213e-06, 'C': 0.7955356119414232, 'loss': 'squared_hinge', 'tol_linear_svc': 4.035993349563228e-05}. Best is trial 35 with value: 0.8921735458687682.
2026-05-21 03:49:19,045 - INFO - Trial 94 finished with value: 0.892136768179976 and parameters: {'n_components': 73, 'algorithm': 'randomized', 'n_iter': 7, 'power_iteration_normalizer': 'auto', 'tol': 0.0002678322026377494, 'C': 0.8103004523194831, 'loss': 'squared_hinge', 'tol_linear_svc': 4.246635399551195e-05}. Best is trial 35 with value: 0.8921735458687682.
2026-05-21 03:50:07,614 - INFO - Trial 95 finished with value: 0.8920306433000025 and parameters: {'n_components': 72, 'algorithm': 'randomized', 'n_iter': 5, 'power_iteration_normalizer': 'LU', 'tol': 1.0002350220369632e-05, 'C': 0.15368034099303945, 'loss': 'squared_hinge', 'tol_linear_svc': 1.2189692605487002e-05}. Best is trial 35 with value: 0.8921735458687682.
2026-05-21 03:50:17,830 - INFO - Trial 98 pruned. 
2026-05-21 03:50:17,871 - INFO - Trial 97 pruned. 
2026-05-21 03:50:42,315 - INFO - Trial 90 finished with value: 0.892075874802232 and parameters: {'n_components': 73, 'algorithm': 'randomized', 'n_iter': 13, 'power_iteration_normalizer': 'auto', 'tol': 0.00026083973457084324, 'C': 74.06208201951239, 'loss': 'squared_hinge', 'tol_linear_svc': 2.1712418840019235e-05}. Best is trial 35 with value: 0.8921735458687682.
2026-05-21 03:51:19,780 - INFO - Trial 99 pruned. 
2026-05-21 03:52:05,272 - INFO - Trial 100 pruned. 
2026-05-21 03:55:20,372 - INFO - Trial 96 finished with value: 0.8920289280630117 and parameters: {'n_components': 73, 'algorithm': 'randomized', 'n_iter': 5, 'power_iteration_normalizer': 'auto', 'tol': 0.0002795828442125347, 'C': 0.7379095132463575, 'loss': 'squared_hinge', 'tol_linear_svc': 1.2028273360070198e-05}. Best is trial 35 with value: 0.8921735458687682.
2026-05-21 03:56:57,501 - INFO - Trial 71 finished with value: 0.8920430052901231 and parameters: {'n_components': 71, 'algorithm': 'randomized', 'n_iter': 10, 'power_iteration_normalizer': 'OR', 'tol': 0.00010185679748908274, 'C': 0.23904951700833443, 'loss': 'squared_hinge', 'tol_linear_svc': 2.768998656977913e-06}. Best is trial 35 with value: 0.8921735458687682.
2026-05-21 03:57:39,357 - INFO - Trial 102 finished with value: 0.891868410622101 and parameters: {'n_components': 73, 'algorithm': 'randomized', 'n_iter': 7, 'power_iteration_normalizer': 'auto', 'tol': 1.0483413548975617e-06, 'C': 1.3607437472293376, 'loss': 'squared_hinge', 'tol_linear_svc': 8.515206033529429e-06}. Best is trial 35 with value: 0.8921735458687682.
2026-05-21 03:58:24,505 - INFO - Trial 74 finished with value: 0.8920574422261384 and parameters: {'n_components': 71, 'algorithm': 'randomized', 'n_iter': 12, 'power_iteration_normalizer': 'OR', 'tol': 1.4893531818988531e-06, 'C': 0.037197891131823334, 'loss': 'squared_hinge', 'tol_linear_svc': 2.3381389463094226e-06}. Best is trial 35 with value: 0.8921735458687682.
2026-05-21 03:58:28,032 - INFO - Trial 104 finished with value: 0.8921477742621615 and parameters: {'n_components': 73, 'algorithm': 'randomized', 'n_iter': 7, 'power_iteration_normalizer': 'auto', 'tol': 0.00014131689172859773, 'C': 65.42794123333248, 'loss': 'squared_hinge', 'tol_linear_svc': 0.0001738749622119278}. Best is trial 35 with value: 0.8921735458687682.
2026-05-21 03:58:36,383 - INFO - Trial 105 finished with value: 0.8920167803604855 and parameters: {'n_components': 65, 'algorithm': 'randomized', 'n_iter': 13, 'power_iteration_normalizer': 'auto', 'tol': 0.00014011844105864607, 'C': 0.47531354487079225, 'loss': 'squared_hinge', 'tol_linear_svc': 1.908404268725546e-05}. Best is trial 35 with value: 0.8921735458687682.
2026-05-21 03:59:10,497 - INFO - Trial 101 finished with value: 0.8919649621245123 and parameters: {'n_components': 73, 'algorithm': 'randomized', 'n_iter': 7, 'power_iteration_normalizer': 'auto', 'tol': 1.0346635591604728e-06, 'C': 0.5338715875704834, 'loss': 'squared_hinge', 'tol_linear_svc': 0.00018033424805737343}. Best is trial 35 with value: 0.8921735458687682.
2026-05-21 04:00:51,665 - INFO - Trial 103 finished with value: 0.8921102405047179 and parameters: {'n_components': 73, 'algorithm': 'randomized', 'n_iter': 7, 'power_iteration_normalizer': 'auto', 'tol': 0.0003218696417997434, 'C': 42.09776429651719, 'loss': 'squared_hinge', 'tol_linear_svc': 7.424575323589868e-05}. Best is trial 35 with value: 0.8921735458687682.
2026-05-21 04:04:15,790 - INFO - Trial 106 finished with value: 0.8919761547961704 and parameters: {'n_components': 74, 'algorithm': 'randomized', 'n_iter': 13, 'power_iteration_normalizer': 'auto', 'tol': 0.0009040157653155501, 'C': 0.05079658533962495, 'loss': 'squared_hinge', 'tol_linear_svc': 8.204192489710363e-05}. Best is trial 35 with value: 0.8921735458687682.
2026-05-21 04:04:26,475 - INFO - Trial 110 finished with value: 0.8919405182385777 and parameters: {'n_components': 65, 'algorithm': 'randomized', 'n_iter': 7, 'power_iteration_normalizer': 'LU', 'tol': 7.251511677372505e-05, 'C': 18.872265462743037, 'loss': 'squared_hinge', 'tol_linear_svc': 0.00024414187148355944}. Best is trial 35 with value: 0.8921735458687682.
2026-05-21 04:05:18,885 - INFO - Trial 107 finished with value: 0.8919730931044537 and parameters: {'n_components': 74, 'algorithm': 'randomized', 'n_iter': 13, 'power_iteration_normalizer': 'LU', 'tol': 1.0431103959480104e-06, 'C': 0.04323700220550264, 'loss': 'squared_hinge', 'tol_linear_svc': 7.451678009475252e-05}. Best is trial 35 with value: 0.8921735458687682.
2026-05-21 04:05:34,447 - INFO - Trial 72 finished with value: 0.8919942108157433 and parameters: {'n_components': 71, 'algorithm': 'randomized', 'n_iter': 10, 'power_iteration_normalizer': 'OR', 'tol': 7.96108118327853e-05, 'C': 0.18405711627713608, 'loss': 'squared_hinge', 'tol_linear_svc': 0.00010881911990058499}. Best is trial 35 with value: 0.8921735458687682.
2026-05-21 04:06:08,086 - INFO - Trial 76 finished with value: 0.8920434703730615 and parameters: {'n_components': 71, 'algorithm': 'randomized', 'n_iter': 12, 'power_iteration_normalizer': 'OR', 'tol': 1.4717895145743007e-06, 'C': 0.20286467369864672, 'loss': 'squared_hinge', 'tol_linear_svc': 3.235285053096275e-05}. Best is trial 35 with value: 0.8921735458687682.
2026-05-21 04:06:17,442 - INFO - Trial 109 finished with value: 0.8919416654442494 and parameters: {'n_components': 65, 'algorithm': 'randomized', 'n_iter': 13, 'power_iteration_normalizer': 'LU', 'tol': 0.0001512313102219442, 'C': 0.013359059549032623, 'loss': 'squared_hinge', 'tol_linear_svc': 1.7726208502711898e-05}. Best is trial 35 with value: 0.8921735458687682.
2026-05-21 04:07:51,578 - INFO - Trial 108 finished with value: 0.8922651583859675 and parameters: {'n_components': 75, 'algorithm': 'randomized', 'n_iter': 13, 'power_iteration_normalizer': 'LU', 'tol': 0.00013141482794734764, 'C': 0.47270366930575447, 'loss': 'squared_hinge', 'tol_linear_svc': 1.8479517614754465e-05}. Best is trial 108 with value: 0.8922651583859675.
2026-05-21 04:10:18,462 - INFO - Trial 112 finished with value: 0.8921575013854524 and parameters: {'n_components': 74, 'algorithm': 'randomized', 'n_iter': 13, 'power_iteration_normalizer': 'LU', 'tol': 7.145682555624319e-05, 'C': 85.22720777845569, 'loss': 'squared_hinge', 'tol_linear_svc': 7.793768576887423e-05}. Best is trial 108 with value: 0.8922651583859675.
2026-05-21 04:10:56,389 - INFO - Trial 113 finished with value: 0.892232620371382 and parameters: {'n_components': 75, 'algorithm': 'randomized', 'n_iter': 8, 'power_iteration_normalizer': 'LU', 'tol': 0.00017125845042951054, 'C': 23.52904219347535, 'loss': 'squared_hinge', 'tol_linear_svc': 7.96481049584661e-05}. Best is trial 108 with value: 0.8922651583859675.
2026-05-21 04:11:14,552 - INFO - Trial 115 finished with value: 0.8920176969131353 and parameters: {'n_components': 69, 'algorithm': 'randomized', 'n_iter': 8, 'power_iteration_normalizer': 'LU', 'tol': 0.0001519597733496263, 'C': 95.93236424446525, 'loss': 'squared_hinge', 'tol_linear_svc': 7.964985744246064e-05}. Best is trial 108 with value: 0.8922651583859675.
2026-05-21 04:12:25,996 - INFO - Trial 77 finished with value: 0.8921639764850042 and parameters: {'n_components': 72, 'algorithm': 'randomized', 'n_iter': 12, 'power_iteration_normalizer': 'OR', 'tol': 1.2839538985128577e-06, 'C': 0.2792174971906108, 'loss': 'squared_hinge', 'tol_linear_svc': 2.8009376744752093e-05}. Best is trial 108 with value: 0.8922651583859675.
2026-05-21 04:12:48,154 - INFO - Trial 116 finished with value: 0.8918900549099222 and parameters: {'n_components': 69, 'algorithm': 'randomized', 'n_iter': 8, 'power_iteration_normalizer': 'LU', 'tol': 0.00018568772754021262, 'C': 97.26729249539038, 'loss': 'squared_hinge', 'tol_linear_svc': 0.00012265599784765888}. Best is trial 108 with value: 0.8922651583859675.
2026-05-21 04:12:55,134 - INFO - Trial 114 finished with value: 0.8920780907705886 and parameters: {'n_components': 75, 'algorithm': 'randomized', 'n_iter': 8, 'power_iteration_normalizer': 'LU', 'tol': 0.0001646916278375106, 'C': 28.562227033053006, 'loss': 'squared_hinge', 'tol_linear_svc': 0.0004170481208602218}. Best is trial 108 with value: 0.8922651583859675.
2026-05-21 04:12:57,854 - INFO - Trial 117 finished with value: 0.8918665994700804 and parameters: {'n_components': 69, 'algorithm': 'randomized', 'n_iter': 8, 'power_iteration_normalizer': 'LU', 'tol': 0.00017181051849365648, 'C': 18.12713108477074, 'loss': 'squared_hinge', 'tol_linear_svc': 4.620229104093242e-05}. Best is trial 108 with value: 0.8922651583859675.
2026-05-21 04:13:30,368 - INFO - Trial 119 finished with value: 0.8921030505257319 and parameters: {'n_components': 69, 'algorithm': 'randomized', 'n_iter': 8, 'power_iteration_normalizer': 'LU', 'tol': 0.00019910537552938923, 'C': 44.21403558806048, 'loss': 'squared_hinge', 'tol_linear_svc': 5.048044299938519e-05}. Best is trial 108 with value: 0.8922651583859675.
2026-05-21 04:13:32,670 - INFO - Trial 118 finished with value: 0.8917559897636149 and parameters: {'n_components': 69, 'algorithm': 'randomized', 'n_iter': 8, 'power_iteration_normalizer': 'LU', 'tol': 2.056834560016234e-06, 'C': 72.4537329621245, 'loss': 'squared_hinge', 'tol_linear_svc': 4.793145913336839e-05}. Best is trial 108 with value: 0.8922651583859675.
2026-05-21 04:13:58,376 - INFO - Trial 111 finished with value: 0.892182565867589 and parameters: {'n_components': 75, 'algorithm': 'randomized', 'n_iter': 8, 'power_iteration_normalizer': 'LU', 'tol': 6.77995394385074e-05, 'C': 31.68093153468772, 'loss': 'squared_hinge', 'tol_linear_svc': 8.68713049373994e-05}. Best is trial 108 with value: 0.8922651583859675.
2026-05-21 04:16:21,438 - INFO - Trial 120 finished with value: 0.8920910476660845 and parameters: {'n_components': 69, 'algorithm': 'randomized', 'n_iter': 8, 'power_iteration_normalizer': 'LU', 'tol': 0.00018524534105199405, 'C': 71.00862692494694, 'loss': 'squared_hinge', 'tol_linear_svc': 4.95308176377833e-05}. Best is trial 108 with value: 0.8922651583859675.
2026-05-21 04:17:12,093 - INFO - Trial 128 pruned. 
2026-05-21 04:18:04,416 - INFO - Trial 121 finished with value: 0.8920224454608284 and parameters: {'n_components': 69, 'algorithm': 'randomized', 'n_iter': 8, 'power_iteration_normalizer': 'LU', 'tol': 0.00017234592859317768, 'C': 75.62663015752786, 'loss': 'squared_hinge', 'tol_linear_svc': 0.0001358721901420836}. Best is trial 108 with value: 0.8922651583859675.
2026-05-21 04:18:52,292 - INFO - Trial 122 finished with value: 0.8921116645277964 and parameters: {'n_components': 75, 'algorithm': 'randomized', 'n_iter': 8, 'power_iteration_normalizer': 'LU', 'tol': 0.0001787332733077175, 'C': 66.81101355211135, 'loss': 'squared_hinge', 'tol_linear_svc': 0.00043717499176509016}. Best is trial 108 with value: 0.8922651583859675.
2026-05-21 04:20:41,123 - INFO - Trial 123 finished with value: 0.8921148080162616 and parameters: {'n_components': 75, 'algorithm': 'randomized', 'n_iter': 8, 'power_iteration_normalizer': 'LU', 'tol': 0.00019279089842475, 'C': 26.868894283597864, 'loss': 'squared_hinge', 'tol_linear_svc': 4.175253154762192e-05}. Best is trial 108 with value: 0.8922651583859675.
2026-05-21 04:21:06,402 - INFO - Trial 124 finished with value: 0.8920837903679273 and parameters: {'n_components': 75, 'algorithm': 'randomized', 'n_iter': 8, 'power_iteration_normalizer': 'auto', 'tol': 2.09275570223916e-06, 'C': 42.52858942455925, 'loss': 'squared_hinge', 'tol_linear_svc': 0.0001404773717106887}. Best is trial 108 with value: 0.8922651583859675.
2026-05-21 04:21:25,338 - INFO - Trial 69 finished with value: 0.8920411238642828 and parameters: {'n_components': 72, 'algorithm': 'randomized', 'n_iter': 10, 'power_iteration_normalizer': 'OR', 'tol': 0.00010225976369469823, 'C': 6.891439318034818, 'loss': 'squared_hinge', 'tol_linear_svc': 0.00010283836947356633}. Best is trial 108 with value: 0.8922651583859675.
2026-05-21 04:22:20,171 - INFO - Trial 129 finished with value: 0.8921914516131647 and parameters: {'n_components': 75, 'algorithm': 'randomized', 'n_iter': 6, 'power_iteration_normalizer': 'auto', 'tol': 0.00012996596984419327, 'C': 12.613018714758745, 'loss': 'squared_hinge', 'tol_linear_svc': 0.0001476431164955186}. Best is trial 108 with value: 0.8922651583859675.
2026-05-21 04:22:34,392 - INFO - Trial 125 finished with value: 0.8922047882901534 and parameters: {'n_components': 75, 'algorithm': 'randomized', 'n_iter': 6, 'power_iteration_normalizer': 'auto', 'tol': 2.0672237951403583e-06, 'C': 46.95177113954063, 'loss': 'squared_hinge', 'tol_linear_svc': 4.587507068018577e-05}. Best is trial 108 with value: 0.8922651583859675.
2026-05-21 04:23:05,066 - INFO - Trial 126 finished with value: 0.8920510718218612 and parameters: {'n_components': 75, 'algorithm': 'randomized', 'n_iter': 6, 'power_iteration_normalizer': 'auto', 'tol': 1.9908661800670316e-06, 'C': 41.80254996152597, 'loss': 'squared_hinge', 'tol_linear_svc': 4.2969599249508015e-05}. Best is trial 108 with value: 0.8922651583859675.
2026-05-21 04:23:12,506 - INFO - Trial 131 finished with value: 0.8920663757098343 and parameters: {'n_components': 75, 'algorithm': 'randomized', 'n_iter': 6, 'power_iteration_normalizer': 'LU', 'tol': 4.7730391017613456e-05, 'C': 32.34116531186355, 'loss': 'squared_hinge', 'tol_linear_svc': 0.00017947499096467693}. Best is trial 108 with value: 0.8922651583859675.
2026-05-21 04:23:20,627 - INFO - Trial 130 finished with value: 0.8920063765707518 and parameters: {'n_components': 75, 'algorithm': 'randomized', 'n_iter': 9, 'power_iteration_normalizer': 'LU', 'tol': 4.0130403096708224e-05, 'C': 30.130410794133805, 'loss': 'squared_hinge', 'tol_linear_svc': 0.00014377834971648502}. Best is trial 108 with value: 0.8922651583859675.
2026-05-21 04:25:02,266 - INFO - Trial 127 finished with value: 0.8919581693924739 and parameters: {'n_components': 75, 'algorithm': 'randomized', 'n_iter': 6, 'power_iteration_normalizer': 'auto', 'tol': 0.00035698275189338235, 'C': 50.00319677135024, 'loss': 'squared_hinge', 'tol_linear_svc': 0.00019970346103778794}. Best is trial 108 with value: 0.8922651583859675.
2026-05-21 04:25:46,919 - INFO - Trial 132 finished with value: 0.8920336710994491 and parameters: {'n_components': 75, 'algorithm': 'randomized', 'n_iter': 9, 'power_iteration_normalizer': 'LU', 'tol': 3.474379981669028e-05, 'C': 41.45052987322316, 'loss': 'squared_hinge', 'tol_linear_svc': 0.00021329780520610038}. Best is trial 108 with value: 0.8922651583859675.
2026-05-21 04:27:13,724 - INFO - Trial 133 finished with value: 0.8922342615344725 and parameters: {'n_components': 75, 'algorithm': 'randomized', 'n_iter': 9, 'power_iteration_normalizer': 'LU', 'tol': 3.899366557043316e-05, 'C': 29.836379108585795, 'loss': 'squared_hinge', 'tol_linear_svc': 0.00022358087921906016}. Best is trial 108 with value: 0.8922651583859675.
2026-05-21 04:27:47,209 - INFO - Trial 134 finished with value: 0.8921809079279871 and parameters: {'n_components': 75, 'algorithm': 'randomized', 'n_iter': 9, 'power_iteration_normalizer': 'LU', 'tol': 0.001847361957355094, 'C': 50.03773283274635, 'loss': 'squared_hinge', 'tol_linear_svc': 0.0008768630187456938}. Best is trial 108 with value: 0.8922651583859675.
2026-05-21 04:29:22,002 - INFO - Trial 135 finished with value: 0.8918992972073948 and parameters: {'n_components': 72, 'algorithm': 'randomized', 'n_iter': 9, 'power_iteration_normalizer': 'LU', 'tol': 1.7542202176294999e-06, 'C': 39.160346557004715, 'loss': 'squared_hinge', 'tol_linear_svc': 2.6242183819432183e-05}. Best is trial 108 with value: 0.8922651583859675.
2026-05-21 04:30:08,285 - INFO - Trial 136 finished with value: 0.8920422794342446 and parameters: {'n_components': 72, 'algorithm': 'randomized', 'n_iter': 9, 'power_iteration_normalizer': 'LU', 'tol': 3.681834242521123e-05, 'C': 10.718512235640274, 'loss': 'squared_hinge', 'tol_linear_svc': 3.5879825848984826e-05}. Best is trial 108 with value: 0.8922651583859675.
2026-05-21 04:30:30,150 - INFO - Trial 138 finished with value: 0.8920982872196696 and parameters: {'n_components': 72, 'algorithm': 'randomized', 'n_iter': 6, 'power_iteration_normalizer': 'LU', 'tol': 1.249692262080495e-06, 'C': 9.433338330141067, 'loss': 'squared_hinge', 'tol_linear_svc': 0.00026598390742352447}. Best is trial 108 with value: 0.8922651583859675.
2026-05-21 04:30:30,151 - INFO - Trial 137 finished with value: 0.8920112944641142 and parameters: {'n_components': 72, 'algorithm': 'randomized', 'n_iter': 9, 'power_iteration_normalizer': 'LU', 'tol': 0.00012534388854029295, 'C': 10.88500865566391, 'loss': 'squared_hinge', 'tol_linear_svc': 3.63715106508542e-05}. Best is trial 108 with value: 0.8922651583859675.
2026-05-21 04:31:09,839 - INFO - Trial 139 finished with value: 0.8920082288136257 and parameters: {'n_components': 72, 'algorithm': 'randomized', 'n_iter': 9, 'power_iteration_normalizer': 'auto', 'tol': 4.010931879583014e-05, 'C': 2.994458560621014, 'loss': 'squared_hinge', 'tol_linear_svc': 3.261466784447052e-05}. Best is trial 108 with value: 0.8922651583859675.
2026-05-21 04:31:21,034 - INFO - Trial 142 finished with value: 0.8921490828807951 and parameters: {'n_components': 72, 'algorithm': 'randomized', 'n_iter': 9, 'power_iteration_normalizer': 'auto', 'tol': 0.002345025871836798, 'C': 0.005478023421441004, 'loss': 'squared_hinge', 'tol_linear_svc': 3.354055003339117e-05}. Best is trial 108 with value: 0.8922651583859675.
2026-05-21 04:32:02,918 - INFO - Trial 141 finished with value: 0.8920336932340586 and parameters: {'n_components': 72, 'algorithm': 'randomized', 'n_iter': 9, 'power_iteration_normalizer': 'auto', 'tol': 5.985496837464106e-05, 'C': 10.721203077713312, 'loss': 'squared_hinge', 'tol_linear_svc': 3.3829114138902225e-05}. Best is trial 108 with value: 0.8922651583859675.
