2026-05-20 12:22:06,301 - INFO - ----- Fine Tuning -----
2026-05-20 12:22:06,301 - INFO - A new study created in memory with name: no-name-e28096ee-3782-47d4-a2b5-f72776cdd6a3
2026-05-20 12:22:13,629 - WARNING - Trial 5 failed with parameters: {'n_components': 186, 'algorithm': 'randomized', 'n_iter': 8, 'power_iteration_normalizer': 'auto', 'tol': 0.0004334809053530617, 'solver': 'saga', 'C': 0.07045354748492894, 'l1_ratio': 0.5318127188018651} because of the following error: ValueError('n_components(186) must be <= n_features(75).').
Traceback (most recent call last):
  File "/home/junior/Documentos/GitHub/prediction-f1-pit-stops-kaggle-competition/.venv/lib/python3.13/site-packages/optuna/study/_optimize.py", line 206, in _run_trial
    value_or_values = func(trial)
  File "/home/junior/Documentos/GitHub/prediction-f1-pit-stops-kaggle-competition/src/truncate_svd_logistic_regression_tuning copy.py", line 121, in <lambda>
    study.optimize(lambda trial: objective(trial, X_train, y_train), n_trials=100, n_jobs=-1, show_progress_bar=True)
                                 ~~~~~~~~~^^^^^^^^^^^^^^^^^^^^^^^^^
  File "/home/junior/Documentos/GitHub/prediction-f1-pit-stops-kaggle-competition/src/truncate_svd_logistic_regression_tuning copy.py", line 106, in objective
    ).fit(X_train, y_train)
      ~~~^^^^^^^^^^^^^^^^^^
  File "/home/junior/Documentos/GitHub/prediction-f1-pit-stops-kaggle-competition/.venv/lib/python3.13/site-packages/sklearn/base.py", line 1336, in wrapper
    return fit_method(estimator, *args, **kwargs)
  File "/home/junior/Documentos/GitHub/prediction-f1-pit-stops-kaggle-competition/.venv/lib/python3.13/site-packages/sklearn/pipeline.py", line 613, in fit
    Xt = self._fit(X, y, routed_params, raw_params=params)
  File "/home/junior/Documentos/GitHub/prediction-f1-pit-stops-kaggle-competition/.venv/lib/python3.13/site-packages/sklearn/pipeline.py", line 547, in _fit
    X, fitted_transformer = fit_transform_one_cached(
                            ~~~~~~~~~~~~~~~~~~~~~~~~^
        cloned_transformer,
        ^^^^^^^^^^^^^^^^^^^
    ...<5 lines>...
        params=step_params,
        ^^^^^^^^^^^^^^^^^^^
    )
    ^
  File "/home/junior/Documentos/GitHub/prediction-f1-pit-stops-kaggle-competition/.venv/lib/python3.13/site-packages/joblib/memory.py", line 326, in __call__
    return self.func(*args, **kwargs)
           ~~~~~~~~~^^^^^^^^^^^^^^^^^
  File "/home/junior/Documentos/GitHub/prediction-f1-pit-stops-kaggle-competition/.venv/lib/python3.13/site-packages/sklearn/pipeline.py", line 1484, in _fit_transform_one
    res = transformer.fit_transform(X, y, **params.get("fit_transform", {}))
  File "/home/junior/Documentos/GitHub/prediction-f1-pit-stops-kaggle-competition/.venv/lib/python3.13/site-packages/sklearn/utils/_set_output.py", line 316, in wrapped
    data_to_wrap = f(self, X, *args, **kwargs)
  File "/home/junior/Documentos/GitHub/prediction-f1-pit-stops-kaggle-competition/.venv/lib/python3.13/site-packages/sklearn/base.py", line 1336, in wrapper
    return fit_method(estimator, *args, **kwargs)
  File "/home/junior/Documentos/GitHub/prediction-f1-pit-stops-kaggle-competition/.venv/lib/python3.13/site-packages/sklearn/decomposition/_truncated_svd.py", line 240, in fit_transform
    raise ValueError(
    ...<2 lines>...
    )
ValueError: n_components(186) must be <= n_features(75).
2026-05-20 12:22:13,684 - WARNING - Trial 5 failed with value None.
2026-05-20 12:22:13,726 - WARNING - Trial 2 failed with parameters: {'n_components': 127, 'algorithm': 'randomized', 'n_iter': 7, 'power_iteration_normalizer': 'auto', 'tol': 5.188806244420687e-06, 'solver': 'saga', 'C': 3.730228402094389, 'l1_ratio': 0.12768714662984437} because of the following error: ValueError('n_components(127) must be <= n_features(75).').
Traceback (most recent call last):
  File "/home/junior/Documentos/GitHub/prediction-f1-pit-stops-kaggle-competition/.venv/lib/python3.13/site-packages/optuna/study/_optimize.py", line 206, in _run_trial
    value_or_values = func(trial)
  File "/home/junior/Documentos/GitHub/prediction-f1-pit-stops-kaggle-competition/src/truncate_svd_logistic_regression_tuning copy.py", line 121, in <lambda>
    study.optimize(lambda trial: objective(trial, X_train, y_train), n_trials=100, n_jobs=-1, show_progress_bar=True)
                                 ~~~~~~~~~^^^^^^^^^^^^^^^^^^^^^^^^^
  File "/home/junior/Documentos/GitHub/prediction-f1-pit-stops-kaggle-competition/src/truncate_svd_logistic_regression_tuning copy.py", line 106, in objective
    ).fit(X_train, y_train)
      ~~~^^^^^^^^^^^^^^^^^^
  File "/home/junior/Documentos/GitHub/prediction-f1-pit-stops-kaggle-competition/.venv/lib/python3.13/site-packages/sklearn/base.py", line 1336, in wrapper
    return fit_method(estimator, *args, **kwargs)
  File "/home/junior/Documentos/GitHub/prediction-f1-pit-stops-kaggle-competition/.venv/lib/python3.13/site-packages/sklearn/pipeline.py", line 613, in fit
    Xt = self._fit(X, y, routed_params, raw_params=params)
  File "/home/junior/Documentos/GitHub/prediction-f1-pit-stops-kaggle-competition/.venv/lib/python3.13/site-packages/sklearn/pipeline.py", line 547, in _fit
    X, fitted_transformer = fit_transform_one_cached(
                            ~~~~~~~~~~~~~~~~~~~~~~~~^
        cloned_transformer,
        ^^^^^^^^^^^^^^^^^^^
    ...<5 lines>...
        params=step_params,
        ^^^^^^^^^^^^^^^^^^^
    )
    ^
  File "/home/junior/Documentos/GitHub/prediction-f1-pit-stops-kaggle-competition/.venv/lib/python3.13/site-packages/joblib/memory.py", line 326, in __call__
    return self.func(*args, **kwargs)
           ~~~~~~~~~^^^^^^^^^^^^^^^^^
  File "/home/junior/Documentos/GitHub/prediction-f1-pit-stops-kaggle-competition/.venv/lib/python3.13/site-packages/sklearn/pipeline.py", line 1484, in _fit_transform_one
    res = transformer.fit_transform(X, y, **params.get("fit_transform", {}))
  File "/home/junior/Documentos/GitHub/prediction-f1-pit-stops-kaggle-competition/.venv/lib/python3.13/site-packages/sklearn/utils/_set_output.py", line 316, in wrapped
    data_to_wrap = f(self, X, *args, **kwargs)
  File "/home/junior/Documentos/GitHub/prediction-f1-pit-stops-kaggle-competition/.venv/lib/python3.13/site-packages/sklearn/base.py", line 1336, in wrapper
    return fit_method(estimator, *args, **kwargs)
  File "/home/junior/Documentos/GitHub/prediction-f1-pit-stops-kaggle-competition/.venv/lib/python3.13/site-packages/sklearn/decomposition/_truncated_svd.py", line 240, in fit_transform
    raise ValueError(
    ...<2 lines>...
    )
ValueError: n_components(127) must be <= n_features(75).
2026-05-20 12:22:13,731 - WARNING - Trial 4 failed with parameters: {'n_components': 153, 'algorithm': 'randomized', 'n_iter': 13, 'power_iteration_normalizer': 'LU', 'tol': 4.5078900031326565e-05, 'solver': 'saga', 'C': 0.00044292645942882263, 'l1_ratio': 0.997865095119379} because of the following error: ValueError('n_components(153) must be <= n_features(75).').
Traceback (most recent call last):
  File "/home/junior/Documentos/GitHub/prediction-f1-pit-stops-kaggle-competition/.venv/lib/python3.13/site-packages/optuna/study/_optimize.py", line 206, in _run_trial
    value_or_values = func(trial)
  File "/home/junior/Documentos/GitHub/prediction-f1-pit-stops-kaggle-competition/src/truncate_svd_logistic_regression_tuning copy.py", line 121, in <lambda>
    study.optimize(lambda trial: objective(trial, X_train, y_train), n_trials=100, n_jobs=-1, show_progress_bar=True)
                                 ~~~~~~~~~^^^^^^^^^^^^^^^^^^^^^^^^^
  File "/home/junior/Documentos/GitHub/prediction-f1-pit-stops-kaggle-competition/src/truncate_svd_logistic_regression_tuning copy.py", line 106, in objective
    ).fit(X_train, y_train)
      ~~~^^^^^^^^^^^^^^^^^^
  File "/home/junior/Documentos/GitHub/prediction-f1-pit-stops-kaggle-competition/.venv/lib/python3.13/site-packages/sklearn/base.py", line 1336, in wrapper
    return fit_method(estimator, *args, **kwargs)
  File "/home/junior/Documentos/GitHub/prediction-f1-pit-stops-kaggle-competition/.venv/lib/python3.13/site-packages/sklearn/pipeline.py", line 613, in fit
    Xt = self._fit(X, y, routed_params, raw_params=params)
  File "/home/junior/Documentos/GitHub/prediction-f1-pit-stops-kaggle-competition/.venv/lib/python3.13/site-packages/sklearn/pipeline.py", line 547, in _fit
    X, fitted_transformer = fit_transform_one_cached(
                            ~~~~~~~~~~~~~~~~~~~~~~~~^
        cloned_transformer,
        ^^^^^^^^^^^^^^^^^^^
    ...<5 lines>...
        params=step_params,
        ^^^^^^^^^^^^^^^^^^^
    )
    ^
  File "/home/junior/Documentos/GitHub/prediction-f1-pit-stops-kaggle-competition/.venv/lib/python3.13/site-packages/joblib/memory.py", line 326, in __call__
    return self.func(*args, **kwargs)
           ~~~~~~~~~^^^^^^^^^^^^^^^^^
  File "/home/junior/Documentos/GitHub/prediction-f1-pit-stops-kaggle-competition/.venv/lib/python3.13/site-packages/sklearn/pipeline.py", line 1484, in _fit_transform_one
    res = transformer.fit_transform(X, y, **params.get("fit_transform", {}))
  File "/home/junior/Documentos/GitHub/prediction-f1-pit-stops-kaggle-competition/.venv/lib/python3.13/site-packages/sklearn/utils/_set_output.py", line 316, in wrapped
    data_to_wrap = f(self, X, *args, **kwargs)
  File "/home/junior/Documentos/GitHub/prediction-f1-pit-stops-kaggle-competition/.venv/lib/python3.13/site-packages/sklearn/base.py", line 1336, in wrapper
    return fit_method(estimator, *args, **kwargs)
  File "/home/junior/Documentos/GitHub/prediction-f1-pit-stops-kaggle-competition/.venv/lib/python3.13/site-packages/sklearn/decomposition/_truncated_svd.py", line 240, in fit_transform
    raise ValueError(
    ...<2 lines>...
    )
ValueError: n_components(153) must be <= n_features(75).
2026-05-20 12:22:13,750 - WARNING - Trial 8 failed with parameters: {'n_components': 140, 'algorithm': 'randomized', 'n_iter': 13, 'power_iteration_normalizer': 'auto', 'tol': 0.00439033496826404, 'solver': 'saga', 'C': 0.009499182456128066, 'l1_ratio': 0.03755616306136189} because of the following error: ValueError('n_components(140) must be <= n_features(75).').
Traceback (most recent call last):
  File "/home/junior/Documentos/GitHub/prediction-f1-pit-stops-kaggle-competition/.venv/lib/python3.13/site-packages/optuna/study/_optimize.py", line 206, in _run_trial
    value_or_values = func(trial)
  File "/home/junior/Documentos/GitHub/prediction-f1-pit-stops-kaggle-competition/src/truncate_svd_logistic_regression_tuning copy.py", line 121, in <lambda>
    study.optimize(lambda trial: objective(trial, X_train, y_train), n_trials=100, n_jobs=-1, show_progress_bar=True)
                                 ~~~~~~~~~^^^^^^^^^^^^^^^^^^^^^^^^^
  File "/home/junior/Documentos/GitHub/prediction-f1-pit-stops-kaggle-competition/src/truncate_svd_logistic_regression_tuning copy.py", line 106, in objective
    ).fit(X_train, y_train)
      ~~~^^^^^^^^^^^^^^^^^^
  File "/home/junior/Documentos/GitHub/prediction-f1-pit-stops-kaggle-competition/.venv/lib/python3.13/site-packages/sklearn/base.py", line 1336, in wrapper
    return fit_method(estimator, *args, **kwargs)
  File "/home/junior/Documentos/GitHub/prediction-f1-pit-stops-kaggle-competition/.venv/lib/python3.13/site-packages/sklearn/pipeline.py", line 613, in fit
    Xt = self._fit(X, y, routed_params, raw_params=params)
  File "/home/junior/Documentos/GitHub/prediction-f1-pit-stops-kaggle-competition/.venv/lib/python3.13/site-packages/sklearn/pipeline.py", line 547, in _fit
    X, fitted_transformer = fit_transform_one_cached(
                            ~~~~~~~~~~~~~~~~~~~~~~~~^
        cloned_transformer,
        ^^^^^^^^^^^^^^^^^^^
    ...<5 lines>...
        params=step_params,
        ^^^^^^^^^^^^^^^^^^^
    )
    ^
  File "/home/junior/Documentos/GitHub/prediction-f1-pit-stops-kaggle-competition/.venv/lib/python3.13/site-packages/joblib/memory.py", line 326, in __call__
    return self.func(*args, **kwargs)
           ~~~~~~~~~^^^^^^^^^^^^^^^^^
  File "/home/junior/Documentos/GitHub/prediction-f1-pit-stops-kaggle-competition/.venv/lib/python3.13/site-packages/sklearn/pipeline.py", line 1484, in _fit_transform_one
    res = transformer.fit_transform(X, y, **params.get("fit_transform", {}))
  File "/home/junior/Documentos/GitHub/prediction-f1-pit-stops-kaggle-competition/.venv/lib/python3.13/site-packages/sklearn/utils/_set_output.py", line 316, in wrapped
    data_to_wrap = f(self, X, *args, **kwargs)
  File "/home/junior/Documentos/GitHub/prediction-f1-pit-stops-kaggle-competition/.venv/lib/python3.13/site-packages/sklearn/base.py", line 1336, in wrapper
    return fit_method(estimator, *args, **kwargs)
  File "/home/junior/Documentos/GitHub/prediction-f1-pit-stops-kaggle-competition/.venv/lib/python3.13/site-packages/sklearn/decomposition/_truncated_svd.py", line 240, in fit_transform
    raise ValueError(
    ...<2 lines>...
    )
ValueError: n_components(140) must be <= n_features(75).
2026-05-20 12:22:13,751 - WARNING - Trial 2 failed with value None.
2026-05-20 12:22:13,753 - WARNING - Trial 4 failed with value None.
2026-05-20 12:22:13,777 - WARNING - Trial 3 failed with parameters: {'n_components': 172, 'algorithm': 'randomized', 'n_iter': 7, 'power_iteration_normalizer': 'QR', 'tol': 0.00010006659095267502, 'solver': 'saga', 'C': 0.01659321692978027, 'l1_ratio': 0.1253825851361503} because of the following error: InvalidParameterError("The 'power_iteration_normalizer' parameter of TruncatedSVD must be a str among {'OR', 'none', 'LU', 'auto'}. Got 'QR' instead.").
Traceback (most recent call last):
  File "/home/junior/Documentos/GitHub/prediction-f1-pit-stops-kaggle-competition/.venv/lib/python3.13/site-packages/optuna/study/_optimize.py", line 206, in _run_trial
    value_or_values = func(trial)
  File "/home/junior/Documentos/GitHub/prediction-f1-pit-stops-kaggle-competition/src/truncate_svd_logistic_regression_tuning copy.py", line 121, in <lambda>
    study.optimize(lambda trial: objective(trial, X_train, y_train), n_trials=100, n_jobs=-1, show_progress_bar=True)
                                 ~~~~~~~~~^^^^^^^^^^^^^^^^^^^^^^^^^
  File "/home/junior/Documentos/GitHub/prediction-f1-pit-stops-kaggle-competition/src/truncate_svd_logistic_regression_tuning copy.py", line 106, in objective
    ).fit(X_train, y_train)
      ~~~^^^^^^^^^^^^^^^^^^
  File "/home/junior/Documentos/GitHub/prediction-f1-pit-stops-kaggle-competition/.venv/lib/python3.13/site-packages/sklearn/base.py", line 1336, in wrapper
    return fit_method(estimator, *args, **kwargs)
  File "/home/junior/Documentos/GitHub/prediction-f1-pit-stops-kaggle-competition/.venv/lib/python3.13/site-packages/sklearn/pipeline.py", line 613, in fit
    Xt = self._fit(X, y, routed_params, raw_params=params)
  File "/home/junior/Documentos/GitHub/prediction-f1-pit-stops-kaggle-competition/.venv/lib/python3.13/site-packages/sklearn/pipeline.py", line 547, in _fit
    X, fitted_transformer = fit_transform_one_cached(
                            ~~~~~~~~~~~~~~~~~~~~~~~~^
        cloned_transformer,
        ^^^^^^^^^^^^^^^^^^^
    ...<5 lines>...
        params=step_params,
        ^^^^^^^^^^^^^^^^^^^
    )
    ^
  File "/home/junior/Documentos/GitHub/prediction-f1-pit-stops-kaggle-competition/.venv/lib/python3.13/site-packages/joblib/memory.py", line 326, in __call__
    return self.func(*args, **kwargs)
           ~~~~~~~~~^^^^^^^^^^^^^^^^^
  File "/home/junior/Documentos/GitHub/prediction-f1-pit-stops-kaggle-competition/.venv/lib/python3.13/site-packages/sklearn/pipeline.py", line 1484, in _fit_transform_one
    res = transformer.fit_transform(X, y, **params.get("fit_transform", {}))
  File "/home/junior/Documentos/GitHub/prediction-f1-pit-stops-kaggle-competition/.venv/lib/python3.13/site-packages/sklearn/utils/_set_output.py", line 316, in wrapped
    data_to_wrap = f(self, X, *args, **kwargs)
  File "/home/junior/Documentos/GitHub/prediction-f1-pit-stops-kaggle-competition/.venv/lib/python3.13/site-packages/sklearn/base.py", line 1329, in wrapper
    estimator._validate_params()
    ~~~~~~~~~~~~~~~~~~~~~~~~~~^^
  File "/home/junior/Documentos/GitHub/prediction-f1-pit-stops-kaggle-competition/.venv/lib/python3.13/site-packages/sklearn/base.py", line 492, in _validate_params
    validate_parameter_constraints(
    ~~~~~~~~~~~~~~~~~~~~~~~~~~~~~~^
        self._parameter_constraints,
        ^^^^^^^^^^^^^^^^^^^^^^^^^^^^
        self.get_params(deep=False),
        ^^^^^^^^^^^^^^^^^^^^^^^^^^^^
        caller_name=self.__class__.__name__,
        ^^^^^^^^^^^^^^^^^^^^^^^^^^^^^^^^^^^^
    )
    ^
  File "/home/junior/Documentos/GitHub/prediction-f1-pit-stops-kaggle-competition/.venv/lib/python3.13/site-packages/sklearn/utils/_param_validation.py", line 98, in validate_parameter_constraints
    raise InvalidParameterError(
    ...<2 lines>...
    )
sklearn.utils._param_validation.InvalidParameterError: The 'power_iteration_normalizer' parameter of TruncatedSVD must be a str among {'OR', 'none', 'LU', 'auto'}. Got 'QR' instead.
2026-05-20 12:22:13,794 - WARNING - Trial 3 failed with value None.
2026-05-20 12:22:13,789 - WARNING - Trial 11 failed with parameters: {'n_components': 114, 'algorithm': 'randomized', 'n_iter': 9, 'power_iteration_normalizer': 'QR', 'tol': 3.0468495048378064e-06, 'solver': 'saga', 'C': 59.39772514296407, 'l1_ratio': 0.5958385797677787} because of the following error: InvalidParameterError("The 'power_iteration_normalizer' parameter of TruncatedSVD must be a str among {'OR', 'none', 'LU', 'auto'}. Got 'QR' instead.").
Traceback (most recent call last):
  File "/home/junior/Documentos/GitHub/prediction-f1-pit-stops-kaggle-competition/.venv/lib/python3.13/site-packages/optuna/study/_optimize.py", line 206, in _run_trial
    value_or_values = func(trial)
  File "/home/junior/Documentos/GitHub/prediction-f1-pit-stops-kaggle-competition/src/truncate_svd_logistic_regression_tuning copy.py", line 121, in <lambda>
    study.optimize(lambda trial: objective(trial, X_train, y_train), n_trials=100, n_jobs=-1, show_progress_bar=True)
                                 ~~~~~~~~~^^^^^^^^^^^^^^^^^^^^^^^^^
  File "/home/junior/Documentos/GitHub/prediction-f1-pit-stops-kaggle-competition/src/truncate_svd_logistic_regression_tuning copy.py", line 106, in objective
    ).fit(X_train, y_train)
      ~~~^^^^^^^^^^^^^^^^^^
  File "/home/junior/Documentos/GitHub/prediction-f1-pit-stops-kaggle-competition/.venv/lib/python3.13/site-packages/sklearn/base.py", line 1336, in wrapper
    return fit_method(estimator, *args, **kwargs)
  File "/home/junior/Documentos/GitHub/prediction-f1-pit-stops-kaggle-competition/.venv/lib/python3.13/site-packages/sklearn/pipeline.py", line 613, in fit
    Xt = self._fit(X, y, routed_params, raw_params=params)
  File "/home/junior/Documentos/GitHub/prediction-f1-pit-stops-kaggle-competition/.venv/lib/python3.13/site-packages/sklearn/pipeline.py", line 547, in _fit
    X, fitted_transformer = fit_transform_one_cached(
                            ~~~~~~~~~~~~~~~~~~~~~~~~^
        cloned_transformer,
        ^^^^^^^^^^^^^^^^^^^
    ...<5 lines>...
        params=step_params,
        ^^^^^^^^^^^^^^^^^^^
    )
    ^
  File "/home/junior/Documentos/GitHub/prediction-f1-pit-stops-kaggle-competition/.venv/lib/python3.13/site-packages/joblib/memory.py", line 326, in __call__
    return self.func(*args, **kwargs)
           ~~~~~~~~~^^^^^^^^^^^^^^^^^
  File "/home/junior/Documentos/GitHub/prediction-f1-pit-stops-kaggle-competition/.venv/lib/python3.13/site-packages/sklearn/pipeline.py", line 1484, in _fit_transform_one
    res = transformer.fit_transform(X, y, **params.get("fit_transform", {}))
  File "/home/junior/Documentos/GitHub/prediction-f1-pit-stops-kaggle-competition/.venv/lib/python3.13/site-packages/sklearn/utils/_set_output.py", line 316, in wrapped
    data_to_wrap = f(self, X, *args, **kwargs)
  File "/home/junior/Documentos/GitHub/prediction-f1-pit-stops-kaggle-competition/.venv/lib/python3.13/site-packages/sklearn/base.py", line 1329, in wrapper
    estimator._validate_params()
    ~~~~~~~~~~~~~~~~~~~~~~~~~~^^
  File "/home/junior/Documentos/GitHub/prediction-f1-pit-stops-kaggle-competition/.venv/lib/python3.13/site-packages/sklearn/base.py", line 492, in _validate_params
    validate_parameter_constraints(
    ~~~~~~~~~~~~~~~~~~~~~~~~~~~~~~^
        self._parameter_constraints,
        ^^^^^^^^^^^^^^^^^^^^^^^^^^^^
        self.get_params(deep=False),
        ^^^^^^^^^^^^^^^^^^^^^^^^^^^^
        caller_name=self.__class__.__name__,
        ^^^^^^^^^^^^^^^^^^^^^^^^^^^^^^^^^^^^
    )
    ^
  File "/home/junior/Documentos/GitHub/prediction-f1-pit-stops-kaggle-competition/.venv/lib/python3.13/site-packages/sklearn/utils/_param_validation.py", line 98, in validate_parameter_constraints
    raise InvalidParameterError(
    ...<2 lines>...
    )
sklearn.utils._param_validation.InvalidParameterError: The 'power_iteration_normalizer' parameter of TruncatedSVD must be a str among {'OR', 'none', 'LU', 'auto'}. Got 'QR' instead.
2026-05-20 12:22:13,796 - WARNING - Trial 11 failed with value None.
2026-05-20 12:22:13,778 - WARNING - Trial 8 failed with value None.
2026-05-20 12:22:13,808 - WARNING - Trial 6 failed with parameters: {'n_components': 239, 'algorithm': 'randomized', 'n_iter': 11, 'power_iteration_normalizer': 'LU', 'tol': 0.006263603400273098, 'solver': 'saga', 'C': 30.156416050390888, 'l1_ratio': 0.03700364150367175} because of the following error: ValueError('n_components(239) must be <= n_features(75).').
Traceback (most recent call last):
  File "/home/junior/Documentos/GitHub/prediction-f1-pit-stops-kaggle-competition/.venv/lib/python3.13/site-packages/optuna/study/_optimize.py", line 206, in _run_trial
    value_or_values = func(trial)
  File "/home/junior/Documentos/GitHub/prediction-f1-pit-stops-kaggle-competition/src/truncate_svd_logistic_regression_tuning copy.py", line 121, in <lambda>
    study.optimize(lambd